batid,bowlid,comm,inns,oa,ou,ovr,r,rt,x,y,z
41434,288284,"another edge. Flies down to third man along the ground, just one. Great fielding from Cummins, sprints to his left to save three",2,3.4,3.05,3.4,1,1,65,84,7
227762,288284,"races away. Again, so strong on the pull. Slightly short and Sharjeel nails his pull through midwicket for four. Picked the length early",2,3.5,3.06,3.5,4,4,24,270,6
227762,288284,"134 kph, on a length on leg, defended with a straight bat",2,3.6,3.07,3.6,0,0,174,195,5
41434,311592,"full and straight from Starc, worked towards midwicket. That little bit of swing seems to have ceased",2,4.1,4.01,4.1,0,0,202,244,4
41434,311592,"angled across, lovely line. A set of stumps outside off. Hafeez plays a good stroke, left alone",2,4.2,4.02,4.2,0,0,0,0,0
41434,311592,"another nice leave. Full and wide, asking Hafeez to drive or test Smith again. Hafeez wants neither",2,4.3,4.03,4.3,0,0,0,0,0
41434,311592,"146 kph, dabbed towards backward point",2,4.4,4.04,4.4,0,0,145,158,7
41434,311592,"full and way too wide, 148 kph, another leave",2,4.5,4.05,4.5,0,1,0,0,0
41434,311592,"too straight from Starc, flicked through square leg for more runs. Three of them",2,4.5,4.06,4.5,3,3,321,249,3
227762,311592,"good end. 149 kph, full and straight, Sharjeel defends back with the full face",2,4.6,4.07,4.6,0,0,200,192,4
41434,288284,"Hafeez falls over again. Straying down leg, Hafeez misses a flick. Sliding down",2,5.1,5.01,5.1,0,0,0,0,0
41434,288284,"falls over again! On a length and straight, Hafeez fails to connect with a nudge into the leg side. The ball hits him high on the body",2,5.2,5.02,5.2,0,0,151,182,6
41434,288284,"good length outside off, Hafeez leaves this alone",2,5.3,5.03,5.3,0,0,0,0,0
41434,288284,"lovely line. Around off, Hafeez defends into the off side",2,5.4,5.04,5.4,0,0,145,190,6
41434,288284,"135 kph, left alone outside off, lovely bowling. Hafeez refuses to play there. Good from both",2,5.5,5.05,5.5,0,0,0,0,0
41434,288284,maiden! Hafeez gets forward and drives through cover.,2,5.6,5.06,5.6,0,0,135,185,6
227762,489889,"too straight from Cummins first up, Sharjeel tucks away merrily down to the fine leg boundary. Easy as",2,6.1,6.01,6.1,4,4,90,27,8
227762,489889,Sharjeel can't get on top of the bounce and play into the leg side. Struck on the body,2,6.2,6.02,6.2,0,0,156,181,6
227762,489889,"beauty! 143 kph, outside off, Sharjeel is beaten on the outside edge",2,6.3,6.03,6.3,0,0,0,0,0
227762,489889,"full and straight, defended towards cover",2,6.4,6.04,6.4,0,0,213,197,3
227762,489889,"full and straight, another solid defensive block",2,6.5,6.05,6.5,0,0,146,204,5
227762,489889,"140 kph, shortish delivery on middle, Sharjeel can't time his pull. Hits straight to mid-on",2,6.6,6.06,6.6,0,0,148,196,6
41434,288284,"full and straight, a solid block",2,7.1,7.01,7.1,0,0,214,203,4
41434,288284,"too straight from Hazelwood, flicked down to fine leg, Starc dives to his right and saves some runs. Good stuff",2,7.2,7.02,7.2,2,2,227,26,1
41434,288284,"on a length outside off, left alone by Hafeez",2,7.3,7.03,7.3,0,0,0,0,0
41434,288284,"full and straight, seaming back in, attacking the stumps. Hafeez defends into the leg side",2,7.4,7.04,7.4,0,0,214,187,3
41434,288284,"back of a length on leg, bouncer. Hafeez gloves one down to fine leg. Not in control of the pull, beaten for pace",2,7.5,7.05,7.5,1,1,215,22,1
227762,288284,"full and straight, Sharjeel picks it up and drag-flicks the ball over midwicket. Closed the bat face but picked his area. Not a bad shot at all. Good proactive batting",2,7.6,7.06,7.6,4,4,32,271,6
41434,489889,"back of a length outside off, Hafeez tries to ride the bounce but lets this one go",2,8.1,8.01,8.1,0,0,0,0,0
41434,489889,"nice channels. A couple of stumps outside off, Hafeez leaves again",2,8.2,8.02,8.2,0,0,0,0,0
41434,489889,"full and straight, defended back",2,8.3,8.03,8.3,0,0,156,191,5
41434,489889,"hustled for pace. Back of a length down leg, Hafeez doesn't connect with his half-pull help down to fine leg. Rapped on the body",2,8.4,8.04,8.4,0,0,0,0,0
41434,489889,"good length outside off, defended into the off side",2,8.5,8.05,8.5,0,0,120,204,6
41434,489889,"another maiden played by Hafeez. Full and straight from Cummins, Hafeez defends back",2,8.6,8.06,8.6,0,0,178,199,5
227762,270484,"126 kph, full delivery outside off, played to the left of short third man. A long run there but Hafeez sends him back. Not good that from Hafeez",2,9.1,9.01,9.1,0,0,208,138,2
227762,270484,"much better. On a full length down leg, Sharjeel is struck on the pad, hits the pad and ricochets towards point. Hafeez calls Sharjeel through",2,9.2,9.02,9.2,0,1,133,182,6
41434,270484,"131 kph, angled across outside off, left alone",2,9.3,9.03,9.3,0,0,0,0,0
41434,270484,"just clears mid-on. Looks to go over the top, but fails to time the ball after a forward shimmy. Gets enough on that",2,9.4,9.04,9.4,2,2,263,307,4
41434,270484,"too straight and tucked down to fine leg for one. A lot better way to bat, finds the singles",2,9.5,9.05,9.5,1,1,235,31,1
227762,270484,shovelled down to deep backward square leg for one.,2,9.6,9.06,9.6,1,1,128,195,6
227762,489889,"full and straight from Cummins, Sharjeel gets a thick inside edge towards deep backward square leg. The pair want two but are just too slow between the wickets. Should have been two there",2,10.1,10.01,10.1,1,1,112,123,7
41434,489889,"top-edged for four. Bouncer on off, Hafeez fails to control the stroke. Hustles Hafeez, who gets a thick edge which flies down to the fine leg boundary. Grazed the helmet too",2,10.2,10.02,10.2,4,4,238,10,1
41434,489889,"around off on a length, defended",2,10.3,10.03,10.3,0,0,135,153,7
41434,489889,"good length outside off, defended into the off side",2,10.4,10.04,10.4,0,0,160,204,5
41434,489889,"nice lines. Close to off on a length, defended back. Not much Hafeez can do to that",2,10.5,10.05,10.5,0,0,180,188,4
41434,489889,"nice end. But too many dot balls to Hafeez. Good length outside off, played into the off side",2,10.6,10.06,10.6,0,0,125,186,6
227762,270484,"lovely shot. Full outside off, Sharjeel gets forward and lofts the ball nonchalantly over cover for three. Didn't bother keeping it down. Nice",2,11.1,11.01,11.1,3,3,322,250,3
41434,270484,"full and straight, Hafeez gets forward and defends, inside-edges the ball into his pad",2,11.2,11.02,11.2,0,0,210,199,4
41434,270484,"good length outside off, played towards point. Another dot. Not even looking for one",2,11.3,11.03,11.3,0,0,122,181,6
41434,270484,gets a leg side delivery that he tucks down to fine leg for a run,2,11.4,11.04,11.4,1,1,243,57,1
227762,270484,"fantastic batting. A slower ball down leg, Sharjeel clips him towards deep midwicket and calls for two. Played that with soft hands",2,11.5,11.05,11.5,2,2,73,210,6
227762,270484,"shortish delivery, seaming back in, cut towards point",2,11.6,11.06,11.6,0,0,239,144,2
41434,489889,"full delivery outside off, pushed towards cover from the crease",2,12.1,12.01,12.1,0,0,124,196,6
41434,489889,"good length outside off, 142 kph, scythed away towards point where Maxwell dives to his right",2,12.2,12.02,12.2,0,0,121,162,7
41434,489889,"just wide of Wade. Gloved again! A back of a length down leg, Hafeez is late on the pull, flies down towards fine leg. Hazlewood saves two with a dive. Wade is not too far away, diving to his left",2,12.3,12.03,12.3,2,2,230,21,1
41434,489889,defended towards cover from the crease,2,12.4,12.04,12.4,0,0,118,184,6
41434,489889,"nailed that! Back of a length on middle and leg, a bouncer. Hafeez thwacks this through deep backward square leg with ease. Placed well too",2,12.5,12.05,12.5,4,4,362,193,3
41434,489889,"fullish on off, 147 kph, pushed towards mid-off",2,12.6,12.06,12.6,0,0,132,206,6
227762,530011,"shortish outside off, punched down to long-on with so much ease",2,13.1,13.01,13.1,1,1,113,275,5
41434,530011,"beaten on the outside edge. Flat delivery outside off, skids on with the arm and beats the bat. No turn",2,13.2,13.02,13.2,0,0,0,0,0
41434,530011,nicely played. Gets low and hammers his sweep through deep backward square leg. Fantastic timing. Superb placement,2,13.3,13.03,13.3,4,4,336,103,2
41434,530011,"that's tripe. Short and way down leg, Hafeez pulls down to fine leg. Could have left that and got the extra ball",2,13.4,13.04,13.4,1,1,314,103,2
227762,530011,"tossed up on leg, clipped through square leg",2,13.5,13.05,13.5,1,1,56,231,6
41434,530011,"four more! Great batting, Hafeez runs down to the pitch and drills the ball over the bowler for four. Fantastic timing. Good area to hit the ball too",2,13.6,13.06,13.6,4,4,201,353,4
227762,270484,"too straight from Faulkner, flicked down to fine leg for one",2,14.1,14.01,14.1,1,1,61,109,7
41434,270484,"more runs. Full and straight, easy pickings for Hafeez to flick through midwicket for plenty. A poor ball",2,14.2,14.02,14.2,3,3,343,218,3
227762,270484,"taken this time! And Australia get Sharjeel. A length delivery outside off, fourth-stump channel. Sharjeel lets the ball come to him, looking for one down to third man off the open face but the ball kisses the outside edge and is easily held by Wade. Sharjeel looking for something too cheeky, that's not his strength.",2,14.3,14.03,14.3,0,0,182,126,1
348144,270484,"good length delivery outside off, pushed towards cover",2,14.4,14.04,14.4,0,0,136,197,6
348144,270484,"good stuff. Lovely length, fuller than a good length, Azam is beaten on the inside edge and struck on the pad",2,14.5,14.05,14.5,0,0,212,179,3
348144,270484,"too straight from Faulkner, worked away to square leg",2,14.6,14.06,14.6,0,0,239,189,3
41434,272450,"good length delivery outside off, dabbed down to third man for a run",2,15.1,15.01,15.1,1,1,165,183,5
348144,272450,"good length outside off, played down to cover",2,15.2,15.02,15.2,0,0,144,199,6
348144,272450,"132 kph, blocked from the crease",2,15.3,15.03,15.3,0,0,157,180,6
348144,272450,"full and straight, pushed back to the bowler from the crease",2,15.4,15.04,15.4,0,0,161,230,5
348144,272450,"fullish delivery outside off, pushed away towards mid-off. Seven dot balls from Azam",2,15.5,15.05,15.5,0,0,147,179,6
348144,272450,another defensive prod into the off side,2,15.6,15.06,15.6,0,0,130,190,6
41434,270484,"good length delivery outside off, Hafeez gets forward and lets it go",2,16.1,16.01,16.1,0,0,146,185,6
41434,270484,"full and very wide, 131 kph, no stroke offered from Hafeez",2,16.2,16.02,16.2,0,0,0,0,0
41434,270484,"good length outside off, 128 kph, punched towards extra cover",2,16.3,16.03,16.3,0,0,154,180,6
41434,270484,"full and straight from Faulkner, a solid block",2,16.4,16.04,16.4,0,0,178,204,5
41434,270484,"swatted away through midwicket. Full and wide from Faulkner, Hafeez doesn't care. A cross-batted heave into the gap off the front foot. Nowhere near a bad bal",2,16.5,16.05,16.5,4,4,347,237,3
41434,270484,"full and wide, left alone",2,16.6,16.06,16.6,0,0,223,176,3
348144,272450,"good length outside off, slashed down to third man for one",2,17.1,17.01,17.1,1,1,93,84,7
41434,272450,"some extra bounce. Good length delivery outside off, prodded away towards point. Takes the glove and handle of the bat. Signs of variable bounce",2,17.2,17.02,17.2,0,0,138,190,6
41434,272450,"good length delivery outside off, carved behind point for three. Good batting from Hafeez",2,17.3,17.03,17.3,3,3,29,144,7
348144,272450,"overpitched outside off, driven to mid-off",2,17.4,17.04,17.4,0,0,127,187,6
348144,272450,"superb shot from Azam. Overpitched from marsh and straight, Azam gets forward and crisply caresses his drive through mid-on. Fantastic timing. Full face of the bat, delectable",2,17.5,17.05,17.5,4,4,186,359,4
348144,272450,"on a length outside off, defended",2,17.6,17.06,17.6,0,0,148,148,7
41434,288284,"full and straight from Hazlewood, played towards mid-on",2,18.1,18.01,18.1,0,0,203,192,4
41434,288284,"short and wide, slashed to third man on the bounce, went up and over, wanted that over point",2,18.2,18.02,18.2,1,1,98,61,8
348144,288284,"fullish delivery outside off, defended into the off side",2,18.3,18.03,18.3,0,0,134,185,6
348144,288284,"full delivery outside off, defended towards cover",2,18.4,18.04,18.4,0,0,160,180,6
348144,288284,"fullish length outside off, blocked",2,18.5,18.05,18.5,0,0,140,184,6
348144,288284,"inside-edged. Full on a fourth-stump line, Azam gets forward and gets a thick edge into his body",2,18.6,18.06,18.6,0,0,144,155,7
41434,272450,"superb lines. Straight on a good length, defended",2,19.1,19.01,19.1,0,0,118,177,6
41434,272450,"127 kph, good length delivery outside off, dabbed towards backward point",2,19.2,19.02,19.2,0,0,116,149,7
41434,272450,"128 kph, gets on top of the bounce to steer towards gully. Wants one does Hafeez, rightly sent back",2,19.3,19.03,19.3,0,0,154,177,6
41434,272450,"pinged on the helmet. Hafeez has worn some this innings, second time on the helmet. Marsh's back of a length delivery climbs steeply and misses Hafeez's pull. One down to third man",2,19.4,19.04,19.4,0,1,122,151,7
348144,272450,pushed towards mid-on,2,19.5,19.05,19.5,0,0,210,195,3
348144,272450,"too straight this time, flicked through square leg for three more. Made easily, shrewd field manipulation. Waited for the bowler to come to him",2,19.6,19.06,19.6,3,3,314,213,3
348144,288284,"fullish delivery around off, blocked into the off side",2,20.1,20.01,20.1,0,0,0,0,0
348144,288284,"good length outside off, steered to point from the crease. Squirted off the outside half",2,20.2,20.02,20.2,0,0,0,0,0
348144,288284,"a tad too full from Hazlewood, pushed back to the bowler",2,20.3,20.03,20.3,0,0,173,203,5
348144,288284,"bouncer on off, Azam gets underneath that",2,20.4,20.04,20.4,0,0,0,0,0
348144,288284,"excellent lines, Hazlewood's forte. Good length on middle, blocked",2,20.5,20.05,20.5,0,0,151,170,6
348144,288284,played back towards the bowler. A maiden,2,20.6,20.06,20.6,0,0,169,241,5
41434,489889,"a tad full outside off, driven to mid-off",2,21.1,21.01,21.1,0,0,131,231,5
41434,489889,"good length, zoning in on off. Steered to point",2,21.2,21.02,21.2,0,0,131,179,6
41434,489889,"youch! Another one that flies at Hafeez. Back of a length, climbs steeply and hits the shoulder of the bat, deflects into hos chest. More pain. Soldiers on",2,21.3,21.03,21.3,0,0,126,191,6
41434,489889,"defended towards point, wants one does Hafeez, Azam sends him back",2,21.4,21.04,21.4,0,0,0,0,0
41434,489889,carved down to third man for a run,2,21.5,21.05,21.5,1,1,61,96,7
348144,489889,"good length outside off, 137 kph, Azam looks to force this through cover but mis-times his slap back to the bowler",2,21.6,21.06,21.6,0,0,0,0,0
41434,288284,"superb from Faulkner. Full and straight, on-driven elegantly towards mid-on where Faulkner dives to his left",2,22.1,22.01,22.1,0,0,129,191,6
41434,288284,"superb lines, close to off on a full length, another solid block",2,22.2,22.02,22.2,0,0,198,182,3
41434,288284,"135 kph, fullish length on middle and leg, a soft-hands push towards mid-on for a quick single.",2,22.3,22.03,22.3,1,1,213,211,4
348144,288284,"136 kph, there's the pressure telling. On a length on off, Azam wants to pull, but the ball is nowhere near a pull-able length. <b>Inside-edge into the box</b>, ricochets towards point but bounces in front",2,22.4,22.04,22.4,0,0,0,0,0
348144,288284,pushed out to mid-on,2,22.5,22.05,22.5,0,0,204,228,4
348144,288284,"shot! Superb timing from Azam. Gets one on his pads and flicks away through midwicket. Fantastic timing. Gets the bowler to bowl to him, a very un-Hazlewood type delivery",2,22.6,22.06,22.6,4,4,348,241,3
41434,489889,"good length outside off, outside-halved down to third man",2,23.1,23.01,23.1,1,1,94,89,7
348144,489889,"not quite timed. Fullish on off, Azam looks to unfurl a gorgeous drive through mid-off but squirts to mid-on in rather ugly fashion",2,23.2,23.02,23.2,0,0,210,189,3
348144,489889,"141 kph, a half-volley outside off, driven to mid-off",2,23.3,23.03,23.3,0,0,168,232,5
348144,489889,"good length outside off, carved to point from the crease",2,23.4,23.04,23.4,0,0,122,162,7
348144,489889,"gets it through this time, Warner hunts it down from mid-off but they get just two. Cummins took some pace off that straight drive",2,23.5,23.05,23.5,2,2,133,338,5
348144,489889,"too straight, flicked away through square leg",2,23.6,23.06,23.6,2,2,295,107,2
41434,311592,"a good length delivery outside off, played down towards point",2,24.1,24.01,24.1,0,0,139,155,7
41434,311592,"superb stroke. Full on the pads, Hafeez flicks that nonchalantly over square leg. A wristy flick. Didn't bother keeping that down. <b>Hafeez brings up fifty too</b>",2,24.2,24.02,24.2,4,4,305,47,2
41434,311592,"a yorker outside off, carved towards a short third man",2,24.3,24.03,24.3,0,0,139,144,7
41434,311592,"both watching each other from the middle of the pitch almost. Full delivery outside off, pushed into the cover region",2,24.4,24.04,24.4,0,0,0,0,0
41434,311592,"on a length outside off, blocked",2,24.5,24.05,24.5,0,0,214,176,3
41434,311592,"past the edge this time. Full and wide from Starc, Hafeez is rooted in the crease, pushes and the ball goes past his bat",2,24.6,24.06,24.6,0,0,234,203,3
348144,489889,"141 kph, outside off from Cummins, driven to mid-off",2,25.1,25.01,25.1,0,0,141,203,6
348144,489889,"141 kph, driven to cover from the crease",2,25.2,25.02,25.2,0,0,143,194,6
348144,489889,"good single. 140 kph, outside off and full, Azam opens the bat face late to get one to third man",2,25.3,25.03,25.3,1,1,91,89,7
41434,489889,"144 kph, a full length outside off, draws Hafeez forward who drives to mid-off",2,25.4,25.04,25.4,0,0,132,196,6
41434,489889,too straight again. Hafeez is so strong there. Whipped through square leg for another three runs. Uppish but wide of the fielder,2,25.5,25.05,25.5,3,3,336,198,3
348144,489889,"shot! Good length on off, Azam reads the length early, goes on the back foot and hammers his pull over midwicket. Fantastic execution",2,25.6,25.06,25.6,4,4,300,310,4
41434,311592,"if you can make a run to Warner look easy, it's well judged. Full outside off, pushed to mid-off, Hafeez calls immediately and gets there",2,26.1,26.01,26.1,1,1,123,192,6
348144,311592,"offcutter on off, blocked",2,26.2,26.02,26.2,0,0,134,192,6
348144,311592,"<b>saved four.</b> Wow. Full and wide from Starc, Azam laces his drive towards extra cover. Head sticks out a left hand and prevents plenty of runs. Fantastic stuff",2,26.3,26.03,26.3,0,0,120,186,6
348144,311592,"full outside off, moving away late. A thick outside edge races down to third man for one",2,26.4,26.04,26.4,1,1,89,99,7
41434,311592,"144 kph, full and straight, pushed to mid-off",2,26.5,26.05,26.5,0,0,152,181,6
41434,311592,"<strong>150 kph</strong>. Full and wide, Hafeez misses his dab down to third man. Pakistan 1 for 111",2,26.6,26.06,26.6,0,0,128,191,6
348144,270484,"good length on off and middle, pushed away towards mid-off",2,27.1,27.01,27.1,0,0,241,78,1
348144,270484,"on the hips, Azam misses a nudge, struck on the pad and a deflection to fine leg ensues",2,27.2,27.02,27.2,0,1,239,134,2
41434,270484,"<strong>dropped! </strong>Another sensational effort, but just can't cling on. Extra cover was 10 metres outside the circle. Hafeez wanted to go over cover but the ball squirted off the outside half. Cummins stretches out a left hand but the ball bursts out",2,27.3,27.03,27.3,2,2,90,93,7
41434,270484,dabbed down to third man,2,27.4,27.04,27.4,1,1,105,185,6
348144,270484,"creamed away. Full and wide, driven to the right of Cummins this time. He's probably at that awkward position to cut off the angles?",2,27.5,27.05,27.5,1,1,109,187,6
41434,270484,"blocked into the off side, nice and straight from Faulkner",2,27.6,27.06,27.6,0,0,140,196,6
348144,311592,"full delivery outside off, pushed to mid-off",2,28.1,28.01,28.1,0,0,220,195,3
348144,311592,"good length on middle and leg, swatted through square leg for a couple more",2,28.2,28.02,28.2,2,2,299,71,2
348144,311592,nicely steered to third man off the open face. Need more of that,2,28.3,28.03,28.3,1,1,130,82,8
41434,311592,"in the air but in the gap. Four. Full and wide, swerving away. Hafeez can't hold back his drive, ends up skewing the ball off the outside half through point. Very catchable but not to the fielder",2,28.4,28.04,28.4,4,4,10,177,6
41434,311592,"more runs, full and straight, a wristy flick over square leg. Didn't want to keep that down. More runs",2,28.5,28.05,28.5,3,3,315,106,2
348144,311592,"flies down to the third man boundary. Back of a length outside off, Azam gives it all he has, the ball flashes away off the top edge over gully. Think I saw steam from Starc's ears",2,28.6,28.06,28.6,4,4,111,20,8
41434,270484,"slower ball outside off, defended towards mid-off",2,29.1,29.01,29.1,0,0,146,193,6
41434,270484,"slower ball outside off, Hafeez fails to connect with a guide",2,29.2,29.02,29.2,0,0,0,0,0
41434,270484,"119 kph, slower ball, carved to backward point, Maxwell is quick to the ball",2,29.3,29.03,29.3,0,0,134,158,7
41434,270484,"goes past the outside edge. Full and wide outside off, Hafeez pokes and the ball swerves past",2,29.4,29.04,29.4,0,0,0,0,0
41434,270484,"123 kph, good length outside off, played down to third man for one",2,29.5,29.05,29.5,1,1,93,61,8
348144,270484,"superlative timing. Full and wide from Faulkner, Azam times his cover drive past cover. No chance once he found the gap. Awesome stuff",2,29.6,29.06,29.6,4,4,22,253,6
41434,311592,"through the gap again. Full and wide from Starc, Hafeez leans forward and scythes a drive through point. These two letting loose now",2,30.1,30.01,30.1,4,4,6,192,6
41434,311592,"back of a length outside off, Hafeez gets a thick outside edge which flies down to third man, on the bounce",2,30.2,30.02,30.2,1,1,93,61,8
348144,311592,"taken! Not a percentage stroke with third man in place. Back of a length outside off, Azam plays that nicely, sways away from the line, arches his back and gets underneath the ball. Ramps the ball but can't get it over slip, more over gully, and because of that, third man is able to get around and complete a good catch at the third man boundary. May have been a better option to hit that over point.",2,30.3,30.03,30.3,0,0,106,42,8
316397,311592,"a yorker outside off, jammed out",2,30.4,30.04,30.4,0,0,197,196,4
316397,311592,"another yorker outside off, kept out again",2,30.5,30.05,30.5,0,0,138,184,6
316397,311592,"full and wide, left alone",2,30.6,30.06,30.6,0,0,0,0,0
41434,270484,"fuller ball on off, presses forward and opens his bat face to run it down towards third man",2,31.1,31.01,31.1,1,1,113,158,7
316397,270484,late away movement outside off. It's very full and Shafiq gets beaten as he tries to squeeze it out through the off side,2,31.2,31.02,31.2,0,0,0,0,0
316397,270484,"short of a length and on the stumps, stays back and defends but gets an inside edge to the pads",2,31.3,31.03,31.3,0,0,186,183,4
316397,270484,"back of a length and angling away outside off, waits for it to come before opening the bat face late to steer it down to third man",2,31.4,31.04,31.4,1,1,114,67,8
41434,270484,"fuller ball outside off, Hafeez perishes trying to play across the line. Looks to loft it and the bat face closes in his hand as he goes through with the shot. Can't get any sort of distance as the ball balloons only as far as mid-on where Hazlewood snaffles it",2,31.5,31.05,31.5,0,0,227,240,4
42657,270484,"fuller back-of-the-hand slower ball outside off, presses forward and drives into the off side",2,31.6,31.06,31.6,0,0,150,190,6
316397,311592,"poor shot. Full and wide, Shafiq doesn't go after that properly, nor does he bail out. Ends up poking, the ball goes past",2,32.1,32.01,32.1,0,0,155,177,6
316397,311592,"<strong>Warner's done something to his hamstring</strong>? Full and wide, driven towards Warner at mid-off, who runs to the ball, got into position to throw at the batsman's end, but just pulled up, Looks fine though",2,32.2,32.02,32.2,1,1,140,186,6
42657,311592,"lovely bowling. Full and wide, Malik drives but Starc gets late away movement. Beats the bat",2,32.3,32.03,32.3,0,0,0,0,0
42657,311592,"fullish delivery outside off, defended towards extra cover",2,32.4,32.04,32.4,0,0,113,181,6
42657,311592,"nice again, full and straight, Malik defends",2,32.5,32.05,32.5,0,0,178,189,5
42657,311592,"too straight, off the pads down to fine leg. Malik was hesitant but came back for the second. The throw was not accurate, the backing-up not great and Pakistan get three eventually. Would have been very close had the stumps been hit at the batsman's end",2,32.6,32.06,32.6,0,3,207,99,1
42657,489889,"good length on off, 138 kph, the ball seams back in and hits the inside edge of Malik, onto the body",2,33.1,33.01,33.1,0,0,0,0,0
42657,489889,"nice line. Around off, coming back in. Malik defends",2,33.2,33.02,33.2,0,0,161,184,5
42657,489889,"<strong>edged and short of first slip</strong>. Goes through the fielder for four. Fullish length outside off, Malik gets a genuine outside edge which dies in front of Marsh. Goes through his hands for four",2,33.3,33.03,33.3,4,4,81,33,8
42657,489889,"another edge, this time along the ground, for one to third man",2,33.4,33.04,33.4,1,1,118,38,8
316397,489889,"full outside off, defended",2,33.5,33.05,33.5,0,0,147,190,6
316397,489889,"full and straight, flicked away to midwicket. Good over from Cummins",2,33.6,33.06,33.6,0,0,216,195,3
42657,288284,"full delivery outside off, Malik defends to point",2,34.1,34.01,34.1,0,0,124,177,6
42657,288284,"full and straight, pushed back",2,34.2,34.02,34.2,0,0,177,200,5
42657,288284,"on the pads, 132 kph, pushed with the angle to mid-on. Another dot. These dots are more than just dots though, it's pressure, it's momentum",2,34.3,34.03,34.3,0,0,122,183,6
