batid,bowlid,comm,inns,oa,ou,ovr,r,rt,x,y,z
42657,288284,"lovely line. Getting the ball to seam back in, attacking the pads. Malik's defensive technique intervenes",2,34.4,34.04,34.4,0,0,141,144,7
42657,288284,"on a length and straight, defended",2,34.5,34.05,34.5,1,1,196,255,4
316397,288284,,2,34.6,34.06,34.6,0,0,204,208,4
42657,489889,"shortish and wide, Malik gets on top of the bounce and laces a square drive through point. Forced that through.",2,35.1,35.01,35.1,4,4,4,208,6
42657,489889,"good length outside off, defended into the off side",2,35.2,35.02,35.2,0,0,127,185,6
42657,489889,"139 kph, loopy bouncer over the head, wide called",2,35.3,35.03,35.3,0,1,0,0,0
42657,489889,"beauty! Exceptional bowling. <strong>Malik reviews the out decision. </strong>A big noise, was it bat on pad, or bat on ball? Hotspot has nothing. This is interesting. There is a big spike before the ball reaches the bat, which may indicate that the bat clipped the pad. But that doesn't mean there is no bat on ball. In this case, it was just bat on pad. The back flap was moved forward with the bat. Good use of the review from Malik, called for it immediately.",2,35.3,35.04,35.3,0,0,178,140,8
42657,489889,"sweet timing through cover for a couple more. Just a gentle push, leans into the drive",2,35.4,35.05,35.4,2,2,62,227,6
42657,489889,"a bouncer, a high bouncer, 143 kph. Second bouncer called. Not wide",2,35.5,35.06,35.5,0,0,0,0,0
42657,489889,"on the pads, worked to square leg",2,35.6,35.07,35.6,0,0,199,188,4
316397,288284,"full and straight, some seam movement back in, pushed to mid-on with the angle",2,36.1,36.01,36.1,0,0,205,216,4
316397,288284,"just short of midwicket. No need for these strokes. Back of a length on middle, Shafiq mis-times his pull and is lucky that the ball lands in front of Khawaja",2,36.2,36.02,36.2,0,0,132,192,6
316397,288284,calls for one. Gets there. A bit of a leading edge to mid-off. Warner is quick to it and fires an inaccurate throw to the batsman's end. <strong>Out with a direct hit</strong>,2,36.3,36.03,36.3,1,1,95,186,6
42657,288284,"oh yea. What a shot. Full and straight and speaking about percentage strokes, how's this? Presents the full face of the bat and lofts over mid-on. Clean ball-striking. Clears the boundary. Experience.",2,36.4,36.04,36.4,6,6,269,346,4
42657,288284,defended into the off side,2,36.5,36.05,36.5,0,0,125,159,7
42657,288284,"good length delivery outside off, blocked to cover",2,36.6,36.06,36.6,0,0,162,201,5
316397,489889,"driven towards cover.  A loud call of ""yeees"", gets there easily. Well played",2,37.1,37.01,37.1,1,1,115,197,6
42657,489889,"big appeal, not out. <strong>Smith reviews. Has nothing to lose. </strong>Good length on middle and leg, seaming back in. Strikes Malik over the kneeroll. No bat. Looks a touch high. Two reds, but one very important green as the ball is heading over leg stump. An easy decision that on this surface.",2,37.2,37.02,37.2,0,0,0,0,0
42657,489889,"good length outside off, some inward seam movement. Malik is beaten on the inside edge",2,37.3,37.03,37.3,0,0,0,0,0
42657,489889,"too straight, nudged away to deep backward square leg for a couple more. Already can see what Pakistan missed in the previous game, some experience",2,37.4,37.04,37.4,2,2,263,75,1
42657,489889,"inside-edged just past the stumps. A leaden-footed slap, one to fine leg",2,37.5,37.05,37.5,1,1,257,70,1
316397,489889,"through square leg for a couple more. Full and straight from Cummins, Shafiq skews a couple towards fine leg",2,37.6,37.06,37.6,3,3,296,90,2
316397,288284,"full and straight, a thick inside edge into the pad? No, says umpire Wilson. <strong>Big big appeal.</strong> No inside edge. Hit both pads. Sliding down? Umpire's call on impact with stumps",2,38.1,38.01,38.1,0,0,0,0,0
316397,288284,"nice channel around off, defended",2,38.2,38.02,38.2,0,0,192,240,4
316397,288284,"132 kph, length on middle, inside-edged into the pad. Malik sends an exuberant Shafiq back. No run there",2,38.3,38.03,38.3,0,0,148,161,7
316397,288284,"132 kph, fullish outside off, another solid defensive block",2,38.4,38.04,38.4,0,0,115,187,6
316397,288284,a thick outside edge down to third man for one,2,38.5,38.05,38.5,1,1,114,44,8
42657,288284,nice. A steer down to third man,2,38.6,38.06,38.6,1,1,97,73,8
42657,272450,"tripe to start. Short and wide, Malik gets under the bounce and scythes over point. Exceptionally played. Didn't bother keeping it down",2,39.1,39.01,39.1,4,4,18,122,7
42657,272450,"full and straight, blocked",2,39.2,39.02,39.2,0,0,180,199,4
42657,272450,"full and straight again, driven back to Marsh",2,39.3,39.03,39.3,0,0,147,194,6
42657,272450,"good length on off, Malik stays in the crease and plays it down. Well played",2,39.4,39.04,39.4,0,0,170,195,5
42657,272450,"shot. Superb. The MCG goes wild. Full and straight from Marsh, Malik presents the full face to on-drive through mid-on. Making run-scoring look so easy on a difficult surface",2,39.5,39.05,39.5,4,4,208,358,4
42657,272450,"knows he got eight off it, so he gets forward and blocks this full delivery",2,39.6,39.06,39.6,0,0,188,200,4
316397,311592,"back of a length down leg, nudged down to fine leg",2,40.1,40.01,40.1,1,1,214,39,1
42657,311592,"full delivery on leg, blocked to mid-on",2,40.2,40.02,40.2,0,0,208,220,4
42657,311592,"another good single. On middle and leg, pushed to mid-on for a quick run",2,40.3,40.03,40.3,1,1,201,196,4
316397,311592,"nice shot. Warner parries it away. Full outside off, a nice clean drive towards mid-off. Shafiq gets forward and drives to mid-off. Warner dives to his right and saves two",2,40.4,40.04,40.4,2,2,42,231,6
316397,311592,"full and wide, 143 kph, left alone",2,40.5,40.05,40.5,0,0,0,0,0
316397,311592,"yorker outside off, jammed back",2,40.6,40.06,40.6,0,0,144,193,6
42657,272450,"good length outside off, caressed down to third man off the open face",2,41.1,41.01,41.1,1,1,106,65,8
316397,272450,deflected towards square leg,2,41.2,41.02,41.2,0,0,217,186,3
316397,272450,"too straight, picked off his hips for a run to fine leg",2,41.3,41.03,41.3,1,1,272,61,1
42657,272450,"bouncer, Malik gets underneath, but it's too high. The illegal delivery is duly punished",2,41.4,41.04,41.4,0,1,0,0,0
42657,272450,"good length outside off, Malik misses a cut.",2,41.4,41.05,41.4,0,0,0,0,0
42657,272450,blocked to mid-off from the front foot,2,41.5,41.06,41.5,0,0,137,190,6
42657,272450,strays down leg for  leg side wide. Lots of extras now,2,41.6,41.07,41.6,0,1,0,0,0
42657,272450,blocked off the front foot,2,41.6,41.08,41.6,0,0,207,185,3
316397,311592,"driven to mid-on for a quick single. A direct hit at the bowler's end forces the <strong>intervention of the third umpire</strong>, but Shafiq has made his ground with time to spare. Well-judged. Hazlewood at mid-on",2,42.1,42.01,42.1,1,1,235,207,3
42657,311592,"full and straight, blocked. Good batting. Play out Starc",2,42.2,42.02,42.2,0,0,224,190,3
42657,311592,"145 kph, gets this through extra cover for a couple. Half-stopped by extra cover, diving to his left",2,42.3,42.03,42.3,2,2,50,199,6
42657,311592,"Warner dives to his right, saves three and almost effects a wicket. But Malik has made the run, pushed off the front foot to mid-off",2,42.4,42.04,42.4,1,1,158,241,5
316397,311592,"that's Shafiq gone. Extremely poor shot. Full and wide from Starc, the ball was moving away. He had  o reason to play with this being Starc's last over. Shafiq, though, wanted to drive through cover. Ended up stretching out for the ball, but it was too wide. Had no control, no balance and got a thick outside edge to Wade",2,42.5,42.05,42.5,0,0,158,119,8
317273,311592,"just misses the outside edge. Full outside off, the ball pitches and moves away to beat the bat",2,42.6,42.06,42.6,0,0,0,0,0
42657,272450,"120 kph, good length on middle and leg, worked to square leg",2,43.1,43.01,43.1,1,1,250,97,2
317273,272450,"125 kph, pushed to mid-on from the crease",2,43.2,43.02,43.2,0,0,219,192,3
317273,272450,"crashed through point. Good length and wide outside off, Akmal carved a guided square punch to the left of cover point. Takes the pace off with a dive does Cummins",2,43.3,43.03,43.3,3,3,16,177,6
42657,272450,"full outside off, crisply driven to mid-off",2,43.4,43.04,43.4,0,0,145,210,5
42657,272450,hammered! A fraction short is Marsh and Malik pounces all over it. Gets his cross-bat in position early and swats over midwicket. Timing is great too,2,43.5,43.05,43.5,4,4,337,257,3
42657,272450,"full and straight, pushed to mid-on",2,43.6,43.06,43.6,0,0,207,196,4
317273,270484,"123 kph, full around off, defended",2,44.1,44.01,44.1,0,0,119,172,6
317273,270484,"full delivery outside off, blocked into the off side",2,44.2,44.02,44.2,0,0,125,188,6
317273,270484,"full and straight, another solid defensive block",2,44.3,44.03,44.3,0,0,179,198,5
317273,270484,"lofts this for four. Full outside off, saw the length he wanted, got underneath and a clean full-face lofted drive over the bowler's head",2,44.4,44.04,44.4,4,4,144,346,5
317273,270484,"full and wide outside off, drilled towards Warner at mid-off, who dives to his left to save three",2,44.5,44.05,44.5,1,1,106,275,5
42657,270484,"defended into the off side, another over ticks by",2,44.6,44.06,44.6,0,0,124,190,6
317273,530011,"slow on off, Akmal gets forward to defend",2,45.1,45.01,45.1,0,0,175,188,5
317273,530011,"91 kph, driven towards cover",2,45.2,45.02,45.2,0,0,166,233,5
317273,530011,"tries to shimmy down but the length is shorter, Akmal pushes back, Head dives to his right",2,45.3,45.03,45.3,0,0,205,213,4
317273,530011,"short on off, worked to midwicket",2,45.4,45.04,45.4,0,0,211,224,4
317273,530011,"flat on the pads, worked to deep midwicket",2,45.5,45.05,45.5,1,1,314,216,3
42657,530011,"shortish on middle, Malik was sitting back in the crease, knowing there was no flight. Pulled past midwicket for some runs. Warner dives to his left but can't cut the ball back in",2,45.6,45.06,45.6,2,2,329,251,3
317273,270484,"good length outside off, Akmal misses a cut, beaten for bounce",2,46.1,46.01,46.1,0,0,0,0,0
317273,270484,"good length outside off, pushed to cover",2,46.2,46.02,46.2,0,0,118,189,6
317273,270484,"a wild swing. Full on off, Akmal looks to smash this over midwicket, a thick inside edge towards leg gully",2,46.3,46.03,46.3,1,1,214,152,2
42657,270484,"hit on the body. 127 kph, length delivery on middle. Malik hit on the back thigh",2,46.4,46.04,46.4,0,0,178,189,5
42657,270484,comes down but the length is good and Malik has to improvise a block,2,46.5,46.05,46.5,0,0,135,185,6
42657,270484,"defended from the crease, tidy over from Faulkner",2,46.6,46.06,46.6,0,0,195,189,4
317273,530011,"flat on middle, pushed back to the bowler",2,47.1,47.01,47.1,0,0,210,203,4
317273,530011,gets down to the pitch and lofts over cover for four. Nice use of the feet to get close to the pitch. Good execution,2,47.2,47.02,47.2,4,4,46,305,5
317273,530011,blocked from the crease,2,47.3,47.03,47.3,0,0,196,185,4
317273,530011,Akmal comes down and hammers a drive past his partner. Whistles past mid-off for four. Scores are level,2,47.4,47.04,47.4,4,4,142,359,5
317273,530011,the game finishes with a wide. Head fires this down leg and Pakistan complete a <b>sensational win by six wickets at the MCG</b>,2,47.5,47.05,47.5,0,1,0,0,0
