batid,bowlid,comm,inns,oa,ou,ovr,r,rt,x,y,z
267192,227758,gets a good stride forward and defends this fullish length ball into the off side,1,24.6,24.07,24.6,0,0,140,184,6
325026,41434,pushed across on middle stump from around the wicket. Pushed off the front foot through extra cover,1,25.1,25.01,25.1,1,1,126,260,5
267192,41434,"slightly short of a length, punched off the backfoot to the right of the bowler who gets down to his right and gets a hand to it",1,25.2,25.02,25.2,0,0,202,198,4
267192,41434,whips this back of a length ball off the backfoot to long-on,1,25.3,25.03,25.3,1,1,219,305,4
325026,41434,"flatter and on a length, tucked away to square leg",1,25.4,25.04,25.4,1,1,233,215,3
267192,41434,"length ball, knocks it out to deep midwicket",1,25.5,25.05,25.5,1,1,212,264,4
325026,41434,strides forward and meets the pitch of this fullish ball to push it into the covers area,1,25.6,25.06,25.6,1,1,82,208,6
325026,227758,"quicker ball on middle, turned away to midwicket",1,26.1,26.01,26.1,0,0,225,198,3
325026,227758,knocked him over. Quicker ball from Wsim and Maxwell charges down the track and the bat hits the pad as he tris to force it through the off-side. Does not make contact with the ball as a result and it goes through to take out the stumps,1,26.2,26.02,26.2,0,0,0,0,0
230193,227758,pushed across the left-hander quicket at 96.2kph. Forces Wade to come forward and go after it and he gets a thickish outside edge that goes away towards third man,1,26.3,26.03,26.3,1,1,221,188,3
267192,227758,"back of a length and on the stumps, punched off the backfoot to the left of the bowler who runs across and fields it",1,26.4,26.04,26.4,0,0,181,194,4
267192,227758,"tries to flick this fuller ball into the leg side but he is beaten by pace and the ball goes off the pad into the off side, towards the point region",1,26.5,26.05,26.5,0,0,0,0,0
267192,227758,ends a probing over with a good length ball that is defended back towards him off the front foot,1,26.6,26.06,26.6,0,0,143,188,6
230193,41434,"flighted and sliding in on leg, tries to flick it away and that was a chance. It was in the air as it went to the right of the forward short leg fielder. Went quite quickly and he had little to no time to react to it. Very tough chance",1,27.1,27.01,27.1,1,1,115,175,6
267192,41434,"fuller ball, presses forward and works it down to long-on",1,27.2,27.02,27.2,1,1,202,284,4
230193,41434,"flighted, loopy delivery around off, pushed towards mid-on off the front foot",1,27.3,27.03,27.3,0,0,180,203,4
230193,41434,comes down the track to take this flatter ball on the full and whips it away wide of mid-on,1,27.4,27.04,27.4,1,1,103,189,6
267192,41434,"flighted on off and middle, comes forward and gently pushes it to long-on",1,27.5,27.05,27.5,1,1,221,262,4
230193,41434,rapped on the pads and appeal for lbw. Turned down by the umpire. It was a length ball and angling in and Wade was shifting on the backfoot looking to flick it away. Hit on the pad but the angle seems to suggest it was missing leg,1,27.6,27.06,27.6,0,0,0,0,0
267192,227758,"very full ball that is angled in at a flat trajectory, clipped away to deep square leg",1,28.1,28.01,28.1,1,1,228,248,4
230193,227758,optimistic appeal for caught behind but not given. Wade is done in by the drift that takes the ball away and gets beaten as he sticks his bat at it,1,28.2,28.02,28.2,0,0,0,0,0
230193,227758,another appeal for caught behind and this time given. But Australia have reviewed it. Wade was pretty quick in reviewing it. Pushed across to the left-hander and rushes him with pace. Wade is caught on neither foot and walks across after being opened up as he tries to stick his bat out. Replays show that there is no bat involved as confirmed by both HotSpot and snicko and the on-field decision is reversed. The ball actually brushed the flap of the pad which produced the noise. Good review,1,28.3,28.03,28.3,0,0,0,0,0
230193,227758,"shorter and width outside off, punched off the backfoot through backward point",1,28.4,28.04,28.4,1,1,304,160,2
267192,227758,clipped behind square on the leg side and the wicketkeeper runs across and fields it,1,28.5,28.05,28.5,0,0,0,0,0
267192,227758,"flatter short of a length ball, does not get up much, pushed cautiously off the front foot to covers",1,28.6,28.06,28.6,0,0,127,182,6
230193,41434,nudged to the on side,1,29.1,29.01,29.1,0,0,147,188,6
230193,41434,sees a little width outside off and slaps this square of the wicket,1,29.2,29.02,29.2,1,1,281,98,2
267192,41434,"flighted and sliding in with the arm, turned away to midwicket",1,29.3,29.03,29.3,1,1,241,221,3
230193,41434,comes down the track and nudges it wide of mid-on,1,29.4,29.04,29.4,1,1,129,201,6
267192,41434,"good length ball, punched off the backfoot towards midwicket",1,29.5,29.05,29.5,0,0,265,209,3
267192,41434,worked to deep midwicket,1,29.6,29.06,29.6,1,1,265,213,3
267192,227758,"loopy tossed up ball, sliding in on leg with the arm, turned behind to short fine leg",1,30.1,30.01,30.1,0,0,229,198,3
267192,227758,gives it too much air and bowls a low full toss that is driven straight down the ground,1,30.2,30.02,30.2,1,1,172,317,5
230193,227758,comes forward to this fuller ball that is angled across from around the wicket and pushes it into covers,1,30.3,30.03,30.3,0,0,224,183,3
230193,227758,gets down low to sweep early and manages to put bat to ball but it is a tad straight and he cannot beat short fine leg,1,30.4,30.04,30.4,0,0,143,144,7
230193,227758,"good length ball that is pushed across quicker and keeps low outside off, Wade shuffles across and bunts it off the backfoot",1,30.5,30.05,30.5,0,0,197,185,4
230193,227758,"flat short of a length ball, punched off the backfoot back to the right of the bowler",1,30.6,30.06,30.6,0,0,188,200,4
267192,41434,"flat and straight outside off, comes forward and defends back to the bowler",1,31.1,31.01,31.1,0,0,168,190,5
267192,41434,,1,31.2,31.02,31.2,0,0,197,191,4
267192,41434,"fuller ball, works it to long-on",1,31.3,31.03,31.3,1,1,210,315,4
230193,41434,"flighted outside off, mid-off lets it go and they take the single",1,31.4,31.04,31.4,1,1,222,235,4
267192,41434,tucked off the backfoot to deep midwicket,1,31.5,31.05,31.5,1,1,299,196,3
230193,41434,pushed in to the left-hander but the drift takes it way down the leg side and Wade can't make contact on the tuck,1,31.6,31.06,31.6,0,1,0,0,0
230193,41434,comes down the track and whips this with the angle through square leg,1,31.6,31.07,31.6,2,2,67,222,6
267192,290948,"short of a length outside off, moves across and defends into the off side",1,32.1,32.01,32.1,0,0,155,191,5
267192,290948,,1,32.2,32.02,32.2,0,0,148,180,6
267192,290948,"fuller ball, clipped away to deep midwicket",1,32.3,32.03,32.3,1,1,293,247,3
230193,290948,"short of a length, angling in from outside off, lets it come on before opening the face of his bat to steer it to third man",1,32.4,32.04,32.4,1,1,267,70,1
267192,290948,"good length, wide outside off, moves across and uses his wrists to tuck it to the leg side",1,32.5,32.05,32.5,1,1,301,140,2
230193,290948,"fuller ball, driven straight to extra cover. The batsmen put pressure on the fielder and set off for the single and there is a misfield which takes the run out out of the equation",1,32.6,32.06,32.6,1,1,211,233,4
230193,41434,"fuller and on the stumps, clipped straight to forward short leg",1,33.1,33.01,33.1,0,0,120,184,6
230193,41434,comes forward to this fuller ball and pushes it back to the bowler,1,33.2,33.02,33.2,0,0,182,205,4
230193,41434,"comes down the track, it's a short of a length ball but he still has enough time to lay into a pull shot",1,33.3,33.03,33.3,4,4,1,213,6
230193,41434,comes down the track and pushes this into the off side,1,33.4,33.04,33.4,0,0,221,190,3
230193,41434,"flighted on the stumps, driven off the front foot to long-off",1,33.5,33.05,33.5,1,1,202,299,4
267192,41434,"fullish ball, pushes it to mid-on and walks down a step or two as he thinks of the single but the fielder makes a very good, diving stop and they don't take the run",1,33.6,33.06,33.6,0,0,201,195,4
230193,290948,"short of a length outside off, slapped off the backfoot to square third man",1,34.1,34.01,34.1,1,1,285,82,2
267192,290948,shuffles across the stumps to this wider ball and dabs it with soft hands to third man,1,34.2,34.02,34.2,1,1,154,271,5
230193,290948,"fuller ball, pushed to mid-off",1,34.3,34.03,34.3,0,0,225,184,3
230193,290948,walks across to the stumps and advances down early. Amir adjusts well and drops it short and Wade is forced to drop it with soft hands into the off side,1,34.4,34.04,34.4,0,0,224,197,3
230193,290948,gets an outside edge as he tries to slash at this short of a length ball and the ball goes away wide of the cordon quickly down to the third man boundary,1,34.5,34.05,34.5,4,4,261,21,1
230193,290948,left alone in the channel outside off,1,34.6,34.06,34.6,0,0,0,0,0
267192,41434,"pitched up on the stumps, pushed off the front foot into the leg side",1,35.1,35.01,35.1,0,0,232,194,3
267192,41434,"short of a length, not much turn, stays on the backfoot and turns this away to midwicket",1,35.2,35.02,35.2,1,1,298,201,3
230193,41434,"loopy delivery, angling in with the arm on leg stump, blocked off the front foot to the bowler",1,35.3,35.03,35.3,0,0,130,166,6
230193,41434,gets down to sweep and the ball is a tad shorter so he guides it with a flat bat towards backward square leg,1,35.4,35.04,35.4,1,1,83,132,7
267192,41434,"fuller and on the stumps, skews it off the splice on the front foot push to the bowler",1,35.5,35.05,35.5,0,0,178,201,5
267192,41434,"short of a length, no turn again, whips it off the backfoot to midwicket",1,35.6,35.06,35.6,0,0,221,150,2
230193,681305,"short of a length on the stumps, blocked off the backfoot back to the bowler",1,36.1,36.01,36.1,0,0,142,185,6
230193,681305,"fuller ball outside off, pushed off the front foot into covers",1,36.2,36.02,36.2,0,0,218,186,3
230193,681305,"length ball outside off, gets up more than he anticipates but he negotiates the bounce well and drops it with soft hands into the off side",1,36.3,36.03,36.3,0,0,208,143,2
230193,681305,"short of a length, does not get the timing right as he swivels around and pulls to deep midwicket",1,36.4,36.04,36.4,1,1,101,63,8
267192,681305,"fuller ball outside off, clips it wide of deep midwicket and the deep square leg fielder had to cover some ground running to his left. They had the chance to take three, but settle down for two",1,36.5,36.05,36.5,2,2,328,194,3
267192,681305,"fullish length ball outside off, gets a long way across and defends with bat close to pad back to the bowler",1,36.6,36.06,36.6,0,0,201,197,4
230193,42657,"pitched up outside off, driven into the off side",1,37.1,37.01,37.1,0,0,191,189,4
230193,42657,"some bounce and turn from the short of a length region around off, Wade is a bit taken aback and manages to drop it with soft hands into the off side",1,37.2,37.02,37.2,0,0,210,157,2
230193,42657,turns it away to square leg for a quick single,1,37.3,37.03,37.3,1,1,110,147,7
267192,42657,"shifts back in the crease, not much turn from the length region and he turns it away to square leg",1,37.4,37.04,37.4,0,0,250,164,2
267192,42657,tucked behind square off the pads,1,37.5,37.05,37.5,1,1,213,46,1
230193,42657,punched off the backfoot to mid-off,1,37.6,37.06,37.6,0,0,233,203,3
267192,681305,walks across to meet this fuller ball outside off and drives it straight to mid-off,1,38.1,38.01,38.1,0,0,139,196,6
267192,681305,tries to play the pull shot against this back of a length ball but it gets slightly big on him and he is beaten by pace as it comes on a tad quicker so he skews it off the splice to mid-on,1,38.2,38.02,38.2,0,0,207,240,4
267192,681305,"fuller ball on middle, clipped away to deep midwicket. And that's the fifty for Smith. He has had to grind it out for this fifty. But job only half-done as Australia need him to stay on",1,38.3,38.03,38.3,1,1,245,199,3
230193,681305,"fuller ball outside off, drops it in front of points and walks a step or two forward looking for the single but cannot take it as it goes straight to the fielder",1,38.4,38.04,38.4,0,0,243,180,3
230193,681305,beautiful placement. Juicy half-volley that is fired straight on the stumps and Wade uses his wrists and uses them perfectly to get it wide of the bowler and at the same tim comfortably beat mid-on,1,38.5,38.05,38.5,4,4,108,341,5
230193,681305,"fullish outside off, driven firmly straight to mid-off",1,38.6,38.06,38.6,0,0,217,213,4
267192,42657,"pitched up on the stumps, clipped behind square",1,39.1,39.01,39.1,1,1,240,47,1
230193,42657,"floated up outside off, tries to drill it hard and straight but cannot time it well",1,39.2,39.02,39.2,0,0,188,194,4
230193,42657,guides it to point but cannot find the gap. Smith is in a hurry looking for a single but has to go back,1,39.3,39.03,39.3,0,0,239,156,2
230193,42657,"sliding in with the arm on leg stump, runs it to cover-point for a quick single",1,39.4,39.04,39.4,1,1,212,187,3
267192,42657,"pushed across on a length outside off, waits for it in the crease and whips it off the backfoot to deep square leg",1,39.5,39.05,39.5,1,1,293,195,3
230193,42657,"pitches on leg and straightens, Wade uses his wrists to guide it to the off side but cannot find the gap",1,39.6,39.06,39.6,0,0,222,168,3
267192,227758,"good length on off, no turn, punched off the front foot to long-off",1,40.1,40.01,40.1,1,1,117,298,5
230193,227758,"arm ball at 96.3, fired wide and flat and beats the attempted cut",1,40.2,40.02,40.2,0,0,0,0,0
230193,227758,tries to reverse sweep this flatter ball that is pushed across on off and does not make contact,1,40.3,40.03,40.3,0,0,0,0,0
230193,227758,slashes hard at this fullish ball that is angled across and gets beaten. Struggling for timing here,1,40.4,40.04,40.4,0,0,0,0,0
230193,227758,"short and wide, slaps it away off the backfoot square of the wicket",1,40.5,40.05,40.5,1,1,308,169,3
267192,227758,walks into the shot as he comes down the track and pushes it to long-off,1,40.6,40.06,40.6,1,1,140,316,5
267192,42657,comes down the track and takes it on the full before whipping it away to deep midwicket,1,41.1,41.01,41.1,1,1,152,312,5
230193,42657,shuffles back and across before whipping it away through midwicket. They call early for the second and charge back to complete it. Good running,1,41.2,41.02,41.2,2,2,59,209,6
230193,42657,comes forward to this length ball and steers it to point,1,41.3,41.03,41.3,0,0,211,156,2
230193,42657,comes down the track and gets leg side of it before he tucks this away to midwicket as it dips late,1,41.4,41.04,41.4,1,1,76,184,6
267192,42657,"length ball on leg, turned away to midwicket",1,41.5,41.05,41.5,0,0,212,182,3
267192,42657,flashes hard but does not really get hold of it as he carves it over the covers region and the ball goes on the bounce to the man guarding the sweeper cover fence,1,41.6,41.06,41.6,1,1,42,218,6
267192,227758,"fired down the leg side, Smith gets down and tries to scoop it but the ball drifts down leg and he cannot make contact. The wicketkeeper also cannot get his hands to it as it is bowled at a poor line",1,42.1,42.01,42.1,0,5,238,7,1
267192,227758,"shorter ball, pulled hard to deep midwicket and long-on runs across and does well to slide in and cut it off",1,42.1,42.02,42.1,2,2,265,309,4
267192,227758,"comes down the track and pushes it past the bowler who dives to his right. A half-chance for the bowler but he cannot get his hands to it, probably didn't get down low enough. Long-on dives to his left in the deep and pulls it back",1,42.2,42.03,42.2,2,2,203,341,4
267192,227758,good length ball that is delivered at a slower pace and Smith is through with the shot early. Gets an inside edge as he comes forward looking to force it through the off side and the ball crashes into the stumps. Done in by the lack of pace,1,42.3,42.04,42.3,0,0,181,159,1
270484,227758,"fullish and on the pads, pushed to wide long-on",1,42.4,42.05,42.4,1,1,236,290,4
230193,227758,"width on offer outside off, carves it square of the wicket from the crease",1,42.5,42.06,42.5,1,1,120,77,8
270484,227758,"down the leg side, tries to flick it but the ball brushes the pad and goes away behind the stumps",1,42.6,42.07,42.6,0,1,214,123,1
270484,42657,"tries to flick from outside off and closes the bat face early. Gets a leading edge but because he went at it with soft hands, it goes along the ground towards mid-off",1,43.1,43.01,43.1,1,1,112,273,5
230193,42657,advances down the ground and nearly yorks himself but manages to push it down to long-on,1,43.2,43.02,43.2,1,1,139,330,5
270484,42657,tucked off the backfoot to deep midwicket. There are fielders at both deep midwicket and deep square leg and it will only be a single,1,43.3,43.03,43.3,1,1,320,215,3
230193,42657,"goes through the gate. Wade's troubled stay against spin comes to an end. Played all around it. Attacking line and on the stumps. Wade pushes forward awkwardly, leaves a big gap between bat and pad and the ball sneaks through that gap to take out middle stump",1,43.4,43.04,43.4,0,0,0,0,0
311592,42657,"sliding in with the arm on leg stump line, gets an inside edge on the pad and the ball goes away to deep square leg",1,43.5,43.05,43.5,1,1,123,158,7
270484,42657,stays back and works it to midwicket. It was a length ball and kept slightly low but he manages to jam his bat down and make contact,1,43.6,43.06,43.6,1,1,217,166,3
270484,227758,"fuller and sliding in on leg with the arm, nicely places the tuck between deep midwicket and deep backward square leg",1,44.1,44.01,44.1,2,2,220,53,1
270484,227758,"sort and wide, cut square of the wicket",1,44.2,44.02,44.2,1,1,114,101,7
311592,227758,"short of a length ball, delivered at some pace, defended from the crease",1,44.3,44.03,44.3,0,0,227,181,3
311592,227758,"fuller ball, eased down to long-on",1,44.4,44.04,44.4,1,1,133,319,5
270484,227758,"flat and on a length, 101.6 kph, pushed into the off side off the front foot",1,44.5,44.05,44.5,0,0,0,0,0
270484,227758,"fired quicker and straighter, on middle, pushed gently back to the bowler",1,44.6,44.06,44.6,0,0,0,0,0
311592,259551,"full and angling on leg, tries to clip it and gets an inside edge on the pad, stifled appeal for lbw. Got a little bit of reverse there",1,45.1,45.01,45.1,1,1,112,162,7
270484,259551,"short of a length and angling away, keeps lower than expected but Faulkner manages to keep it out to the off side",1,45.2,45.02,45.2,0,0,141,202,6
270484,259551,"fuller ball, angled across, holding its line outside off this time and it is crunched to mid-off",1,45.3,45.03,45.3,1,1,129,323,5
311592,259551,slower full ball and some good fielding by Junaid. He is having a dream comeback game. It was full and Starc was trying to clip it away but inside-edges it to the pad and the ball just rolls away. He looks for a non-existent single and it does not help that Faulkner is a tad unresponsive. Sent back late and Junaid picks it up and nails a direct hit,1,45.4,45.04,45.4,0,0,166,180,5
489889,259551,appeal for caught behind and not given. That really seemed out as there was a clear noise. HotSpot shows a clear mark and snicko also confirms the outside edge. It was short of good length and angling away. Cummins was trying to slap it away but there is not quite enough room and he skews it to the wicketkeeper. Pakistan does not have a review left,1,45.5,45.05,45.5,0,0,0,0,0
489889,259551,,1,45.6,45.06,45.6,0,0,114,162,7
270484,290948,"slower ball, angled across outside off, tries to open his bat face and run it down to third man and does not make contact",1,46.1,46.01,46.1,0,0,0,0,0
270484,290948,"back of a length on leg stump channel, jumps up and turns it behind square to the deep fine leg boundary",1,46.2,46.02,46.2,4,4,250,25,1
270484,290948,"yorker outside off, dug out straight back to the bowler",1,46.3,46.03,46.3,0,0,221,192,3
270484,290948,"fullish and angling across outside off, gets a good stride across and drops it in front of point with bat close to pad",1,46.4,46.04,46.4,1,1,112,160,7
489889,290948,"short ball, tries to hook and gets a top-edge as the ball goes to the wicketkeeper. Probably got a glove again and it's a very feeble edge. This time, Cummins walks. Does not bother looking at the umpire as he walks away even as the wicketkeeper starts appealing",1,46.5,46.05,46.5,0,0,0,0,0
288284,290948,"fuller ball outside off, pushes at it without much feet and the bat turns in his hands slightly as the ball goes to point",1,46.6,46.06,46.6,0,0,231,154,2
270484,259551,"slower back of a length ball, tries to open the bat face and run it down and gets very narrowly beaten",1,47.1,47.01,47.1,0,0,0,0,0
270484,259551,"short ball, well-directed, sways out of the line. But it is too short and called a wide",1,47.2,47.02,47.2,0,1,0,0,0
270484,259551,"fuller ball outside off, driven firmly to mid-off and he starts off with the single. Jogs initially before realising late that the ball goes to the fielder quite quickly and then ups his pace even as a throw is fired at the non-striker's end that does not hit the stumps",1,47.2,47.03,47.2,1,1,166,217,5
288284,259551,tucked off the pads to the backward square leg region and it is vacant there so the wicketkeeper has to run across and gather it. Easy single,1,47.3,47.04,47.3,0,1,164,130,8
270484,259551,"short of a length, jumps up and drops it in front of point. Faulkner was off for the single but is sent back by Hazlewood and it's the right call in the end",1,47.4,47.05,47.4,0,0,121,178,6
270484,259551,"fullish ball, pushes it off the front of the toes towards mid-on",1,47.5,47.06,47.5,1,1,223,208,3
288284,259551,tries a yorker but ends up bowling a low full toss outside off that is driven firmly but straight to cover,1,47.6,47.07,47.6,0,0,240,201,3
270484,290948,unintentional boundary. It was a short ball and he was backing away. But the ball follows him and takes the top part of his bat before flying over wher ethe cordon would have been and into the third man boundary,1,48.1,48.01,48.1,4,4,106,27,8
270484,290948,held at point and that's the end of the innings with four balls remaining. It was a short of good length ball but he is in no position to slap it. Skews it in the air to point where Shafiq settles under it easily,1,48.2,48.02,48.2,0,0,92,154,7
41434,311592,"full and wide to start, 144.5 kph, left alone nicely. A hint of inward movement",2,0.1,0.01,0.1,0,0,0,0,0
41434,311592,"gets that line closer to off, 145 kph, Hafeez gets forward and blocks to mid-off",2,0.2,0.02,0.2,0,0,150,181,6
41434,311592,"146 kph, full and wide from Starc. Seeing if there is some swing, there is but not much. Hafeez misses his leaden-footed drive",2,0.3,0.03,0.3,0,0,0,0,0
41434,311592,"<strong>edged and dropped</strong>! Smith's slips struggles continue. A sitter. Uh oh. Full and wide again, Hafeez goes hard at the ball and gets a thick outside edge which goes straight to Smith at second slip. Gets his hands down near his midriff and shells a dolly. He has dropped an unusual number of catches recently",2,0.4,0.04,0.4,0,0,153,139,7
41434,311592,defended solidly into the cover region,2,0.5,0.05,0.5,0,0,134,178,6
41434,311592,"147 kph, fantastic over from Starc. Attacks the stumps with a full length, Hafeez defends back to the bowler. Starc picks up and is ready to breathe fire but doesn't let go of the ball",2,0.6,0.06,0.6,0,0,209,227,4
227762,288284,"short and wide, there for the cut. Sharjeel just misses it. No worries. If it's there, try. Beaten by bounce",2,1.1,1.01,1.1,0,0,0,0,0
227762,288284,"oh my.<strong> That's a gem</strong>. Good length outside off, climbs and climbs and climbs past the outside edge. Wade takes it by his head. Cut that!",2,1.2,1.02,1.2,0,0,0,0,0
227762,288284,"130 kph, the line and length that had Sharjeel nicking off in the Sydney Test. Not wide, not close to off. A set of stumps wide. Sharjeel think, should I cut? Ah, no. Left alone",2,1.3,1.03,1.3,0,0,0,0,0
227762,288284,"close to off on a good length, defended back",2,1.4,1.04,1.4,0,0,170,196,5
227762,288284,"there is that backward square leg region in play. Ready to pull anything short, this isn't quite short but he swats anyway to deep backward square leg.",2,1.5,1.05,1.5,1,1,45,206,6
41434,288284,"on the pads, drifting down. An appeal is quickly aborted. Hafeez misses a flick",2,1.6,1.06,1.6,0,0,0,0,0
227762,311592,"147 kph, full and straight, Sharjeel gets a thick outside edge which flies towards point.",2,2.1,2.01,2.1,0,0,235,184,3
227762,311592,"143 kph, full delivery outside off, defended to mid-off. Not much movement",2,2.2,2.02,2.2,0,0,209,188,3
227762,311592,strays down leg for an extra. 148 kph.,2,2.3,2.03,2.3,0,1,0,0,0
227762,311592,"shot! A tad too full from Starc, Sharjeel leans forward, a nice gentle stride. His shot is not gentle. Lovely, clean, flowing drive past Warner at mid-off and through cover. Timing",2,2.3,2.04,2.3,4,4,330,266,3
227762,311592,"short and wide this time, cuts in front of extra cover for a couple more. Good batting, there to be hit, hit it",2,2.4,2.05,2.4,2,2,304,192,3
227762,311592,"another clean drive but he finds mid-off. Good batting, depending on timing. Picking the right balls too",2,2.5,2.06,2.5,0,0,252,192,3
227762,311592,"149 kph, pacey stuff. Beats Sharjeel for pace, he inside-edges his flick into his pad.",2,2.6,2.07,2.6,0,0,0,0,0
41434,288284,"131 kph, on the pads, flicked down towards backward square leg for a couple more",2,3.1,3.01,3.1,2,2,262,67,1
41434,288284,"close to off on a full length, defended towards point",2,3.2,3.02,3.2,0,0,141,139,7
41434,288284,"on a length outside off, too wide. Called",2,3.3,3.03,3.3,0,1,0,0,0
41434,288284,"<strong>a big appeal.</strong> No says the umpire. Sliding down. Full and down leg, Hafeez falls over as he misses a flick.",2,3.3,3.04,3.3,0,0,0,0,0
