batid,bowlid,comm,inns,oa,ou,ovr,r,rt,x,y,z
5334,277912,shuffles across and defends the length ball on middle back to the bowler,2,1.5,1.05,1.5,0,0,199,193,4
5334,277912,"too straight and down leg, Finch gets some pad on the way as the ball deflects behind the wicket",2,1.6,1.06,1.6,1,1,237,93,1
5334,232364,"glorious stroke! Full and swinging away, Finch gets to the pitch of the ball and lofts him through the line. The ball sails over the ropes at long-off. Just an extension of his arms but the timing was outstanding. Little or no followthrough on that occasion. Big, broad blades, yes, but the timing was super too",2,2.1,2.01,2.1,6,6,124,355,5
5334,232364,"sliding into middle and leg, flicked into the gap at midwicket, excellent running",2,2.2,2.02,2.2,2,2,322,163,2
5334,232364,gets forward and taps the away-going delivery to cover,2,2.3,2.03,2.3,0,0,161,195,5
5334,232364,width and he's cracked that off the back foot to point,2,2.4,2.04,2.4,0,0,108,173,6
5334,232364,goes back into the crease and defends the short of length delivery back to the bowler,2,2.5,2.05,2.5,0,0,164,201,5
5334,232364,"hops back and across, blocks an away-going short of length delivery again",2,2.6,2.06,2.6,0,0,168,197,5
6683,277912,"shapes to cut but this was a lot fuller for him to play the stroke, beaten.",2,3.1,3.01,3.1,0,0,0,0,0
6683,277912,cracking delivery. Marsh shapes to cut again but this one nips back in to cut him in two halves. 142 clicks on that one,2,3.2,3.02,3.2,0,0,0,0,0
6683,277912,firm push but straight to mid-off,2,3.3,3.03,3.3,0,0,222,217,4
6683,277912,"gets this to deviate from length area on off stump, he uses the depth of the crease to defend with an angled bat to point",2,3.4,3.04,3.4,0,0,234,155,2
6683,277912,"stifled lbw appeal. Marsh plays outside the line in anticipation of an outswinger, but this one angles in and holds its line to hit him on the flap of the pad",2,3.5,3.05,3.5,0,0,212,150,2
6683,277912,"this time he gets forward and bunts the inswinger back to the bowler. Top over, created some self-doubts in Marsh's mind",2,3.6,3.06,3.6,0,0,176,188,5
5334,232364,"<b> tough chance </b>, but Southee has taken such catches before. So powerfully drilled that the ball nearly parried off Southee's hands to mid-on. Was hit hard and hit straight",2,4.1,4.01,4.1,0,0,215,223,4
5334,232364,"angles this into middle from wide of the crease, worked to midwicket",2,4.2,4.02,4.2,0,0,223,221,4
5334,232364,"tentative in his forward defense this time, on the move as he defends the outswinger to cover. Southee bowled that with a scrambled seam",2,4.3,4.03,4.3,0,0,143,174,6
5334,232364,"slower delivery but he gets the angle wrong, way down leg and on the bounce to the keeper. 111 kph",2,4.4,4.04,4.4,0,1,0,0,0
5334,232364,glides this one away towards third man. Had all the pace in the world to play the shot.,2,4.4,4.05,4.4,1,1,124,34,8
6683,232364,"played back with a straight bat, Southee stops it on his followthrough and threatens to break the stumps at the striker's end",2,4.5,4.06,4.5,0,0,183,200,4
6683,232364,"angling into middle and leg, tucked to midwicket",2,4.6,4.07,4.6,0,0,123,178,6
5334,277912,slides a length ball across Finch who shoulders arms,2,5.1,5.01,5.1,0,0,0,0,0
5334,277912,dabbed softly into the gap between cover and mid-off,2,5.2,5.02,5.2,1,1,149,202,5
6683,277912,whipped off his hip but straight to midwicket,2,5.3,5.03,5.3,0,0,146,194,6
6683,277912,"uppish but one bounce to mid-on. Once again, Marsh was uncertain as to which way that was moving. Looked to drive, got a thick inside edge as the ball nipped back in. Pressure building",2,5.4,5.04,5.4,0,0,138,213,5
6683,277912,"flicks and misses, hit on the pad. 11 balls in a row and he's just scored one off Boult",2,5.5,5.05,5.5,0,0,170,141,8
6683,277912,firm push wide of mid-off for a single,2,5.6,5.06,5.6,1,1,247,204,3
6683,232364,"nearly chopped on. Didn't have the width to cut, got a thick inside edge towards fine leg where Ferguson did well to dive to his left and save two runs.",2,6.1,6.01,6.1,2,2,143,21,8
6683,232364,"crunching cover drive this time. On the up, timed superbly. This was an outswinger that had enough width, and Marsh timed that beautifully. That should make him feel much better",2,6.2,6.02,6.2,4,4,357,229,3
6683,232364,"glides this into the third man boundary. All timing and placement. Hint of width, Marsh opens the face of the bat late and then steers it behind point. Short boundary there too",2,6.3,6.03,6.3,4,4,258,16,1
6683,232364,"slower delivery, but too full. Marsh gets to the pitch of the ball and cracks that into the cover boundary. Delayed the shot just a wee bit, moved into position and boom!",2,6.4,6.04,6.4,4,4,349,252,3
6683,232364,shows the full face of the bat and defends that incoming length ball,2,6.5,6.05,6.5,0,0,181,191,4
6683,232364,bunts the inswinger behind point as they steal a quick single,2,6.6,6.06,6.6,1,1,238,145,2
6683,277912,"some outstanding wrist work! Did I just say pressure? How he's managed to wriggle out of that. Marginally overpitched, but he simply drove that back down past mid-on with an air of nonchalance",2,7.1,7.01,7.1,4,4,168,360,5
6683,277912,"real bonus for New Zealand. Marsh was really slow on the turn. This was full on the pads, he flicked this towards deep square, where Mitchell Santner got to the ball quickly and fired a throw on the halfvolley to Latham, who did the rest. Have to say that was an excellent take from the keeper, and Marsh is caught comfortably short of the crease. Why would you want to self-destruct like that? He was just starting to play some gorgeous shots",2,7.2,7.02,7.2,1,1,72,178,6
334337,277912,width and he's driven that straight to mid-off,2,7.3,7.03,7.3,0,0,132,198,6
334337,277912,"chopped on! New Zealand are back and indecision in footwork has cost Handscomb. Simply wafts at an away-going length ball, nothing shot really. No feet movement whatsoever. The ball crashes into the stumps off the inside edge",2,7.4,7.04,7.4,0,0,184,160,1
530011,277912,works an incoming delivery on middle to midwicket,2,7.5,7.05,7.5,0,0,137,198,6
530011,277912,"solidly behind the line of that full delivery, defended back to the bowler",2,7.6,7.06,7.6,0,0,183,194,4
5334,493773,"hustles in with a length ball on middle from wide of the crease, worked t midwicket",2,8.1,8.01,8.1,0,0,212,207,4
5334,493773,"bouncer on middle and leg, ducks under that but not entirely convincing. Finch was on the move. 144 kph",2,8.2,8.02,8.2,0,0,0,0,0
5334,493773,"floats this full on off stump, pushed to cover",2,8.3,8.03,8.3,0,0,138,191,6
5334,493773,gets on top of the bounce and fends the bouncer form outside off to midwicket. 147kph delivery. Finch was fraction of a second late but played it well,2,8.4,8.04,8.4,0,0,235,190,3
5334,493773,"solid push to cover. 150kph this time, he's cranking it up",2,8.5,8.05,8.5,0,0,149,172,6
5334,493773,"uppish but just short of cover point. Both feet were off the ground when he shaped to cut, didn't get enough bat on it. Nearly a wicket maiden",2,8.6,8.06,8.6,0,0,112,184,6
530011,277912,"super timing on the flick, but the midwicket fielder does well to run all the way back to flick it back. Santner the man. Did well to dish in a slide to save one run. Not much swing",2,9.1,9.01,9.1,3,3,26,211,6
5334,277912,"short of length delivery on middle, defended back with a straight bat",2,9.2,9.02,9.2,0,0,177,197,5
5334,277912,eased gently off the back foot towards mid-off for a quick single,2,9.3,9.03,9.3,1,1,163,201,5
530011,277912,"straightens from a length area on off stump, Head is neatly onto the back foot as he defends",2,9.4,9.04,9.4,0,0,225,174,3
530011,277912,"too wide and he's crashed that into the point boundary at the rate of knots! Sitting up nicely for him to play the cut, had to reach for it in the end but he hit that off the middle.",2,9.5,9.05,9.5,4,4,355,143,2
530011,277912,"full and angling back in from wide of the crease, left alone",2,9.6,9.06,9.6,0,0,0,0,0
5334,493773,"back of length delivery on off stump, bunted wide of cover as the get across for a single",2,10.1,10.01,10.1,1,1,116,198,6
530011,493773,"hint of width, he gets on top of the bounce and glides this behind point. Third man goes well to come around. 149kph",2,10.2,10.02,10.2,1,1,329,126,2
5334,493773,punched to cover. Loud call of  'waiiiiiitttt'. 151kph,2,10.3,10.03,10.3,0,0,121,196,6
5334,493773,"hustled for pace again, caught on the hop as the ball thuds into the top half of the bat and roll to the leg side",2,10.4,10.04,10.4,0,0,216,184,3
5334,493773,firm push this time wide of cover as they steal a single,2,10.5,10.05,10.5,1,1,151,199,5
530011,493773,"floats this full on middle, Head defends from the crease back to the bowler",2,10.6,10.06,10.6,0,0,183,194,4
5334,355269,"starts off with a short of length delivery outside off, punched to point",2,11.1,11.01,11.1,0,0,126,198,6
5334,355269,hops back and turns the incoming short of length delivery to the leg side,2,11.2,11.02,11.2,0,0,203,191,4
5334,355269,"toe ends a pull on the bounce to midwicket. Tried to fetch it from outside off, and was through with the stroke way too early",2,11.3,11.03,11.3,0,0,235,209,3
5334,355269,crashed to deep point as they jog a single. A meter on either side and it was four,2,11.4,11.04,11.4,1,1,30,201,6
530011,355269,"angles a length ball into middle and leg, turned to the leg side",2,11.5,11.05,11.5,0,0,157,199,5
530011,355269,opens the face of the bat and angles the short delivery behind point,2,11.6,11.06,11.6,1,1,322,188,3
530011,493773,driven on the up to sweeper cover,2,12.1,12.01,12.1,1,1,334,214,3
5334,493773,"pulled from outside off, but there' protection at deep square. Rolled the wrists over that delivery to keep it all along the ground",2,12.2,12.02,12.2,1,1,333,148,2
530011,493773,"whipped beautifully into the gap between midwicket and square leg. Just eased it superbly, all timing and class. Super wrist work. Using the pace, 152kph, to time that",2,12.3,12.03,12.3,4,4,10,142,7
530011,493773,"firm push, not much flourish of the bat. Into the gap at deep extra cover, back for the second in a jiffy",2,12.4,12.04,12.4,2,2,321,226,3
530011,493773,"whipped to midwicket, where Brownlie moves swiftly to his left to effect a one-handed stop. 152.3 clicks",2,12.5,12.05,12.5,0,0,119,181,6
530011,493773,slapped off the back foot to deep cover,2,12.6,12.06,12.6,1,1,336,213,3
530011,355269,"Williamson won't be impressed with that effort at sweeper cover. Punched towards Brownlie, who does well to get to the ball, but the late bobble as he tries to push it back in with the slide results in the ball touching the ropes",2,13.1,13.01,13.1,4,4,350,240,3
530011,355269,"angled into middle and leg, turned to midwicket",2,13.2,13.02,13.2,0,0,155,228,5
530011,355269,"overbalanced, but he gets some bat on it as he works it behind square on the leg side",2,13.3,13.03,13.3,1,1,92,130,7
5334,355269,"looked to go square on the leg side, ended up beating mid-off. Slapped. Forehand smash",2,13.4,13.04,13.4,4,4,134,354,5
5334,355269,"angles a length ball on middle from wide of the crease, defended down to mid-on",2,13.5,13.05,13.5,0,0,218,201,3
5334,355269,"lucky to get away with a leg-stump half-volley, picked away into the gap at deep midwicket",2,13.6,13.06,13.6,2,2,328,128,2
530011,493773,driven on the up to deep cover as they jog the single,2,14.1,14.01,14.1,1,1,334,207,3
5334,493773,"hits the deck hard with a back of length delivery on off stump, punched to cover",2,14.2,14.02,14.2,0,0,140,196,6
5334,493773,"turned the bat face early as he looked to nurdle it wide of midwicket, lobbed just wide of the bowler on his followthrough",2,14.3,14.03,14.3,0,0,207,210,4
5334,493773,can't pick the gap at midwicket. Looks to play a short-arm jab this time to the short ball angling into middle,2,14.4,14.04,14.4,0,0,237,198,3
5334,493773,both feet in the air as he tucks that off his hip to deep square leg,2,14.5,14.05,14.5,1,1,280,166,3
530011,493773,"too much width, but is lucky to get away with it again. Crunched straight to deep point",2,14.6,14.06,14.6,1,1,335,185,3
530011,502714,drilled down the ground. Mid-off had no chance. Rocket hit. Too much flight and it was struck off the middle,2,15.1,15.01,15.1,4,4,262,339,4
530011,502714,"slider across the batsman from around the stumps, turned to square leg",2,15.2,15.02,15.2,0,0,142,191,6
530011,502714,gets a good stride forward and smothers the spin,2,15.3,15.03,15.3,0,0,219,194,3
530011,502714,"quicker delivery on middle and leg, whipped to Taylor, who throws himself to his left. The ball was going away from him but he stuck out his left-hand to effect a one-handed stop and save a single",2,15.4,15.04,15.4,0,0,116,125,7
530011,502714,"drifting across the batsman, who rocks back and eases it to deep cover",2,15.5,15.05,15.5,1,1,323,133,2
5334,502714,"pulled to wide long-on, six off the over",2,15.6,15.06,15.6,1,1,275,289,4
5334,277906,"<b> drops a tough chance. </b> Too full, Finch looks to go over the bowler's head but doesn't get the elevation. It was hit well alright, but Williamson was just a fraction of a second late to react",2,16.1,16.01,16.1,0,0,187,199,4
5334,277906,"this time, he clears mid-off. Gets to the pitch of the ball and lofts him over the infield. Easily done",2,16.2,16.02,16.2,4,4,72,322,5
5334,277906,"into the hospitality area at deep midwicket. Sure, it was the longer boundary but this was a full toss that had to be hit. Connected cleanly",2,16.3,16.03,16.3,6,6,350,251,3
5334,277906,"backs away and hits hit hard, but straight to cover",2,16.4,16.04,16.4,0,0,122,186,6
5334,277906,"slapped wide of cover, down to the boundary rider this time",2,16.5,16.05,16.5,1,1,34,211,6
530011,277906,"straightens from middle, pushed back to the bowler",2,16.6,16.06,16.6,0,0,184,199,4
5334,502714,"turns from middle, he opens the face of the bat to ease it behind point",2,17.1,17.01,17.1,1,1,132,186,6
530011,502714,driven firmly back to the bowler,2,17.2,17.02,17.2,0,0,178,202,5
530011,502714,"rocks back and pulls, but hits it straight back to the bowler",2,17.3,17.03,17.3,0,0,175,196,5
530011,502714,"slider across the left-hander from around the stumps, bunted to point",2,17.4,17.04,17.4,0,0,228,145,2
530011,502714,"hit over the infield, on the bounce to Neesham at wide long-pn",2,17.5,17.05,17.5,1,1,45,254,6
5334,502714,makes a bit of room and places that into the gap between cover and point,2,17.6,17.06,17.6,1,1,53,191,6
5334,277906,"looked like dragged the slog from outside off, but it it into the gap at deep midwicket.",2,18.1,18.01,18.1,4,4,346,256,3
5334,277906,punched down to long-on,2,18.2,18.02,18.2,1,1,253,307,4
530011,277906,"looks to cut but was cramped for room, hit back to the bowler",2,18.3,18.03,18.3,0,0,194,202,4
530011,277906,rocks back and eases the short ball off the back foot to point,2,18.4,18.04,18.4,0,0,247,158,2
530011,277906,makes some room and crunches the short ball on middle to deep point,2,18.5,18.05,18.5,1,1,329,207,3
5334,277906,crunched to deep cover,2,18.6,18.06,18.6,1,1,25,192,6
5334,502714,"slider on middle and leg from around the stumps, punched to mid-on",2,19.1,19.01,19.1,0,0,216,193,3
5334,502714,"hint of width but he can't take full toll of that. Hit hard, but straight to point",2,19.2,19.02,19.2,0,0,107,147,7
5334,502714,gets to the pitch of the ball and drives this inside-out to sweeper cover. <b> 15th ODI fifty </b>,2,19.3,19.03,19.3,1,1,24,194,6
530011,502714,beaten as he looks to ease the slider behind square on the off side,2,19.4,19.04,19.4,0,0,0,0,0
530011,502714,"full and straight on the pads, worked into the gap at deep midwicket. The fielder at wide long-on had to run around a wee bit to his left",2,19.5,19.05,19.5,2,2,58,187,6
530011,502714,nurdled with the spin to square leg,2,19.6,19.06,19.6,0,0,125,190,6
5334,277906,"fired down leg, Finch lets it go",2,20.1,20.01,20.1,0,1,0,0,0
5334,277906,slapped to wide long-off. Once again too short. Finch gave it a proper thwack but found the fielder,2,20.1,20.02,20.1,1,1,49,270,6
530011,277906,"drilled down the ground, Williamson deflects it on the dive towards mid-off",2,20.2,20.03,20.2,1,1,257,307,4
5334,277906,"punched to Boult at deep midwicket. Looked like he was shaping to clear the ropes there, but didn't have much pace to work with",2,20.3,20.04,20.3,1,1,328,237,3
530011,277906,"uppish but into the gap, down to deep cover",2,20.4,20.05,20.4,1,1,343,208,3
5334,277906,"Santner had to decide in a split second if he was going for the catch running in from long-off or save three runs. Finch backs away and slaps that over the infield, Santner goes for the catch but the ball just falls short of him. What's worse? It's a four too",2,20.5,20.06,20.5,4,4,70,321,5
5334,277906,"got lucky with the previous delivery, this time he muscles it straight to the lone man at deep midwicket. Looked to go over long-on perhaps, ended up dragging it a bit, and towards the longer boundary there, he stood no chance. New Zealand back into this",2,20.6,20.07,20.6,0,0,330,245,3
530011,502714,"tossed up over the batsman's eyeline, he goes back into the crease and defends",2,21.1,21.01,21.1,0,0,152,200,5
530011,502714,whips the in-drifter to square lg,2,21.2,21.02,21.2,0,0,114,181,6
530011,502714,wrists it between midwicket and square leg,2,21.3,21.03,21.3,1,1,68,210,6
325026,502714,"tossed up on middle and leg, Maxwell plays with a straight bat",2,21.4,21.04,21.4,0,0,225,222,4
325026,502714,gets onto the back foot and nurdles the incoming delivery to midwicket,2,21.5,21.05,21.5,0,0,198,185,4
325026,502714,"this one drifts back in, pitches outside off and spins away, Maxwell shapes to cut, gets the thinnest of edges through to Latham who rides the bounce and takes an excellent catch. Very thin spike, there wasn't much on hotspot either. Maxwell shakes his head as he walks off",2,21.6,21.06,21.6,0,0,179,157,8
530011,277906,"tossed up on off, driven inside out to cover",2,22.1,22.01,22.1,0,0,217,195,3
530011,277906,"pushed through quicker on off, dabbed to the cover fielder again",2,22.2,22.02,22.2,0,0,209,194,3
530011,277906,"eased with the spin to sweeper cover, once again generously tossed up",2,22.3,22.03,22.3,1,1,324,194,3
325012,277906,"defends from the crease, gets an edge to short third man",2,22.4,22.04,22.4,0,0,146,149,7
325012,277906,"turned to square leg, once again this was pushed through quicker",2,22.5,22.05,22.5,0,0,241,153,2
325012,277906,"loopy delivery on off, spins back in to take a thick inside edge and roll back to the bowler",2,22.6,22.06,22.6,0,0,213,205,4
530011,502714,"tossed up on off stump, hit back to the bowler",2,23.1,23.01,23.1,0,0,178,196,5
530011,502714,"drilled down the ground, but Santner does well to stop it on his followthrough",2,23.2,23.02,23.2,0,0,174,201,5
530011,502714,"flatter one on middle and leg, whipped to square leg this time. Pressure building",2,23.3,23.03,23.3,0,0,118,155,7
530011,502714,"gets this to slide across the left-hander, who dabs it wide of cover this time. Santner has asked the third umpire to check upstairs, he thought the bat was plonked, but all good in the end. He slid the bat in",2,23.4,23.04,23.4,1,1,235,123,2
325012,502714,"drifts this into middle, Stoinis gets a good stride forward and smothers the spin",2,23.5,23.05,23.5,0,0,173,191,5
325012,502714,turned to square leg as they jog the single,2,23.6,23.06,23.6,1,1,246,173,3
325012,277906,"tossed up on off, defended from the crease to the leg side",2,24.1,24.01,24.1,0,0,203,185,3
325012,277906,driven to the cover fielder at the edge of the ring,2,24.2,24.02,24.2,1,1,120,241,5
530011,277906,"full toss, looks to swing this to the leg side, slices this down to long-off instead",2,24.3,24.03,24.3,1,1,272,277,4
325012,277906,makes some room and punches the flatter delivery to mid-off,2,24.4,24.04,24.4,0,0,124,227,5
325012,277906,stays inside the crease and turns the flighted delivery on middle and off to the leg side,2,24.5,24.05,24.5,0,0,201,188,4
325012,277906,"pushed through quicker on middle, whipped to square leg",2,24.6,24.06,24.6,0,0,230,167,3
530011,502714,"tossed up on off stump, he lunges forward and blocks",2,25.1,25.01,25.1,0,0,183,187,4
530011,502714,whips an away-drifter to square leg. Can be risky if he gets one to bounce awkwardly,2,25.2,25.02,25.2,0,0,148,190,6
530011,502714,gets to the pitch of the ball and eases it with the spin to midwicket,2,25.3,25.03,25.3,1,1,81,247,6
325012,502714,"invites the batsman to go for a biff by tossing it up, drifted back in, solidly defended",2,25.4,25.04,25.4,0,0,184,189,4
325012,502714,"slow turn from middle, he gets onto the back foot and defends",2,25.5,25.05,25.5,0,0,185,193,4
325012,502714,gets to the pitch of the ball and eases it with the spin to long-off,2,25.6,25.06,25.6,1,1,81,283,5
325012,277906,"slow turn back into middle, makes some room and punches it down to long-on",2,26.1,26.01,26.1,1,1,277,282,4
530011,277906,"drifts in and straightens, looks to work it across the line but the ball lobs off a thick outside edge to the off side",2,26.2,26.02,26.2,0,0,224,193,3
530011,277906,"eased with the spin to long-off, sensible stuff",2,26.3,26.03,26.3,1,1,282,282,4
325012,277906,gets outside the line of the stumps and blocks,2,26.4,26.04,26.4,0,0,185,196,4
325012,277906,"risky single with a push to mid-off, a direct hit would have made things interesting",2,26.5,26.05,26.5,1,1,135,240,5
530011,277906,"can't get it away. Too short, sitting up nicely for him to free his arms and slap it away. What does he do? Hit it straight to cover",2,26.6,26.06,26.6,0,0,245,174,3
325012,493773,"overpitched on off, Stoinis plays a stylish drive but hits it straight to cover",2,27.1,27.01,27.1,0,0,136,219,5
325012,493773,drops it gently into the off side with soft hands as they scamper a single,2,27.2,27.02,27.2,1,1,141,181,6
530011,493773,"the flashing blade of Head. There was width and he crunched it, but straight to square third man",2,27.3,27.03,27.3,1,1,269,49,1
325012,493773,beautiful drive but can't beat mid-on. Allowed the ball to slide back in as he played with a straight bat,2,27.4,27.04,27.4,1,1,200,260,4
530011,493773,gets out of the way of that short ball. Banged in short outside off from around the stumps. Dropped his wrists at the last moment,2,27.5,27.05,27.5,0,0,0,0,0
530011,493773,gets on top of the bounce and turns it wide of midwicket,2,27.6,27.06,27.6,1,1,140,201,6
530011,277906,"slower through the air, tossed up as well, from around the wicket. Head comes forward for a nudge to midwicket",2,28.1,28.01,28.1,0,0,134,186,6
530011,277906,flays to long-off as he gets to the pitch of a flighted delivery outside off,2,28.2,28.02,28.2,1,1,261,288,4
325012,277906,"first boundary for Stoinis, and it's a classy one, coming down the track, connecting with the ball on the full and watching it scurry away through extra cover",2,28.3,28.03,28.3,4,4,22,257,6
325012,277906,drives it to cover,2,28.4,28.04,28.4,0,0,132,196,6
325012,277906,"and there's another, this one goes over the rope as Stoinis takes a giant stride forward, with that he gets to the flighted delivery and launches it over extra cover",2,28.5,28.05,28.5,6,6,66,314,5
325012,277906,"pushes it through quicker, and into middle and leg. Stoinis backs away and punches it back at the bowler",2,28.6,28.06,28.6,0,0,194,216,4
530011,493773,"147 kph, drills a length ball down the ground, a little misfield at mid-off by Williamson allows the batsmen to take two",2,29.1,29.01,29.1,2,2,185,345,4
530011,493773,"doesn't look comfortable against the bouncer, this one from around the wicket, at good pace, coming at Head's head. Gets a little glove, onto helmet and through to fine leg",2,29.2,29.02,29.2,1,1,116,50,8
325012,493773,"147 kph, shortish and outside off, Stoinis goes for a cut but is beaten for pace",2,29.3,29.03,29.3,0,0,0,0,0
325012,493773,"back of a length on off stump at 146 kph, defends",2,29.4,29.04,29.4,0,0,180,200,4
325012,493773,"digs it in short, Stoinis ignores it, Latham can't hope to move quickly enough to his left",2,29.5,29.05,29.5,0,5,0,0,0
325012,493773,"flat-batted down the ground, doesn't get all of it and that's why Southee running back from mid-on is able to pull it back inches inside the rope",2,29.5,29.06,29.5,2,2,201,340,4
325012,493773,"edged, and past the wicketkeeper's right. This is a genuine mis-hit, Stoinis pushing at a back of a length ball, which seams away just enough to get past the middle of his bat. Had there been a slip, he might have been gone",2,29.6,29.07,29.6,4,4,121,13,8
530011,277912,"ripper of a bouncer. He shaped to pull but then realised the ball was rearing up alarmingly and tried to pull out, but by then the ball had deflected off his shoulder and over the keeper's head. Handy runs",2,30.1,30.01,30.1,0,4,166,4,8
530011,277912,"living dangerously, but will get another boundary to bring up his <b> 5th ODI fifty. </b> Length ball drifting into middle and leg, flicked wide of Taylor at midwicket",2,30.2,30.02,30.2,4,4,15,238,6
530011,277912,"gets this to jag back in from outside off, Head punches this to mid-off",2,30.3,30.03,30.3,0,0,181,198,4
530011,277912,,2,30.4,30.04,30.4,0,0,217,222,4
530011,277912,"looking to reverse this, is he? Head shapes to drive but the ball veers back in late to take a thick inside edge back to the bowler",2,30.5,30.05,30.5,0,0,178,199,5
530011,277912,"play and a miss. Too close to cut, the length was a touch fuller too",2,30.6,30.06,30.6,0,0,0,0,0
325012,493773,hops back and across to whip the incoming length delivery to deep backward square leg,2,31.1,31.01,31.1,1,1,293,90,2
530011,493773,"clobbers that, but straight to Boult at deep square leg",2,31.2,31.02,31.2,1,1,35,210,6
