batid,bowlid,comm,inns,oa,ou,ovr,r,rt,x,y,z
5334,277912,"Neesham dives to his right from square leg, reaches for the ball with both hands, and plucks it out. Boult and Neesham combine to send back Australia's stand-in captain. Not a happy comeback for Finch. Hip-high short ball outside off, Finch simply flaps a pull to square leg",2,3.1,3.01,3.1,0,0,253,170,3
6683,277912,nudged to the left of Santner at short midwicket. Marsh sets off for a single. A direct hit from Santner could have had Head,2,3.2,3.02,3.2,1,1,109,178,6
530011,277912,"very full and slanted in on off, played back to the bowler",2,3.3,3.03,3.3,0,0,201,182,3
530011,277912,"back of a length and outside off, forced to cover",2,3.4,3.04,3.4,0,0,236,178,3
530011,277912,"holes out to deep third man running in. Eden Park raises itself to a roar. Back of a length and very wide outside off, Head flails at it. The ball swirls into the hands of Munro off a top edge",2,3.5,3.05,3.5,0,0,245,45,1
6683,277912,the length is short for the cut but this is too close to the body. Chopped behind past the off stump,2,3.6,3.06,3.6,0,0,0,0,0
334337,232364,"very full on middle and leg, hangs back and clips to midwicket",2,4.1,4.01,4.1,1,1,233,222,4
6683,232364,"very full, hint of inswing, flicked to mid-on",2,4.2,4.02,4.2,0,0,132,232,5
6683,232364,"good length and slanting away outside off, dabbed to cover",2,4.3,4.03,4.3,0,0,222,160,2
6683,232364,"full and angling away outside off, opens the face and dinks the ball wide enough of wide slip. Played down to third man",2,4.4,4.04,4.4,1,1,252,65,1
334337,232364,"full and straight on middle, blocked with a straight bat to mid-off",2,4.5,4.05,4.5,0,0,163,197,5
334337,232364,"short of a length and outside off, Handscomb is happy to camp back and run it down to third man",2,4.6,4.06,4.6,1,1,108,47,8
334337,277912,"back of a length and width outside off, Handscomb jumps onto the width and punches it in the gap at cover",2,5.1,5.01,5.1,4,4,8,199,6
334337,277912,full and angled into a defence to the off side,2,5.2,5.02,5.2,0,0,161,188,5
334337,277912,"short of a length and angled outside off, Handscomb plays at the last possible moment and glides it down to third man",2,5.3,5.03,5.3,1,1,92,118,7
6683,277912,"full and holds its line outside off, Marsh watches it through to the keeper",2,5.4,5.04,5.4,0,0,0,0,0
6683,277912,"full and floated on middle, Marsh ventures forward and across to negotiate it",2,5.5,5.05,5.5,0,0,163,190,5
6683,277912,"back of a length and kicks away outside off, beats the attempted cut",2,5.6,5.06,5.6,0,0,0,0,0
334337,232364,"there's a clicking sound as the stand-in keeper Latham gloves the ball. Umpire Knight shakes his head. NZ challenge the on-field not-out decision. Cross-seamer from Southee. Handsomb simply prods at it away from the body, and nicks it behind. Hotspot detects a white blotch and nicko detects a spike as the ball passes the bat. Handscomb has to go. Umpire Knight reverses his call, raises his finger, and sends back Handscomb",2,6.1,6.01,6.1,0,0,0,0,0
325026,232364,"Maxwell is greeted by a short ball, angled in on off, pulls and gets enough bat on it to send the ball away fine on the leg side past the diving keeper",2,6.2,6.02,6.2,4,4,221,5,1
325026,232364,,2,6.3,6.03,6.3,0,0,0,0,0
325026,232364,"full and outside off, guided through backward point",2,6.4,6.04,6.4,1,1,107,153,7
6683,232364,"nice and full outside off - not a half-volley, Marsh flows forward and drives it smoothly straight of mid-off",2,6.5,6.05,6.5,4,4,266,337,4
6683,232364,"Southee drags his length back outside off, Marsh punches into the covers",2,6.6,6.06,6.6,0,0,230,195,3
325026,277912,"back of a length and slanting away outside off, opens the face and dabs to backward point",2,7.1,7.01,7.1,0,0,141,167,6
325026,277912,"back of a length on leg stump, whipped to midwicket on the back foot",2,7.2,7.02,7.2,0,0,236,176,3
325026,277912,"tight line and length, no room at all, defended back to the bowler",2,7.3,7.03,7.3,0,0,187,192,4
325026,277912,picked away off the hips to long leg,2,7.4,7.04,7.4,1,1,239,35,1
6683,277912,"short on middle and leg, and with fine leg up, Marsh gets inside the line and helps it away fine of short fine leg",2,7.5,7.05,7.5,4,4,111,14,8
6683,277912,"short and skids off the deck outside off, Marsh is opened up as he sends an outside edge flying in the air... Taylor leaps but can only tip it over",2,7.6,7.06,7.6,4,4,210,4,1
325026,232364,,2,8.1,8.01,8.1,0,0,144,183,6
325026,232364,"short and wide outside off, flayed away to backward point, sprawling save from Munro",2,8.2,8.02,8.2,0,0,118,153,7
325026,232364,"good length, Southee brings out the offbreak variation, Marsh waits on the ball and defends to the off side",2,8.3,8.03,8.3,1,1,250,61,1
6683,232364,"full on off, pushed back on the front foot",2,8.4,8.04,8.4,0,0,205,181,3
6683,232364,,2,8.5,8.05,8.5,0,0,187,196,4
6683,232364,"short of a length and outside off, leans back and cuts to point",2,8.6,8.06,8.6,0,0,243,171,3
325026,277912,"full and sliding into the leg stump, clipped away square through the leg side to the right of long leg",2,9.1,9.01,9.1,2,2,298,73,2
325026,277912,"De Grandhomme, subbing for Broom, throws himself to his right from backward point and stops this full-blooded cut",2,9.2,9.02,9.2,0,0,116,150,7
325026,277912,"back of a length on middle and leg, worked to midwicket",2,9.3,9.03,9.3,0,0,208,184,3
325026,277912,"shot. Full on off, Maxwell punches on the front foot, through the legs of the non-striker, and skips away straight of mid-on",2,9.4,9.04,9.4,4,4,212,362,4
325026,277912,"back of a length and angled in on off, defended",2,9.5,9.05,9.5,0,0,214,187,3
325026,277912,"full on the pads from over the wicket, knocked in the direction of midwicket",2,9.6,9.06,9.6,2,2,336,187,3
6683,493773,"short and wide outside off, thrashes a cut to the right of extra cover, tumbling save",2,10.1,10.01,10.1,0,0,244,175,3
6683,493773,"short and hurries on outside off, fended to leg",2,10.2,10.02,10.2,0,0,135,221,5
6683,493773,"short and wide outside off, forced to deep point on the back foot",2,10.3,10.03,10.3,1,1,324,189,3
325026,493773,"very full and slanted in, chipped to mid-on",2,10.4,10.04,10.4,1,1,240,212,3
6683,493773,"short of a length and angling away outside off, punched past backward point, but deep third man hunts it down",2,10.5,10.05,10.5,1,1,302,78,2
325026,493773,"ripping bouncer outside off, throat-high delivery, <strong>149ks - pace like fire</strong> - Maxwell drops his wrists and rocks out of the way",2,10.6,10.06,10.6,0,0,0,0,0
6683,502714,"short and sliding across off, pushed back, Santner dives to his left and stops it",2,11.1,11.01,11.1,0,0,147,199,5
6683,502714,"Santner beats Marsh in the air. Marsh uses his feet, Santner drags his length back, the ball dips, creating distance between the bat and the pitch. The batsman misses a straight ball - okay spins in slightly - and Latham the stand-in keeper does the rest. Poor shot from Marsh. Looked very ungainly",2,11.2,11.02,11.2,0,0,0,0,0
826679,502714,"flat and angled across off from around the wicket, punched back to Santner",2,11.3,11.03,11.3,0,0,200,198,4
826679,502714,"drifting into the leg stump, tucked to deep midwicket",2,11.4,11.04,11.4,1,1,66,214,6
325026,502714,"more round-arm than usual, clatters into the front pad of Maxwell, heading down",2,11.5,11.05,11.5,0,0,177,167,6
325026,502714,"tossed outside off, pushed to cover on the front foot",2,11.6,11.06,11.6,0,0,161,189,5
826679,493773,"bouncer outside off, upper-cuts and misses",2,12.1,12.01,12.1,0,0,0,0,0
826679,493773,"dragged short and outside off, shovelled to deep midwicket",2,12.2,12.02,12.2,1,1,41,145,7
325026,493773,"short and angled in on the hips, helped away fine on the leg side. Sensible stuff",2,12.3,12.03,12.3,4,4,238,10,1
325026,493773,"short of a length on middle, <b>150ks</b>, punched to mid-on",2,12.4,12.04,12.4,0,0,216,216,4
325026,493773,"nasty short ball, hits the deck, rears up and Maxwell somehow fends on the pitch",2,12.5,12.05,12.5,0,0,178,193,5
325026,493773,"Nicked off. Australia are five down and sinking at Eden Park. 142.3ks, back of a length and outside off, Maxwell was aiming to run it down to third man. He only feathers it behind to Latham. He's having a good day behind the stumps, unlike Handscomb",2,12.6,12.06,12.6,0,0,182,135,1
826679,502714,"flatter on middle and leg, glanced to long leg",2,13.1,13.01,13.1,1,1,117,50,8
325012,502714,"looped up outside off, pushed to the left of the bowler",2,13.2,13.02,13.2,0,0,141,200,6
325012,502714,"round-armed into the pads, nudged to the leg side",2,13.3,13.03,13.3,0,0,207,184,3
325012,502714,"fast slider, defended with a straight bat",2,13.4,13.04,13.4,0,0,161,185,5
325012,502714,"drifts in on off, drops at the batsman, chipped to the left of the bowler",2,13.5,13.05,13.5,0,0,162,194,5
325012,502714,"tossed up on leg stump, knocked down to long-on",2,13.6,13.06,13.6,1,1,198,296,4
325012,493773,"short and angled on leg or just outside leg, hunkers down",2,14.1,14.01,14.1,0,0,0,0,0
325012,493773,"back of a length and angled in on off, played back to the bowler",2,14.2,14.02,14.2,0,0,172,179,5
325012,493773,"back of a length, kicks and screams at Stoinis. He fends it down",2,14.3,14.03,14.3,0,0,167,192,5
325012,493773,"full and slung into the pads, diverted square on the leg side",2,14.4,14.04,14.4,0,0,199,165,2
325012,493773,"short and wide outside off, slashes a cut down to third man",2,14.5,14.05,14.5,1,1,64,86,7
826679,493773,"short and outside off, Ferguson is too quick for the debutant. Attempts a pull and watches the ball dribble back to the bowler",2,14.6,14.06,14.6,0,0,167,186,5
325012,502714,nudged off the pads to short fine leg,2,15.1,15.01,15.1,0,0,249,148,2
325012,502714,"shortish and angled in on off, back-foot punch back to Santner",2,15.2,15.02,15.2,0,0,164,195,5
325012,502714,"sliding into the hips, directed to short fine leg",2,15.3,15.03,15.3,1,1,236,142,2
826679,502714,,2,15.4,15.04,15.4,0,0,149,207,5
826679,502714,"flighted nicely on middle, this full ball is driven back to the bowler",2,15.5,15.05,15.5,0,0,174,197,5
826679,502714,"short and just outside off, short-armed away to midwicket",2,15.6,15.06,15.6,0,0,120,191,6
325012,493773,"short and angled in, raps the glove as the ball lobs to the off side",2,16.1,16.01,16.1,0,0,139,180,6
325012,493773,"short and just below the chest, hops and fends to midwicket",2,16.2,16.02,16.2,0,0,225,186,3
325012,493773,"back of a length on off, punched back to the bowler",2,16.3,16.03,16.3,0,0,168,194,5
325012,493773,"short and slung into the pads, tucked around the corner",2,16.4,16.04,16.4,2,2,309,126,2
325012,493773,"good length and angled in on off, Stoinis does well to come forward, meet the pitch, and defend it back to the bowler",2,16.5,16.05,16.5,0,0,181,201,4
325012,493773,"short and fizzes on outside off, Stoinis is beaten for pace. The ball grazes the inside edge and streaks away to leg-gully",2,16.6,16.06,16.6,0,0,205,117,1
826679,502714,"pushes it through from over the wicket into the pads, Heazlett picks it away to long leg",2,17.1,17.01,17.1,1,1,133,30,8
325012,502714,goes back to a flatter delivery on off stump and keeps it out,2,17.2,17.02,17.2,0,0,131,174,6
325012,502714,"spots the short ball so early and then powers it away over straight midwicket. Solid base on the back foot, reads the lack of turn, knows he can hit into the leg side as he pleases",2,17.3,17.03,17.3,4,4,320,311,4
325012,502714,good length ball on off stump - much better line for the rapid pace he's bowling - defends,2,17.4,17.04,17.4,0,0,154,250,5
325012,502714,"that's a lot slower, brings Stoinis forward with a block in front of off stump",2,17.5,17.05,17.5,0,0,163,196,5
325012,502714,drives fluently through to long-off to retain strike,2,17.6,17.06,17.6,1,1,152,333,5
325012,493773,"back of a length and just outside off, Stoinis stands tall and punches into the covers",2,18.1,18.01,18.1,1,1,124,225,5
826679,493773,"all pace. Or rather the perception of it for Ferguson's throttled down has paralysed Heazlett's feet. In an effort to compensate, he throws his hands at a back of a length delivery and it takes the edge through to stand-in keeper Tom Latham",2,18.2,18.02,18.2,0,0,197,112,1
270484,493773,"lands a yorker on middle, digs it out",2,18.3,18.03,18.3,0,0,193,196,4
270484,493773,"length ball on off stump, handled",2,18.4,18.04,18.4,0,0,147,191,6
270484,493773,"sends down a bouncer, at 138 kph, on and around off stump. Faulkner tucks his head into his armpit to avoid it",2,18.5,18.05,18.5,0,0,0,0,0
270484,493773,"full on leg stump, deflected past leg gully to get off the mark",2,18.6,18.06,18.6,1,1,248,36,1
270484,502714,"shimmies down the track and pushes it down the ground, Santner dives to his left and stops the runs",2,19.1,19.01,19.1,0,0,162,199,5
270484,502714,"good work from the man at midwicket, diving to his right to stop a well-timed short-armed jab from leading to runs",2,19.2,19.02,19.2,0,0,246,200,3
270484,502714,"fires it in on middle, Faulkner trying to flick it with a closed face, gets a leading edge",2,19.3,19.03,19.3,0,0,132,206,6
270484,502714,,2,19.4,19.04,19.4,0,0,219,190,3
270484,502714,"fires it in on middle, defends",2,19.5,19.05,19.5,0,0,193,201,4
270484,502714,"a little slower through the air, a little shorter in length, Faulkner is unsure what to do with it as he belatedly tries to dab into the leg side",2,19.6,19.06,19.6,0,0,0,0,0
325012,493773,"143kph, moves in line with a length ball outside off and guides it to backward point",2,20.1,20.01,20.1,0,0,128,143,7
325012,493773,"146kph, goes short and at the body, Stoinis does well to move across and flick it off his hips to long leg",2,20.2,20.02,20.2,1,1,227,31,1
270484,493773,gets up on his toes to a short delivery at 144 kph and blunts it towards point,2,20.3,20.03,20.3,0,0,148,137,7
270484,493773,"fuller ball outside off, steps forward to defend",2,20.4,20.04,20.4,0,0,132,185,6
270484,493773,works his wrists over a shortish delivery on off stump and sends it to midwicket,2,20.5,20.05,20.5,1,1,315,185,3
325012,493773,"lovely batting. Stoinis looks absolutely unhurried today. Rising up with the short ball outside off and guiding it to point. He's been Australia's player of the day, can he pull off this miracle?",2,20.6,20.06,20.6,0,0,121,154,7
270484,502714,keeps back and flicks a length delivery angled into leg stump to long leg,2,21.1,21.01,21.1,1,1,326,153,2
325012,502714,good length ball - at slower pace - on middle stump. Stoinis is forward with a block,2,21.2,21.02,21.2,0,0,165,197,5
325012,502714,strides down the pitch at the first sign of flight and hammers a ball from outside off down to long-on,2,21.3,21.03,21.3,1,1,222,320,4
270484,502714,waits on a flatter delivery on leg stump and clips it to midwicket,2,21.4,21.04,21.4,1,1,254,203,3
325012,502714,goes back to block on off stump,2,21.5,21.05,21.5,0,0,131,198,6
325012,502714,comes down the track for a length ball on off stump - Santner flattened his length seeing the batsman's tactics - pushes it to midwicket,2,21.6,21.06,21.6,0,0,215,203,4
270484,493773,"139kph, full on off stump, blocks it",2,22.1,22.01,22.1,0,0,225,200,3
270484,493773,"on the pads, hits the pads and gives Tom Latham a bit of work to do. He runs to his left and parries the ball to leg gully",2,22.2,22.02,22.2,0,1,206,95,1
325012,493773,stands up tall against a back of a length delivery outside off and drills it to cover,2,22.3,22.03,22.3,0,0,125,199,6
325012,493773,"goes for a bouncer, and it gains considerable height. Umpire calls it one for the over as it flies past Stoinis' left shoulder",2,22.4,22.04,22.4,0,0,0,0,0
325012,493773,"goes for the drive the moment he sees a ball full and outside off, gets a thick edge which flies down to deep third man. Good work from Munro, keeping that to one, sprinting to his right",2,22.5,22.05,22.5,1,1,106,38,8
270484,493773,"full and down leg, picks it to long leg. Might be it for Ferguson",2,22.6,22.06,22.6,1,1,288,84,2
270484,355269,"starts with a back of a length delivery on middle, Faulker is up off his toes to tuck the ball into midwicket",2,23.1,23.01,23.1,1,1,250,191,3
325012,355269,moves outside off to take a short delivery on leg stump and pull it to long leg,2,23.2,23.02,23.2,1,1,320,104,2
270484,355269,"pats a length delivery to mid-off, seems a little odd that he played that off the back foot, possibly why he mistimes it. Perhaps realised his mistake late because at the last minute he was trying to play with a straight bat rather than the horizontal one for a late cut",2,23.3,23.03,23.3,1,1,155,257,5
325012,355269,"top edges over the wicketkeeper. Extra bounce from Neesham troubles Stoinis, who commits to a pull despite not having the room to free his arms",2,23.4,23.04,23.4,4,4,225,12,1
325012,355269,"shortish and outside off, slices it to point",2,23.5,23.05,23.5,0,0,115,191,6
325012,355269,digs it in short over middle and off stump - gains a little too much height for the umpire's liking as Stoinis leaves,2,23.6,23.06,23.6,0,1,0,0,0
325012,355269,pure power. He picks the slower delivery - so that shows how composed he is at the crease - and then he maximises on the poor ball - short and outside off - by placing it to the right of long-on,2,23.6,23.07,23.6,4,4,296,316,4
270484,277912,"back of a length and outside off, pushes it to cover",2,24.1,24.01,24.1,1,1,141,253,5
325012,277912,thumps a backfoot drive past short cover's right and gets a single. A bit of early evidence that Stoinis can bat up the order if needed,2,24.2,24.02,24.2,1,1,144,244,5
270484,277912,"deceives him with a slower ball, slanted full and outside off. Faulkner flicks it, looking ungainly, to mdiwicket",2,24.3,24.03,24.3,1,1,247,200,3
325012,277912,stands tall and pulls a short ball from outside off through straight midwicket.,2,24.4,24.04,24.4,2,2,292,277,3
325012,277912,"another pull, well controlled as he swivels on his back foot and places it to deep square leg",2,24.5,24.05,24.5,1,1,326,194,3
270484,277912,"that's bowling to his field. With plenty of people waiting on the off side, Boult pitches it up and his angle from over the wicket does the rest. Faulkner, caught in the crease, pushes with his hands and is beaten",2,24.6,24.06,24.6,0,0,0,0,0
325012,355269,"full and outside off, he drills it to mid-off",2,25.1,25.01,25.1,0,0,135,234,5
325012,355269,"good length ball on middle, defends",2,25.2,25.02,25.2,1,1,244,315,4
270484,355269,"looks for the blockhole on off stump, Stoinis, while trying to flick it away, ends up only pushing it back down the pitch",2,25.3,25.03,25.3,0,0,148,209,5
270484,355269,"onto the pads, worked away to long leg",2,25.4,25.04,25.4,1,1,275,56,1
325012,355269,"shortish and outside off, cut behind point",2,25.5,25.05,25.5,0,0,129,122,7
325012,355269,"waits a touch too long that time, trying to pick the gap behind point and ends up being beaten. Threw his head back at the lack of execution",2,25.6,25.06,25.6,0,0,0,0,0
270484,277912,"back of a length on off stump, blocks it",2,26.1,26.01,26.1,0,0,205,201,4
270484,277912,"full and outside off, lashes it to cover",2,26.2,26.02,26.2,0,0,117,199,6
270484,277912,"goes for a bouncer at 139 kph, Faulkner gets below it comfortably",2,26.3,26.03,26.3,0,0,0,0,0
270484,277912,"looks for the yorker on off stump, flicks it to mid-on",2,26.4,26.04,26.4,0,0,208,252,4
270484,277912,lets the short ball come to him and then dabs it on top of the bounce to deep third man,2,26.5,26.05,26.5,1,1,136,38,8
325012,277912,"fuller delivery angled across the right-hander, who leaves it well alone",2,26.6,26.06,26.6,0,0,0,0,0
270484,355269,"on the pads, clips it to long leg",2,27.1,27.01,27.1,1,1,315,123,2
325012,355269,"good length on off stump, blocks it down the pitch",2,27.2,27.02,27.2,0,0,165,197,5
325012,355269,"134 kph, back of a length and outside off, Stoinis punches it into the covers",2,27.3,27.03,27.3,0,0,109,198,6
325012,355269,flicks through midwicket,2,27.4,27.04,27.4,1,1,273,215,3
270484,355269,"finally Australia have their hundred, as Neesham spills a length ball down leg",2,27.5,27.05,27.5,0,1,0,0,0
270484,355269,"comes down the track, that big backlift going high, but Neesham follows Faulkner, cramping him for room and getting the ball to come up towards his stomach. Can only slice to point",2,27.5,27.06,27.5,0,0,122,201,6
270484,355269,"jumps back in his crease to nudge a shortish delivery behind square leg, and since he plays with soft hands, and placed it well to the right of Southee, there's always two on offer",2,27.6,27.07,27.6,2,2,311,131,2
325012,232364,"back of a length and outside off, Stoinis gets in line with a straight bat",2,28.1,28.01,28.1,0,0,152,188,6
325012,232364,"just a little shape away on this 124 kph good length delivery outside off, and Stoinis who stands and drives on the up is comfortably beaten",2,28.2,28.02,28.2,0,0,0,0,0
325012,232364,"goes wide of the crease to try and straighten the ball, but there's not as much on offer this time. Stoinis is back and across with a handsome push to cover",2,28.3,28.03,28.3,0,0,115,199,6
325012,232364,takes a short ball from outside off and pulls through midwicket,2,28.4,28.04,28.4,2,2,318,242,3
325012,232364,"shortish and outside off, carves it past point to deep third man",2,28.5,28.05,28.5,1,1,80,64,8
270484,232364,"fuller delivery on off stump, defends",2,28.6,28.06,28.6,0,0,155,191,5
325012,355269,short of a length and cramps the batsman for room. Punched to mid-on,2,29.1,29.01,29.1,0,0,222,215,4
325012,355269,"slightly short and outside off, Stoinis sits deep in the crease and clouts it over midwicket",2,29.2,29.02,29.2,4,4,326,281,3
325012,355269,"full and wide outside off, just inside the tramline, as the batsman swishes and does not connect",2,29.3,29.03,29.3,0,0,0,0,0
325012,355269,"length ball on off, firmly struck down the ground",2,29.4,29.04,29.4,1,1,214,333,4
270484,355269,"backs away, the bowler follows him, mis-hits a drive to mid-off",2,29.5,29.05,29.5,0,0,152,241,5
270484,355269,"Stoinis shuffles down the track and makes room. Ferguson digs it in short, but he still slots a cut wide enough of point and fetches a boundary",2,29.6,29.06,29.6,4,4,88,29,8
325012,232364,"length and outside off, punched to cover on the front foot",2,30.1,30.01,30.1,0,0,125,196,6
325012,232364,"very full, overpitched outside off, Stoinis drills it through mid-off. Stoinis is giving a good account of himself in his second ODI",2,30.2,30.02,30.2,4,4,199,358,4
325012,232364,,2,30.3,30.03,30.3,1,1,247,202,3
270484,232364,"short of a length on middle, goes back and fends it to cover",2,30.4,30.04,30.4,2,2,323,229,3
270484,232364,,2,30.5,30.05,30.5,0,0,165,185,5
270484,232364,,2,30.6,30.06,30.6,0,0,179,186,5
325012,502714,"tossed up on off stump, slugged flat and hard over long-on, evades a diving Munro and hits the hoarding on the full",2,31.1,31.01,31.1,6,6,294,325,4
325012,502714,"dug short and outside off, Stoinis sizes it up and nails a pull over midwicket. <b>Follows his three-for with a fifty</b>",2,31.2,31.02,31.2,6,6,341,265,3
325012,502714,,2,31.3,31.03,31.3,1,1,277,279,4
270484,502714,"back of a length, flicked towards the midwicket region",2,31.4,31.04,31.4,0,0,217,183,3
270484,502714,"darted flat on the pads, hangs back and turns the ball to the right of midwicket",2,31.5,31.05,31.5,1,1,255,205,3
325012,502714,"slightly short and wide outside off, chopped away to cover",2,31.6,31.06,31.6,0,0,129,200,6
270484,232359,"floated full on middle and leg, nudged to midwicket",2,32.1,32.01,32.1,0,0,218,198,3
270484,232359,"112.1ks, rolled down the leg side, past the glance, difficult take for Latham to his left",2,32.2,32.02,32.2,0,1,0,0,0
270484,232359,crunched to deep backward point for one,2,32.2,32.03,32.2,1,1,40,123,7
325012,232359,,2,32.3,32.04,32.3,0,0,144,131,7
325012,232359,"full and straight, clipped away square on the leg side",2,32.4,32.05,32.4,1,1,252,56,1
270484,232359,another leg-side wide,2,32.5,32.06,32.5,0,1,0,0,0
270484,232359,"full and straight, whipped away to long-on",2,32.5,32.07,32.5,1,1,266,299,4
325012,232359,"little roller on the pads, tickled away square of short fine leg",2,32.6,32.08,32.6,1,1,270,186,3
325012,502714,"""caaaatch,"" is the cry but Stoinis, though he has skewed this off the outside half of the bat, has placed it to the right of the sweeper cover. Comes down the track and goes at a flighted delivery as hard as he could",2,33.1,33.01,33.1,2,2,44,238,6
325012,502714,"spears it into the blockhole on off stump, he drills it back to long-off",2,33.2,33.02,33.2,1,1,103,296,5
270484,502714,"spears it into the blockhole on off stump, he drills it back to long-off",2,33.3,33.03,33.3,0,0,119,148,7
270484,502714,"shortish and outside off, but with the pace being a lot slower, Faulkner's attempt to force the pace with a cut doesn't work. Finds cover",2,33.4,33.04,33.4,0,0,169,194,5
270484,502714,"looks for the arm ball, but it strays well wide of off stump",2,33.5,33.05,33.5,0,1,0,0,0
270484,502714,pushes it through cover,2,33.5,33.06,33.5,1,1,96,303,5
325012,502714,"looks to take a length ball from well wide of off stump and sweep it away. Ends up mistiming to square leg, looks to snitch a single but is rightly sent back",2,33.6,33.07,33.6,0,0,220,167,3
270484,232359,"shortish and outside off, Faulkner whips it to long-on from deep in his crease",2,34.1,34.01,34.1,1,1,271,302,4
325012,232359,"falls short of Ferguson at short third man. Stoinis was trying to slice a boundary to third man, but the change in pace does him",2,34.2,34.02,34.2,1,1,147,110,8
