batid,bowlid,comm,inns,oa,ou,ovr,r,rt,x,y,z
270484,232359,"topples him and Eden roars with Munro! It's the cross-seamer coming down on a good length, stump-to-stump. Faulkner swings across the line and he groans the moment he misses the ball. He knows where it is heading. Doesn't look back",2,34.3,34.03,34.3,0,0,0,0,0
489889,232359,"beats him first ball as a good length ball outside off invites the drive. Cummins goes for it, looking for cover but comes up with nothing. Good take from Latham standing up behind the stumps",2,34.4,34.04,34.4,0,0,0,0,0
489889,232359,now Latham's gone back and watches a good length ball outside off being driven to cover,2,34.5,34.05,34.5,0,0,111,179,6
489889,232359,"back of a length and outside off, taps it through extra cover",2,34.6,34.06,34.6,1,1,93,186,6
489889,493773,"133kph, defends a back of a length delivery outside off off the bottom of the bat",2,35.1,35.01,35.1,0,0,177,188,5
489889,493773,"mistimes a pull, looks a bit like he was into the shot a tad too early and was trying to adjust. Lucky the ball lands well in front of deep midiwcket",2,35.2,35.02,35.2,2,2,330,223,3
489889,493773,"full on off stump, defends",2,35.3,35.03,35.3,0,0,149,188,6
489889,493773,"good length ball, skirting by beside off stump, with the slip and wicketkeeper watching its progress. Cummins shoulders arms",2,35.4,35.04,35.4,0,0,0,0,0
489889,493773,"full and outside off, Cummins opens the face but finds point",2,35.5,35.05,35.5,0,0,118,196,6
489889,493773,"past first slip, Taylor diving to his right, stretching out a hand cannot get there. Can't really be called a drop. Good bowling from Ferguson though, hitting a good length and inviting the unchecked drive.",2,35.6,35.06,35.6,4,4,110,19,8
325012,232359,"back of a length and outside off, Stoinis punches a single to cover",2,36.1,36.01,36.1,1,1,128,192,6
489889,232359,"dragged down outside off, Cummins punishes Munro, pulling hard over midwicket",2,36.2,36.02,36.2,4,4,345,250,3
489889,232359,"much better from Munro. Full and just a shade outside off, pushed down to long-on",2,36.3,36.03,36.3,1,1,262,286,4
325012,232359,"back of a length on middle, manufactures room by backing away and stabs it with a flat bat down to long-off",2,36.4,36.04,36.4,1,1,132,229,5
489889,232359,"full, barely 103ks, on off, chipped in the air and just clears Williamson at mid-off. Delectable shot",2,36.5,36.05,36.5,4,4,87,336,5
489889,232359,"slightly short and outside off, chopped to short third man",2,36.6,36.06,36.6,0,0,150,122,8
325012,493773,"mighty full on off, swiped across the line to wide mid-on",2,37.1,37.01,37.1,1,1,233,225,4
489889,493773,back of a length and thuds into the splice of the bat. Fended back to the bowler,2,37.2,37.02,37.2,0,0,176,180,5
489889,493773,"full and outside off, drives through the line to extra cover",2,37.3,37.03,37.3,0,0,144,195,6
489889,493773,"short of a length and outside off, smartly late cut away to the right of deep third man",2,37.4,37.04,37.4,1,1,97,51,8
325012,493773,"and it fetches him s a boundary right away with some help from Southee who fumbles sliding at mid-on and going for the ball with only one hand. Slower short ball outside off, swatted to the long-on fence",2,37.5,37.05,37.5,4,4,290,328,4
325012,493773,,2,37.6,37.06,37.6,1,1,144,246,5
325012,232364,"back of a length and outside off, punched to mid-off",2,38.1,38.01,38.1,1,1,123,228,5
489889,232364,chopped from off stump to point,2,38.2,38.02,38.2,0,0,151,133,8
489889,232364,"back of a length on middle, chipped to the right of Guptill at short midwicket",2,38.3,38.03,38.3,0,0,220,187,3
489889,232364,"length ball outside off, pinged over the covers. Williamson slides at the edge of the boundary and knocks it back in. Or is he in contact with the ball while brushing the hoarding? Yes, it seems like, it's a four",2,38.4,38.04,38.4,4,4,59,267,6
489889,232364,,2,38.5,38.05,38.5,0,0,182,188,4
489889,232364,"back of a length and outside off, flat-batted to mid-off who is inside the circle",2,38.6,38.06,38.6,1,1,132,215,5
489889,493773,"short ball, slung in on off, rushes the batsman into a pull. Top-edged in the air between keeper and slip",2,39.1,39.01,39.1,4,4,196,0,1
489889,493773,"length ball outside off, flat-batted away to the left of mid-on. Southee dives to his left and takes some pace off the  ball",2,39.2,39.02,39.2,2,2,299,277,3
489889,493773,"back of a length on off, ripe for a launch right now. Back of the hand slower ball, dispatched disdainfully over midwicket",2,39.3,39.03,39.3,6,6,348,252,3
489889,493773,"rapid short ball, skids into strike the thigh. Beaten for pace",2,39.4,39.04,39.4,0,0,186,166,3
489889,493773,"Guptill flies to his right from extra cover, stretches his right hand out, <b>nearly pulls off a one-hander</b>. The ball hits the wrist and goes down. Saves a boundary. Cummins sliced a drive in the air",2,39.5,39.05,39.5,1,1,119,225,6
325012,493773,"shortish and outside off, flayed to point, tumbling save",2,39.6,39.06,39.6,1,1,105,148,7
325012,502714,"turn and bounce, beats the slash",2,40.1,40.01,40.1,0,0,0,0,0
325012,502714,"tossed up, down the track and drilled back",2,40.2,40.02,40.2,0,0,166,199,5
325012,502714,reverse-paddled from the stumps to short third man,2,40.3,40.03,40.3,1,1,158,107,8
489889,502714,"looped up on off stump, slogged across the line to deep midwicket",2,40.4,40.04,40.4,1,1,327,235,3
325012,502714,"skips out, converts it into a full-toss and belts it to long-off",2,40.5,40.05,40.5,1,1,166,334,5
489889,502714,"Santner beats Cummins in the air, beats him with turn and snaffles him. He does not have many variations, isn't fancy, but is pretty smart. Cummins jumps down the track. The bowler lobs it up wide outside off and finds some turn as well. Latham helps himself to another stumping.",2,40.6,40.06,40.6,0,0,0,0,0
325012,355269,leg-side wide,2,41.1,41.01,41.1,0,1,0,0,0
325012,355269,"length ball outside off, Stoinis backs away outside leg and clobbers it over cover. Picked the offcutter and hit the pants off it",2,41.1,41.02,41.1,6,6,136,352,5
325012,355269,"slower bouncer, too high. Wide called",2,41.2,41.03,41.2,0,1,0,0,0
325012,355269,"too full on off, Stoinis gets under it and hoists it over long-on. Clean strike",2,41.2,41.04,41.2,6,6,257,343,4
325012,355269,"lifter on middle, the batsman sways his upper body out of the way",2,41.3,41.05,41.3,0,0,0,0,0
325012,355269,"back of a length on off, Stoinis moves into the 90s with a lusty club over the bowler's head. Williamson's anxiety grows",2,41.4,41.06,41.4,6,6,193,358,4
325012,355269,"low full-toss on off, slapped flat and hard to long-off. <strong>Williamson drops it.</strong> Stinging blow. He dives to his right but the ball pops out",2,41.5,41.07,41.5,0,0,152,260,5
325012,355269,"low full-toss, hacked to long-on. 21 off that over",2,41.6,41.08,41.6,1,1,216,326,4
325012,502714,"short and wide outside off, waits on it and cracks a cut through backward point",2,42.1,42.01,42.1,4,4,65,49,8
325012,502714,,2,42.2,42.02,42.2,1,1,119,315,5
311592,502714,"yorker on middle, outside-edged down to third man",2,42.3,42.03,42.3,2,2,234,30,1
311592,502714,"flat and sliding across off, square-cut away",2,42.4,42.04,42.4,1,1,324,129,2
325012,502714,"full and angled in on off, defended",2,42.5,42.05,42.5,1,1,129,221,5
311592,502714,"tossed up outside off, angling away from around the wicket. Starc goes low, attempts a slog-sweep and holes out to deep midwicket. Strikes with the last ball of his spell and eases NZ's nerves",2,42.6,42.06,42.6,0,0,32,230,6
325012,277912,"full and straying into the pads, clipped away to square leg",2,43.1,43.01,43.1,0,0,262,139,2
325012,277912,"shimmies down the track, meets a short ball, and swats to long-on. Declines the single",2,43.2,43.02,43.2,0,0,232,307,4
325012,277912,"bouncer, sails over the batsman, sails over the keeper. Five wides",2,43.3,43.03,43.3,0,5,0,0,0
325012,277912,"Boult serves up a length ball on middle, Stoinis dispatches it over long-on and brings up his maiden century in his second ODI. He is the <a href=""http://stats.espncricinfo.com/ci/engine/stats/index.html?class=2;filter=advanced;orderby=start;qualmin1=100;qualmin2=3;qualval1=runs;qualval2=wickets;template=results;type=allround;view=match"" target=""_blank"">first Australian</a> to take three wickets and hit a hundred in an ODI",2,43.3,43.04,43.3,6,6,229,354,4
325012,277912,backs away outside leg and carves a full-toss up and over wide mid-off. Goes all the way,2,43.4,43.05,43.4,6,6,73,325,5
325012,277912,"full and wide outside off, scythes and misses",2,43.5,43.06,43.5,0,0,0,0,0
325012,277912,"back of a length on off, camps back, jabs to cover for one",2,43.6,43.07,43.6,1,1,129,191,6
325012,232364,"short on leg, following the batsman, chopped to short third man",2,44.1,44.01,44.1,0,0,130,123,7
325012,232364,"slower offcutter, clears the biggest boundary at Eden Park with a muscular tug. Slammed over midwicket",2,44.2,44.02,44.2,6,6,335,274,3
325012,232364,"dug short and outside off, Stoinis sits back waiting for it and carves over short third man. This is some innings from Stoinis",2,44.3,44.03,44.3,4,4,146,7,8
325012,232364,"full on off stump, Southee misses his length again. Stoinis smites it over the short, straight boundary. He is doing it for Australia on his own. Tense faces in the crowd",2,44.4,44.04,44.4,6,6,231,355,4
325012,232364,"low full-toss outside off, flat-batted away to long-off. Stoinis declines the single",2,44.5,44.05,44.5,0,0,129,309,5
325012,232364,"<b>pandemonium at Eden Park</b>. Full and outside off, front-foot drive to cover from Stoinis. Kane Williamson swoops down on the ball, runs in, then decides to throw the ball to the bowler's end. Santner running in does not gather it cleanly. He <b>can't capitalise on the mix-up between the wickets</b>. Stoinis could have been dismissed, instead he runs across for one and pinches the strike",2,44.6,44.06,44.6,1,1,143,200,6
325012,277912,"low full-toss on off, dragged away towards wide long-on. Broom makes a sprawling save, sliding to his right from deep midwicket",2,45.1,45.01,45.1,2,2,265,310,4
325012,277912,"back of a length and outside off, sliced away over cover. The ball swirls to the right of third man. He does not take the single. Two on offer. He does not take it either",2,45.2,45.02,45.2,0,0,77,75,7
325012,277912,"full and outside off, driven to cover",2,45.3,45.03,45.3,0,0,107,212,6
325012,277912,"140.2ks short ball, fizzes off the surface, cramps the batsman for room and pings the glove, beating the hook",2,45.4,45.04,45.4,0,0,243,156,2
325012,277912,"back of a length and on off stump, 138ks, slogged away to the right of Broom at deep midwicket",2,45.5,45.05,45.5,4,4,337,255,3
325012,277912,"<b>Has Stoinis nicked it behind</b>? Not given by Palliyaguruge. And they cross over. Latham should have run up and attempted to flick the ball onto the stumps. New Zealand challenge the on-field not out decision. Good-length indipper,cramps the batsman for room. He jams his bat down, the ball grazes the flap of the front pad and carries through to the keeper. Snicko picks up a spike - that's when the ball hit the pad. <b>No clear evidence of an inside snick</b>. Umpire Dharmasena checks from various angles. Excellent awareness from Stoinis and Hazlewood. Not so much from Latham",2,45.6,45.06,45.6,0,1,171,121,8
325012,232364,"low full-toss, hit to deep midwicket, but they don't run",2,46.1,46.01,46.1,0,0,304,267,3
325012,232364,"Ripping effort from Broom. He dives full length to his left and meets the ball on a half-volley and knocks it away towards long-off. Wide yorker, dragged away to wide long-on",2,46.2,46.02,46.2,0,0,223,334,4
325012,232364,"full and outside off, slapped away to cover",2,46.3,46.03,46.3,0,0,115,227,6
325012,232364,similar ball - full and wide outside off - Stoinis throws his hands at it and slices it over cover. Clears the bigger boundary,2,46.4,46.04,46.4,6,6,8,196,6
325012,232364,"low full-toss outside off, smeared over long-off for a six. <b>Fifty partnership with no contribution at all from Hazlewood</b>. He hasn't faced a ball yet. Unbelievable scenes at Eden Park",2,46.5,46.05,46.5,6,6,138,354,5
325012,232364,"<b>Venue: Eden Park. Hero: Kane Williamson. Result: New Zealand win a thriller</b>! You've heard that before? Whoa.... What a game. Breathless stuff. First let us give credit to Williamson for placing himself at short mid-on. Southee nails a yorker on off stump, Stoinis can only dig the ball out fairly straight to Williamson. He collects the ball, falls in front of the stumps, and under-arms it into the stumps to catch Hazlewood short. Hazlewood had lost his head. He was off for a single - there wasn't a single there - he has to spin back. He dishes out a desperate dive, but that's not enough. <b>This is the first time Hazlewood has been dismissed in an ODI</b>. Spare a thought for Marcus Stonis, though. Nearly pulled off an incredible heist from nowhere",2,46.6,46.06,46.6,0,0,212,211,4
