batid,bowlid,comm,inns,oa,ou,ovr,r,rt,x,y,z
219889,414990,"outside off, pushed into the covers",1,0.1,0.01,0.1,0,0,235,145,2
219889,414990,"on the toes, tucked to the leg side",1,0.2,0.02,0.2,0,0,129,199,6
219889,414990,"that's a lovely ball, angling in and nipping away, past the left-hander's edge. Warner does well not to nick it",1,0.3,0.03,0.3,0,0,0,0,0
219889,414990,"dangling it outside off stump, tempting the indiscretion. Warner leaves",1,0.4,0.04,0.4,0,0,0,0,0
219889,414990,"tight and straight, tapped back to the bowler. Hitting the pitch hard on a fullish length, and just nibbling it a touch so far",1,0.5,0.05,0.5,0,0,151,191,6
219889,414990,"round the wicket, angled into the bat, poked to cover and that's a maiden. Well done.",1,0.6,0.06,0.6,0,0,236,179,3
5334,351588,"careful now! A wild slash outside off, desperate to feel bat on ball",1,1.1,1.01,1.1,0,0,0,0,0
5334,351588,"dangled outside off, a hint of gentle outswing. Finch reaches but can't connect",1,1.2,1.02,1.2,0,0,0,0,0
5334,351588,"good line and length, a bit of outswing once more. Finch leaves alone, as the ball dies through to the keeper",1,1.3,1.03,1.3,0,0,0,0,0
5334,351588,"wafty. Finch is lining up the massive wallop over the covers, but Wood's line keeps drifting just out of his reach",1,1.4,1.04,1.4,0,0,0,0,0
5334,351588,"fuller length, Finch attempts to hit straight back whence it came, but a thick outside edge fizzes into the covers to get him off the mark",1,1.5,1.05,1.5,1,1,111,194,6
219889,351588,"on the back foot, punched back down the pitch. ""Wait on!"" is the cry, and sure enough, they wait. Very solid start",1,1.6,1.06,1.6,0,0,208,214,4
5334,414990,"biffed! On the front foot, dispatched with utter contempt through mid-on with a round-house swing. That'll make him feel better!",1,2.1,2.01,2.1,4,4,210,353,4
5334,414990,"good comeback, tighter line. Defended",1,2.2,2.02,2.2,0,0,153,191,6
5334,414990,"another boundary, not remotely where he intended, but his ambitious swing means that an attempted cover-drive ends up as a whistling inside edge through midwicket",1,2.3,2.03,2.3,4,4,344,112,2
5334,414990,"hanging back in the crease this time, a single into the leg side",1,2.4,2.04,2.4,1,1,220,223,4
219889,414990,"lots of humpty behind that stroke, cracked on the up into the covers. But wide mid-off is well placed",1,2.5,2.05,2.5,0,0,208,249,4
219889,414990,"a quick single to backward point, Roy fumbles as Warner gets off the mark",1,2.6,2.06,2.6,1,1,235,146,2
219889,351588,"a fraction too short, and now it's Warner's turn to connect with a haymaker, leaning back to smite with great vengeance over wide mid-on. Seems he's knocked the ball a touch out of shape with that blow",1,3.1,3.01,3.1,4,4,24,263,6
219889,351588,"short again, Warner rises onto his toes, like a pugnacious ballerina, and hauls a measured pull through the leg-side",1,3.2,3.02,3.2,1,1,90,56,8
5334,351588,"better line and length, holding its own on off stump. Finch pats back to the bowler",1,3.3,3.03,3.3,0,0,158,205,5
5334,351588,"on the back foot, and defended back down the pitch",1,3.4,3.04,3.4,0,0,164,194,5
5334,351588,"tip and run, on the back foot, but an instant call beats the cover fielder",1,3.5,3.05,3.5,1,1,146,232,5
219889,351588,"nibbles back into the left-hander, dabbed into the off side. Good cut and thrust on show so far",1,3.6,3.06,3.6,0,0,218,156,2
5334,414990,"angled in from wider on the crease, defended on the back foot",1,4.1,4.01,4.1,0,0,166,201,5
5334,414990,sliding down the leg side,1,4.2,4.02,4.2,0,1,0,0,0
5334,414990,works the single,1,4.2,4.03,4.2,1,1,302,195,3
219889,414990,"dispatched! Round the wicket, in Warner's slot, a massive heave-ho over the leg side",1,4.3,4.04,4.3,4,4,23,269,6
219889,414990,"back on a fuller length, patted into the covers",1,4.4,4.05,4.4,0,0,236,158,2
219889,414990,"inside edge, and tapped down into the crease. More good calling to steal the single",1,4.5,4.06,4.5,1,1,205,179,3
5334,414990,"excellent running again, poked to the off side, an instant call. Had to scamper as the under-arm came in from Morgan but safely home",1,4.6,4.07,4.6,1,1,134,196,6
5334,351588,"banged in short, swivelled round the corner for a measured single",1,5.1,5.01,5.1,1,1,259,46,1
219889,351588,"a loud roar of ""no!"" from the big man",1,5.2,5.02,5.2,0,0,117,181,6
219889,351588,"on the pads, that's a poor ball, and Rashid can't cut that off as Warner works it exceptionally fine off the hip",1,5.3,5.03,5.3,4,4,166,7,8
219889,351588,tapped to the leg side,1,5.4,5.04,5.4,0,0,118,177,6
219889,351588,"well bowled, fuller length, swinging past a tentative poke outside off",1,5.5,5.05,5.5,0,0,0,0,0
219889,351588,"tries to steal the single into the off side, think better of it, then nick it anyway as the shy pings off the stumps and away to no-man's land. Excellent awareness from Australia",1,5.6,5.06,5.6,1,1,241,162,2
219889,414990,"round the wicket, that's a probing line and length, pushed back down the pitch from under the batsman's nose",1,6.1,6.01,6.1,0,0,213,167,3
219889,414990,"up on the toes, working the single to the leg side",1,6.2,6.02,6.2,1,1,131,178,6
5334,414990,"good placement from Finch, this is a positive start from Australia, without being explosive",1,6.3,6.03,6.3,2,2,96,294,5
5334,414990,deflected fine,1,6.4,6.04,6.4,0,1,221,122,1
219889,414990,"inches from holing out to cover! Pushed hard off the back foot, it hung in the air for a while, but died just in front",1,6.5,6.05,6.5,0,0,248,204,3
219889,414990,"a good bombastic finish to another over of solid progress. Short, not ruinously so, but Warner is so quick to punish on length. Midwicket can't intercept",1,6.6,6.06,6.6,4,4,40,271,6
5334,351588,"on the pads, another single to keep England frustrated",1,7.1,7.01,7.1,1,1,225,227,4
219889,351588,"edged and Warner is gone! That is a superb delivery from Wood, inch-perfect line, kicking off the deck and nibbling half-a-bat's width away from the left-hander! He was just beginning to find his range, but Australia's danger man is extracted in his prime",1,7.2,7.02,7.2,0,0,203,103,1
267192,351588,"lovely way to greet the new batsman! Outside off, holds its line, beats a tentative defensive push",1,7.3,7.03,7.3,0,0,0,0,0
267192,351588,"well bowled again, outside off, a hint of movement back into the right hander, as he shoulders arms",1,7.4,7.04,7.4,0,0,0,0,0
267192,351588,"firm-handed push to cover. ""No run!"" is the cry, but then Morgan misfields, so they take one anyway",1,7.5,7.05,7.5,1,1,126,201,6
5334,351588,"that's a loose delivery, too straight to a player of Finch's ability, who walks inside the line and tucks a boundary through fine leg",1,7.6,7.06,7.6,4,4,231,10,1
267192,414990,"no stroke offered as the ball crashes into the pads! Huge appeal from Ball, but he knows in his heart of hearts that that was missing off... no review, on we go",1,8.1,8.01,8.1,0,0,0,0,0
267192,414990,"sharp lift from a full length, Smith removes his top hand from the bat as the ball gets big on him",1,8.2,8.02,8.2,1,1,217,198,3
5334,414990,"good forcing stroke off the back foot, bisecting cover and point, who chase manfully to the edge of the rope to limit the damage",1,8.3,8.03,8.3,3,3,19,177,6
267192,414990,"outside off, through to the keeper on a measured line and length",1,8.4,8.04,8.4,0,0,0,0,0
267192,414990,"beautiful timing, trusting the hands to fling the ball through the line and away to the rope",1,8.5,8.05,8.5,4,4,88,332,5
267192,414990,panned down the pitch once again. He's finding the middle of his bat already,1,8.6,8.06,8.6,2,2,147,331,5
5334,351588,"driving with hard hands off the back foot, not really timed though as it pings off the splice into the off side",1,9.1,9.01,9.1,0,0,136,183,6
5334,351588,through to the keeper once more,1,9.2,9.02,9.2,0,0,0,0,0
5334,351588,"on the toes, into the leg side",1,9.3,9.03,9.3,1,1,241,151,2
267192,351588,"punched into the covers, Smith feels the vibrations through his handle as he wrings his top hand after that shot",1,9.4,9.04,9.4,0,0,137,239,5
267192,351588,"wider on the crease from Wood, fuller length as well. Cover tidies up",1,9.5,9.05,9.5,0,0,150,249,5
267192,351588,"tight line, tight length. Defended into the off side from deep in the crease",1,9.6,9.06,9.6,0,0,123,179,6
5334,19264,"tremendous strike! Full and straight, Finch waited and waited, bashed it right under his eyeline, and it squeezes past the stumps and away to the rope",1,10.1,10.01,10.1,4,4,165,354,5
5334,19264,works the single as Plunkett adjusts his length,1,10.2,10.02,10.2,1,1,278,140,2
267192,19264,"on the pads, flicked wide of mid-on, who gathers with a dive",1,10.3,10.03,10.3,1,1,286,253,3
5334,19264,"slower ball, but Finch picks it well, waiting late to punch it past a flailing mid-on. A loose start from Plunkett",1,10.4,10.04,10.4,4,4,231,349,4
5334,19264,"drilled on the up, into the covers",1,10.5,10.05,10.5,0,0,151,254,5
5334,19264,"on the pads, settles for a deflected single into the leg side",1,10.6,10.06,10.6,1,1,237,149,2
5334,311158,"a bit of a loosener, short and wide, but cover is well placed to protect against any damage",1,11.1,11.01,11.1,0,0,115,185,6
5334,311158,"tighter line, back of a length, punched to mid-off",1,11.2,11.02,11.2,0,0,153,255,5
5334,311158,"on the pads, tapped to midwicket",1,11.3,11.03,11.3,1,1,307,151,2
267192,311158,"cracked into the off side, no way through",1,11.4,11.04,11.4,0,0,125,195,6
267192,311158,worked off the leg side,1,11.5,11.05,11.5,1,1,294,216,3
5334,311158,"slower ball, back of a length, pulled to backward square. A tidier over from Stokes",1,11.6,11.06,11.6,1,1,288,69,2
5334,19264,"attacking the toes, worked to leg",1,12.1,12.01,12.1,0,0,213,233,4
5334,19264,"that's Plunkett's area, tight on off stump, hitting the deck hard, forcing a defensive push off the back foot",1,12.2,12.02,12.2,0,0,201,253,4
5334,19264,"ambitious from Smith, looking to steal a single to a non-descript push to mid-on, and he had to scarper for his crease as the under-arm flick came in",1,12.3,12.03,12.3,0,0,222,226,4
5334,19264,misdirected. We'll have that one again,1,12.4,12.04,12.4,0,1,0,0,0
5334,19264,"whittled into the leg side, full length on the pads",1,12.4,12.05,12.4,0,1,260,71,1
267192,19264,"pushed back into the crease, defended to the leg side",1,12.5,12.06,12.5,0,0,230,195,3
267192,19264,"a better over from Plunkett, he's finding his range",1,12.6,12.07,12.6,0,0,155,196,5
5334,311158,"very full length once again, drilled to mid-on",1,13.1,13.01,13.1,0,0,209,241,4
5334,311158,"outside off stump, dangled out there, asking Finch to come and have a go. He declines, and simply wafts the ball back to the bowler with minimal footwork",1,13.2,13.02,13.2,0,0,124,189,6
5334,311158,"tapped to cover, another sharp single",1,13.3,13.03,13.3,1,1,111,171,6
267192,311158,a wide line and a full length. Stokes inviting Smith to take the initiative,1,13.4,13.04,13.4,0,0,125,186,6
267192,311158,"short, and that's a cracking stroke - literally, as the shot echoes around a disappointingly un-rammed Edgbaston. But the midwicket sweeper tidies up",1,13.5,13.05,13.5,1,1,330,219,3
5334,311158,"short and wide, but the sweeper on the off side this time is well placed to intercept",1,13.6,13.06,13.6,1,1,30,185,6
5334,19264,thumped out to the off side,1,14.1,14.01,14.1,1,1,33,193,6
267192,19264,"full length, and defended to the off side",1,14.2,14.02,14.2,0,0,127,185,6
267192,19264,"outside off, tight line, full length, left alone",1,14.3,14.03,14.3,0,0,0,0,0
267192,19264,tucked up a touch by a tighter line. Plunkett gathers in his followthrough,1,14.4,14.04,14.4,0,0,156,199,5
267192,19264,fenced down into the crease,1,14.5,14.05,14.5,0,0,209,193,3
267192,19264,"that's a good bit of dot-joining from Plunkett, tight on off stump and fended away",1,14.6,14.06,14.6,0,0,131,175,6
5334,311158,"a cross-seam delivery from Stokes, but it comes out as a bit of a biff-able long-hop, slapped through midwicket",1,15.1,15.01,15.1,4,4,347,121,2
5334,311158,"back-to-back boundaries, as Stokes is this time punished for his wider line. Cut fiercely",1,15.2,15.02,15.2,4,4,22,108,7
5334,311158,"Stokes recalibrates, and this is a better ball angling into the top of off. Pushed to point",1,15.3,15.03,15.3,1,1,135,40,8
267192,311158,"genuine edge, but Buttler can't reach it! A loose waft, but safe in the end, as England's only slip is standing at a splice-intercepting fifth",1,15.4,15.04,15.4,4,4,150,7,8
267192,311158,"shorter and straighter, tucked to the leg side. The fifty partnership is up in good time",1,15.5,15.05,15.5,1,1,258,166,3
5334,311158,a touch taken aback as this one leaps from a good length. But negotiated in the end,1,15.6,15.06,15.6,0,0,201,185,3
267192,19264,"tight line outside off, Smith hops across to work into the leg side",1,16.1,16.01,16.1,0,0,197,186,4
267192,19264,"squirted into the leg side, another single to keep the pot boiling",1,16.2,16.02,16.2,1,1,315,193,3
5334,19264,"a roll of the wrists, and a single to midwicket. Fifty for Finch, and he's building a head of steam",1,16.3,16.03,16.3,1,1,308,253,3
267192,19264,attacking line,1,16.4,16.04,16.4,0,0,192,246,4
267192,19264,"Smith opens the face on impact, attempting to milk a tight and aggressive line on off stump",1,16.5,16.05,16.5,0,0,144,177,6
267192,19264,"worked into the leg side, another single - lots of them around today.",1,16.6,16.06,16.6,1,1,232,213,3
267192,244497,"floated up full on off stump, blunted watchfully back to the bowler by Smith",1,17.1,17.01,17.1,0,0,170,200,5
267192,244497,"full and loopy, comes across, tapped into the covers",1,17.2,17.02,17.2,0,0,152,202,5
267192,244497,"flighted, bit of dip on to middle stump, Smith clips it brusquely past the bowler and Jake Ball has to put in a good slide to stop it at long-on",1,17.3,17.03,17.3,2,2,215,326,4
267192,244497,tossed up on the legs and worked away square for a single,1,17.4,17.04,17.4,1,1,292,212,3
5334,244497,"full and flighted, nurdled to mid-on, the fielder is set back and it's a comfortable single",1,17.5,17.05,17.5,1,1,249,311,4
267192,244497,"pushed through a bit quicker on the stumps, Smith tucks to midwicket for one more",1,17.6,17.06,17.6,1,1,281,210,3
267192,19264,"oof, that's a menace, Plunkett beams Smith and it's rightly called a no-ball, did well to shovel it away to leg for a couple",1,18.1,18.01,18.1,2,3,311,155,2
267192,19264,follows up with a bouncer that Smith swivels down to fine leg,1,18.1,18.02,18.1,1,1,245,32,1
5334,19264,"length on the hips and tucked into a gap square, they come back for two",1,18.2,18.03,18.2,2,2,259,49,1
5334,19264,"sliding in with the arm, Finch waits in the crease and turns one more off his hip",1,18.3,18.04,18.3,1,1,295,190,3
267192,19264,"lovely stroke, timed like a Swiss watchmaker back down the ground, beats mid-on and races away",1,18.4,18.05,18.4,4,4,216,353,4
267192,19264,back of a length and worked into the leg side,1,18.5,18.06,18.5,1,1,297,167,3
5334,19264,"short outside off stump, Finch splunks a back-foot drive square for one more",1,18.6,18.07,18.6,1,1,56,198,6
5334,244497,tossed up outside off and pushed down the ground to long-off,1,19.1,19.01,19.1,1,1,143,325,5
267192,244497,"drifting a touch straighter, Smith clips it from under his nose through the on side",1,19.2,19.02,19.2,1,1,209,309,4
5334,244497,"doesn't pick the googly, spins on to the pads but slightly leg side",1,19.3,19.03,19.3,0,0,0,0,0
5334,244497,"huge appeal from Rashid, again he inveigles a Bosie back inside the bat, Dharmasena not interested... and England decide not to <b>review</b> on Buttler's instinct that is was sliding down",1,19.4,19.04,19.4,0,0,0,0,0
5334,244497,"another lbw shout, this time as the ball grubs on to hit the boot with Finch in an awful tangle - but this was definitely missing leg",1,19.5,19.05,19.5,0,0,0,0,0
5334,244497,waits and calmly nudges away a single to leg to finish an eventful over,1,19.6,19.06,19.6,1,1,283,162,2
5334,311158,touch short and wide and steered through point for a single,1,20.1,20.01,20.1,1,1,37,169,6
267192,311158,lets this one go in the channel,1,20.2,20.02,20.2,0,0,0,0,0
267192,311158,"full and wide, that's pretty ordinary bowling, Smith happily clubs it away through backward point for a boundary",1,20.3,20.03,20.3,4,4,18,125,7
267192,311158,"better lines, Smith shuffles across and defends",1,20.4,20.04,20.4,0,0,170,189,5
267192,311158,"short outside off, 138kph/86mph, again patted back down towards the bowler",1,20.5,20.05,20.5,0,0,146,176,6
267192,311158,"full and wide, in the tramlines and Smith couldn't reach it having moved across. Stokes scowls at the decision",1,20.6,20.06,20.6,0,1,0,0,0
267192,311158,touch short and flicked off the body through backward square,1,20.6,20.07,20.6,1,1,293,216,3
267192,244497,"flighted, on middle and leg, punched down the ground",1,21.1,21.01,21.1,1,1,185,318,4
5334,244497,"tossed up on the stumps and Finch is down early, gets a good stride and paddles a couple through backward square",1,21.2,21.02,21.2,2,2,198,33,1
5334,244497,"slider, this skips on and does for Finch, stuck on the back foot, into the pads, Rashid again implores for the lbw... but no dice, possibly <i>just</i> missing leg",1,21.3,21.03,21.3,0,0,0,0,0
5334,244497,spots the googly this time and plays with the spin through square leg for a couple,1,21.4,21.04,21.4,2,2,336,216,3
5334,244497,comes forward and pushes one back past the bowler,1,21.5,21.05,21.5,1,1,136,318,5
267192,244497,tossed up and tickled through mid-off for one more,1,21.6,21.06,21.6,1,1,150,310,5
267192,311158,"on the stumps, worked away to leg",1,22.1,22.01,22.1,1,1,320,241,3
5334,311158,absolutely boshed! Too full from Stokes and Finch leans his considerable bulk into a hammer blow past the dive of mid-off,1,22.2,22.02,22.2,4,4,129,352,5
5334,311158,"fired into the tramlines outside off, another wide",1,22.3,22.03,22.3,0,1,0,0,0
5334,311158,"short, on the body and worked away to the leg side",1,22.3,22.04,22.3,1,1,297,103,2
267192,311158,"back of a length and angling in, turned behind square but fine leg is up quickly to prevent a second",1,22.4,22.05,22.4,1,1,254,68,1
5334,311158,"Finch misfires! Just as he was beginning to look very dangerous, he tried to launch Stokes into West Bromwich and ended up hitting the ball straight up, to be taken smartly by Morgan circling under it from mid-off. Came right off the toe of the bat, maybe deceived by a legcutter from Stokes",1,22.5,22.06,22.5,0,0,99,191,6
267192,311158,comes across on off and defends,1,22.6,22.07,22.6,0,0,172,201,5
5961,244497,"tossed up on middle and leg, Henriques is on to the front foot to push away",1,23.1,23.01,23.1,0,0,198,248,4
5961,244497,pushed into the off side,1,23.2,23.02,23.2,0,0,139,173,6
5961,244497,"floated up outside off, tapped towards extra cover",1,23.3,23.03,23.3,0,0,165,186,5
5961,244497,"pushed through a little flatter and Henriques misses out trying to cut, finds backward point",1,23.4,23.04,23.4,0,0,132,138,7
5961,244497,"floated up full and straight, worked to midwicket this time",1,23.5,23.05,23.5,0,0,223,195,3
5961,244497,"that's a maiden for Rashid, as Henriques flays a drive to cover. Sound and fury, signifying nothing",1,23.6,23.06,23.6,0,0,133,189,6
267192,311158,"angled in, touch short and worked away off the body through midwicket",1,24.1,24.01,24.1,1,1,302,151,2
5961,311158,"fuller length, Henriques closes the face early and gets a leading edge back to the bowler",1,24.2,24.02,24.2,0,0,176,192,5
5961,311158,"lovely shot, a confidence-boosting way to get off the mark, steps out and drills a square drive to the boundary, textbook shot-making",1,24.3,24.03,24.3,4,4,10,146,7
5961,311158,"four more, this time on the pull! Henriques was waiting for it in the crease and he rolls the wrists on a whipcrack blow through backward square leg",1,24.4,24.04,24.4,4,4,354,201,3
5961,311158,"shortish, sliding on to the body as Henriques looks to work to leg, deflects off the thigh pad",1,24.5,24.05,24.5,0,1,268,111,2
267192,311158,Smith is again left flailing as Stokes finds the tramlines,1,24.6,24.06,24.6,0,1,0,0,0
267192,311158,"better line, length ball outside off, draws him forward and clips the inside edge on to pad as Smith feels for it",1,24.6,24.07,24.6,0,0,157,139,8
5961,244497,"nicely bowled, brings the wrong'un back in and again it's inside edge on to pad as Henriques pushes forward",1,25.1,25.01,25.1,0,0,213,169,3
5961,244497,"tossed up and this time the stroke is played more confidently, punched down the ground and they get two",1,25.2,25.02,25.2,2,2,53,231,6
5961,244497,"flighted, on middle and leg, down early to paddle one",1,25.3,25.03,25.3,1,1,219,45,1
267192,244497,Smith steps out and drives a single to long-on,1,25.4,25.04,25.4,1,1,193,322,4
5961,244497,"floated up outside off stump, Henriques taps one more back through mid-off",1,25.5,25.05,25.5,1,1,142,294,5
267192,244497,tossed up and tickled to long-off once again,1,25.6,25.06,25.6,1,1,130,304,5
267192,19264,"shortish on off stump, defended back down the track",1,26.1,26.01,26.1,0,0,173,188,5
267192,19264,angled in and worked to leg as Smith makes a familiar journey across his stumps,1,26.2,26.02,26.2,1,1,289,223,3
5961,19264,"back of a length outside off, Henriques opens the face and glides one to third man",1,26.3,26.03,26.3,1,1,128,43,8
267192,19264,"length ball, clipped through midwicket",1,26.4,26.04,26.4,1,1,279,144,2
5961,19264,"Henriques is doggedly taking on the h8terz here, steps out and pumps a half-volley past extra cover with a flourish",1,26.5,26.05,26.5,4,4,15,231,6
5961,19264,"shortish, defended into the ground towards gully and there's no run",1,26.6,26.06,26.6,0,0,149,178,6
267192,244497,"tossed up outside off, pushed back towards the bowler",1,27.1,27.01,27.1,0,0,182,194,4
267192,244497,pushed through on the stumps and flicked across the line,1,27.2,27.02,27.2,1,1,292,136,2
5961,244497,"flighted, outside off stump, tapped into the covers",1,27.3,27.03,27.3,0,0,152,200,5
5961,244497,"gone, slogged to mid-on! He's played a few impressive strokes - but that won't go down as one of them. Might have been the googly from Rashid but, either way, Henriques wasn't to the pitch trying to hit down the ground and it screwed off the inside half of the bat, looping tamely to mid-on",1,27.4,27.04,27.4,0,0,210,245,4
530011,244497,"flighted, straightening on the stumps, worked away through the leg side",1,27.5,27.05,27.5,1,1,54,184,6
267192,244497,"flat legbreak, Smith moves on to off stump and works away against the turn",1,27.6,27.06,27.6,1,1,229,149,2
267192,19264,"shortish in the channel and Smith can't work this to leg, defends",1,28.1,28.01,28.1,0,0,168,185,5
267192,19264,short and a touch wide and this time Smith goes through backward point for a single,1,28.2,28.02,28.2,1,1,50,106,7
530011,19264,back of a length and defended from the crease,1,28.3,28.03,28.3,0,0,179,189,5
530011,19264,"only a touch short and wide but Head plays this beautifully, arrowing a back cut to the rope at deep backward point",1,28.4,28.04,28.4,4,4,336,102,2
530011,19264,"well bowled in response, cross-seam from Plunkett and it leaps from a shortish length to hit the glove, doesn't carry to slip",1,28.5,28.05,28.5,0,0,220,128,2
530011,19264,"pitched up and driven, not out of the middle but he gets it past extra cover for a couple",1,28.6,28.06,28.6,2,2,311,210,3
267192,244497,"flighted, dipping and turning on off stump, Smith leans into a block",1,29.1,29.01,29.1,0,0,158,196,5
267192,244497,pushed through flatter and dabbed into the off side,1,29.2,29.02,29.2,0,0,146,164,7
267192,244497,"tossed up on middle and off stump, Smith smothers it again",1,29.3,29.03,29.3,0,0,198,197,4
267192,244497,"bit of width, Smith cracks a drive off the back foot but finds the man at cover",1,29.4,29.04,29.4,0,0,107,178,6
267192,244497,"tossed up on off stump, pushed down the ground for one",1,29.5,29.05,29.5,1,1,128,310,5
530011,244497,"full and flighted, on off stump, drilled past the bowler but mid-off prevents more than a single",1,29.6,29.06,29.6,1,1,192,252,4
530011,19264,"back of a length, worked into the leg side",1,30.1,30.01,30.1,0,0,145,210,5
530011,19264,"banged in halfway down and Head is quickly on the pull, smacked to deep backward square",1,30.2,30.02,30.2,1,1,35,143,7
267192,19264,"that's his fifty, overpitched and driven, wide of mid-off and it just keeps picking up pace, duping Wood into trying to cut it off and then giving him no chance - important innings from the Australia captain",1,30.3,30.03,30.3,4,4,90,328,5
267192,19264,goes back and across and works to the leg side,1,30.4,30.04,30.4,0,0,134,172,6
267192,19264,pitched up and prodded towards extra cover,1,30.5,30.05,30.5,0,0,136,199,6
267192,19264,dug in short and Smith whirls his arms on a flat pull to deep backward square leg,1,30.6,30.06,30.6,1,1,288,86,2
267192,8917,"over the wicket, pushed through and it keeps a little low, Smith manages to jab it away",1,31.1,31.01,31.1,0,0,151,197,5
267192,8917,tossed up on off stump and defended,1,31.2,31.02,31.2,0,0,183,197,4
267192,8917,"flighted, comes forward to drive, straight back to the bowler",1,31.3,31.03,31.3,0,0,178,200,5
267192,8917,pushed through on the stumps and worked to leg with the spin,1,31.4,31.04,31.4,1,1,333,187,3
530011,8917,"round the wicket, tossed up outside off, driven to long-off coming forwards",1,31.5,31.05,31.5,1,1,231,321,4
267192,8917,"on the stumps, Smith clips another single down the ground",1,31.6,31.06,31.6,1,1,225,317,4
