batid,bowlid,comm,inns,oa,ou,ovr,r,rt,x,y,z
24598,489889,"pitched up and driven again, out to Finch in the deep",2,12.4,12.04,12.4,1,1,339,142,2
311158,489889,"beautiful batting, gets half a stride and pings it on the up, middled straight back down the ground for four",2,12.5,12.05,12.5,4,4,155,354,5
311158,489889,more entertainment for the crowd as Starc misfields a drive on the greasy surface at mid-off and Stokes picks up a brace,2,12.6,12.06,12.6,2,2,241,315,4
24598,530011,"very full, dips and nearly sneaks under the bat as Morgan chops down on it",2,13.1,13.01,13.1,0,0,202,188,4
24598,530011,tossed up and dinked through the covers coming forwards,2,13.2,13.02,13.2,1,1,327,198,3
311158,530011,"flighted, drifting towards the pads, turned to midwicket",2,13.3,13.03,13.3,0,0,142,200,6
311158,530011,"pushed through, Stokes goes back and hurls the bat at a cut, finds cover",2,13.4,13.04,13.4,0,0,236,202,3
311158,530011,"flicked through backward square leg, a full toss from Head and Stokes helps it away to the boundary",2,13.5,13.05,13.5,4,4,105,19,8
311158,530011,"pushed through on off, tapped square",2,13.6,13.06,13.6,0,0,240,209,3
24598,489889,short and wide and Morgan cuts fiercely off the back foot down to third man,2,14.1,14.01,14.1,1,1,339,150,2
311158,489889,"pitched up and Stokes slashes hard, off the outside edge but it whistles over the leaping Maxwell at backward point. Scorched!",2,14.2,14.02,14.2,4,4,342,114,2
311158,489889,"fullish, Stokes swings from the hip again, mistimed into the covers",2,14.3,14.03,14.3,0,0,208,254,4
311158,489889,"full toss from Cummins and that is humped away over the leg side, just needs to get a good connection on it and the screw turns tighter - England's 100 up and they have come roaring back at Australia",2,14.4,14.04,14.4,4,4,37,280,6
311158,489889,"pitched up, Stokes drive, in the air... but <i>just</i> short of cover diving forwards",2,14.5,14.05,14.5,0,0,234,223,4
311158,489889,"round the wicket, full and wide and lashed to the fence once again! Stokes has muscles on his muscles and looks in imperious mood",2,14.6,14.06,14.6,4,4,328,278,3
24598,530011,"tossed up from round the wicket, miscued back towards the bowler",2,15.1,15.01,15.1,0,0,187,193,4
24598,530011,"flighted, leans forward and strokes one through the covers",2,15.2,15.02,15.2,1,1,305,215,3
311158,530011,Stokes comes down and clips though mid-on,2,15.3,15.03,15.3,1,1,161,322,5
24598,530011,comes across and pushes this towards cover,2,15.4,15.04,15.4,0,0,220,192,3
24598,530011,tossed up on the stumps and worked down the ground,2,15.5,15.05,15.5,1,1,151,308,5
311158,530011,tossed up and clipped to long-on for another single to end the over,2,15.6,15.06,15.6,1,1,152,333,5
311158,5961,"short outside off, Stokes advances and swings vengefully, fails to connect",2,16.1,16.01,16.1,0,0,0,0,0
311158,5961,pitched up and prodded into the covers coming forwards,2,16.2,16.02,16.2,0,0,258,199,3
311158,5961,"fourth-stump line, 126kph dobbers, Stokes pushes into the covers and is sent back",2,16.3,16.03,16.3,0,0,237,187,3
311158,5961,"dug in short and lollipopping up outside off, Stokes drags a pull down past midwicket for a couple",2,16.4,16.04,16.4,2,2,58,222,6
311158,5961,"steps out to drive, in the air... but it clears mid-on! More tap from Stokes and he swings though the line",2,16.5,16.05,16.5,4,4,152,360,5
311158,5961,"in the channel, opens the face and steers to backward point",2,16.6,16.06,16.6,0,0,230,175,3
24598,311592,"short of a length, over middle and leg, Morgan chops it down towards midwicket",2,17.1,17.01,17.1,0,0,128,181,6
24598,311592,"outside off, Morgan waits and pushes in front of point for one",2,17.2,17.02,17.2,1,1,301,205,3
311158,311592,"good length, 146kph/90mph and tapped back on the move, Starc sticks out a paw to stop it",2,17.3,17.03,17.3,0,0,175,195,5
311158,311592,comes forward and punches firmly to mid-on,2,17.4,17.04,17.4,0,0,142,225,5
311158,311592,"tonked beyond the rope at deep backward square, that's his fifty! Banged in shot by Starc but Stokes likes it that way and goes hard in response, hooked for six!",2,17.5,17.05,17.5,6,6,18,112,7
311158,311592,"better length, worked off the pads to midwicket",2,17.6,17.06,17.6,0,0,125,193,6
24598,379504,"over the wicket, tossed up on leg stump, clipped to midwicket",2,18.1,18.01,18.1,0,0,136,198,6
24598,379504,pushed through and worked off the legs behind square for a single,2,18.2,18.02,18.2,1,1,98,128,7
311158,379504,"looped up on off, Stokes prods it into a gap in the covers and they scamper one",2,18.3,18.03,18.3,1,1,226,228,4
24598,379504,"full and clipped down the ground coming forwards - that's Morgan's fifty, too, a firefighting knock to get England back in this game",2,18.4,18.04,18.4,1,1,162,311,5
311158,379504,floated up on the stumps and tapped away,2,18.5,18.05,18.5,0,0,171,189,5
311158,379504,"fizzed through, Stokes closes the face and works to midwicket",2,18.6,18.06,18.6,0,0,134,187,6
24598,311592,pitched up and sporked towards point without timing,2,19.1,19.01,19.1,0,0,236,167,3
24598,311592,"full and Morgan drives, comes off the outside half of the bat and loops past extra cover, lands wide of mid-off and they get one",2,19.2,19.02,19.2,1,1,247,209,3
311158,311592,"fired in straight, nudged to midwicket",2,19.3,19.03,19.3,0,0,111,198,6
311158,311592,"fullish outside off, 146kph and poked into the covers coming forwards",2,19.4,19.04,19.4,0,0,219,186,3
311158,311592,"low full toss, whipped crisply off the pads out to deep midwicket... The crowd gives Finch the wind-up as he fields",2,19.5,19.05,19.5,1,1,31,211,6
24598,311592,"full, 145kph/90mph on off, Morgan chops down in it - which means we have played 20 overs and <b>Australia cannot have another no-result</b>",2,19.6,19.06,19.6,0,0,203,184,3
311158,379504,stoutly forward,2,20.1,20.01,20.1,0,0,152,192,6
311158,379504,a wild slash - and why not? - but safely into the covers,2,20.2,20.02,20.2,0,0,230,196,3
311158,379504,"more compact drive, nice high elbow",2,20.3,20.03,20.3,1,1,206,312,4
24598,379504,"stabbed through mid-off, a loose dive allows another run",2,20.4,20.04,20.4,1,1,212,319,4
311158,379504,"short, wide, crash. Gave himself room, slammed his bat through the line, and cover had no chance whatsoever",2,20.5,20.05,20.5,4,4,352,249,3
311158,379504,"better line and length, twisting into a back-foot push back to the bowler",2,20.6,20.06,20.6,0,0,161,207,5
24598,325026,"ab-so-lute-lee massive! Short, ugly delivery, sat up and begged to be flogged into the stands!",2,21.1,21.01,21.1,6,6,16,248,6
24598,325026,into line,2,21.2,21.02,21.2,0,0,141,117,8
24598,325026,"better line and length, clipped to leg",2,21.3,21.03,21.3,0,0,140,186,6
24598,325026,forward and blocked,2,21.4,21.04,21.4,0,0,197,189,4
24598,325026,"a lot of excitement round the bat, but nothing doing as Morgan works this one to leg",2,21.5,21.05,21.5,0,0,141,201,6
24598,325026,standing tall on the back foot. Content to play out the over after that beast of a shot early doors,2,21.6,21.06,21.6,0,0,147,197,6
311158,379504,pushed off the back foot to mid-on,2,22.1,22.01,22.1,1,1,157,318,5
24598,379504,"reverse sweep, that's sweetly played, toying with the field and just pickpocketing the boundary through third man",2,22.2,22.02,22.2,4,4,230,6,1
24598,379504,tapped to mid-on,2,22.3,22.03,22.3,0,0,162,204,5
24598,379504,a misfield from Zampa off his own bowling. It's getting ragged out there,2,22.4,22.04,22.4,1,1,115,298,5
311158,379504,"better ball, holding its line on leg stump, but fended away",2,22.5,22.05,22.5,0,0,0,0,0
311158,379504,"down the track, Zampa saw him coming, dropped it a touch short, and nearly a return catch. But nearly doesn't cut it right now for Australia...",2,22.6,22.06,22.6,0,0,170,191,5
24598,325026,tapped into the off side,2,23.1,23.01,23.1,1,1,205,312,4
311158,325026,"short, Stokes rocks back but doesn't connect properly. Driver error might be Australia's best hope here",2,23.2,23.02,23.2,0,0,131,187,6
311158,325026,forward and pushed to mid-off,2,23.3,23.03,23.3,1,1,254,299,4
24598,325026,"on the pads, tucked to leg",2,23.4,23.04,23.4,0,0,167,180,5
24598,325026,cut to point,2,23.5,23.05,23.5,0,0,243,169,3
24598,325026,"absolutely pounded once again, high over wide long-on. Australia's part-time spin approach is playing into England's hands, and wrists, and flailing bats at the moment",2,23.6,23.06,23.6,6,6,18,239,6
311158,379504,nudged down to long-on,2,24.1,24.01,24.1,1,1,139,299,5
24598,379504,sliding down the leg side,2,24.2,24.02,24.2,0,1,0,0,0
24598,379504,"on the hip, one more single to backward square",2,24.2,24.03,24.2,1,1,137,67,8
311158,379504,"hammered hard through long-on! 'Catch catch!' is the cry, but my God that's got some power on it. Scuds flat over Warner's head and into the stands!",2,24.3,24.04,24.3,6,6,126,354,5
311158,379504,back on a better length,2,24.4,24.05,24.4,0,0,222,206,3
311158,379504,wafted down to long-on to rotate the strike again,2,24.5,24.06,24.5,1,1,126,301,5
24598,379504,"looped up, calm response from Morgan, who steps forward to milk the single to long-on. Australia can't attack, and can't defend in their current mindset. They simply have to get a wicket soon",2,24.6,24.07,24.6,1,1,140,296,5
24598,489889,"smashed through point, Morgan gauging the change-up in pace from the outset",2,25.1,25.01,25.1,1,1,328,206,3
311158,489889,"that is stunning timing! A nothing flick from back of a length, into the leg-side to a decent delivery, but that just seems to pick up speed as it gallops through wide long-on",2,25.2,25.02,25.2,4,4,14,240,6
311158,489889,"down on one knee, flashy drive into the covers",2,25.3,25.03,25.3,0,0,250,205,3
311158,489889,"fuller length, a circumspect push through the line",2,25.4,25.04,25.4,0,0,166,194,5
311158,489889,another down-on-one-knee drill into the covers,2,25.5,25.05,25.5,0,0,197,241,4
311158,489889,"wider of the stumps, flashed in the air, down to third man",2,25.6,25.06,25.6,1,1,261,57,1
311158,288284,"full length, an outside-edged push to point",2,26.1,26.01,26.1,0,0,235,165,2
311158,288284,on to the front foot,2,26.2,26.02,26.2,0,0,167,195,5
311158,288284,forward to defend,2,26.3,26.03,26.3,0,0,205,254,4
311158,288284,"onto the front foot once more, steering the ball back down the pitch",2,26.4,26.04,26.4,0,0,169,190,5
311158,288284,"back of a length, chiselled into the leg side",2,26.5,26.05,26.5,0,0,168,200,5
311158,288284,"on the hip, worked to deep midwicket for another single, as England wisely decide to show respect to Australia's wicket threats",2,26.6,26.06,26.6,1,1,44,207,6
311158,489889,"good wheels from Cummins, that's through Stokes before he can lay bat on ball, at 91mph",2,27.1,27.01,27.1,0,0,190,131,1
311158,489889,high-elbowed push back down the line of the ball. An urgent single,2,27.2,27.02,27.2,1,1,193,242,4
24598,489889,"bouncer, and Morgan has a hoick, but can't get close to it",2,27.3,27.03,27.3,0,0,0,0,0
24598,489889,"short, wide, cut. Clean through point. Golly, he's timed that shot well today",2,27.4,27.04,27.4,4,4,357,176,3
24598,489889,down the track to defend into the covers,2,27.5,27.05,27.5,0,0,201,179,3
24598,489889,"crashed through the off side once again. The sweeper cleans up, but Australia's prospects continue to ebb away",2,27.6,27.06,27.6,2,2,302,67,2
311158,288284,pushed down the ground,2,28.1,28.01,28.1,0,0,187,230,4
311158,288284,"stands tall in defence, poked to the off side",2,28.2,28.02,28.2,0,0,236,201,3
311158,288284,"murderous intent as Stokes advances and batters a drive into the covers, where a fine diving stop limits the damage",2,28.3,28.03,28.3,1,1,63,199,6
24598,288284,"on the pads, a deft clip to deep midwicket.",2,28.4,28.04,28.4,0,0,208,193,3
24598,288284,"huge. Simply huge. A round-house bottom-handed dump-truck of a shot, down the track, into the stands!",2,28.5,28.05,28.5,6,6,19,241,6
24598,288284,behind the line this time,2,28.6,28.06,28.6,0,0,213,176,3
311158,311592,forward and blocked down the track,2,29.1,29.01,29.1,0,0,193,196,4
311158,311592,up comes the 150 partnership with another cherry-picked pair of runs,2,29.2,29.02,29.2,2,2,302,238,3
311158,311592,tight line and length,2,29.3,29.03,29.3,0,0,199,186,4
311158,311592,"very full length, tapped into the off side",2,29.4,29.04,29.4,0,0,208,187,3
311158,311592,,2,29.5,29.05,29.5,0,0,123,181,6
311158,311592,"very full once again, chiselled into the leg side. No joy for Australia. Plenty, it would seem, for Bangladesh ...",2,29.6,29.06,29.6,1,1,58,111,7
311158,489889,"wow, timing to the fore. Clearing the front leg, swinging the bat through the line, the ball streaks through cover",2,30.1,30.01,30.1,4,4,345,248,3
311158,489889,"on the pads, worked to leg",2,30.2,30.02,30.2,0,0,134,198,6
311158,489889,worked to leg,2,30.3,30.03,30.3,1,1,98,51,8
24598,489889,dabbed to the off side,2,30.4,30.04,30.4,1,1,243,178,3
311158,489889,"pushed a touch wider, and a rare play-and-miss",2,30.5,30.05,30.5,0,0,0,0,0
311158,489889,"fuller length, attacking the stumps. Worked to point to complete the over",2,30.6,30.06,30.6,0,0,252,153,2
24598,311592,forward and wafted into the leg side,2,31.1,31.01,31.1,0,0,136,199,6
24598,311592,nudged into the leg side. Easy pickings,2,31.2,31.02,31.2,1,1,37,127,7
311158,311592,"tight line and length, blocked back down the pitch",2,31.3,31.03,31.3,0,0,168,199,5
311158,311592,into line to defend. No rush here for England. Utter control now. Can Australia disrupt them somehow?,2,31.4,31.04,31.4,0,0,246,168,3
311158,311592,"there's the disruption! A chip in the air from Stokes, inches short of midwicket. Morgan is ball-watching as Stokes hurtles for a single, and that's an immense direct hit shy from Zampa with the skipper stranded!",2,31.5,31.05,31.5,0,0,141,234,5
308967,311592,full toss to greet the new batsman. Worked down to third man,2,31.6,31.06,31.6,1,1,118,48,8
308967,379504,"solidly onto the front foot, blocked back down the pitch",2,32.1,32.01,32.1,0,0,175,194,5
308967,379504,forward and pushed to cover,2,32.2,32.02,32.2,0,0,137,199,6
308967,379504,worked to leg,2,32.3,32.03,32.3,0,0,223,203,3
308967,379504,"on the back foot, punching out to cover",2,32.4,32.04,32.4,0,0,150,184,6
308967,379504,tight line and length,2,32.5,32.05,32.5,0,0,121,140,7
308967,379504,"down on one knee, swept calmly for the single",2,32.6,32.06,32.6,1,1,234,38,1
308967,311592,"round the wicket from Starc, but that's right in Buttler's arc, laced along the turf through the covers, bottom-handed to oblivion",2,33.1,33.01,33.1,4,4,9,217,6
308967,311592,"angled into the right-hander from round the wicket, Buttler waits til the ball is under his eyeline, then dabs a single to cover",2,33.2,33.02,33.2,1,1,74,176,6
311158,311592,into line to defend,2,33.3,33.03,33.3,0,0,227,210,3
311158,311592,"squeezed into the leg side, another cheer goes up for the single. Edgbaston is enjoying itself today",2,33.4,33.04,33.4,1,1,48,118,7
308967,311592,"firmly into line, good attacking delivery, probing the stumps from round the wicket",2,33.5,33.05,33.5,0,0,137,246,5
308967,311592,another nudge into the covers,2,33.6,33.06,33.6,1,1,38,201,6
308967,379504,"works the single once again, Australia can't have fielders everywhere",2,34.1,34.01,34.1,1,1,291,104,2
311158,379504,"stands tall in defence, and that's a well-taken single, the ball just bobbling into the off side. Buttler was actually slow setting off, but Stokes' judgment was correct",2,34.2,34.02,34.2,1,1,238,188,3
308967,379504,"worked into the covers once more, a ripple of applause for another pair of runs milked",2,34.3,34.03,34.3,2,2,65,131,7
308967,379504,blocked into the covers. A productive area with the field set deep. Australia dying a death by a thousand cuts here.,2,34.4,34.04,34.4,1,1,49,221,6
311158,379504,"on the back foot, punched on the up into the leg side",2,34.5,34.05,34.5,0,0,135,198,6
311158,379504,behind the line once more,2,34.6,34.06,34.6,0,0,226,205,3
308967,311592,"back of a length, cut loosely to point and <B>dropped</B> by Maxwell! He lost sight of it as it burst out of the crowd, and goes clean through him as well! Oh dear",2,35.1,35.01,35.1,4,4,35,79,7
308967,311592,"stabbed to point, a huge ironic cheer echoes out as Maxwell fields more successfully this time",2,35.2,35.02,35.2,0,0,124,154,7
308967,311592,another stolen single into the covers,2,35.3,35.03,35.3,1,1,138,246,5
311158,311592,"pushed on the up, to mid-on",2,35.4,35.04,35.4,0,0,147,235,5
311158,311592,"another stab into the off side, another single",2,35.5,35.05,35.5,1,1,311,205,3
308967,311592,"pushed to mid-off, Starc's day is done, and with him goes one of Australia's most potent wicket-taking threats. Where now for Smith?",2,35.6,35.06,35.6,0,0,152,251,5
311158,379504,pushed into the off side,2,36.1,36.01,36.1,0,0,203,205,4
311158,379504,"long hop. Stokes dances at the crease, waits for the ball to pitch and spin, then flogs it hard through the covers to move into the nineties",2,36.2,36.02,36.2,4,4,328,268,3
311158,379504,"a touch slower, a touch wider",2,36.3,36.03,36.3,0,0,239,135,2
311158,379504,open-faced push down the ground to long-on,2,36.4,36.04,36.4,1,1,136,317,5
308967,379504,"could this be the breakthrough? A loose slap down the ground, but no! It bounces short of the fielder, clatters off his shins, and away to the rope. Oh misery...",2,36.5,36.05,36.5,4,4,216,347,4
308967,379504,"into line, defended",2,36.6,36.06,36.6,0,0,139,124,7
311158,489889,"pulled from back of a length, out through square leg",2,37.1,37.01,37.1,1,1,32,199,6
308967,489889,"short, pulled, but Buttler plays an air shot as the ball hops through to the keeper",2,37.2,37.02,37.2,0,0,0,0,0
308967,489889,"a whistling bouncer, Buttler dips out of a pull. Gets away with the wide on height",2,37.3,37.03,37.3,0,0,0,0,0
308967,489889,"tapped past point. Another cheer in the stands, though that may a Mexican Wave. The crowd are making their own entertainment as England just chip away",2,37.4,37.04,37.4,1,1,53,109,7
311158,489889,"on the pads, nurdled to the midwicket sweeper",2,37.5,37.05,37.5,1,1,31,193,6
308967,489889,"up on the toes, defended to point",2,37.6,37.06,37.6,0,0,145,123,8
311158,379504,"on the pads, tucked behind square",2,38.1,38.01,38.1,0,0,160,110,8
311158,379504,"down the track, fetched into the leg side, nearly done in the flight as the ball dipped late, but made good contact in the end",2,38.2,38.02,38.2,1,1,36,219,6
308967,379504,solid block back to the bowler,2,38.3,38.03,38.3,0,0,153,187,6
308967,379504,"back of a length, carved to point",2,38.4,38.04,38.4,0,0,124,145,7
308967,379504,"dispatched. Picked the line, picked the length. In the arc, and battered high and hard over long-on!",2,38.5,38.05,38.5,6,6,222,355,4
308967,379504,thumped back to the bowler. Australia are helpless bystanders in their own demise,2,38.6,38.06,38.6,0,0,182,196,4
311158,288284,hauled into the leg side,2,39.1,39.01,39.1,1,1,57,91,7
308967,288284,"tight line, defended to the leg side",2,39.2,39.02,39.2,0,0,229,186,3
308967,288284,dabbed to third man,2,39.3,39.03,39.3,1,1,130,37,8
311158,288284,advances and smears into the off side,2,39.4,39.04,39.4,1,1,312,238,3
308967,288284,"solid block, covering the stumps with a big stride",2,39.5,39.05,39.5,0,0,128,187,6
308967,288284,"on the pads, worked to the leg side",2,39.6,39.06,39.6,0,0,223,204,3
311158,379504,"slammed in front  of deep cover, that's his hundred! Magnificent stuff from Stokes, though this was a straightforward dispatch of a long-hop through the covers... Off comes the helmet, up go the crowd, England are powering to their target",2,40.1,40.01,40.1,4,4,350,231,3
311158,379504,pushed through on the stumps and tucked to leg,2,40.2,40.02,40.2,0,0,139,186,6
