batid,bowlid,comm,inns,oa,ou,ovr,r,rt,x,y,z
308967,325026,"flight on off stump, driven down to long on for one",1,32.2,32.02,32.2,1,1,273,240,3
24598,325026,"flighted on off, worked down to long off for one",1,32.3,32.03,32.3,1,1,281,278,4
308967,325026,that one kept low after pitching outside off as Buttler went back to cut but missed,1,32.4,32.04,32.4,0,0,0,0,0
308967,325026,driven down to long on where a fumble from Starc gives them two runs,1,32.5,32.05,32.5,2,2,308,263,3
308967,325026,"fullish on the stumps, pushed back to the bowler",1,32.6,32.06,32.6,0,0,193,190,4
24598,5017,goes back in the crease to work the ball to midwicket,1,33.1,33.01,33.1,0,0,126,193,6
24598,5017,charges down the track to take it on the full and lofts it down the ground over long off for six to bring up his fifty,1,33.2,33.02,33.2,6,6,259,351,4
24598,5017,"fullish on middle and leg, worked down to mid on for a quick one",1,33.3,33.03,33.3,1,1,105,252,5
308967,5017,stifled appeal from Doherty for lbw as he paddled it to the leg side,1,33.4,33.04,33.4,1,1,276,195,3
24598,5017,length delivery is worked to mid on for one,1,33.5,33.05,33.5,1,1,101,271,5
308967,5017,"flighted outside off, he blocks it back and that's <b>drinks</b>",1,33.6,33.06,33.6,0,0,148,186,6
24598,270484,"from back of the hand on off stump, he defends it back",1,34.1,34.01,34.1,0,0,220,191,3
24598,270484,"angled in towards the batsman, worked off the back foot to the leg side for one",1,34.2,34.02,34.2,1,1,59,238,6
308967,270484,"full outside off, driven straight to cover",1,34.3,34.03,34.3,0,0,124,191,6
308967,270484,"one more for Faulkner, he gets Buttler this time! Angled it across outside the off stump, Buttler drove it up and high in the air and Warner at sweeper cover took a couple of steps to take a simple catch",1,34.4,34.04,34.4,0,0,29,216,6
24598,270484,"slightly slower towards the stumps, Morgan helps it behind square on leg for one",1,34.5,34.05,34.5,1,1,119,148,7
247235,270484,"towards middle and leg, Woakes flicks it on leg, just wide of short midwicket",1,34.6,34.06,34.6,0,0,242,219,3
24598,489889,"short and wide, Morgan gets room and he slaps it between point and cover point for a cracking four!",1,35.1,35.01,35.1,4,4,351,213,3
24598,489889,"short on the leg side now, worked off the hips to fine leg for two",1,35.2,35.02,35.2,2,2,104,35,8
24598,489889,"towards the pads again, worked on the leg side pat midwicket for two more",1,35.3,35.03,35.3,2,2,71,205,6
24598,489889,slower bouncer towards the batsman who goes on his toes to defend it,1,35.4,35.04,35.4,0,0,210,121,1
24598,489889,the extra pace on the short ball surprises him and there's no room as Morgan didn't move much and took it on his shoulder,1,35.5,35.05,35.5,0,0,222,146,2
24598,489889,"length delivery on middle and off, pushed into the covers",1,35.6,35.06,35.6,0,0,220,228,4
247235,270484,"length delivery on middle and leg, clipped over midwicket in the gap for two",1,36.1,36.01,36.1,2,2,318,236,3
247235,270484,"angled across outside off, steered straight to point",1,36.2,36.02,36.2,0,0,130,148,7
247235,270484,wider outside off and he guides it to third man for one,1,36.3,36.03,36.3,1,1,106,74,8
24598,270484,strays towards the leg side and Morgan flicks it away off the pads past short fine leg for four in the gap,1,36.4,36.04,36.4,4,4,123,16,8
24598,270484,"full and wide, punched straight into the covers",1,36.5,36.05,36.5,0,0,228,194,3
24598,270484,"length delivery towards off stump, Morgan leans forward and blocks",1,36.6,36.06,36.6,0,0,160,186,5
247235,489889,"<b>dropped at fine leg</b>! Woakes merely lofted the ball in the air off his hips, straight to Doherty but he put down a simple catch",1,37.1,37.01,37.1,1,1,257,61,1
24598,489889,"drifts down the leg side, stifled appeal as the ball takes some pad before reaching the keeper",1,37.2,37.02,37.2,0,0,0,0,0
24598,489889,further down leg and Morgan gets a chance to glance it fine down the leg side for four more! Some loose deliveries coming from Cummins,1,37.3,37.03,37.3,4,4,136,12,8
24598,489889,good comeback - length delivery outside off is left alone,1,37.4,37.04,37.4,0,0,0,0,0
24598,489889,"on middle and leg, worked off the pads to the leg side for one",1,37.5,37.05,37.5,1,1,123,155,7
247235,489889,he wanted to work it on leg but was beaten by pace and the ball ended up on the pitch after an edge,1,37.6,37.06,37.6,0,0,160,175,6
24598,325026,"darts it in from middle stump, Morgan defends on the off side",1,38.1,38.01,38.1,0,0,248,198,3
24598,325026,"on the stumps again, he makes room to find the gap this time on off for one",1,38.2,38.02,38.2,1,1,293,147,2
247235,325026,"full outside off, Woakes drives powerfully and the cover fielder gets a hand to it to keep it to one",1,38.3,38.03,38.3,1,1,123,208,6
24598,325026,"outside off, cut off the back foot for one on the off side",1,38.4,38.04,38.4,1,1,238,128,2
247235,325026,"bit too wide outside off, punched off the back foot to sweeper cover for one",1,38.5,38.05,38.5,1,1,33,192,6
24598,325026,"length delivery outside off, pushed into the covers",1,38.6,38.06,38.6,0,0,241,187,3
247235,489889,"beaten outside off, Haddin thought he edged it, but umpire says no! It was a short ball outside off, Woakes went on his toes to poke and didn't get a whiff",1,39.1,39.01,39.1,0,0,0,0,0
247235,489889,towards the pads now and clipped in the air for one to square leg,1,39.2,39.02,39.2,1,1,335,182,3
24598,489889,"slightly slower and on back of length, he defends off the back foot",1,39.3,39.03,39.3,1,1,114,183,6
247235,489889,"full with some room, driven powerfully, but straight to point",1,39.4,39.04,39.4,0,0,125,148,7
247235,489889,"short ball and it's pulled powerfully, but straight to deep midwicket for one",1,39.5,39.05,39.5,1,1,331,195,3
24598,489889,slower bouncer goes over Morgan and it's called a wide,1,39.6,39.06,39.6,0,1,0,0,0
24598,489889,"short ball just down leg, defended towards midwicket for a quick single",1,39.6,39.07,39.6,1,1,127,151,7
24598,325026,"comes down and nearly yorks himself, but pushes it down towards mid on for one",1,40.1,40.01,40.1,1,1,114,234,5
247235,325026,"Woakes has given it away! Pretty innocuous delivery on middle and leg, Woakes went back and worked it to leg but in the air and straight to midwicket for an easy-peasy catch",1,40.2,40.02,40.2,0,0,241,189,3
288992,325026,"wide outside off and pretty full, reaches out and drives it to point",1,40.3,40.03,40.3,0,0,126,128,7
288992,325026,"presses forward and pushes the length delivery to point, this time for a quick single even though Jordan took off late",1,40.4,40.04,40.4,1,1,132,144,7
24598,325026,"length delivery on off stump, defended off the back foot",1,40.5,40.05,40.5,0,0,226,180,3
24598,325026,"towards middle and leg now, worked off the back foot to leg for one",1,40.6,40.06,40.6,1,1,58,193,6
24598,311592,"swings it in from outside off, Morgan blocks it back",1,41.1,41.01,41.1,0,0,130,213,6
24598,311592,"on length and wider outside off, pushed down to mid on this time",1,41.2,41.02,41.2,0,0,136,222,5
24598,311592,bouncer goes over Morgan's head and it's left alone for a wide,1,41.3,41.03,41.3,0,1,0,0,0
24598,311592,"swinging into the pads, attempted yorker is a low full toss, and clipped to deep square leg for one",1,41.3,41.04,41.3,1,1,64,183,6
288992,311592,"length delivery on the off stump, defended off the back foot on off for a quick single",1,41.4,41.05,41.4,1,1,127,205,6
24598,311592,"bangs in the short one outside off, Morgan works it down with soft hands for one on off",1,41.5,41.06,41.5,1,1,258,81,1
288992,311592,"fullish on the off stump, Jordan defends on the leg side",1,41.6,41.07,41.6,0,0,208,191,3
24598,325026,"slightly short and wide, chopped off the back foot to deep point for one",1,42.1,42.01,42.1,1,1,308,109,2
288992,325026,"outside off with the angle, cut late off the back foot for one to short third man",1,42.2,42.02,42.2,1,1,138,121,8
24598,325026,"that's gone a long way, and all the way! He came down the track and smacked it over the long on boundary for a massive six!",1,42.3,42.03,42.3,6,6,45,344,5
24598,325026,outside off this time and he drives it inside out with a lot of power over the covers in the gap for four,1,42.4,42.04,42.4,4,4,342,256,3
24598,325026,"towards the leg side now, he tries to slap it on leg but gets an edge behind square for one",1,42.5,42.05,42.5,1,1,130,81,8
288992,325026,"outside the off stump, chopped off the back foot wide of third man for two",1,42.6,42.06,42.6,2,2,61,115,7
24598,311592,"slightly full outside off, pushed down the ground to mid off",1,43.1,43.01,43.1,0,0,231,238,4
24598,311592,"attempted yorker on the pads, flicked to deep square leg for one",1,43.2,43.02,43.2,1,1,41,137,7
288992,311592,extra bounce surprises Jordan as he is squared up by the short of length delivery and it fell just short of point,1,43.3,43.03,43.3,0,0,125,145,7
288992,311592,ducks under the bouncer this time on middle and leg,1,43.4,43.04,43.4,0,0,0,0,0
288992,311592,"bit too full outside off, driven to sweeper cover for two",1,43.5,43.05,43.5,2,2,40,108,7
288992,311592,length delivery angled across outside off is left alone,1,43.6,43.06,43.6,0,0,0,0,0
24598,270484,goes back a bit and works the short of length ball to the leg side for one,1,44.1,44.01,44.1,1,1,108,185,6
288992,270484,"length delivery on the stumps, it's defended on the leg side",1,44.2,44.02,44.2,0,0,222,189,3
288992,270484,slightly outside off and it's steered towards point for one,1,44.3,44.03,44.3,1,1,125,148,7
24598,270484,"that's it, what a shot, what a <b>hundred</b>! He made room for the fullish delivery and smacked it over the covers for his seventh ODI hundred!",1,44.4,44.04,44.4,4,4,335,263,3
24598,270484,"touch shorter outside off, he waits and cuts it late to send it for four fine on the off side",1,44.5,44.05,44.5,4,4,226,11,1
24598,270484,"outside off, steered square on the off side for one and he keeps strike",1,44.6,44.06,44.6,1,1,301,168,3
24598,489889,"short ball on the leg side, pulled to deep fine leg for one",1,45.1,45.01,45.1,1,1,59,95,7
288992,489889,"slower bouncer on middle and leg, Jordan ducks under it",1,45.2,45.02,45.2,0,1,0,0,0
288992,489889,"angled into the batsman, deflects off Jordan's inside edge and body for a quick single",1,45.2,45.03,45.2,0,1,198,173,3
24598,489889,length delivery down the leg side for a wide,1,45.3,45.04,45.3,0,1,0,0,0
24598,489889,"short of length towards the legs, worked off the hips fine down leg for two more",1,45.3,45.05,45.3,2,2,113,27,8
24598,489889,makes room and guides the short of length delivery to third man for one,1,45.4,45.06,45.4,1,1,264,69,1
288992,489889,"incoming delivery takes a thick outside edge and goes past the keeper on the off side for four. No slips there, obviously",1,45.5,45.07,45.5,4,4,139,9,8
288992,489889,"short and wide, punched off the back foot to sweeper cover for one",1,45.6,45.08,45.6,1,1,31,167,6
288992,270484,"short of length outside off, pushed to point, not time for a run",1,46.1,46.01,46.1,0,0,133,133,7
288992,270484,"from back of the hand and right on the stumps, Jordan blocks it back",1,46.2,46.02,46.2,0,0,220,187,3
288992,270484,short ball now and it's pulled to deep midwicket for two,1,46.3,46.03,46.3,2,2,323,256,3
288992,270484,"slower ball from the back of the hand, it's full and clipped on the leg side for two more and that's the 50 stand",1,46.4,46.04,46.4,2,2,310,158,2
288992,270484,"accurate yorker on the stumps, Jordan defends it back",1,46.5,46.05,46.5,0,0,200,184,3
288992,270484,"another slow one from the back of the hand, but down the leg side as Jordan looks to slap it on the leg side and it's gone for four byes after hitting Haddin's arm",1,46.6,46.06,46.6,0,5,0,0,0
288992,270484,another one caught in the deep and Jordan has given it away. Short on middle and leg and Jordan pulled it straight to Maxwell at deep midwicket,1,46.6,46.07,46.6,0,0,335,188,3
24598,311592,"that's big, that's another six, his third of the innings! Made room for the incoming delivery, it was full too, he was well in the crease and lofted it high over the long on boundary for six",1,47.1,47.01,47.1,6,6,86,350,5
24598,311592,"full outside off now and he drives it firmly in the air just wide of mid off for another boundary! Timing the ball very well, he's middling everything",1,47.2,47.02,47.2,4,4,299,317,4
24598,311592,"length delivery outside off, steered towards point this time",1,47.3,47.03,47.3,0,0,232,168,3
24598,311592,"another easy catch for Maxwell, this time Morgan's gone but after such a counter-attacking innings. He middled this short ball on middle stump with the pull but found Maxi at deep midwicket. What a fighting innings from the captain",1,47.4,47.04,47.4,0,0,36,187,6
210283,311592,"started the innings with a wicket, and ends with one too! He came round the wicket and darted a yorker right on the off stump, Finn missed it and was bowled first ball",1,47.5,47.05,47.5,0,0,0,0,0
219889,247235,draws an edge straightaway as Warner drives uppishly outside off and the edge goes through the gully region for one,2,0.1,0.01,0.1,1,1,266,44,1
5334,247235,pushes the length delivery from just outside off to mid-on for one,2,0.2,0.02,0.2,1,1,212,246,4
219889,247235,"full on middle and leg, Warner defends it back",2,0.3,0.03,0.3,0,0,198,256,4
219889,247235,bit too full outside off and Warner crunches it through the covers right in the gap for four,2,0.4,0.04,0.4,4,4,336,271,3
219889,247235,"length delivery on the stumps, Warner blocks it back",2,0.5,0.05,0.5,0,0,191,232,4
219889,247235,"bit shorter on the stumps, Warner hops back to work it to leg but plays too early and defends it back",2,0.6,0.06,0.6,0,0,179,201,5
5334,210283,"on length outside off, Finch drives hard on the off side but doesn't middle it",2,1.1,1.01,1.1,0,0,168,252,5
5334,210283,"bit wider outside off on length, pushes to cover this time",2,1.2,1.02,1.2,0,0,158,196,5
5334,210283,"nips it in a little bit from outside off, Finch leans forward and pushes to cover",2,1.3,1.03,1.3,0,0,113,153,7
5334,210283,on off stump now and Finch pushes it down to mid on,2,1.4,1.04,1.4,0,0,233,218,3
5334,210283,swings it in from outside off as Finch goes for an extravagant drive and misses it completely,2,1.5,1.05,1.5,0,0,0,0,0
5334,210283,on the pads now and Finch cashes in by flicking it off his legs in the gap between mid on and midwicket for a four,2,1.6,1.06,1.6,4,4,347,241,3
219889,247235,"short of length on the off stump, Warner stays back to defend it on the off side",2,2.1,2.01,2.1,0,0,216,189,3
219889,247235,"full on middle and leg, checks his on driven a bit as it goes down to mido n",2,2.2,2.02,2.2,0,0,157,243,5
219889,247235,beats Warner as this one pitched on leg and moved towards middle. There was an inside edge actually onto the pads,2,2.3,2.03,2.3,0,0,211,151,2
219889,247235,"he sees room on the off side, goes down on a knee for a powerful drive but misses",2,2.4,2.04,2.4,0,0,0,0,0
219889,247235,goes back for the back of length delivery on off and defends it on off,2,2.5,2.05,2.5,0,0,235,205,3
219889,247235,"towards leg stump now, clipped to midwicket now",2,2.6,2.06,2.6,0,0,112,192,6
5334,210283,strays towards the pads again and Finch clips it fine down the leg side for another four. Finn not getting his lines right,2,3.1,3.01,3.1,4,4,261,18,1
5334,210283,"outside the off stump now, he guides it to third man for one",2,3.2,3.02,3.2,1,1,68,102,7
219889,210283,"that's gone high in the air, but lands safe, lucky for Warner! He drove the fullish delivery straight up in the air and down the ground, but it just beat mid on for two",2,3.3,3.03,3.3,2,2,167,267,5
219889,210283,"he sees room again, drives again outside off and misses again",2,3.4,3.04,3.4,0,0,0,0,0
219889,210283,fullish on the off stump and it's crunched down straight to mid off,2,3.5,3.05,3.5,0,0,201,241,4
219889,210283,another one in the air as Warner drives uppishly outside off and the ball goes wide of point towards third man,2,3.6,3.06,3.6,2,2,330,110,2
5334,247235,"back of length around off, Finch stays back and defends it back",2,4.1,4.01,4.1,0,0,146,192,6
5334,247235,"bit wide outside off, Finch drives firmly but it's stopped at short cover with a dive",2,4.2,4.02,4.2,0,0,113,182,6
5334,247235,length delivery on off is pushed down to mid on with soft hands for a quick single. Direct hit at non-striker's end from Broad and Finch was in trouble,2,4.3,4.03,4.3,1,1,201,234,4
219889,247235,too full outside off and Warner connects with his drive this time! He got room to free his arms and went down on the knee to power it through the covers for four,2,4.4,4.04,4.4,4,4,310,306,4
219889,247235,"back of length on leg stump, bit of extra bounce surprises Warner",2,4.5,4.05,4.5,0,0,240,204,3
219889,247235,bit short of length on leg and he mistimes the pull a bit and finds midwicket,2,4.6,4.06,4.6,0,0,111,187,6
5334,210283,leans forward and defends the length delivery on the off side,2,5.1,5.01,5.1,0,0,158,187,5
5334,210283,<b>dropped</b> by Finn! Finch drove the length delivery back toward the bowler's head and Finn got his hands to it but the ball popped out and went wide of mid off for four,2,5.2,5.02,5.2,4,4,116,348,5
5334,210283,"shortish outside off, Finch pulls this time and misses",2,5.3,5.03,5.3,0,0,0,0,0
5334,210283,"angled in towards leg stump, clipped to the leg side for a leg bye",2,5.4,5.04,5.4,0,1,259,168,3
219889,210283,"seams away a bit from middle stump, steered to point off the back foot",2,5.5,5.05,5.5,0,0,251,161,2
219889,210283,"too full and wide, Warner swings his arms and hits it high in the air using his wrists over the covers for four",2,5.6,5.06,5.6,4,4,347,247,3
5334,247235,puts his front foot forward and pushes the length delivery towards cover,2,6.1,6.01,6.1,0,0,111,146,7
5334,247235,"he's chopped it on, Finch is gone! Finch didn't move much for the ball that held its line after pitching outside off on back of length, he stayed back to punch it on the off side but got an inside edge that took his off stump",2,6.2,6.02,6.2,0,0,184,162,2
8180,247235,well outside the off stump and Watson slices it to third man for one,2,6.3,6.03,6.3,1,1,61,113,7
219889,247235,"beats Warner with a back of length delivery that nipped in, cramped him up for room as Warner defended awkwardly and could not get bat to it",2,6.4,6.04,6.4,0,0,0,0,0
219889,247235,"short of length outside off, he stays back and punches to cover point",2,6.5,6.05,6.5,0,0,217,182,3
219889,247235,"bit full on the pads, worked away to deep midwicket for one",2,6.6,6.06,6.6,1,1,92,84,7
219889,210283,"goes for a slog and misses again! It was fullish and just outside off, Warner heaved on the leg side and missed it",2,7.1,7.01,7.1,0,0,0,0,0
219889,210283,"fullish outside off, pushed into the covers now",2,7.2,7.02,7.2,0,0,283,201,3
219889,210283,"full and wider now, Warner doesn't go hard at it and merely pushes it over the covers for four",2,7.3,7.03,7.3,4,4,343,250,3
219889,210283,"bit slower on middle and leg, clipped off the pads for one past midwicket",2,7.4,7.04,7.4,1,1,94,189,6
8180,210283,"back of length and angling in towards the batsman, worked to leg off the back foot for one",2,7.5,7.05,7.5,1,1,299,120,2
219889,210283,guides it very well on the off side. Again not using too much power for the wide delivery outside off and he merely got bat on it late enough to send it fine on the off side for four,2,7.6,7.06,7.6,4,4,267,26,1
8180,247235,"on length outside off, Watson defends it into the covers",2,8.1,8.01,8.1,0,0,140,199,6
8180,247235,"wider outside off, Watson chops and the ball reaches slip after a bounce",2,8.2,8.02,8.2,0,0,174,146,8
8180,247235,"bit shorter outside off, Watson goes back and works it to midwicket",2,8.3,8.03,8.3,0,0,208,209,4
8180,247235,"well outside off, Watson leans forward and drives to cover point",2,8.4,8.04,8.4,0,0,115,192,6
8180,247235,full on off and middle and Watson flicks it beautifully from the middle of the bat with the wrists to the square leg boundary for four,2,8.5,8.05,8.5,4,4,336,96,2
8180,247235,outside off again and it's driven straight to cover off the front foot,2,8.6,8.06,8.6,0,0,142,196,6
219889,10617,short and wide enough outside off for Warner to punch it off the back foot past a diving cover point for four,2,9.1,9.01,9.1,4,4,355,214,3
219889,10617,"length delivery on middle and leg, Warner blocks it back",2,9.2,9.02,9.2,0,0,210,193,3
219889,10617,"back of length on middle and leg again, he stays back to defend it on off",2,9.3,9.03,9.3,0,0,199,191,4
219889,10617,"length delivery on leg stump, pushed on the leg side by Warner",2,9.4,9.04,9.4,0,0,128,190,6
219889,10617,wider on the leg side and Warner clips it to deep backward square leg for two,2,9.5,9.05,9.5,2,2,79,59,8
219889,10617,"bit wide outside off now, Warner waits for it and punches it to Bell at point",2,9.6,9.06,9.6,0,0,250,142,2
8180,288992,"starts with a wide delivery outside off, Watson had enough time to slice it late past point for four",2,10.1,10.01,10.1,4,4,16,121,7
8180,288992,leans forward and defends the length delivery angled in from outside off,2,10.2,10.02,10.2,0,0,126,201,6
8180,288992,"short of length outside off, Watson rocks back and punches it by getting on top of it, wide of third man for two",2,10.3,10.03,10.3,2,2,43,119,7
8180,288992,bit of room again outside off and he guides it past point and wide of third man for two more,2,10.4,10.04,10.4,2,2,45,113,7
8180,288992,"fullish now, still width on offer, and Watson drives it in the air to sweeper cover for one",2,10.5,10.05,10.5,1,1,52,118,7
219889,288992,"length delivery outside off, pushed off the back foot to point",2,10.6,10.06,10.6,0,0,228,198,3
8180,10617,"coming in from outside off, Watson leans forward and steers it to third man",2,11.1,11.01,11.1,1,1,137,50,8
219889,10617,"fullish on the legs, clipped off the pads to deep backward square leg for two",2,11.2,11.02,11.2,2,2,68,82,7
219889,10617,<b>just wide of mid off</b>! Warner drove the length delivery in the air and Morgan ran to his right with a full-length dive but the ball was just out of his reach,2,11.3,11.03,11.3,3,3,305,277,3
8180,10617,defends the length delivery from outside off to short midwicket,2,11.4,11.04,11.4,0,0,152,183,6
8180,10617,"this one's wide outside off, Watson pulls and misses completely",2,11.5,11.05,11.5,0,0,0,0,0
8180,10617,waits for this one outside off and steers it straight to point,2,11.6,11.06,11.6,0,0,119,157,7
219889,288992,"short delivery, but not much room and Warner manages to guide it to third man",2,12.1,12.01,12.1,1,1,271,57,1
8180,288992,"back of length outside off, punched back to the bowler",2,12.2,12.02,12.2,0,0,144,195,6
8180,288992,"short and wide, cut fiercely off the back foot, but straight to point",2,12.3,12.03,12.3,0,0,120,152,7
8180,288992,"Watson pulls again but is caught this time, very good catch by Woakes running in from deep midwicket! Watson pulled the short ball from just outside off and it went very high, Moeen was running in from deep square leg and Woakes from deep midwicket and the latter ran in a long way to grab it with both hands",2,12.4,12.04,12.4,0,0,316,186,3
219889,288992,"slightly back of length on leg, pushed to the leg side by Warner",2,12.5,12.05,12.5,0,0,141,186,6
219889,288992,"on length outside the off stump, pushed softly to backward point",2,12.6,12.06,12.6,0,0,255,146,2
267192,10617,watches the short of length delivery outside off and lets it go,2,13.1,13.01,13.1,0,0,0,0,0
267192,10617,another one outside off on similar length and left again,2,13.2,13.02,13.2,0,0,0,0,0
267192,10617,on length outside off and it's driven through the covers to get off the mark,2,13.3,13.03,13.3,1,1,56,204,6
219889,10617,"cheeky shot! Short ball from Broad towards Warner's head, he swayed out of the line and get a faint bit of bat while playing the ramp shot to just clear the keeper",2,13.4,13.04,13.4,4,4,229,11,1
219889,10617,length delivery on middle and Warner pushes it off the middle of the bat through the covers in the gap for four more,2,13.5,13.05,13.5,4,4,351,219,3
219889,10617,"length delivery right on middle stump, defended to cover point this time",2,13.6,13.06,13.6,0,0,228,191,3
267192,288992,goes across a bit and works the length delivery from outside off to the leg side,2,14.1,14.01,14.1,1,1,316,204,3
219889,288992,"back of length towards the legs, worked off the hips on the leg side",2,14.2,14.02,14.2,0,0,111,187,6
219889,288992,towards the leg side now and Warner gets a leg bye off the pad,2,14.3,14.03,14.3,0,1,105,92,7
267192,288992,goes back in the crease and defends the short of length ball back to the bowler,2,14.4,14.04,14.4,0,0,169,199,5
267192,288992,"nips it in fro outside off, Smith defends it back again",2,14.5,14.05,14.5,0,0,167,197,5
267192,288992,goes across a little bit for the back of length delivery angling in and works it to leg for a leg bye,2,14.6,14.06,14.6,0,1,230,188,3
267192,10617,"fullish outside off, flicked with the wrists off the back foot to mid on",2,15.1,15.01,15.1,1,1,223,242,4
219889,10617,"back of length on leg, worked off the hips to fine leg for one",2,15.2,15.02,15.2,1,1,96,78,8
267192,10617,leans forward and pushes the length delivery into the covers,2,15.3,15.03,15.3,0,0,109,186,6
267192,10617,good-length ball is driven into the covers again,2,15.4,15.04,15.4,0,0,110,189,6
267192,10617,moves across towards off and pushes the ball on off again,2,15.5,15.05,15.5,0,0,111,160,7
267192,10617,"full outside off, whipped with the wrists to mid on. That's <b>drinks</b>",2,15.6,15.06,15.6,0,0,221,238,4
219889,288992,"short ball, Warner pulls and it lands safely in the midwicket region for one",2,16.1,16.01,16.1,1,1,48,194,6
267192,288992,"that's short and wide, slapped straight to backward point",2,16.2,16.02,16.2,0,0,112,161,7
