batid,bowlid,comm,inns,oa,ou,ovr,r,rt,x,y,z
267192,288992,goes back and works the incoming delivery to leg for a quick single,2,16.3,16.03,16.3,1,1,243,215,3
219889,288992,outside the leg stump and it's clipped off the pads for one to bring up his <b>fifty</b>,2,16.4,16.04,16.4,1,1,42,166,6
267192,288992,"fullish outside off, he drives firmly but an edge goes to mid on",2,16.5,16.05,16.5,0,0,195,230,4
267192,288992,gets an edge on the incoming delivery as he tries to work it on leg but it goes on off,2,16.6,16.06,16.6,0,0,110,188,6
219889,8917,loud appeal for lbw as Warner tries reverse sweep first ball and is hit in front of leg stump. The umpire says no,2,17.1,17.01,17.1,0,0,182,179,4
219889,8917,"bit of flight on the off stump, worked to the leg side",2,17.2,17.02,17.2,0,0,226,197,3
219889,8917,"short and flat towards leg, worked behind square on leg for one",2,17.3,17.03,17.3,1,1,96,148,7
267192,8917,comes down and pushes the fullish ball to mid on,2,17.4,17.04,17.4,0,0,223,199,3
267192,8917,waits for it to turn and defends the ball to midwicket,2,17.5,17.05,17.5,0,0,231,200,3
267192,8917,"flighted on middle, he comes down and drives to long on for one",2,17.6,17.06,17.6,1,1,233,294,4
267192,288992,back of length outside off and it's worked behind square on leg for one,2,18.1,18.01,18.1,1,1,268,129,2
219889,288992,bit too wide outside off and it's clipped on the leg side for one,2,18.2,18.02,18.2,1,1,40,152,7
267192,288992,"on length on the legs, clipped off the pads towards fine leg for one",2,18.3,18.03,18.3,1,1,284,83,2
219889,288992,"bit wide outside off, Warner chases tentatively and gets a thick outside edge as there's no slips",2,18.4,18.04,18.4,4,4,251,16,1
219889,288992,waits for it outside off and guides it to deep backward point for one,2,18.5,18.05,18.5,1,1,298,109,2
267192,288992,"short and wide outside off, slapped off the back foot but point dives to save a few runs",2,18.6,18.06,18.6,0,0,110,147,7
219889,8917,"short of length on middle, worked to leg off the back foot for one",2,19.1,19.01,19.1,1,1,104,117,7
267192,8917,"flighted outside off, he comes down and drives to long on for one",2,19.2,19.02,19.2,1,1,228,289,4
219889,8917,"length delivery towards off stump, Warner leaves forward and blocks",2,19.3,19.03,19.3,0,0,152,197,5
219889,8917,comes down this time and flicks to deep midwicket with the wrists,2,19.4,19.04,19.4,1,1,72,212,6
267192,8917,comes down and pushes it back past the bowler for one more,2,19.5,19.05,19.5,1,1,205,299,4
219889,8917,"shorter and flatter outside off, steered through the point region for one",2,19.6,19.06,19.6,1,1,274,145,2
219889,288992,short ball towards Warner and he pulls it powerfully towards deep midwicket where Root runs a lot from square leg but can't cut it off,2,20.1,20.01,20.1,4,4,16,241,6
219889,288992,"short and wide outside off now, Warner doesn't move his feet much and slaps it behind point for two",2,20.2,20.02,20.2,2,2,311,86,2
219889,288992,"another short ball down the leg side, Warner pulls awkwardly and gets a bit of bat as it goes down fine leg for four",2,20.3,20.03,20.3,4,4,151,9,8
219889,288992,"length delivery just outside off, he punches it off the back foot towards mid-off",2,20.4,20.04,20.4,0,0,227,230,4
219889,288992,"short of length on middle stump, Warner waits for it and guides it towards point",2,20.5,20.05,20.5,1,1,222,119,1
267192,288992,length delivery outside off and he drives it down to mid on,2,20.6,20.06,20.6,0,0,211,232,4
219889,8917,full outside off and it's pushed back to the bowler,2,21.1,21.01,21.1,0,0,218,210,4
219889,8917,"flighted on middle and leg, full again, Warner pushes it back to Moeen's right",2,21.2,21.02,21.2,0,0,198,204,4
219889,8917,comes down this time and whips the ball from middle and leg towards backward square leg,2,21.3,21.03,21.3,1,1,128,133,7
267192,8917,Smith comes down too and pushes the ball back to Moeen,2,21.4,21.04,21.4,0,0,183,190,4
267192,8917,going down leg and Smith paddles it without bending much fine down the leg side and they run like rabbits for three,2,21.5,21.05,21.5,3,3,242,32,1
219889,8917,"on length outside off, driven into the covers",2,21.6,21.06,21.6,0,0,216,202,4
267192,10582,"fullish around the off stump, driven down to long on for one",2,22.1,22.01,22.1,1,1,258,299,4
219889,10582,"slightly slow outside the off stump, pushed to sweeper cover for one",2,22.2,22.02,22.2,1,1,300,182,3
267192,10582,"angling in from around off, helped with the angle to the leg side for one",2,22.3,22.03,22.3,1,1,311,185,3
219889,10582,"oh, that was a <b>chance</b> but very tough! Warner drove outside off, got an edge but it deflected off the keeper's gloves for two",2,22.4,22.04,22.4,2,2,217,17,1
219889,10582,length delivery outside off and it's pushed into the covers,2,22.5,22.05,22.5,0,0,235,192,3
219889,10582,"length delivery outside off, steered to backward point off the back foot",2,22.6,22.06,22.6,0,0,239,154,2
267192,8917,"that's gone high, that's all the way! He came down the track and smacked it over the long off boundary for a six from outside off",2,23.1,23.01,23.1,6,6,99,353,5
267192,8917,"tossed up around off, whipped to the leg side for one",2,23.2,23.02,23.2,1,1,304,197,3
219889,8917,comes down a bit and pushes the ball to cover,2,23.3,23.03,23.3,0,0,237,194,3
219889,8917,goes back this time for the incoming delivery and works it to leg for one,2,23.4,23.04,23.4,1,1,58,186,6
267192,8917,presses forward and blocks it on off,2,23.5,23.05,23.5,0,0,132,191,6
267192,8917,"turning in towards middle and leg, helped with the turn behind square on leg for one",2,23.6,23.06,23.6,1,1,277,104,2
267192,10582,"outside the off stump, steered straight to backward point",2,24.1,24.01,24.1,0,0,126,146,7
267192,10582,incoming delivery towards the leg side and Smith helped it along the angle by guiding it fine down the leg side for four,2,24.2,24.02,24.2,4,4,232,12,1
267192,10582,outside off now and it's steered past point for two more. Can't do much when these two want to run two,2,24.3,24.03,24.3,2,2,66,91,7
267192,10582,length delivery is driven through the covers for one,2,24.4,24.04,24.4,1,1,52,202,6
219889,10582,"fullish on middle and leg, driven down to long on for one",2,24.5,24.05,24.5,1,1,116,300,5
267192,10582,"not too wide outside off, steered towards point off the front foot",2,24.6,24.06,24.6,0,0,128,166,6
219889,8917,comes down to take it on the full and drives it down to long off. The two even exchanged high fives while taking the run,2,25.1,25.01,25.1,1,1,267,290,4
267192,8917,strays down the leg side for a wide,2,25.2,25.02,25.2,0,1,0,0,0
267192,8917,comes down and whips the ball to leg,2,25.2,25.03,25.2,0,0,241,197,3
267192,8917,slightly over pitched and Smith smacks it like a sweep and gets four on the midwicket boundary for four,2,25.3,25.04,25.3,4,4,354,167,3
267192,8917,,2,25.4,25.05,25.4,1,1,209,307,4
219889,8917,"pitched up on off, pushed back to the bowler",2,25.5,25.06,25.5,0,0,201,201,4
219889,8917,comes down the track and powers it down to long off for one,2,25.6,25.07,25.6,1,1,274,283,4
219889,210283,short ball on the leg side and Warner pulls it to the deep backward square leg boundary for four,2,26.1,26.01,26.1,4,4,23,110,7
219889,210283,"length delivery on off, pushed towards the covers",2,26.2,26.02,26.2,0,0,217,200,3
219889,210283,"good short ball on middle, Warner jumps to steer the ball to third man",2,26.3,26.03,26.3,1,1,246,58,1
267192,210283,pushes the length delivery into the covers off the front foot,2,26.4,26.04,26.4,0,0,131,190,6
267192,210283,thick edge as Smith looks to work it on leg but gets a single past point,2,26.5,26.05,26.5,1,1,86,188,6
219889,210283,"room with the short ball outside off, it's smashed straight to backward point",2,26.6,26.06,26.6,0,0,233,149,2
267192,8917,"turning in from off, Smith helps it to midwicket",2,27.1,27.01,27.1,0,0,246,189,3
267192,8917,comes down the track and whips the ball to fine leg for one,2,27.2,27.02,27.2,1,1,246,64,1
219889,8917,"run out chance! Warner made some room first and then steered it towards point, Smith was way out of his crease when the ball went past the non-striker's end for an overthrow",2,27.3,27.03,27.3,1,1,247,145,2
267192,8917,"flighted on off, he drives it down to long-on for one",2,27.4,27.04,27.4,1,1,278,256,3
219889,8917,strays towards the pads and Warner and he works it past square leg,2,27.5,27.05,27.5,1,1,88,165,6
267192,8917,"he charges down to drive, misses and is bowled! It was a full delivery on the stumps, Smith wanted to go over the covers with his inside-out drive but missed it completely and lost his stumps",2,27.6,27.06,27.6,0,0,0,0,0
219889,210283,"another run out chance missed! Warned pulled the short ball to deep midwicket, there was hesitation after the first run from both batsmen but they went ahead with the second and the inaccurate throw helped Bailey at the non-striker's end. Finn was also not standing behind the stumps",2,28.1,28.01,28.1,2,2,36,196,6
219889,210283,"short of length ball, worked towards midwicket for one",2,28.2,28.02,28.2,1,1,115,181,6
4451,210283,"that's bouncer just outside off, first of the over",2,28.3,28.03,28.3,0,0,0,0,0
4451,210283,"length delivery just outside off, defended back to the bowler",2,28.4,28.04,28.4,0,0,206,208,4
4451,210283,"back of length outside the off stump, he defends off the back foot",2,28.5,28.05,28.5,0,0,124,184,6
4451,210283,"short ball angled in, Bailey pulls it wide of deep fine leg for one",2,28.6,28.06,28.6,1,1,262,69,1
4451,8917,"fullish on off, worked straight to midwicket",2,29.1,29.01,29.1,0,0,247,199,3
4451,8917,comes down the track and clips the ball from outside off to leg,2,29.2,29.02,29.2,0,0,238,198,3
4451,8917,helps the turning delivery to short fine leg off the back foot,2,29.3,29.03,29.3,0,0,239,144,2
4451,8917,goes back and across and flicks the ball to midwicket,2,29.4,29.04,29.4,0,0,230,197,3
4451,8917,comes down and drives the ball down to long on for one,2,29.5,29.05,29.5,1,1,257,286,4
219889,8917,"stays back and punches the shortish delivery outside off, it goes just wide of long off and they run two more",2,29.6,29.06,29.6,2,2,297,266,3
4451,210283,"length delivery outside off, he defends the ball back to the bowler",2,30.1,30.01,30.1,0,0,153,189,6
4451,210283,"shorter delivery towards the batsman, he goes on his toes and defends it",2,30.2,30.02,30.2,0,0,199,191,4
4451,210283,outside off and it's driven down to mid off,2,30.3,30.03,30.3,0,0,154,223,5
4451,210283,"on length outside off, he pushes it into the covers",2,30.4,30.04,30.4,0,0,144,186,6
4451,210283,"on length on the off stump, Bailey defends it back",2,30.5,30.05,30.5,0,0,154,201,5
4451,210283,"slightly short of length outside off, Bailey defends off the back foot",2,30.6,30.06,30.6,0,0,116,176,6
219889,8917,"yorks Warner on the middle stump, he digs it out on the off side",2,31.1,31.01,31.1,0,0,203,152,2
219889,8917,"fullish on the stumps, pushed back to the bowler",2,31.2,31.02,31.2,0,0,206,198,4
219889,8917,"full and well outside off, driven firmly but straight to cover",2,31.3,31.03,31.3,0,0,235,198,3
219889,8917,"bit closer to the off stump, pushed past cover for one",2,31.4,31.04,31.4,1,1,273,251,3
4451,8917,he works the ball with the turn to the leg side for one,2,31.5,31.05,31.5,1,1,243,187,3
219889,8917,"goes back and makes room, steers the ball into the covers for one more",2,31.6,31.06,31.6,1,1,276,276,4
219889,210283,"full and wide, you can't bowl there to Warner! He goes down on a knee and smashes it over the covers for a cracking four. He was smiling while playing that shot!",2,32.1,32.01,32.1,4,4,351,231,3
219889,210283,"short of length delivery outside off, Warner doesn't middle the cut and gets one towards point",2,32.2,32.02,32.2,1,1,250,173,3
4451,210283,"length delivery outside off, pushed into the covers",2,32.3,32.03,32.3,0,0,118,188,6
4451,210283,short of length delivery is pulled on the leg side for one,2,32.4,32.04,32.4,1,1,301,79,2
219889,210283,"short ball coming in, Warner pulls it to the leg side and gets only one",2,32.5,32.05,32.5,1,1,62,196,6
4451,210283,wants to drive the length delivery from off into the covers but gets an edge and it goes to mid on,2,32.6,32.06,32.6,0,0,216,218,4
219889,8917,full delivery is pushed back to Moeen,2,33.1,33.01,33.1,0,0,183,192,4
219889,8917,comes down and pushes the length delivery into the covers,2,33.2,33.02,33.2,0,0,222,206,3
219889,8917,"poor delivery down the leg side, swept fine to the fine leg area for four and that's his <b>hundred</b>, third in ODIs, and fourth international hundred since early December",2,33.3,33.03,33.3,4,4,125,17,8
219889,8917,"short and flat, he makes some room and cuts it past point for two",2,33.4,33.04,33.4,2,2,317,181,3
219889,8917,comes down the track and pushes the ball to long off for one,2,33.5,33.05,33.5,1,1,251,308,4
4451,8917,"loud appeal for lbw from the keeper and bowler as Bailey looked to sweep it across the line, missed and it was pretty close. But no says the umpire. That's time for a <b>drink</b>",2,33.6,33.06,33.6,0,0,0,0,0
219889,247235,"Warner makes room, Woakes chases him and he gets two leg byes down the leg side",2,34.1,34.01,34.1,0,2,127,76,8
219889,247235,"fullish outside off, pushed firmly down the ground to mid off",2,34.2,34.02,34.2,0,0,229,241,4
219889,247235,"makes room, goes for a big heave and misses the incoming length delivery",2,34.3,34.03,34.3,0,0,0,0,0
219889,247235,"short ball, Warner pulls handsomely and collects for more from the midwicket boundary. Short or full, you can't bowl to him there",2,34.4,34.04,34.4,4,4,15,240,6
219889,247235,"Woakes chases Warner again as he makes room, another leg bye on the leg side off the pads",2,34.5,34.05,34.5,0,1,144,114,8
4451,247235,"short ball to Bailey too, and he smacks it to the midwicket boundary along the ground off the back foot",2,34.6,34.06,34.6,4,4,346,244,3
219889,10617,"full just outside off, Warner drives it over Bailey's head towards long off for one",2,35.1,35.01,35.1,1,1,265,298,4
4451,10617,"seams it in from outside off, Bailey gets a thick outside edge for one on the off side",2,35.2,35.02,35.2,1,1,130,65,8
219889,10617,"slightly short of length outside off, slapped towards long on for one",2,35.3,35.03,35.3,1,1,41,200,6
4451,10617,"short ball outside off, Bailey pulls it but not from the middle to mid on",2,35.4,35.04,35.4,0,0,235,232,4
4451,10617,"short and wide, cut to point off the back foot for one",2,35.5,35.05,35.5,1,1,115,149,7
219889,10617,"full and outside off, punched down the ground to long off for one",2,35.6,35.06,35.6,1,1,265,289,4
219889,247235,"tries a heave on the leg side, misses and gets a leg bye on the off side",2,36.1,36.01,36.1,0,1,230,124,2
4451,247235,"the Powerplay does produce a wicket! Short of length ball outside off, Bailey pulled and got a top edge which went high and towards gully. Buttler called for it and took it easily",2,36.2,36.02,36.2,0,0,157,158,7
219889,247235,"on length outside off, crunched into the covers for one",2,36.3,36.03,36.3,1,1,248,217,3
325026,247235,"charges down, makes room and slaps the short ball to cover point at the edge of the circle",2,36.4,36.04,36.4,0,0,110,188,6
325026,247235,"there's a loud appeal for caught behind and he's gone! It was a fullish delivery outside off, Maxi poked without much footwork, the keeper and bowler went up and so did the umpire's finger! But replays and HotSpot confirm there was no edge, the sound was of the bat hitting the ground",2,36.5,36.05,36.5,0,0,180,144,8
5560,247235,"incoming delivery towards the stumps, helped to the leg side for one",2,36.6,36.06,36.6,1,1,279,185,3
5560,10617,"fullish on the off stump, Haddin smacks it straight down the ground over the umpire'a head for four!",2,37.1,37.01,37.1,4,4,207,359,4
5560,10617,and another one! Short ball follows the full delivery and this one is pulled wide of the deep midwicket fielder for four,2,37.2,37.02,37.2,4,4,348,245,3
5560,10617,"oh, what a shot! He made room, the ball was coming in towards leg stump and he cut it fiercely past point for four",2,37.3,37.03,37.3,4,4,21,105,7
5560,10617,,2,37.4,37.04,37.4,1,1,268,148,2
219889,10617,"full on the leg stump, Warner heaves it to the wide long on boundary for another cracking four!",2,37.5,37.05,37.5,4,4,23,260,6
219889,10617,"full outside off now, steered to cover for one",2,37.6,37.06,37.6,1,1,249,219,3
219889,247235,"it's full, it's smacked, it's four! Cleared his front foot out of the way and cleared the mid on fielder",2,38.1,38.01,38.1,4,4,99,338,5
219889,247235,"that's a switch hit, but he doesn't connect well. Changed the grip of the bat and could not clear the leg side in field",2,38.2,38.02,38.2,0,0,244,218,3
219889,247235,"stays left-handed this time and gets a full toss to smash it over the fine leg boundary for four. Might have been a no ball, but not given",2,38.3,38.03,38.3,4,4,47,65,7
219889,247235,"oh, another wicket, Warner also falls. He tried to heave the length delivery on the off side over the in field but got a leading edge and was caught at point. Raises the bat for the crowd while walking back",2,38.4,38.04,38.4,0,0,263,140,2
5560,247235,"full outside off, driven easily to sweeper cover for one",2,38.5,38.05,38.5,1,1,54,173,6
270484,247235,"slightly short outside off, Faulkner slaps it right between mid on and midwicket for four. Bonus point becomes easy now",2,38.6,38.06,38.6,4,4,339,262,3
5560,10617,makes a bit of room and pushes the length ball back to the bowler,2,39.1,39.01,39.1,0,0,180,192,4
5560,10617,full toss on the pads and it's clipped on the leg side for one,2,39.2,39.02,39.2,1,1,240,190,3
270484,10617,"charges down the track and Broad angles it in, Faulkner pokes and misses",2,39.3,39.03,39.3,0,0,0,0,0
270484,10617,"oh, that's chaos, that's just poor stuff from Australia as Haddin is run out! Faulkner dug out the full delivery to short midwicket, Haddin was already halfway down the track and Bopara ran to the non-striker's end with the ball to run him out",2,39.4,39.04,39.4,0,0,219,193,3
270484,10617,"it's done now, Faulkner makes sure there are no more stutters as he slaps the ball <i>just</i> over Bopara at short midwicket for two and Australia do <b>get the bonus point</b>",2,39.5,39.05,39.5,2,2,328,239,3
