batid,bowlid,comm,inns,oa,ou,ovr,r,rt,x,y,z
40618,379504,"flighted on off, the batsman goes low and sweep-scoops to fine leg",2,46.1,46.01,46.1,1,1,239,62,1
550215,379504,"shorter and outside off, rocks back and pulls to long-on",2,46.2,46.02,46.2,1,1,86,308,5
40618,379504,"Wade misses a stumping. Full and dips just outside off as Tahir swings and misses. Wade snatches at the first attempt, juggles, and is late as the batsman slides back",2,46.3,46.03,46.3,0,0,0,0,0
40618,379504,chopped to short third man,2,46.4,46.04,46.4,1,1,160,132,8
550215,379504,shorter and slapped down the ground,2,46.5,46.05,46.5,1,1,277,291,4
40618,379504,"dangled up on the leg stump, sweeps and misses, rolls off the pad towards short fine leg",2,46.6,46.06,46.6,0,1,214,135,2
40618,288284,"full and drifting into the pads, glanced to fine leg",2,47.1,47.01,47.1,1,1,246,33,1
550215,288284,"short and shading towards the leg stump, takes the pad and wanders to square leg",2,47.2,47.02,47.2,0,1,150,129,8
40618,288284,"back of a length and outside off, Tahir cuts to sweeper cover",2,47.3,47.03,47.3,1,1,45,231,6
550215,288284,"<strong>Australia win</strong>! back of a length and angled in, helped down to deep fine leg. They aim for the second. There is a direct hit at the non-striker's end from wicketkeeper Wade after collecting the throw from Khawaja in the deep. Redemption for the missed stumping? Tahir's bat is in the air as the bails get dislodged. All over",2,47.4,47.04,47.4,1,1,108,41,8
