batid,bowlid,comm,inns,oa,ou,ovr,r,rt,x,y,z
5334,550215,"good length around off. Blocked. Good stuff from Finch, playing this testing period out",2,5.6,5.06,5.6,0,0,171,192,5
219889,47492,"what respite. My word, what a greeting. Shortish outside off, Warner sees the length early and then pulls through midwicket with disdain. Cross-seam from Steyn.",2,6.1,6.01,6.1,4,4,36,283,6
219889,47492,"137 kph, good length down leg, Warner tries to nudge into the leg side but pops back a leading edge",2,6.2,6.02,6.2,0,0,172,180,5
219889,47492,"and again. Not very short - on middle and leg. Warner was waiting for that, gets the length he wanted and swatted Steyn through midwicket. In the vacant region and four more",2,6.3,6.03,6.3,4,4,22,252,6
219889,47492,"more runs. Fantastic batting from Warner. Good length outside off, Warner backs away, giving himself room and lofts the ball over mid-off. Didn't bother keeping it down.",2,6.4,6.04,6.4,4,4,338,281,3
219889,47492,"good length on middle, Warner wanted to keep that out or dab one to third man but gets a bit of inswing. Inside edged onto the pad",2,6.5,6.05,6.5,0,0,218,171,3
219889,47492,"worked into the leg side where Amla is stationed. Warner wanted one, Amla is quick on it but lobs his throw back. A better fielder and a direct hit would have had FInch",2,6.6,6.06,6.6,1,1,116,201,6
219889,550215,"shovelled for four. Hmm. Interesting. Overpitched on off, Warner cleared his leg and looked to go straight but the ball skews off the inside half and races away through midwicket for four.",2,7.1,7.01,7.1,4,4,23,257,6
219889,550215,"four more. Sloppy fielding and Warner gets four more. Shortish and wide outside off, pushed straight towards extra cover where Phehlukwayo just lets it go through",2,7.2,7.02,7.2,4,4,356,176,3
219889,550215,"just wide of Duminy. Shortish and wide, Warner wanted to go over point but just about manages to get it past Duminy",2,7.3,7.03,7.3,2,2,322,106,2
219889,550215,"ooh, snorter. Smell that. Back of a length on off, the angle gets this back to Warner who gets his hands up and fends to point. Fantastic contest",2,7.4,7.04,7.4,0,0,207,148,2
219889,550215,"no ball and four runs. Short down leg is Rabada, Warner helps it along to the fine leg boundary. Easy",2,7.5,7.05,7.5,4,5,133,10,8
219889,550215,"144 kph, full toss on leg. Warner backs away and squeezes this down to third man",2,7.5,7.06,7.5,1,1,290,62,2
5334,550215,good length on off to finish. <strong>Hitting 140 kph consistently</strong>. Blocked by Finch,2,7.6,7.07,7.6,0,0,164,194,5
219889,47492,"full and straight from Steyn, better. Driven back to the bowler",2,8.1,8.01,8.1,0,0,175,198,5
219889,47492,"slower cutter down leg, nudged to deep square leg for a single",2,8.2,8.02,8.2,1,1,81,188,6
5334,47492,"back of a length outside off, very tight to Finch who pushes to mid-off from the back foot",2,8.3,8.03,8.3,0,0,148,203,5
5334,47492,"nice from Finch. Back of a length outside off, pushed out to mid-on who is slightly deep. Despite being on the back foot. Finch makes the run easily",2,8.4,8.04,8.4,1,1,222,239,4
219889,47492,"a slower delivery outside off, played to cover. Good changes in pace from Steyn",2,8.5,8.05,8.5,0,0,212,198,4
219889,47492,"good end. Another cutter on off, tapped towards point. A tight over, tight lines",2,8.6,8.06,8.6,0,0,229,163,2
5334,297583,"good length outside off, maybe a tad too much width? Finch punches but finds extra cover",2,9.1,9.01,9.1,0,0,106,189,6
5334,297583,"oh what a shot. And it finds the gap at wide mid-off. Back of a length outside off, natural stroke-making would indicate the ball shouldn't be going there. He stays back and muscles a punch past cover and mid-off",2,9.2,9.02,9.2,4,4,36,286,6
5334,297583,"short, wide and put away. Finch stands tall and nails his slap to the other side of cover this time. Runs leaking",2,9.3,9.03,9.3,4,4,11,226,6
5334,297583,"good length down leg, worked away towards midwicket",2,9.4,9.04,9.4,0,0,212,192,3
5334,297583,"good length outside off, 130 ks. Pushed to cover",2,9.5,9.05,9.5,0,0,132,195,6
5334,297583,"end of a fantastic Powerplay for Australia. Short and wide outside off, scythed to point.",2,9.6,9.06,9.6,0,0,113,166,6
219889,47492,"full outside off, Warner comes down and shovels his swat to deep square leg",2,10.1,10.01,10.1,1,1,37,199,6
5334,47492,"good length outside off, pushed to deep cover for a single. A good single. 144 kph",2,10.2,10.02,10.2,1,1,42,192,6
219889,47492,"full on off, lovely channels. Blocked by Warner",2,10.3,10.03,10.3,0,0,212,191,3
219889,47492,"<strong>big, big appeal</strong>. no, says the umpire Joel Wilson. Big inside edge, but the umpire didn't think so because he signalled leg byes. Fullish on leg, Warner smashes the ball into his pad and a run to third man ensues",2,10.4,10.04,10.4,0,1,218,151,2
5334,47492,"nice lines, gets a bit of movement but Finch blocks",2,10.5,10.05,10.5,0,0,179,185,5
5334,47492,good end. Back of a length outside off at 143 kph. Pushed towards cover,2,10.6,10.06,10.6,0,0,140,196,6
219889,297583,"good length on off, superb channel this. 132 kph, defended into the cover region",2,11.1,11.01,11.1,0,0,216,197,3
219889,297583,"gives himself room and creates more width than there was. Shortish outside off, cut down to third man",2,11.2,11.02,11.2,1,1,248,46,1
5334,297583,"<strong>dropped. Almost a sensational catch from Steyn</strong>. Short and wide from Abbott, not a good delivery, but Finch cuts. Some extra bounce leads to a thick top edge which flies down to Steyn at third man. Steyn thought it was a tougher catch that it was, ran in and sideways, got there and the ball bounces out. Great effort, Steyn underestimated his own athletic prowess",2,11.3,11.03,11.3,1,1,90,70,8
219889,297583,"good length on middle and leg, played into the leg side",2,11.4,11.04,11.4,0,0,164,177,6
219889,297583,"shortish delivery and straight, flat-batted swat to deep square leg",2,11.5,11.05,11.5,1,1,53,196,6
5334,297583,"phew, how did that miss? Almost another typical Finch dismissal. Abbott can't believe it. Full length outside off, Finch wants to go straight down, over mid-on, but the ball swings back in and somehow misses off stump",2,11.6,11.06,11.6,0,0,0,0,0
219889,47492,"good from Steyn. Full on middle, pushed back to Steyn",2,12.1,12.01,12.1,0,0,180,197,4
219889,47492,"gets through and that will be four. Overpitched outside off, Warner forces his drive through cover and gets four. Fantastic timing. Rossouw hustles across from sweeper cover but the work is too much",2,12.2,12.02,12.2,4,4,337,272,3
219889,47492,"good from Warner. Full and straight, pushed down to long-on",2,12.3,12.03,12.3,1,1,80,284,5
5334,47492,"138 kph, change in length. Shortish length on off, Finch is beaten and the ball pings off his body towards the keeper",2,12.4,12.04,12.4,0,0,176,144,8
5334,47492,another back of a length delivery at 136 kph. Finch pulls down to fine leg. A bit uppish but didn't get enough on that,2,12.5,12.05,12.5,1,1,309,90,2
219889,47492,"good length on off, 137 kph. Steered to point",2,12.6,12.06,12.6,0,0,232,160,2
5334,40618,"flatter delivery on leg, played away towards midwicket",2,13.1,13.01,13.1,0,0,209,190,3
5334,40618,"big appeal, but that clearly struck him outside off. Flight outside off from Tahir, Finch gets low and looks to sweep but inside-edges onto his pad",2,13.2,13.02,13.2,0,0,0,0,0
5334,40618,"googly on middle and leg, Finch goes back, doesn't quite pick it and pushes to cover",2,13.3,13.03,13.3,0,0,115,174,6
5334,40618,"gone this time! And Tahir sets off on his celebratory run. May have been the flipper, out the front of the hand. Short delivery, and quick on middle. Finch goes back, looks to cut, but clearly misjudged plenty in that - pace, length and shot selection. The ball skids through and beats Finch's cut to clatter into the stumps. Not nearly short enough to cut",2,13.4,13.04,13.4,0,0,0,0,0
267192,40618,"beautiful, slow through the air but gets the ball to skid. Smith waits and then is hustled as he blocks",2,13.5,13.05,13.5,0,0,181,184,4
267192,40618,"<strong>two in three. </strong>SA's players run behind Tahir. Another wicket, another lovely show of deception. Again, fuller and quicker. No turn at all. Smith goes back, looks to drive but just plain misses a straight one. Smudge gone for nothing. Beats the batsman in a lack of flight and a change up in pace, literally.",2,13.6,13.06,13.6,0,0,0,0,0
219889,540316,"good length on leg, nudged towards midwicket for a run. <b>Warner brings up his fifty</b>. This has been a superb knock from him. Weill need to double this, at least",2,14.1,14.01,14.1,1,1,109,185,6
4451,540316,"almost chopped on. Shortish and wide, comes back in. Bailey inside-edges to the keeper",2,14.2,14.02,14.2,0,0,172,156,8
4451,540316,"full and wide outside off, steered towards point",2,14.3,14.03,14.3,0,0,135,166,6
4451,540316,"short and wide outside off, 134 kph. Too much width, slashed to deep cover. Got on top of the bounce",2,14.4,14.04,14.4,1,1,38,208,6
219889,540316,"good length on middle and off, worked away towards point",2,14.5,14.05,14.5,0,0,236,170,3
219889,540316,"fullish and wide outside off, pushed back. Mis-timed.",2,14.6,14.06,14.6,0,0,193,189,4
4451,40618,gets forward and defends the tossed up delivery on middle,2,15.1,15.01,15.1,0,0,178,188,5
4451,40618,wrong'un but he has the line well covered as he smothers the spin,2,15.2,15.02,15.2,0,0,152,181,6
4451,40618,"touch short, he rocks back to punch one to mid-on",2,15.3,15.03,15.3,1,1,260,293,4
219889,40618,"tosses it up nicely, inviting Warner to go over the top, but he's happy to block",2,15.4,15.04,15.4,0,0,198,187,4
219889,40618,leading edge but lands short of short third man. Warner didn't pick the googly and looked to work it across the line over midwicket,2,15.5,15.05,15.5,0,0,229,135,2
219889,40618,"pushes it through quicker and fuller outside off, Warner defends from the crease",2,15.6,15.06,15.6,0,0,210,191,3
4451,540316,"floats this at length on middle from wide of the crease, the ball keeps a touch low but Bailey is behind the line as he blocks",2,16.1,16.01,16.1,0,0,200,195,4
4451,540316,"drags it back onto the stumps and the roar tells you the story. This is reward for accuracy. This one's bowled a touch fuller from the length area, Bailey is caught on the crease as he pokes tentatively away from the body. The BALL wobbles  wee bit to take the inside edge onto the stumps.",2,16.2,16.02,16.2,0,0,179,163,8
272450,540316,driven on the up but straight to backward point,2,16.3,16.03,16.3,0,0,117,162,7
272450,540316,"gets this to jag away from outside off, Marsh hops back to bunt that to point",2,16.4,16.04,16.4,0,0,118,182,6
272450,540316,gets on top of the bounce and dabs the short delivery to the off side,2,16.5,16.05,16.5,0,0,137,179,6
272450,540316,rooted to the crease as he plays back to a full delivery on off stump. Hit straight to point,2,16.6,16.06,16.6,0,0,139,177,6
219889,40618,"slow turn back in, tapped gently to point for a quick single. Risky, but Rabada's throw was wayward",2,17.1,17.01,17.1,1,1,249,179,3
272450,40618,"googly first up for Mitch Marsh, he gets forward and drives it straight to cover",2,17.2,17.02,17.2,0,0,138,193,6
272450,40618,"drifting into the pads, worked to long-on",2,17.3,17.03,17.3,1,1,270,294,4
219889,40618,"beaten by a superb googly. Warner looks to open the bat face late to slap that past cover, but was deceived in flight",2,17.4,17.04,17.4,0,0,0,0,0
219889,40618,"beaten again, <b> another googly that does him in the air. </B> This is outstanding legspin bowling",2,17.5,17.05,17.5,0,0,0,0,0
219889,40618,checks his drive this time to a slider on off stump,2,17.6,17.06,17.6,0,0,214,192,3
272450,540316,"uppish but safe, flies off the thick edge to third man",2,18.1,18.01,18.1,1,1,116,42,8
219889,540316,"pulled but the ball wasn't all that short for him to wind up like the way he did, mistimed to deep midwicket",2,18.2,18.02,18.2,1,1,38,245,6
272450,540316,"flicked, but finds deep square leg. Her had to come around a fair bit which gave Marsh an opportunity to amble back for the second",2,18.3,18.03,18.3,2,2,276,52,1
272450,540316,"length ball at 134kph, Marsh hops back and punches that to cover",2,18.4,18.04,18.4,0,0,131,204,6
272450,540316,"this one's floated a touch fuller from length outside off, Marsh defends from the crease",2,18.5,18.05,18.5,0,0,123,176,6
272450,540316,the bowler does well to react quickly on his followthrough to stop that rocket drive with his boot,2,18.6,18.06,18.6,0,0,173,194,5
219889,40618,"fizzes straight on from middle, Warner gets back and blocks",2,19.1,19.01,19.1,0,0,175,193,5
219889,40618,"driven through the line to wide long-off, much more authority in the stroke this time",2,19.2,19.02,19.2,1,1,287,291,4
272450,40618,"wrong'un that lands outside off to draw Marsh forward, he deadbats it in the end",2,19.3,19.03,19.3,0,0,169,188,5
272450,40618,"this one spins away, Marsh doesn't get to the pitch of the ball but manages to bunt that to cover",2,19.4,19.04,19.4,0,0,132,198,6
272450,40618,"too full outside off, drilled across the line to Steyn at long-on, quality work to slide across to stop that",2,19.5,19.05,19.5,1,1,252,317,4
219889,40618,gets to the pitch of the ball and drives to deep cover,2,19.6,19.06,19.6,1,1,311,281,3
219889,540316,"hint of width, crunched to sweeper cover",2,20.1,20.01,20.1,1,1,326,166,3
272450,540316,"quality stroke, punched off the back foot to Tahir at deep cover",2,20.2,20.02,20.2,1,1,53,215,6
219889,540316,"slower length ball on leg stump, nurdled to square leg",2,20.3,20.03,20.3,1,1,105,137,7
272450,540316,gloves a pull down to fine leg. Beaten for pace on that occasion even though he got into a relatively good position,2,20.4,20.04,20.4,1,1,257,61,1
219889,540316,worked off the pad to midwicket where Miller dives full length to his right to stop that lovely little flick,2,20.5,20.05,20.5,0,0,148,193,6
219889,540316,deflects off the pad to the leg side as he looks to tickle it fine,2,20.6,20.06,20.6,0,1,149,160,7
219889,40618,leans forward and blocks,2,21.1,21.01,21.1,0,0,197,177,3
219889,40618,makes a bit of room and punches that googly to deep cover,2,21.2,21.02,21.2,1,1,326,222,3
272450,40618,"drifting full into the pads, eased to long-on",2,21.3,21.03,21.3,1,1,276,296,4
219889,40618,"lofted, and lofted very nicely. Almost shoveled that off the front foot. The bat face just turned a wee bit when he made contact but he still placed it where he wanted to. The power of the bottom hand",2,21.4,21.04,21.4,4,4,341,261,3
219889,40618,stretches forward and defends gently,2,21.5,21.05,21.5,0,0,181,186,4
219889,40618,"sharp turn back in from off stump, Warner uses the depth of the crease to defend",2,21.6,21.06,21.6,0,0,205,183,3
272450,540316,"ill-directed short ball outside leg stump, batsman lets it go",2,22.1,22.01,22.1,0,1,0,0,0
272450,540316,"quality stroke. Nothing wrong with the delivery really. It was a length ball that nipped away from off, just a hint of width, Marsh stood tall to get on top of the bounce and punched that behind point",2,22.1,22.02,22.1,4,4,31,89,7
272450,540316,"crunching cover drive, Tahir does well to come around the ropes to restrict that to a single",2,22.2,22.03,22.2,1,1,41,199,6
219889,540316,"whipped off his hip into the deep square leg boundary. Too straight and short, Warner once again uses the depth of the crease before bringing his powerful wrists into play",2,22.3,22.04,22.3,4,4,48,61,7
219889,540316,"slower and fuller on the pads, clipped to short fine where Behardien nearly over-ran the ball",2,22.4,22.05,22.4,1,1,138,122,8
272450,540316,driven back straight to mid-on,2,22.5,22.06,22.5,0,0,220,236,4
272450,540316,"whipped away towards deep backward square again, end of a wayward over",2,22.6,22.07,22.6,1,1,327,128,2
272450,40618,"pushes one quicker on middle, he jams his bat down in time to bunt it back down the pitch",2,23.1,23.01,23.1,0,0,184,196,4
272450,40618,worked uppishly to deep midwicket,2,23.2,23.02,23.2,1,1,325,184,3
219889,40618,"this one spins back in, Warner whips that to deep square leg",2,23.3,23.03,23.3,1,1,52,143,7
272450,40618,"drives, but gets a thick inside edge to midwicket",2,23.4,23.04,23.4,0,0,214,202,4
272450,40618,"touch short, punched to sweeper cover",2,23.5,23.05,23.5,1,1,30,202,6
219889,40618,tucked towards the man coming in from square leg,2,23.6,23.06,23.6,1,1,96,152,7
219889,297583,imperious pull. What a welcome to the bowling crease. Touch short and Warner was onto it in a jiffy as he pulled him in front of square,2,24.1,24.01,24.1,4,4,6,227,6
219889,297583,this time he nurdles that full ball to midwicket,2,24.2,24.02,24.2,0,0,145,188,6
219889,297583,"cut away behind point, Rossouw is quickly off the blocks",2,24.3,24.03,24.3,1,1,322,146,2
272450,297583,"hint of away-movement off the seam, punches the length ball to cover",2,24.4,24.04,24.4,0,0,137,192,6
272450,297583,"this one grips the surface and holds up, Marsh through with his attempted punch, the ball rolls to cover",2,24.5,24.05,24.5,0,0,150,196,5
272450,297583,"quality stroke, once again not afraid to hit on the up, the bat face is turned ever-so-slightly to beat point, the boundary rider comes around",2,24.6,24.06,24.6,1,1,41,123,7
272450,550215,"<b> Palmed over the ropes by Abbott at deep square leg. </b> But let me tell you it was a tough chance. This was short and angling in, Marsh decided he's going to pull, got good enough bat on it too. Had Abbott been on the ropes, it would have been straight down his throat.",2,25.1,25.01,25.1,6,6,336,90,2
272450,550215,"<b> confusion, confusion! </b> Marsh is ball-watching as he bunts it to point, Warner had almost completed the run even as Marsh was halfway down the pitch. A direct hit at the bowler's end would have nailed him. Duminy the fielder in question, would have been close at both ends",2,25.2,25.02,25.2,1,1,130,162,7
219889,550215,plays a short-arm jab to midwicket,2,25.3,25.03,25.3,1,1,29,175,6
272450,550215,"this is an even better stroke. Short and angling in, he swivels back, gets underneath it and pulls him into the fine leg boundary. Total control",2,25.4,25.04,25.4,6,6,343,89,2
272450,550215,punched on the up to mid-off,2,25.5,25.05,25.5,0,0,132,230,5
272450,550215,hops back to bunt that full delivery to cover,2,25.6,25.06,25.6,0,0,158,182,6
219889,297583,"edged, but safe. Down to Steyn at third man. <b> Oh, he's back </b>",2,26.1,26.01,26.1,1,1,252,47,1
272450,297583,"clubbed into the midwicket boundary. Drags a short ball outside off, Marsh sets himself up to slap that in front of square. Into position so quickly too",2,26.2,26.02,26.2,4,4,342,260,3
272450,297583,beaten by a nothing shot. Pokes away from the body with an angled bat,2,26.3,26.03,26.3,0,0,0,0,0
272450,297583,flayed on the up to Tahir at sweeper cover,2,26.4,26.04,26.4,1,1,31,169,6
219889,297583,beaten by a ripper! This one jags away from length on middle to square Warner up. The bounce on that too! Phew,2,26.5,26.05,26.5,0,0,0,0,0
219889,297583,whipped off his hip into the gap at deep square leg. Warner called for two and made it back quite easily,2,26.6,26.06,26.6,2,2,63,123,7
272450,550215,"much better the length from Rabada, touch fuller on off stump, defended",2,27.1,27.01,27.1,0,0,169,187,5
272450,550215,"so the decision to persist with Rabada despite an ordinary last over has worked. And he's got the man who hit him for two sixes in the previous over. This one veers back in full from wide of the crease, Marsh looks to heave it across the line, more towards midwicket, but he swings too early as the ball deflects off the pad onto the stumps",2,27.2,27.02,27.2,0,0,0,0,0
530011,550215,rip roaring short ball that climbs to hit his glove as he hops back to defend,2,27.3,27.03,27.3,0,0,162,172,6
530011,550215,"opens the bat face to punch that, but JP Duminy is super agile. Throws himself to his left to stop that certain boundary",2,27.4,27.04,27.4,0,0,247,167,3
530011,550215,gets on top of the bounce and bunts it to the leg side,2,27.5,27.05,27.5,0,0,164,189,5
530011,550215,"top shot! Balance, timing, wrist work and placement - all in sync as it races into the midwicket boundary. Too full from Rabada and he was punished on that occasion",2,27.6,27.06,27.6,4,4,30,267,6
219889,44932,"drilled to cover, a half-stop gives Warner a single",2,28.1,28.01,28.1,1,1,309,225,3
530011,44932,stretches forward and defends that in-drifter,2,28.2,28.02,28.2,0,0,182,188,4
530011,44932,eased back past the bowler to long-on,2,28.3,28.03,28.3,1,1,95,290,5
219889,44932,"that has been hammered into the gap over cover. JP gives it air, Warner is down on one knee quickly as he lofts it cleanly over the infield",2,28.4,28.04,28.4,4,4,350,242,3
219889,44932,"Miller dives to his right to half-stop that slap, deflects to the boundary rider. That's how powerfully it was struck. <b> Both batsmen collided in the middle </b>",2,28.5,28.05,28.5,1,1,327,204,3
530011,44932,"driven wide of Miller, with the spin, for an easy single",2,28.6,28.06,28.6,1,1,280,288,4
530011,550215,ripper of a delivery that squares Head up. Wasn't far from the outside edge,2,29.1,29.01,29.1,0,0,0,0,0
530011,550215,beaten again. This one nips away off the seam from the length area on middle. Another feeble push,2,29.2,29.02,29.2,0,0,0,0,0
530011,550215,"arches back and helps it up and over the cordon, one bounce to third man",2,29.3,29.03,29.3,1,1,265,50,1
219889,550215,"finds the gap and the timing on that is magnificent. Hops back and then simply opens the face of the bat to steer that behind point. Third man, even though square, had no chance",2,29.4,29.04,29.4,4,4,349,111,2
219889,550215,pushed straight to a diving Faf du Plessis at cover,2,29.5,29.05,29.5,0,0,223,206,3
219889,550215,"flayed into the extra cover boundary. It was hit so hard that JP Duminy, normally a very very safe fielder, had little time to react. He had no more than 5 metres to move to his right. What power! This isn't over yet",2,29.6,29.06,29.6,4,4,354,177,3
530011,540316,good length on middle and worked away towards midwicket. Cramping him for room,2,30.1,30.01,30.1,0,0,144,192,6
530011,540316,"a big appeal, not given by ump Joel Wilson. Full and straight, Head misses and is rapped on the pad. May have pitched outside leg",2,30.2,30.02,30.2,0,0,207,145,2
530011,540316,"good length on middle, 130.2 kph. Pushed towards mid-on for one.",2,30.3,30.03,30.3,1,1,135,218,5
219889,540316,"four more. A slower ball on Warner's thighs. You may want to bowl elsewhere to him. He wanted to put that onto the banks, but got more of the inside half of the bat, sending the ball past short fine leg. Warner on 95",2,30.4,30.04,30.4,4,4,50,59,7
219889,540316,"full on middle, 132 kph. Pushed to cover.",2,30.5,30.05,30.5,0,0,234,190,3
219889,540316,absolute rubbish from Phehlukwayo. Warner takes full toll. Slow offcutter well down leg. Warner just helps it along to the fine leg boundary. Would have been wide had he not got bat on that. Moves to 99.,2,30.6,30.06,30.6,4,4,118,14,8
530011,47492,"full and wide at 136 kph. Head doesn't back down, looks to go down the ground but misses. Big swing, big miss",2,31.1,31.01,31.1,0,0,0,0,0
530011,47492,crashed away through cover for one.,2,31.2,31.02,31.2,1,1,335,192,3
219889,47492,"doesn't quite get there. Overpitched from Steyn outside off, Warner picks the right stroke and drives to cover. Can't pierce the gap",2,31.3,31.03,31.3,0,0,228,192,3
219889,47492,"<b>100 for Warner</b>. Subdued in celebration. Takes off his helmet and acknowledges the applause. Full on leg, pushed to mid-on and calls for one immediately. Easy. Take a bow, splendid innings",2,31.4,31.04,31.4,1,1,142,226,5
530011,47492,"ah poor ball. Full and wide outside off, too much wifdth. Head throws his hands at that and gets it over point. Another boundary",2,31.5,31.05,31.5,4,4,340,90,2
530011,47492,"rather full outside off, crisply driven to mid-off",2,31.6,31.06,31.6,0,0,222,216,4
219889,540316,"132 kph, bad lines these. Not good. Down leg and Warner misses the freebie. Rapped on the pad",2,32.1,32.01,32.1,0,0,170,168,6
219889,540316,"and again, down leg. 129 kph. Warner picks it off, clips to fine leg. Not great bowling this",2,32.2,32.02,32.2,1,1,109,46,8
530011,540316,"129 kph, better line. Full but on middle and off. Head inside edges onto his pad. Had he missed that, he was plumb. A bit of inward movement too.",2,32.3,32.03,32.3,0,0,192,155,2
530011,540316,"131 kph, seems pretty good to Head but loses his line to Warner. Straight on a good length, no room and so Head works to midwicket",2,32.4,32.04,32.4,0,0,151,192,6
530011,540316,superb as usual from Faf. Wristily nudged to Faf at midwicket who puts in a dive. may have saved at least one there,2,32.5,32.05,32.5,1,1,137,188,6
219889,540316,just not good bowling this. An easy nudge through the leg side gives Warner and Australia two more to backward square,2,32.6,32.06,32.6,2,2,35,113,7
530011,47492,"short of a length outside off, Head tries to go over midwicket but was clearly hurries for pace. Bunts to mid-on",2,33.1,33.01,33.1,0,0,149,218,5
530011,47492,"full on middle and off, giving nothing away. Blocked",2,33.2,33.02,33.2,0,0,166,198,5
530011,47492,"good length outside off, carved down to third man",2,33.3,33.03,33.3,1,1,267,52,1
219889,47492,"over mid-of. Short of a length outside off, Warner tries to go over the top. Doesn't get all of it, but gets enough to clear mid-off. Plinks in the outfield. Splendid running gives Warner three",2,33.4,33.04,33.4,3,3,279,298,4
530011,47492,"139 kph, nice lines on off. Steered to third man",2,33.5,33.05,33.5,1,1,244,43,1
219889,47492,"132 kph, slow on middle and leg. Seemed like an offcutter. Worked towards square leg",2,33.6,33.06,33.6,1,1,87,164,7
