batid,bowlid,comm,inns,oa,ou,ovr,r,rt,x,y,z
219889,540316,"131 kph, full outside off, pushed down to mid-off for a quick single.",2,34.1,34.01,34.1,1,1,225,242,4
530011,540316,"134 kph, straying down leg, leading edge towards mid-on for one",2,34.2,34.02,34.2,1,1,128,216,6
219889,540316,"good length on middle, Warner is hurried and gets hit on the thigh. The ball ricochets to point who unnecessarily fires a throw at the non-strikers end. Concedes the overthrow. If you're good at saving runs, have to be able to prevent these kind of runs too. Fine margins in this sport",2,34.3,34.03,34.3,0,2,218,145,2
219889,540316,"strays down leg this time, wide. Very surprised this is the line Phehlukwayo has stuck to",2,34.4,34.04,34.4,0,1,0,0,0
219889,540316,"another one. The bowler is not happy. Overpitched outside off, driven straight to Miller at cover who fires a throw, hits the stumps at the strikers end and concedes one. Two extra runs in this over.",2,34.4,34.05,34.4,1,1,246,206,3
530011,540316,"good length on middle, whipped past midwicket for two. Nice shot, immense power in those wrists",2,34.5,34.06,34.5,2,2,39,217,6
530011,540316,"goes through and that's four. Overpitched on middle and leg, Head finds the gap at midwicket, past mid-on too.",2,34.6,34.07,34.6,4,4,52,302,5
219889,40618,four more! Warner doing nothing wrong. May not have been picking him so he opts to reverse sweep. Gets this in between two fielders for four,2,35.1,35.01,35.1,4,4,338,95,2
219889,40618,"97 kph, flat on middle. Flat-batted to midwicket for one",2,35.2,35.02,35.2,1,1,96,184,6
530011,40618,"slow legbreak on off, Head outside-edges towards short third man for one. Playing him nicely",2,35.3,35.03,35.3,1,1,221,116,1
219889,40618,"82 kph, slow on middle. Cut to short third again, the pair are hesitant but rightly, decide against the run",2,35.4,35.04,35.4,0,0,229,132,2
219889,40618,fantastic batting. Nudged towards midwicket for one,2,35.5,35.05,35.5,1,1,142,189,6
530011,40618,"slow down leg, clipped to square leg. They'll take what they can",2,35.6,35.06,35.6,1,1,116,150,7
530011,47492,"good length outside off, pushed towards cover for a quick run",2,36.1,36.01,36.1,1,1,242,197,3
219889,47492,"strays down leg, worked towards short fine leg",2,36.2,36.02,36.2,1,1,135,119,8
530011,47492,"superb shot, superb fielding. Overpitched outside off, cracked through towards cover. Miller dives and prevents the ball from going through",2,36.3,36.03,36.3,1,1,235,196,3
219889,47492,"good length outside off, 137 kph. Shovelled to long-on. Happy to take the singles.",2,36.4,36.04,36.4,1,1,116,259,5
530011,47492,<strong>142.6 kph</strong> outside off. Head crunches his drive to cover on the bounce,2,36.5,36.05,36.5,0,0,228,192,3
530011,47492,"good over from Steyn. Just four off. Full on middle and leg, Head misses his flick and is struck on the pad",2,36.6,36.06,36.6,0,0,205,174,3
219889,40618,"slow through the air on middle and off, Warner gets low to reverse lap. Misses. Struck on the body",2,37.1,37.01,37.1,0,0,198,162,2
219889,40618,"big appeal, Tahir wants a review. Faf has a look at Qdk and <strong>opts to review</strong>. Only question here is if it was pitching in line? Looked like it did, but hit Warner on the thigh. A flat delivery on leg, Warner gets low to sweep but misses. The ball carries on and hits Warner on the thigh, two leg byes to fine leg, the result. All on hawkeye now. Yikes, pitched just outside leg. Excellent decision from umpire George.",2,37.2,37.02,37.2,0,2,151,51,8
219889,40618,"flat and wide outside off, cut out to deep cover",2,37.3,37.03,37.3,1,1,330,185,3
530011,40618,"the googly outside off, 84 kph. Drilled down to long-off",2,37.4,37.04,37.4,1,1,257,288,4
219889,40618,"another googly outside off, cut out to point. Phehlukwayo dives and prevents the ball from going through",2,37.5,37.05,37.5,1,1,238,136,2
530011,40618,"flight outside off, driven out towards cover",2,37.6,37.06,37.6,0,0,225,193,3
219889,47492,"a slower delivery on middle, bunted down to long-on. 120 kph, Steyn has varied his pace nicely despite not extracting much",2,38.1,38.01,38.1,1,1,93,259,5
530011,47492,"picks the length early. To be fair, wasn't nearly short enough ti pull. But Head was hanging back, gets the length he wanted and slaps his pull in the gap at midwicket. There's the boundary for the over",2,38.2,38.02,38.2,4,4,25,270,6
530011,47492,"drifts down leg, Head picks out square leg with his flick",2,38.3,38.03,38.3,0,0,131,135,7
530011,47492,full and wide from around the wicket. 137 kph. Skids on and beats Head's cut,2,38.4,38.04,38.4,0,0,0,0,0
530011,47492,"good stop. Overpitched outside off, pushed down towards mid-off who saves the boundary, parries it to long-on and allows the second run",2,38.5,38.05,38.5,2,2,223,241,4
530011,47492,"beauty to finish. 139 kph, good length outside off, zips through and beats the bat. Lovely over and effort from Steyn",2,38.6,38.06,38.6,0,0,0,0,0
219889,40618,"flight on off, nice loop. Fiercely cut to deep point",2,39.1,39.01,39.1,1,1,329,206,3
530011,40618,"flatter delivery on off, 87 kph. Defended. Good lines.",2,39.2,39.02,39.2,0,0,201,186,3
530011,40618,"flipper, quick on off and middle. Pushed down to long-on. Nice from Tahir, staying accurate",2,39.3,39.03,39.3,1,1,91,260,5
219889,40618,"superb shot, that should be four. It is. Overpitched outside off, Warner gives himself room by staying leg side of the ball and then smashes his drive past cover. Duminy gets across from long-off but can't cut it in. Makes contact while touching the boundary",2,39.4,39.04,39.4,4,4,331,278,3
219889,40618,"the legspinner outside off, spins back in and cuts the batsman in half",2,39.5,39.05,39.5,0,0,0,0,0
219889,40618,"wrong un, pushed to over. A misfield and a parry allows two",2,39.6,39.06,39.6,2,2,269,252,3
530011,297583,"not all that short to pull but Head had decided he was going to go for it anyway, looked to fetch it from outside off too, and all he managed in the top was a top edge. It was swirling around for a long, long time but De Kock called nice and early, kept his eyes on it all along till he saw it lodge into his gloves.",2,40.1,40.01,40.1,0,0,159,88,8
219889,297583,slapped to point where a half-stop jeeps it down to a single. Faf is withering in pain. Has he damaged his finger? He seems in severe pain. Faf was off balance when the ball took off from one of the patches and smashed into his finger.,2,40.2,40.02,40.2,1,1,248,165,2
230193,297583,runs it down to third man to get off the mark immediately,2,40.3,40.03,40.3,1,1,255,48,1
219889,297583,uses the pace of the bowler to steer it down to third man again,2,40.4,40.04,40.4,1,1,264,50,1
230193,297583,"floats this into the pads, worked to deep midwicket",2,40.5,40.05,40.5,1,1,34,203,6
219889,297583,"yorker-length delivery outside off, Warner stays deep inside the crease to squeeze it wide of cover",2,40.6,40.06,40.6,1,1,237,201,3
219889,40618,"too full on the pads, whipped to deep square leg",2,41.1,41.01,41.1,1,1,74,126,7
230193,40618,gets across the stumps and paddles it to short fine. Lucky to get away with that high full toss. Faf tumbled over and then crawled to get to the ball,2,41.2,41.02,41.2,2,2,154,106,8
230193,40618,driven down to long-off as they amble the single,2,41.3,41.03,41.3,1,1,260,307,4
219889,40618,"touch short, Warner makes room and cuts that to deep point",2,41.4,41.04,41.4,1,1,335,183,3
230193,40618,down one one knee as he plays a half-sweep to square leg. Couldn't generate much power on that occasion,2,41.5,41.05,41.5,1,1,95,140,7
219889,40618,cuts that to Rabada at deep point,2,41.6,41.06,41.6,1,1,317,146,2
219889,297583,"swings over cover, ball flies off the thick outside edge to the third man boundary. At this stage, no one's bothered about aesthetics.",2,42.1,42.01,42.1,4,4,224,6,1
219889,297583,backs away and slaps one behind point to third man,2,42.2,42.02,42.2,1,1,271,60,1
230193,297583,"gets on top of the bounce and eases it off the back foot to deep point, the boundary rider comes haring in to keep that down to a single",2,42.3,42.03,42.3,1,1,319,158,2
219889,297583,"excellent yorker, Warner looks to back away and squeeze it behind point but Abbott bowls this full and just outside off, didn't have the kind of room he would have liked as he digs it out towards the cover region",2,42.4,42.04,42.4,1,1,243,136,2
230193,297583,"gets a big nick that is gleefully accepted by De Kock. This was a short of length delivery outside off, Wade went for a big swipe across the line but the extra bounce did him in.",2,42.5,42.05,42.5,0,0,188,126,1
439288,297583,the ball reverses back in a long way to beat his flick and hit him on the pad,2,42.6,42.06,42.6,0,0,161,166,6
219889,550215,"backs away and carves a full delivery over the infield, to deep cover",2,43.1,43.01,43.1,1,1,337,186,3
439288,550215,"as far as catches go, it can't get easier than that. Pacy length ball that holds up after pitching outside off, Mennie looks to loft through the line but hit it straight down the throat of Miller at mid-off. He impressed with the ball, but the outing with the bat has been anything but that",2,43.2,43.02,43.2,0,0,138,232,5
219889,550215,"delightfully done by Warner. Goes outside leg stump and then unfurls those wrists to pick the gap behind point. Deep cover was sprinting across, but could only get his finger tips upon a dive. Tahir the fielder in question",2,43.3,43.03,43.3,4,4,345,107,2
219889,550215,"floats this full and down leg, all Warner needed was a fine tickle to get a boundary, missed out",2,43.4,43.04,43.4,0,1,0,0,0
219889,550215,"another slower delivery gone wrong, way down leg side. De Kock collects on the bounce",2,43.4,43.05,43.4,0,1,0,0,0
219889,550215,"so, so clever. This time he takes it on the full and then slices it behind point. There were three men on the off side ring, but he still picked the gap.",2,43.4,43.06,43.4,4,4,346,113,2
219889,550215,walks across the stumps and squeezes it to mid-off for a quick single,2,43.5,43.07,43.5,1,1,243,224,3
553800,550215,gets right underneath that yorker outside off to keep it out,2,43.6,43.08,43.6,0,0,174,170,6
219889,297583,"gets a thick inside edge onto the pad as he backs away to slash. The deflection nearly rolls onto the stumps. <b> Brings up his 150 </b> Muted celebrations, but I'm sure it will be anything but that should he take the side past the line",2,44.1,44.01,44.1,1,1,193,161,2
553800,297583,beaten outside off by a delivery that deviates away from the length area outside off,2,44.2,44.02,44.2,0,0,0,0,0
553800,297583,"what athleticism from Faf! Outstanding work to effect a run-out. In the end, Tremain has sacrificed his wicket. He got a thick inside edge towards midwicket where Phehlukwayo intially looked for an under-arm flick as the bowler was still on his followthrough. Faf wasn't even in the picture even as the flick came in. But he dived full-length across to nearly dive into the stumps. But he ensured he disturbed them only when he was fully in control of the ball. Top, top work",2,44.3,44.03,44.3,0,0,223,194,3
219889,297583,dabs it wide of point and scampers through for a quick single,2,44.4,44.04,44.4,1,1,230,123,2
379504,297583,tucked to midwicket as they steal another single,2,44.5,44.05,44.5,1,1,228,225,4
219889,297583,"full and sliding into middle and leg, he wrists it to deep midwicket",2,44.6,44.06,44.6,1,1,87,293,5
219889,550215,"right into the block hole, Warner backs away and carves it past the infield. Somehow, he found a way to squeeze that with immense power. Super stuff this. Tahir at deep cover had no chance",2,45.1,45.01,45.1,4,4,347,253,3
219889,550215,"third man was inside the ring. What does Warner do?Make room, arch back and ramp the ball over him. Rabada slowed it down just a touch but the width was manufactured to find the boundary. Sensational",2,45.2,45.02,45.2,4,4,278,27,1
219889,550215,"angles a yorker-length delivery on the pads, worked into the gap at deep backward square leg",2,45.3,45.03,45.3,2,2,39,189,6
219889,550215,"sliding into the pads, gentle flick of the wrists to get that behind square on the leg side. No one at fine leg. So once he got enough bat on it, that was headed just one way",2,45.4,45.04,45.4,4,4,56,52,7
219889,550215,low full toss that has been fllicked to deep square,2,45.5,45.05,45.5,1,1,36,155,7
379504,550215,bouncer but the direction is wrong. Slides it down leg as Tremain manages to avoid it,2,45.6,45.06,45.6,0,1,0,0,0
379504,550215,"firm drive, straight to cover",2,45.6,45.07,45.6,0,0,118,198,6
219889,47492,"thick outside edge down to third man, scampers back for the second. Looked to squeeze that behind point",2,46.1,46.01,46.1,2,2,239,28,1
219889,47492,"he's clobbered that, or has he? Backs away and slashes that to get it into the gap towards square third man. For a minute, it looked like he'd smashed that, but ended up slicing it",2,46.2,46.02,46.2,2,2,312,98,2
219889,47492,"flays the short ball angling in towards cover, made a bit of room to manufacture something out of nothing.",2,46.3,46.03,46.3,1,1,263,197,3
379504,47492,"swing and a miss. How did that miss off stump, I don't know. Wild swing across the line but was beaten for pace.",2,46.4,46.04,46.4,0,0,0,0,0
379504,47492,over the stumps this time! Jags back in to beat the swing again.,2,46.5,46.05,46.5,0,0,0,0,0
379504,47492,"backs away and lofts it up and over point, third man comes around to cut that off",2,46.6,46.06,46.6,2,2,102,45,8
219889,540316,"Unfortunate end to a top, top knock. He simply had to come back for the second after carving that to deep cover, but the throw was right on top of the stumps from Tahir as de Kock gathered the ball cleanly and whipped the bails off. Newlands stand up to applaud a great innings.",2,47.1,47.01,47.1,1,1,336,141,2
446548,540316,"firm push to mid-off, the throw misses the stumps and smashes into Boland's knee. He's liming now. <B> Ouch, he's in a lot of pain </b> The cameras panned to the Australian dressing room, and almost everyone was falling off their chair in laughter!",2,47.2,47.02,47.2,1,1,136,231,5
379504,540316,"swings over midwicket, ends up slicing it down to third man",2,47.3,47.03,47.3,1,1,111,48,8
446548,540316,mistimes an attempted slog down to mid-on,2,47.4,47.04,47.4,1,1,261,295,4
379504,540316,backs away to squeeze that to deep point,2,47.5,47.05,47.5,1,1,41,144,7
446548,540316,makes room and drills it to deep cover,2,47.6,47.06,47.6,1,1,90,298,5
446548,47492,"sees the batsman backing away and follows him by bowling it full outside leg, squeezed back past the bowler to mid-on",2,48.1,48.01,48.1,1,1,278,285,4
379504,47492,"slower delivery way outside off, just toeing with the wide line",2,48.2,48.02,48.2,0,1,0,0,0
379504,47492,"tucked towards deep midwicket, the throw comes in full and flat as Steyn collects it cleanly and whips the bails off. Perhaps Boland's hit on the knee may have slowed him down as he turned for the second. <b> Third umpire has two looks before deciding it's 5-0 for South Africa. </b>",2,48.2,48.03,48.2,1,1,273,221,3
