batid,bowlid,comm,inns,oa,ou,ovr,r,rt,x,y,z
55608,537126,"starts off with a loose delivery outside off, full and angling away from the sixth stump, Masakadza watches it through to MS Dhoni",1,0.1,0.01,0.1,0,0,0,0,0
55608,537126,"full and straight on middle, Masakadza offers the full face of the bat as he drives it back to the bowler",1,0.2,0.02,0.2,0,0,191,199,4
55608,537126,"swings back in to beat the pad, wide called. Masakadza would be disappointed at missing out on a scoring opportunity. Just needed a faint tickle to get four there",1,0.3,0.03,0.3,0,1,0,0,0
55608,537126,"plays all around a full inswinger on middle and leg, is hit high on the pad",1,0.3,0.04,0.3,0,0,204,194,4
55608,537126,"lobs off the pad once again, shouts of catch but the bat was miles away as he prodded outside the line of the inswinging length ball on middle and leg",1,0.4,0.05,0.4,0,0,0,0,0
55608,537126,"slants a length ball on off stump, tapped with soft hands to point",1,0.5,0.06,0.5,0,0,121,141,7
55608,537126,"bends the ball back into middle and leg, Masakadza once again makes the mistake of looking to play across the line when he would have been better off playing straight, is hit on the left pad, but the ball would have missed leg",1,0.6,0.07,0.6,0,0,0,0,0
55354,277955,"crunching cover drive on the up! It was full and swinging away, Chibhabha is authoritative in his strokeplay as he leans forward and eases the ball past the diving cover point fielder",1,1.1,1.01,1.1,4,4,14,158,7
55354,277955,"flies off the blade again, another delightful extra cover drive, but straight to debutant Fazal",1,1.2,1.02,1.2,0,0,113,175,6
55354,277955,"drops the length slightly shorter this time, Chibhabha is onto the back foot as he taps it to the off side",1,1.3,1.03,1.3,0,0,123,148,7
55354,277955,"angles a full ball that shapes away from middle and off, this time it's driven down the ground to Bumrah at mid-on, dived to his left to save at least two runs",1,1.4,1.04,1.4,0,0,210,250,4
55354,277955,"back of length delivery on off stump, plays a cross-batted defensive shot that bounces to the off side",1,1.5,1.05,1.5,0,0,135,175,6
55354,277955,"hops across the stumps to punch one to cover. Steady start by Dhawal, didn't do much wrong even though he was crunched through cover in that over",1,1.6,1.06,1.6,0,0,135,187,6
55608,537126,"imperious pull shot! Too short, and not much pace on that, Masakadza rocked back and pulled that in front of square, and had plenty of time to do so",1,2.1,2.01,2.1,4,4,350,190,3
55608,537126,"this time, Sran overpitches and Masakadza lofts him over cover, didn't get hold of it but they still manage to get back for the third. Slightly gingerly on the field was Axar, on that occasion, as he gave it chase. The throw from the deep was poor",1,2.2,2.02,2.2,3,3,32,237,6
55354,537126,"bends it back into middle and leg, Chibhabha is hit on the pad as he looks to work it to the on side, he closed the bat face a little too early",1,2.3,2.03,2.3,0,0,0,0,0
55354,537126,"width on offer as he slants one across the batsman, left alone",1,2.4,2.04,2.4,0,0,0,0,0
55354,537126,"driven wide of extra cover with soft hands, quick single taken. The fielder was on the edge of the circle",1,2.5,2.05,2.5,1,1,128,196,6
55608,537126,"lucky to get away with that delivery, full and well outside off, just around the wide line. The batsman is happy to let that go",1,2.6,2.06,2.6,0,0,0,0,0
55354,277955,"banana swing from outside off, zero foot movement from Chibhabha as he looks to drive on the up, wasn't far away from the edge",1,3.1,3.01,3.1,0,0,0,0,0
55354,277955,gets a good stride forward to bunt that back to the bowler,1,3.2,3.02,3.2,0,0,170,197,5
55354,277955,"shapes away off the deck again, left alone",1,3.3,3.03,3.3,0,0,0,0,0
55354,277955,once again he shoulders arms to one that moves further away from outside off,1,3.4,3.04,3.4,0,0,0,0,0
55354,277955,"indecision nearly cost him there, but he'll still get four off a thick inside edge that could have so easily cannoned into the off stump. Looks to have a go, but decides to withdraw from that outswinger t the last moment, it's too late by then as the ball deflects off the inside edge",1,3.5,3.05,3.5,4,4,243,16,1
55354,277955,leans forward to defend it back down the pitch,1,3.6,3.06,3.6,0,0,146,245,5
55608,537126,"punches a full delivery back to the bowler. Could have perhaps played forward to that one, didn't get timing behind that as it wasn't as short as he expected it to be",1,4.1,4.01,4.1,0,0,209,245,4
55608,537126,"looks to cut, is cramped for room as he chops it to the off side",1,4.2,4.02,4.2,0,0,152,116,8
55608,537126,"good leave, looks to force it through the off side, but then drops his wrists and lets that go",1,4.3,4.03,4.3,0,0,0,0,0
55608,537126,"back of length delivery on off stump, pushed back to the bowler again",1,4.4,4.04,4.4,0,0,173,193,5
55608,537126,"width outside off, but he can't take full toll of that. Once again hit straight to backward point",1,4.5,4.05,4.5,0,0,112,151,7
55608,537126,"thick outside edge, but eludes point. Bumrah, at third man, into the picture. He perhaps expected the ball to swing back in when there was none.",1,4.6,4.06,4.6,1,1,107,49,8
55608,277955,"looks to walk across, Dhawal floats it further away, but ends up bowling it well outside the wide line",1,5.1,5.01,5.1,0,1,0,0,0
55608,277955,"back of length delivery outside off, punched to mid-off",1,5.1,5.02,5.1,0,0,165,203,5
55608,277955,"draws him forward with an away-swinger, but Masakadza is happy to let that go",1,5.2,5.03,5.2,0,0,0,0,0
55608,277955,"poor shot, and Masakadza has thrown it away again by falling into the trap. It was floated full and wide, the invitation was there to drive as there was no cover fielder, but all Masakadza could do was get a thick edge that was pouched quite comfortably by Rahul at slip. He went hard at that, but the head was all over the place as he made contact.",1,5.3,5.04,5.3,0,0,168,110,8
55787,277955,lets the awayswinger outside off into Dhoni's gloves. That was bowled at 128 clicks,1,5.4,5.05,5.4,0,0,0,0,0
55787,277955,"lands it a touch ahead of good length outside off, almost robotic by now, Sibanda shoulders arms",1,5.5,5.06,5.5,0,0,0,0,0
55787,277955,"another outswinger from the fifth stump outside off, left alone",1,5.6,5.07,5.6,0,0,0,0,0
55354,537126,"crunched on the up, but straight to mid-off",1,6.1,6.01,6.1,0,0,136,235,5
55354,537126,"shows the full face of the bat to drive it back to Sran, who stops it on his follow-through",1,6.2,6.02,6.2,0,0,189,197,4
55354,537126,"excellent leave, this one was in the 'should-I-play-forward-or-back' zone outside off",1,6.3,6.03,6.3,0,0,0,0,0
55354,537126,"beaten on the drive. Once again, not much foot work there. Throws his bat at a full delivery slanting across him",1,6.4,6.04,6.4,0,0,0,0,0
55354,537126,"punched between cover and point for a comfortable single, the ball skidded off the deck for the first time today for Sran",1,6.5,6.05,6.5,1,1,112,213,6
55787,537126,"<b> Chahal has made a royal mess of that one at square leg. </b> Chibhabha looks to flick, but ends up closing the bat face early. The top edge lobs towards Chahal, who was back-pedaling from square leg but had to also contend with the sun. In the end, he went with his palms facing upwards, only to see the ball burst through his hands.",1,6.6,6.06,6.6,1,1,290,190,3
55787,277955,gets half-forward and defends,1,7.1,7.01,7.1,0,0,142,190,6
55787,277955,"walks across the stumps to flick that across the line, but is struck on the pad. A big appeal from Dhawal, but umpire Ian Gould indicates the batsman was struck outside off. Fair call there, the batsman was a couple of steps outside the crease",1,7.2,7.02,7.2,0,0,0,0,0
55787,277955,"back of length delivery that shapes away from outside off, left alone",1,7.3,7.03,7.3,0,0,0,0,0
55787,277955,"in the channel where most batsmen are indecisive, Sibanda plants forward and sees it thud into Dhoni's gloves",1,7.4,7.04,7.4,0,0,0,0,0
55787,277955,"drivable length, but the bat comes down at an angle to roll back off the inside edge to Dhawal on his follow-through",1,7.5,7.05,7.5,0,0,190,194,4
55787,277955,"shot of the morning, ah, delicious! This time there's a stamp of authority as the high elbows come down straight to hit that on the up. Bisected cover and mid-off with precision. That should give him immense confidence.",1,7.6,7.06,7.6,4,4,48,293,6
55354,537126,"consecutive boundaries for Zimbabwe, has been as rare as the Haley's comet, in this series. Sran overpitches, and this time he simply forces that past mid-off",1,8.1,8.01,8.1,4,4,126,345,5
55354,537126,"length ball angling away, left alone",1,8.2,8.02,8.2,0,0,0,0,0
55354,537126,hops onto the back foot and turns it to Chahal at midwicket,1,8.3,8.03,8.3,0,0,235,202,3
55354,537126,"pulled across the line, but it wasn't all that short. The ball hurried onto him as well as he played that to mid-on",1,8.4,8.04,8.4,0,0,204,252,4
55354,537126,"goes over the infield at cover, but the ball lobs off the top half of the bat. Spongy bounce from the length area on off stump for Sran. It wasn't quite there for the drive, could have so easily chipped it to the fielder at the edge of the circle",1,8.5,8.05,8.5,2,2,83,290,5
55354,537126,"looks to work it fine, but can only get some pad as the ball deflects to the leg side",1,8.6,8.06,8.6,0,1,235,162,2
55354,277955,"have to say another scoring opportunity missed. Drops it a touch short, there was width too, but Sibanda can only hit it straight to point",1,9.1,9.01,9.1,0,0,120,154,7
55354,277955,"excellent delivery, nips away off the seam from outside off, carries waist-high to Dhoni on that occasion",1,9.2,9.02,9.2,0,0,0,0,0
55354,277955,"left alone again, once again there's some width to work with but the batsman is happy to bide his time by the looks of it",1,9.3,9.03,9.3,0,0,0,0,0
55354,277955,"back of length delivery that jags away off the seam from off stump, left alone",1,9.4,9.04,9.4,0,0,0,0,0
55354,277955,"driven on the up, but straight to extra cover, good work by Rayudu moving to his right to stop that",1,9.5,9.05,9.5,0,0,118,211,6
55354,277955,"cut well, but can't pierce that packed off side field. He got on top of the bounce while playing that, but there's point and a cover point to prevent a boundary there. Fazal stops it",1,9.6,9.06,9.6,0,0,108,169,6
55787,625383,"slants on in from wide of the crease, Sibanda shapes to cut but pulls out. Oversteps in his quest for extra pace, so it will be a <b>free-hit </b>",1,10.1,10.01,10.1,0,1,0,0,0
55787,625383,"gets more elevation than distance as he looks to tee off like a golfer. This one was too full, he swung through the line, but got that off the toe end of the bat, Jadhav runs back from mid-on to pull it back in",1,10.1,10.02,10.1,2,2,227,332,4
55787,625383,"short of length delivery outside off, gets some lift, Sibanda lets that go",1,10.2,10.03,10.2,0,0,0,0,0
55787,625383,"sharp inward movement from outside off, Sibanda leaves once again. Appreciable movement on that occasion",1,10.3,10.04,10.3,0,0,0,0,0
55787,625383,did that take the edge? Umpire says no. The ball cuts through Sibanda who pushes outside the line of the ball. The ball deflects to Dhoni off the flap of the pad,1,10.4,10.05,10.4,0,0,0,0,0
55787,625383,"another short of length delivery that nips back in from the fifth stump, he is happy to watch it through to the wicketkeeper",1,10.5,10.06,10.5,0,0,0,0,0
55787,625383,"shapes to cut, but is too early into the stroke. Beaten. There was the width he was looking for, so you have to say Bumrah is lucky to get away with that",1,10.6,10.07,10.6,0,0,0,0,0
55354,277955,"full outside off, some away movement again, left alone",1,11.1,11.01,11.1,0,0,0,0,0
55354,277955,"risky single at the non-striker's end, Sibanda had to dive full length forward to get back into the crease, Fazal with the throw, but it perhaps slipped out of his hand, good backing up though to prevent the overthrow",1,11.2,11.02,11.2,2,2,114,180,6
55354,277955,"bowls it a touch ahead of good length outside off, left alone again",1,11.3,11.03,11.3,0,0,130,206,6
55354,277955,"shapes to cut but is beaten by some appreciable away movement again, Dhoni is on his knees as he collects it. Signs of inconsistent bounce?",1,11.4,11.04,11.4,0,0,0,0,0
55354,277955,"too full to attempt a cut, is beaten by the zip off the surface. This time it thuds into Dhoni's gloves",1,11.5,11.05,11.5,0,0,0,0,0
55354,277955,"chops the attempted cut down to third man, once again got that off the bottom of the bat",1,11.6,11.06,11.6,1,1,106,51,8
55354,625383,"has Chibhabha hopping on the crease with a short ball that skids back into middle, the ball deflects off the flap of the pad to Dhoni",1,12.1,12.01,12.1,0,0,0,0,0
55354,625383,"length ball well outside off on the sixth stump, the width was there for Chibhabha to go over the top but he's happy to let that go",1,12.2,12.02,12.2,0,0,0,0,0
55354,625383,"this one bounces awkwardly for Chibhabha who looks to force it off the back foot, wasn't far away from the edge. The ball was angled in but held its line to create the doubt in the batsman's mind",1,12.3,12.03,12.3,0,0,0,0,0
55354,625383,"much better from Chibhabha, gets across a touch to defend that back down the pitch with a straight bat",1,12.4,12.04,12.4,0,0,149,199,5
55354,625383,"the ball holds its line again after pitching outside off, Chibhabha gets a thick edge down to third man",1,12.5,12.05,12.5,1,1,130,30,8
55787,625383,"angling into middle and leg from wide of the crease, plays it gently behind square on the leg side to retain strike",1,12.6,12.06,12.6,1,1,292,97,2
55787,554691,"drifts into middle and leg, it's a touch short as well, pulled to deep midwicket",1,13.1,13.01,13.1,1,1,320,205,3
55354,554691,"looks to whip that away, but gets far too across as the ball skids back in to hit him on the thigh pad",1,13.2,13.02,13.2,0,0,0,0,0
55354,554691,"gets forward to pat it gently to the off side, grip and turn on that occasion",1,13.3,13.03,13.3,0,0,134,181,6
55354,554691,worked with the angle to short fine leg,1,13.4,13.04,13.4,1,1,235,137,2
55787,554691,eased with the spin to Rayudu at backward point,1,13.5,13.05,13.5,0,0,145,117,8
55787,554691,"slider on middle, punched back to the bowler",1,13.6,13.06,13.6,0,0,163,197,5
55354,625383,"poor from Bumrah again, he's struggling. This one is angled down middle and leg, the ball slides down further as Dhoni moves to his left to stop that",1,14.1,14.01,14.1,0,1,0,0,0
55354,625383,"cuts, but straight to Axar at point. Didn't have the width he would have liked",1,14.1,14.02,14.1,0,0,127,144,7
55354,625383,stays inside the crease as he stabs the length ball on off stump to point,1,14.2,14.03,14.2,0,0,120,158,7
55354,625383,"straying down leg, batsman falls over as he looks to tickle it fine, Dhoni can't stop it cleanly despite a dive",1,14.3,14.04,14.3,0,1,228,80,1
55787,625383,"drivable length again, but misses out on a scoring opportunity. Juicy half-volley, hit straight to mid-off. Came down late on the drive",1,14.4,14.05,14.4,0,0,148,259,5
55787,625383,"inward movement from outside off, watched through to the keeper",1,14.5,14.06,14.5,0,0,0,0,0
55787,625383,"cuts and misses. Tried to hit that too hard, was beaten for pace as well",1,14.6,14.07,14.6,0,0,0,0,0
55354,554691,"loops it nicely on middle, hint of turn away, defended back down the pitch",1,15.1,15.01,15.1,0,0,170,198,5
55354,554691,"gives it flight, lands it on off, Chibhabha lofts it with the spin over the infield, Chahal does well at sweeper cover",1,15.2,15.02,15.2,2,2,50,251,6
55354,554691,"drifting into middle and leg, nudged to square leg",1,15.3,15.03,15.3,0,0,230,203,3
55354,554691,"quicker ball on middle, a touch shorter in length, punched back to the bowler",1,15.4,15.04,15.4,0,0,197,206,4
55354,554691,"sees the batsman giving him charge and slows it down further, dabbed back to the bowler",1,15.5,15.05,15.5,0,0,163,189,5
55354,554691,"skids one on off stump, pushed to cover.",1,15.6,15.06,15.6,0,0,123,198,6
55787,625383,"once again looks to work it across the line, only for him to miss the one that skids back in to hit him on the thigh pad, they take a leg-bye off the deflection to slip",1,16.1,16.01,16.1,1,1,159,119,8
55354,625383,hops across to bunt that down to mid-on as they scamper through for a single,1,16.2,16.02,16.2,1,1,208,245,4
55787,625383,gets half-forward as he steers to backward point,1,16.3,16.03,16.3,0,0,119,140,7
55787,625383,"back of length delivery outside off, width there to cut, but he lets it go instead",1,16.4,16.04,16.4,0,0,0,0,0
55787,625383,gets half-forward to dab it gently to point,1,16.5,16.05,16.5,0,0,126,143,7
55787,625383,"slants one into his hip, tucked to Pandey at square leg",1,16.6,16.06,16.6,1,1,288,105,2
55787,554691,"in-drifter on middle from round the stumps, he gets forward to smother the spin",1,17.1,17.01,17.1,0,0,167,188,5
55787,554691,eased wide of cover for a quick single,1,17.2,17.02,17.2,1,1,133,190,6
55354,554691,"steps out to flick, but misses a full ball that was fired in, appeal from Axar but he was too far down the pitch for the umpire to think about it seriously",1,17.3,17.03,17.3,0,0,0,0,0
55354,554691,gets forward and then makes the late adjustment to account for the spin and defend,1,17.4,17.04,17.4,0,0,132,204,6
55354,554691,makes some room and works it wide of cover for an easy single,1,17.5,17.05,17.5,1,1,62,203,6
55787,554691,"slow turn from off stump, eased to backward point",1,17.6,17.06,17.6,0,0,136,136,7
55354,430246,"lovely flight as he lands it on middle, a touch too full as Sibanda squeezes it back to the bowler",1,18.1,18.01,18.1,0,0,169,198,5
55354,430246,"width on offer, and he slaps it straight to cover",1,18.2,18.02,18.2,0,0,129,202,6
55354,430246,"driven with the spin to short cover, pressure building",1,18.3,18.03,18.3,0,0,150,229,5
55354,430246,"slows it down a touch, the batsman has to lunge forward to defend, angled with soft hands towards point for a quick single, Sibanda had to slide back into the crease",1,18.4,18.04,18.4,1,1,124,153,7
55787,430246,squared up a touch as he negotiates that one late,1,18.5,18.05,18.5,0,0,130,134,7
55787,430246,"swept across the line, had to fetch it from outside off, straight to Sran at deep square leg",1,18.6,18.06,18.6,1,1,333,198,3
55787,554691,"flighted ball on middle stump, driven with the angle to long-on",1,19.1,19.01,19.1,1,1,225,318,4
55354,554691,"slow turn from middle again, pushed with the spin to cover,  he had to check his shot there",1,19.2,19.02,19.2,0,0,124,191,6
55354,554691,"gets a thick inside edge as he looks to ease it past cover, long-off comes into play",1,19.3,19.03,19.3,1,1,131,320,5
55787,554691,"the in-drifter on middle and leg, nudged to the on side",1,19.4,19.04,19.4,0,0,196,190,4
55787,554691,lunges forward to smother the spin,1,19.5,19.05,19.5,0,0,199,194,4
55787,554691,"quicker one on off, plays back to a delivery he could have well prodded forward, somehow gets some bat on it to keep it away",1,19.6,19.06,19.6,0,0,138,127,7
55354,430246,"first signs of intent, and he's holded out to Bumrah who takes a good catch at the ropes at long-off. It was beautifully tossed up, the ball swerved away a touch as well as Sibanda got to the pitch, but didn't generate enough power on the stroke as he looked to loft it over the ropes. He was also hitting it towards the bigger straight boundary, where Bumrah, mindful of the ropes behind him, moved a couple of steps backwards to pouch that. The pressure was building, and Chibhabha has fallen into the trap.",1,20.1,20.01,20.1,0,0,129,338,5
55787,430246,stretches his left pad out to keep that away,1,20.2,20.02,20.2,0,0,0,0,0
55787,430246,driven with the spin to cover,1,20.3,20.03,20.3,0,0,134,203,6
55787,430246,"tossed up on off stump, eased to sweeper cover",1,20.4,20.04,20.4,1,1,41,229,6
235524,430246,"excellent delivery, this one's quicker through the air on middle, he gets the bat in front of the pad to defend",1,20.5,20.05,20.5,0,0,158,195,5
235524,430246,,1,20.6,20.06,20.6,0,0,144,128,8
55787,554691,"fired into middle, defended back down the pitch",1,21.1,21.01,21.1,0,0,139,192,6
55787,554691,gets forward and blocks,1,21.2,21.02,21.2,0,0,186,194,4
55787,554691,"slow turn from middle, he pats it with soft hands",1,21.3,21.03,21.3,0,0,142,197,6
55787,554691,"drifts into middle and leg, tucked to square leg",1,21.4,21.04,21.4,0,0,208,113,1
55787,554691,"beaten by the fizz. The ball pitches on off and holds its line, Maruma played inside the line",1,21.5,21.05,21.5,0,0,0,0,0
55787,554691,gets half-forward and bunts it to the off side,1,21.6,21.06,21.6,0,0,135,124,7
235524,430246,"teases him by gently tossing it up outside off, reaches out to defend",1,22.1,22.01,22.1,0,0,134,206,6
235524,430246,fetches the sweep from outside off towards deep square,1,22.2,22.02,22.2,1,1,336,177,3
55787,430246,"sloppy effort at short third man gives away a couple of runs. Faiz Fazal, the man in question. Dived over the ball there",1,22.3,22.03,22.3,3,3,144,26,8
235524,430246,gets a thick edge onto the pad as he looks to drive,1,22.4,22.04,22.4,0,0,136,202,6
235524,430246,that's a jaffa! This one rips away square from the rough on off stump. The drift created the doubt as well,1,22.5,22.05,22.5,0,0,0,0,0
235524,430246,"sharp turn from middle, he prods forward tentatively, only to see the ball turn square and beat the edge",1,22.6,22.06,22.6,0,0,0,0,0
55787,554691,"in-drifter on middle stump, driven with the spin to cover",1,23.1,23.01,23.1,0,0,131,215,5
55787,554691,"pushed back to the bowler, it was the quicker one this time",1,23.2,23.02,23.2,0,0,155,207,5
55787,554691,"skids one onto middle from wide of the crease, bunted back to the bowler",1,23.3,23.03,23.3,0,0,148,174,6
55787,554691,works it across the line to midwicket,1,23.4,23.04,23.4,0,0,229,215,4
55787,554691,"<b> did that take the edge? </b> Oh, yes. Definitely. He indicated to Axar that he was lucky to get away with the previous one, and has put down a tough chance when he got it right. This ball drifted in to land on middle and then turn away to take the edge. There was some grip as well as the ball took the edge but Dhoni got up a little more than he would have normally, which meant he was slightly on the move as the ball thudded into his gloves.",1,23.5,23.05,23.5,1,1,161,58,8
235524,554691,driven back past the bowler to long-off,1,23.6,23.06,23.6,1,1,142,330,5
235524,430246,get half-forward to defend,1,24.1,24.01,24.1,0,0,128,130,7
235524,430246,swept across the line to deep backward square leg,1,24.2,24.02,24.2,1,1,332,137,2
55787,430246,leans forward and eases it with the spin to long-off,1,24.3,24.03,24.3,1,1,126,319,5
235524,430246,"excellent sweep, bisects deep square and deep midwicket. This one was nicely tossed up outside off, he got down on one knee and went through with the stroke. There was intent there, and he hit it hard",1,24.4,24.04,24.4,4,4,340,253,3
235524,430246,deceived by the googly that pitches on off and rips back into hit him high on the pad,1,24.5,24.05,24.5,0,0,0,0,0
235524,430246,"throws it up in the air, but he landed it well outside off, once again Maruma looked to fetch the sweep from outside off but was into the sweep way too early",1,24.6,24.06,24.6,0,0,0,0,0
55787,537126,"wow, where did that come from? Loose delivery first up from Sran. He banged it in short, Sibanda rocked back and pulled that into the deep square leg boundary. There was a man there, but he picked the bones out of that one to ensure he was a mere spectator. At no stage did he intend to keep that down, so there was definitely some intent there",1,25.1,25.01,25.1,6,6,355,216,3
55787,537126,whips a length ball to mid-on,1,25.2,25.02,25.2,0,0,218,242,4
55787,537126,"what are you doing? Steps out to play a cross-court forehand over mid-off, beaten by the extra bounce. Wonder if there's a message to go after the bowling here",1,25.3,25.03,25.3,0,0,0,0,0
55787,537126,gets forward to bunt it towards the man coming in from cover,1,25.4,25.04,25.4,0,0,125,139,7
55787,537126,"too full and he's hammered that over the infield, didn't quite get it off the middle even though there was room for him to go through with the lofted hit. Mid-off runs back to stop that",1,25.5,25.05,25.5,2,2,127,330,5
55787,537126,"clever cricket, drops it into the off side towards point, his partner responds to the early call and they complete the run without much fuss",1,25.6,25.06,25.6,1,1,132,156,7
55787,430246,"lovely, lovely drive. Leans forward, gets into a wonderful position to ease that drive with the spin towards deep extra cover",1,26.1,26.01,26.1,2,2,37,251,6
55787,430246,"drifts one into middle, a touch fuller as well, squeezed back to the bowler",1,26.2,26.02,26.2,0,0,182,198,4
55787,430246,stretches forward to play it with the spin to point,1,26.3,26.03,26.3,0,0,107,171,6
55787,430246,"reaches out to drive, toe-ends it to the cover fielder",1,26.4,26.04,26.4,0,0,127,211,6
55787,430246,"pushed through quicker, wonder if he tried to bowl the flipper there, he shapes to cut but withdraws and dabs it instead",1,26.5,26.05,26.5,0,0,144,113,8
55787,430246,gets forward and drives it to mid-off,1,26.6,26.06,26.6,0,0,139,222,5
235524,537126,"floats it full on middle and leg, defended to midwicket",1,27.1,27.01,27.1,0,0,247,185,3
235524,537126,"slices it down to third man, didn't quite generate the power as he reached out to loft that half-volley over cover",1,27.2,27.02,27.2,1,1,113,46,8
