batid,bowlid,comm,inns,oa,ou,ovr,r,rt,x,y,z
422108,55346,"tossed up on middle, Rahul makes some room and eases it to cover",2,11.6,11.06,11.6,0,0,139,204,6
28671,55652,"bowls that from close to the stumps, floated at length on middle, Fazal dabs it back down the pitch gently",2,12.1,12.01,12.1,0,0,164,197,5
28671,55652,"solid front foot defense again, he has all the time in the world to get these runs and is in no hurry whatsoever",2,12.2,12.02,12.2,0,0,197,198,4
28671,55652,"looks to walk across to flick, misses the ball as it deflects off the pad to square leg",2,12.3,12.03,12.3,0,1,127,94,8
422108,55652,full-blooded straight drive that has raced past the bowler even before he had completed a couple of steps on his follow-through,2,12.4,12.04,12.4,4,4,165,353,5
422108,55652,"follows that up with a magnificent cover drive. This wasn't a half-volley, but there was width for him to press forward and slap it between cover and mid-off, which he did to perfection",2,12.5,12.05,12.5,4,4,21,242,6
422108,55652,"make that three in a row. That is the best of the lot! There was an extra fielder who had been brought into the ring on the off side, but it doesn't matter. Mupariwa drops it short again, Rahul who pressed forward waited for the bounce before flaying that between cover and point",2,12.6,12.06,12.6,4,4,17,224,6
28671,55346,"sweeps and misses, but the ball pitched well outside leg",2,13.1,13.01,13.1,0,0,0,0,0
28671,55346,gets to the pitch of the ball as he works it with the spin to long-on,2,13.2,13.02,13.2,1,1,135,329,5
422108,55346,"full toss on the pads, worked into the gap at deep midwicket",2,13.3,13.03,13.3,2,2,313,246,3
422108,55346,"opens up the off side field by clearing his front leg and then driving that inside-out into the gap between deep cover and long-off, he's timing them beautifully here",2,13.4,13.04,13.4,2,2,64,291,5
422108,55346,"leading edge past cover point, enough dip to force a false shot",2,13.5,13.05,13.5,1,1,47,196,6
28671,55346,"this time the wrong'un, which he doesn't pick straightaway, pushed awkwardly to the off side",2,13.6,13.06,13.6,0,0,236,150,2
422108,55652,eased wide of cover for a quick single,2,14.1,14.01,14.1,1,1,105,178,6
28671,55652,"works it wide of square leg, the boundary rider had to come in a long way, enough for Fazal to get back for the second. Also the fact that he was a couple of yards outside the crease helped him complete the first run quickly",2,14.2,14.02,14.2,2,2,92,80,7
28671,55652,uses the pace to open the bat face and glide it down to third man,2,14.3,14.03,14.3,1,1,262,62,1
422108,55652,gets forward to pat that to the off side,2,14.4,14.04,14.4,0,0,146,234,5
422108,55652,"Chibhabha dives to his right to effect a one-handed stop at extra cover, it was crunched by Rahul and would have certainly been four had Chibhabha missed that",2,14.5,14.05,14.5,0,0,129,216,5
422108,55652,"gully was in business for a split-second, but it was a very tough chance. Rahul doesn't quite have the room he would have liked as he looks to slap that past point, the edge flies down to third man",2,14.6,14.06,14.6,1,1,96,39,8
422108,55346,"shot of a man in form. Steps out, gets to the pitch of the ball and hits it straight as a dye, into the sightscreen. Went through with a straight bat and at no stage intended to hit it along the ground",2,15.1,15.01,15.1,6,6,160,358,5
422108,55346,worked wide of midwicket for an easy single,2,15.2,15.02,15.2,1,1,279,283,4
28671,55346,"misses out on a scoring opportunity, was sitting up nicely for him to cut it behind square, but hit it straight to point",2,15.3,15.03,15.3,0,0,257,183,3
28671,55346,eased past the bowler to long-off,2,15.4,15.04,15.4,1,1,220,325,4
422108,55346,"flatter one on off stump, breaks away a touch, Rahul stays inside the crease as he punches it back down the pitch",2,15.5,15.05,15.5,0,0,176,198,5
422108,55346,"beautifully bowled. Rahul is deceived in flight as he steps out to go down town, ends up slicing it over point. The man in the deep reacted a second or two late, but he didn't have much of a chance even if he did get off the blocks early as it falls in no man's land. Unnecessary from Rahul. There was a fielder running backwards as well, but no one called clearly",2,15.6,15.06,15.6,1,1,59,117,7
422108,55652,opens the face of the bat and runs it down to square third man,2,16.1,16.01,16.1,2,2,50,104,7
422108,55652,"firm push to mid-off, calls no immediately though",2,16.2,16.02,16.2,0,0,149,238,5
422108,55652,"overbalanced as he shapes to flick, in the end makes a late adjustment by pushing it off the frontfoot to cover",2,16.3,16.03,16.3,0,0,128,213,6
422108,55652,"dabbed gently to short cover for a quick single, Fazal responds immediately for a run that wasn't entirely risk-free",2,16.4,16.04,16.4,1,1,137,184,6
28671,55652,"timing and placement, impeccable as the straight bat comes down to caress the length ball on the up, bisected mid-on and mid-off. Delightful to say the least",2,16.5,16.05,16.5,4,4,196,355,4
28671,55652,"was through with the pull even before the ball got to him, lobs off the back blade to the off side",2,16.6,16.06,16.6,0,0,228,157,2
422108,55346,"drifts into middle, Rahul's drive finds a thick inside edge to short midwicket",2,17.1,17.01,17.1,0,0,233,194,3
422108,55346,leans forward and wrists it wide of midwicket,2,17.2,17.02,17.2,1,1,305,210,3
28671,55346,"half-tracker on middle and leg, pulled with the spin to deep backward square leg",2,17.3,17.03,17.3,1,1,34,131,7
422108,55346,"worked wide of mid-on, Cremer runs across quickly to keep that down to a single",2,17.4,17.04,17.4,1,1,280,292,4
28671,55346,"rolls off the pad as he looks to play a fine paddle sweep with the spin, this was fired in full but pitched outside leg",2,17.5,17.05,17.5,0,0,170,149,8
28671,55346,"first six of his international career is superbly timed straight hit. Sees the flight, dances down the track, gets to the pitch and simply swings through the line to get the elevation. Top shot!",2,17.6,17.06,17.6,6,6,132,354,5
422108,55652,"eased wide of cover to get to a maiden ODI half-century, applause from his mates in the dressing room. This has been a measured knock",2,18.1,18.01,18.1,1,1,127,173,6
28671,55652,"play and a miss, the ball thuds into Mutumbami's thigh on the bounce, ouch, painful blow",2,18.2,18.02,18.2,0,1,0,0,0
422108,55652,"mistimes a cut to cover. It was short, but didn't have the width for him to play it wide of point",2,18.3,18.03,18.3,0,0,130,231,5
422108,55652,works it with the angle to the man running in from short midwicket for a quick single,2,18.4,18.04,18.4,1,1,237,222,3
28671,55652,"wow, that is a scorcher late in the afternoon, sure to have lit up a few houses around Nagpur and elsewhere in Vidarbha and India. Length ball outside off, he leans forward and cracks that on the up between cover and mid-off. Stamp of authority written all over the stroke. Mid-off thought he was in with a chance, but gave up very soon",2,18.5,18.05,18.5,4,4,301,311,4
28671,55652,"takes on the short ball this time, ah, the thing confidence can do to a batsman. The ball got big on him or so it looked like, but Fazal ensured he adjusted to the bounce and ensured there were no half-measures as he went through with the hook, fine leg could have done better to get to the ball there",2,18.6,18.06,18.6,4,4,127,13,8
422108,55354,"back of length delivery outside off, punched to deep point",2,19.1,19.01,19.1,1,1,39,210,6
28671,55354,presses forward to defend that full delivery tailing away from off stump,2,19.2,19.02,19.2,0,0,227,195,3
28671,55354,"floats a full delivery across Fazal, who gets forward to pat it towards cover",2,19.3,19.03,19.3,0,0,244,158,2
28671,55354,eased to mid-off for a quick single,2,19.4,19.04,19.4,1,1,204,252,4
422108,55354,rolls his wrists over the ball to play it to midwicket,2,19.5,19.05,19.5,0,0,232,200,3
422108,55354,"angles one full on middle from wide of the crease, defended to the on side",2,19.6,19.06,19.6,0,0,222,192,3
28671,392945,controls the pull well to help it down to fine leg to bring up a <b> maiden ODI fifty. </b> Controlled knock studded with some elegant strokes,2,20.1,20.01,20.1,1,1,88,63,8
422108,392945,picks the length early and pulls it down to deep fine leg,2,20.2,20.02,20.2,1,1,318,119,2
28671,392945,uses the angle to run it down to third man to amble across for a single,2,20.3,20.03,20.3,1,1,294,77,2
422108,392945,"back of length delivery on off stump, gets some lift off the deck to hit the top half of Rahul's bat as he plays it to mid-off",2,20.4,20.04,20.4,0,0,150,244,5
422108,392945,"sensibly done, gentle dab to the off side for a quick single",2,20.5,20.05,20.5,1,1,128,181,6
28671,392945,"full and angling away from off stump, he gets forward and blocks",2,20.6,20.06,20.6,0,0,232,179,3
422108,55354,"length ball angling away, runs it down to third man, who was caught napping",2,21.1,21.01,21.1,2,2,236,28,1
422108,55354,"confusion, confusion. Rahul wanted the run, but is sent back as he dabs it to point. Rahul had to dive full length, even as Madziva swooped in from cover to fire an under-arm throw",2,21.2,21.02,21.2,0,0,130,181,6
422108,55354,"he's picked the bones out of that one. That's massive! Length ball on middle, Rahul was winding up like he'd decided yesterday that he will hit this one out of the park, and swung through cleanly as the ball lands in the stands at long-on",2,21.3,21.03,21.3,6,6,288,329,4
422108,55354,works it wide of square leg for an easy single,2,21.4,21.04,21.4,1,1,303,221,3
28671,55354,"<b> game, set and match! </b> Brings up the winning runs with an imperious pull in front of square as Fazal wraps up a memorable debut. Too short and angling away, Fazal rocks back and then fetches the pull from outside off. Also does well to roll his wrists over that to keep it down. Smiles all around.",2,21.5,21.05,21.5,4,4,25,253,6
