batid,bowlid,comm,inns,oa,ou,ovr,r,rt,x,y,z
5334,481896,"139 kph, has Finch in a spot of bother as he pings a shortish delivery down on off stump. Squares him up as the batsman uses an open face to run down to point",2,5.5,5.05,5.5,0,0,121,156,7
5334,481896,"good length on off stump, Finch defends to mid-off and Shami walks back with a far better over under his belt. Had his pace up, had his radar right, just needs to reproduce it over and over and over",2,5.6,5.06,5.6,0,0,143,203,5
219889,326016,firmly behind a back of a length delivery on off stump,2,6.1,6.01,6.1,0,0,245,196,3
219889,326016,opens the face against a shortish ball and slices it to deep point,2,6.2,6.02,6.2,1,1,282,209,3
5334,326016,stands up tall and punches to the left of mid-off. Lovely straight bat coming down on the back of a length delivery,2,6.3,6.03,6.3,1,1,114,222,6
219889,326016,"oof, did the ball clip off stump?! Or did it take the bottom of the bat? Definitely hit the bottom of the bat and it veers back towards the stumps, but misses it by a whisker!",2,6.4,6.04,6.4,0,0,164,110,8
219889,326016,"Rohit has a direct hit, but Warner is well home after a push towards mid-off. Decent throw off that angle, but despite being on the back foot Warner was immensely quick off the blocks",2,6.5,6.05,6.5,1,1,215,203,4
5334,326016,gets back and across and tucks the shortish delivery away towards midwicket,2,6.6,6.06,6.6,1,1,250,188,3
5334,481896,width offered and Finch accepts the present as he flays the fuller ball over mid-off. Powerful stroke,2,7.1,7.01,7.1,4,4,32,281,6
5334,481896,decides to go along the ground this time as he drives a good length ball into the covers,2,7.2,7.02,7.2,0,0,119,197,6
5334,481896,"seems to be right in line of the stumps, but he is able to flick the good length ball off his legs to deep midwicket",2,7.3,7.03,7.3,1,1,277,178,3
219889,481896,"despairing dive from Kohli at deep square leg, but Warner's pull has too much heat on it. Shami errs by bowling short and a bit too straight",2,7.4,7.04,7.4,4,4,14,135,7
219889,481896,"stands and delivers a whip, which mid-on does well to stop, diving away to his right",2,7.5,7.05,7.5,0,0,160,248,5
219889,481896,"goes full on the pads this time and Warner works it to deep midwicket and takes on Virat Kohli's throw. Big dive, easily home",2,7.6,7.06,7.6,2,2,37,224,6
5334,326016,"fuller delivery on middle and leg, Finch defends towards mid-on",2,8.1,8.01,8.1,0,0,230,197,3
5334,326016,keeps to the crease and pushes a good length ball into the covers,2,8.2,8.02,8.2,0,0,122,195,6
5334,326016,"gets the bottom of the bat again! We should really get on a name for that ball from Bhuvi. Finch was stepping forward to block, but the ball wanders behind him to slip",2,8.3,8.03,8.3,0,0,153,116,8
5334,326016,"great work from short point, Suresh Raina moves to his right and stops a cracking cut shot. The deflection though is potential for a single and Warner capitalises",2,8.4,8.04,8.4,1,1,154,176,6
219889,326016,"shortish, but not quite wide enough. Warner slaps it to cover",2,8.5,8.05,8.5,0,0,244,199,3
219889,326016,picked away off his hips to long leg. Has the leg-side short-ball bug caught Bhuvi too?,2,8.6,8.06,8.6,1,1,79,85,7
219889,376116,"skies it! Raina calls for it immediately and yells in delight after completing a soft dismissal. It was short of a good length, but Warner's front foot press works against him. Then he decided to play a sort of a pull shot when there wasn't much room. Ends up spooning a simple catch at extra cover, which was well taken.",2,9.1,9.01,9.1,0,0,217,199,3
5334,376116,"full and slipping down leg, Finch helps it away to long leg",2,9.2,9.02,9.2,1,1,256,58,1
8180,376116,"starts well against the new man, probing just a shade outside off with that in-between length. But to Watson and his famous front-foot press, that doesn't matter. Leaves it",2,9.3,9.03,9.3,0,0,0,0,0
8180,376116,gets forward and blocks a back of a length delivery to cover,2,9.4,9.04,9.4,0,0,139,183,6
8180,376116,"offcutter from Umesh and there is a call of ""catch it"" from the Indian fielders, but the flick has bisected midwicket and mid-on",2,9.5,9.05,9.5,4,4,341,253,3
8180,376116,"pushes him back with a short ball on off stump, defended",2,9.6,9.06,9.6,0,0,207,186,3
5334,326016,"good length ball on fifth stump, Finch is caught in the crease as he pushes to mid-off",2,10.1,10.01,10.1,0,0,145,185,6
5334,326016,gets forward to the fuller ball outside off and taps to cover,2,10.2,10.02,10.2,0,0,115,184,6
5334,326016,solid stride forward to defend a fuller delivery to cover,2,10.3,10.03,10.3,0,0,131,189,6
5334,326016,"loosens the grip on his bat, runs a back of a length delivery to third man and secures a single",2,10.4,10.04,10.4,1,1,113,50,8
8180,326016,"just short of a good length on middle, Watson picks short midwicket with a flick",2,10.5,10.05,10.5,0,0,231,201,3
8180,326016,"reaches forward to drive a fuller ball outside off on the up, mistimes it to mid-off. Good control of length from Bhuvi",2,10.6,10.06,10.6,0,0,143,233,5
5334,376116,"shortish delivery on off stump, Finch blocks",2,11.1,11.01,11.1,0,0,171,181,5
5334,376116,"offcutter just a bit outside off, defended into the covers",2,11.2,11.02,11.2,0,0,138,193,6
5334,376116,"back of a length on fifth stump, Finch brings down a straight bat",2,11.3,11.03,11.3,0,0,179,188,5
5334,376116,forces a good length ball to cover point. India are stringing together a good stretch of dots now,2,11.4,11.04,11.4,0,0,128,185,6
5334,376116,"beaten off a beautiful delivery, and the pressure that's been built. Attempts something extravagant off a back of a length delivery outside off as he steps forward ti drive on the up",2,11.5,11.05,11.5,0,0,0,0,0
5334,376116,"141kph, gets the ball to straighten and beat Finch all ends up! Finishes with a maiden as India concede only eight runs in the last four overs, and the wicket of Warner",2,11.6,11.06,11.6,0,0,0,0,0
8180,554691,drags the length short and Watson camps back in his crease and cuts behind point. Not the best start from yet another Indian bowler,2,12.1,12.01,12.1,4,4,32,82,7
8180,554691,that's quicker and it skids into Watson way too quick for the pull. Mistimes into the leg side,2,12.2,12.02,12.2,0,0,215,191,3
8180,554691,"tossed up on middle and leg, tucked to short midwicket",2,12.3,12.03,12.3,0,0,239,202,3
8180,554691,a bit short again and Watson has sliced it to the sweeper,2,12.4,12.04,12.4,1,1,38,198,6
5334,554691,"fuller delivery on middle and leg, Finch drives back at the bowler",2,12.5,12.05,12.5,0,0,178,197,5
5334,554691,"fired in on middle, Finch keeps it out",2,12.6,12.06,12.6,0,0,183,192,4
8180,376116,wafts outside off and is beaten by a back of a length delivery outside off. Good channels from Umesh,2,13.1,13.01,13.1,0,0,0,0,0
8180,376116,"full, but it has width. The search for swing backfires on Umesh as Watson drives on the up and lifts it over extra cover",2,13.2,13.02,13.2,4,4,53,308,5
8180,376116,"a bit of extra bounce for Umesh as he hits back of a length and outside off, Watson dabs it to third man",2,13.3,13.03,13.3,1,1,81,95,7
5334,376116,"shortish on middle and leg, the batsman hops up off his feet to find mid-on",2,13.4,13.04,13.4,1,1,225,212,4
8180,376116,"short and wide, Watson slaps it high over point and wide of third man. Well placed, easy boundary",2,13.5,13.05,13.5,4,4,23,101,7
8180,376116,corrects his line and length and keeps Watson to a dot as he seeks the top of off stump,2,13.6,13.06,13.6,0,0,167,193,5
5334,554691,nudged to the left of short midiwcket as Akshar does what he does - cramp the batsman for room with his darts,2,14.1,14.01,14.1,0,0,221,191,3
5334,554691,"huge appeal from Akshar as Finch attempts something different. Gets a decent stride forward to sweep a fuller ball on off stump. Just a hint of turn, and perhaps the umpire thinks it would miss the target. Kohli is gutted, even comes up to ask the ump for a clarification. The impact might have been outside off",2,14.2,14.02,14.2,0,0,0,0,0
5334,554691,"pressure release as the ball is a bit short and Shami is not the best man at point, can't get across to his left fast enough",2,14.3,14.03,14.3,4,4,13,139,7
5334,554691,tapped away towards short midwicket,2,14.4,14.04,14.4,1,1,284,96,2
8180,554691,"tossed up on off stump, driven to mid-off",2,14.5,14.05,14.5,0,0,150,225,5
8180,554691,pushed to mid-off to end the over,2,14.6,14.06,14.6,1,1,138,297,5
8180,376116,"141kph, short and wide, but his zip and extra bounce saves him from a Watson cut",2,15.1,15.01,15.1,0,0,0,0,0
8180,376116,"back of a length on off stump, defended into the covers where Kohli is very alert",2,15.2,15.02,15.2,0,0,135,190,6
8180,376116,not this time. Watson gets his second chance at a short and wide delight and he beats point comfortably,2,15.3,15.03,15.3,4,4,5,156,7
8180,376116,"back of a length on middle, Watson clips it to long leg and secures an easy two",2,15.4,15.04,15.4,2,2,301,109,2
8180,376116,"fuller delivery on off stump, tapped to the right of mid-on",2,15.5,15.05,15.5,1,1,234,191,3
5334,376116,stands up tall behind the back of a length delivery and punches it down to mid-off,2,15.6,15.06,15.6,0,0,160,189,5
8180,554691,driven to long-off as he stays inside the line of a tossed up delivery outside off,2,16.1,16.01,16.1,1,1,125,318,5
5334,554691,moves back and slices a flatter delivery off the stumps to deep point,2,16.2,16.02,16.2,1,1,58,223,6
8180,554691,"fast and full on off stump and Watson, having gone back, defends just in time",2,16.3,16.03,16.3,0,0,143,178,6
8180,554691,gets down the track to drive the fuller delivery to long-on,2,16.4,16.04,16.4,1,1,252,293,4
5334,554691,"fired in on leg stump, too quick for Finch and his straight drive",2,16.5,16.05,16.5,0,0,0,0,0
5334,554691,"rapped on the pads again, but his angle into the batsman might be working against him on this shout. Across-the-line whip from Finch but he survives to have a drink and clear his mind",2,16.6,16.06,16.6,0,0,0,0,0
8180,26421,starts a bit too straight and he is picked away to long leg.,2,17.1,17.01,17.1,2,2,291,67,2
8180,26421,good length ball on off stump brings Watson forward to block,2,17.2,17.02,17.2,0,0,181,193,4
8180,26421,"good length ball on middle, picked away to square leg",2,17.3,17.03,17.3,1,1,275,159,2
5334,26421,moves around the wicket to Finch and he defends the length ball on off stump,2,17.4,17.04,17.4,0,0,120,196,6
5334,26421,picks up the length ball this time and wallops it to deep square leg with a slog sweep,2,17.5,17.05,17.5,1,1,320,94,2
8180,26421,fluent movement towards the pitch of the ball and Watson unleashes impressive power to slam the good length ball into the sightscreen. Pressure on Ashwin straight away,2,17.6,17.06,17.6,6,6,216,359,4
5334,554691,"back of a length on off stump, Finch gets up tall and punches to cover",2,18.1,18.01,18.1,0,0,112,198,6
5334,554691,oof! skids off the deck and beats Finch's cut shot. Quite close to off stump as well,2,18.2,18.02,18.2,0,0,0,0,0
5334,554691,pushed back at the bowler with a straight bat,2,18.3,18.03,18.3,0,0,183,198,4
5334,554691,"tries to make his own room by moving leg side of the ball, but can't pierce the cover field",2,18.4,18.04,18.4,0,0,92,201,6
5334,554691,this time Akshar provides a hint of width and it's been sliced through cover,2,18.5,18.05,18.5,1,1,47,218,6
8180,554691,backs away and punches the flatter delivery outside off through cover. That's Australia's hundred,2,18.6,18.06,18.6,1,1,61,230,6
8180,26421,"good length ball on off stump, Watson defends carefully",2,19.1,19.01,19.1,0,0,176,195,5
8180,26421,"a bit slower through the air and Watson has to check his flick. Mild leading edge, but it falls short of Ashwin's right",2,19.2,19.02,19.2,0,0,217,207,4
8180,26421,"turned away through square leg as Ashwin bowls his usual, quickish pace on leg stump",2,19.3,19.03,19.3,1,1,255,102,2
5334,26421,"a touch more bounce on leg stump and Finch works the ball, one-handed, to short fine leg",2,19.4,19.04,19.4,0,0,232,120,2
5334,26421,gets down the track and works the good length ball on leg stump to deep square leg,2,19.5,19.05,19.5,1,1,301,110,2
8180,26421,back over the wicket to Watson who pushes a shortish delivery outside off towards cover,2,19.6,19.06,19.6,0,0,117,208,6
5334,554691,"full on middle, Finch drives at mid-off",2,20.1,20.01,20.1,0,0,141,195,6
5334,554691,stays beside the ball and crunches the fuller delivery to long-off,2,20.2,20.02,20.2,2,2,63,240,6
5334,554691,pushed to long-off from the back foot,2,20.3,20.03,20.3,0,0,140,278,5
5334,554691,"stays back to defend a flatter, quicker delivery on middle and leg",2,20.4,20.04,20.4,0,0,215,213,4
5334,554691,"shortish and outside off, Finch cuts to the sweeper",2,20.5,20.05,20.5,1,1,64,119,7
8180,554691,too full to cut and Watson is beaten outside off,2,20.6,20.06,20.6,0,0,0,0,0
5334,26421,cramps him up on leg stump and Finch's flick to a good length ball finds short midwicket,2,21.1,21.01,21.1,0,0,257,198,3
5334,26421,worked to short fine leg and Dhawan fumbles to allow an easy single,2,21.2,21.02,21.2,1,1,243,201,3
8180,26421,"flighted on off stump, eased to midwicket",2,21.3,21.03,21.3,0,0,266,237,3
8180,26421,stays back against a good length ball and flicks it to deep midwicket,2,21.4,21.04,21.4,1,1,262,206,3
5334,26421,jumps outside leg to loosen Ashwin's strangle and succeeds as he slaps the short ball through the covers.,2,21.5,21.05,21.5,4,4,33,256,6
5334,26421,"down the track, but Ashwin limits his flight and keeps it to a single through a square-leg clip",2,21.6,21.06,21.6,1,1,299,229,3
5334,554691,driven solidly to long-off. Dhoni's kept a mid-off as well.,2,22.1,22.01,22.1,1,1,45,252,6
8180,554691,opens the face and slices a good length ball from off stump into the covers,2,22.2,22.02,22.2,1,1,82,132,7
5334,554691,drilled to long-on as Akshar flights in on middle and leg,2,22.3,22.03,22.3,1,1,236,333,4
8180,554691,"slugs across the line and yells at himself as his off stump is knocked back. The Dhoni mantra works, reduce the runs, limit the boundaries and lure the mistake. Good, tight bowling from the left-arm darter",2,22.4,22.04,22.4,0,0,0,0,0
267192,554691,"good length ball on off stump, defended",2,22.5,22.05,22.5,0,0,188,204,4
267192,554691,"down the track with a whip to mid-on. No single there, SPD",2,22.6,22.06,22.6,0,0,215,251,4
5334,26421,nudged through midwicket for a single,2,23.1,23.01,23.1,1,1,312,163,2
267192,26421,"slows it up on off stump, Smith reaches forward to defend",2,23.2,23.02,23.2,0,0,238,203,3
267192,26421,movevs back and across to clip a good length ball to square leg,2,23.3,23.03,23.3,0,0,249,203,3
267192,26421,opens the face against a good length ball that goes on with the arm. Adjusts late there,2,23.4,23.04,23.4,0,0,113,204,6
267192,26421,"clipped off the pads and Smith wants to get off the mark. Might be a risky run here, and the umps are calling for a second look. Excellent work from Dhoni who deflects the incoming throw onto the stumps. Sort of like a late cut played just with his hands and no bat",2,23.5,23.05,23.5,1,1,227,119,2
5334,26421,clipped away to deep midwicket,2,23.6,23.06,23.6,1,1,329,186,3
5334,481896,"fuller delivery outside off brings out the Finch cover drive. Handsome stroke, and he does appear far more solid against pace",2,24.1,24.01,24.1,1,1,56,225,6
267192,481896,uses the width on offer and sends the length ball wandering away to third man,2,24.2,24.02,24.2,1,1,67,76,7
5334,481896,"fuller delivery on off stump, defended",2,24.3,24.03,24.3,0,0,136,247,5
5334,481896,"slower ball on middle and off, Finch whips it away through midwicket and picks up a couple that takes him to fifty",2,24.4,24.04,24.4,2,2,312,206,3
5334,481896,"good length ball on off stump, defended",2,24.5,24.05,24.5,0,0,153,197,5
5334,481896,right up there on off stump and Finch's bat skews in his hands as he drives wider of mid-on than he intended,2,24.6,24.06,24.6,2,2,296,217,3
267192,26421,down the track to clip a flatter delivery on leg stump to deep midwicket,2,25.1,25.01,25.1,1,1,303,80,2
5334,26421,stays on the back foot and clips a shortish delivery to deep square leg,2,25.2,25.02,25.2,1,1,295,108,2
267192,26421,"sees a hint of width outside off, but mistimes the flat-batted thump into the covers",2,25.3,25.03,25.3,0,0,109,152,7
267192,26421,works away a good length ball towards midwicket,2,25.4,25.04,25.4,0,0,238,211,3
267192,26421,"short and outside leg stump, Smith deftly nudges it to deep midwicket",2,25.5,25.05,25.5,1,1,334,207,3
5334,26421,reaches forward to a good length ball and taps it back at the bowler,2,25.6,25.06,25.6,0,0,179,194,5
267192,481896,"sweetly struck! It wasn't such a bad ball, but Smith is in such good form that he stands and magic wands it back down the pitch. Sublime straight drive",2,26.1,26.01,26.1,4,4,206,359,4
267192,481896,"good length a shade outside off, defended",2,26.2,26.02,26.2,0,0,199,260,4
267192,481896,"143kph, searing yorker on middle and off, Smith is able to dig it out",2,26.3,26.03,26.3,0,0,205,197,4
267192,481896,"fullish on off stump, Smith though is just as happy blocking off the back foot",2,26.4,26.04,26.4,0,0,181,205,4
267192,481896,strays on middle and leg and Smith's whirling wrists sends the ball packing to long leg,2,26.5,26.05,26.5,2,2,323,115,2
267192,481896,"banged in, but Smith is quite good at dealing with those. Swivels on the back foot and pulls it to long leg as well",2,26.6,26.06,26.6,1,1,298,68,2
267192,26421,goes back and tucks it to short midwicket. Good work from the man diving to his right,2,27.1,27.01,27.1,0,0,266,195,3
267192,26421,waits a touch more and nudges the good length ball through to deep square leg,2,27.2,27.02,27.2,1,1,313,98,2
5334,26421,back and across to work the flat delivery off leg stump to deep square leg and they trot through for a couple. This around-the-wicket ploy is no longer working to contain,2,27.3,27.03,27.3,2,2,316,187,3
5334,26421,tapped in front of square leg for a single,2,27.4,27.04,27.4,1,1,329,189,3
267192,26421,"beats him in flight, or lack of it, as Smith steps forward to flick a good length delivery through midwicket. Sneaks between bat and pad and to third man for a single",2,27.5,27.05,27.5,0,1,0,0,0
5334,26421,pushed into the covers,2,27.6,27.06,27.6,0,0,112,205,6
267192,326016,"shortish on off stump, Smith tucks it in front of square leg",2,28.1,28.01,28.1,1,1,248,192,3
5334,326016,"gets forward to a back of a length delivery on off stump, tapped into the covers",2,28.2,28.02,28.2,0,0,111,191,6
5334,326016,slips down leg and Finch allows it to skirt past him and to the keeper,2,28.3,28.03,28.3,0,1,0,0,0
5334,326016,"punched to long-off, after Rain lets a straight forward pick-up elude him. Didn't bend down enough. Rare that, a Raina misfield",2,28.3,28.04,28.3,1,1,155,282,5
267192,326016,gets across on off stump and picks a fuller delivery on middle to long leg,2,28.4,28.05,28.4,1,1,315,92,2
5334,326016,solid drive to long-off against a back of a length delivery outside off,2,28.5,28.06,28.5,1,1,119,302,5
267192,326016,easily done as he judges the line of a shortish delivery to be outside off and runs it to deep third man,2,28.6,28.07,28.6,1,1,0,0,0
267192,26421,down the track to push a flatter delivery straight of midiwcket,2,29.1,29.01,29.1,0,0,251,205,3
267192,26421,"he bowls fast and flat, Smith does very little as he gives the ball some direction off the open face, beats short third man and tucks into clever boundary",2,29.2,29.02,29.2,4,4,105,25,8
267192,26421,goes back and taps a length delivery to long-on,2,29.3,29.03,29.3,1,1,274,295,4
5334,26421,pushed to long-off,2,29.4,29.04,29.4,1,1,101,300,5
267192,26421,"cut away, and it didn't have all that much room. Just quick feet to get him back and excellent control with his hands to beat point",2,29.5,29.05,29.5,4,4,4,140,7
267192,26421,"full on middle, pushed back at the bowler",2,29.6,29.06,29.6,0,0,179,212,5
5334,326016,"was there an edge? Dhoni had come up to the stumps and has to negotiate a bit of extra bounce. Finch didnt' do well against it, and Dhoni can't do much better either. Very difficult chance",2,30.1,30.01,30.1,2,2,0,0,0
5334,326016,,2,30.2,30.02,30.2,0,0,177,204,5
5334,326016,worked away to midwicket,2,30.3,30.03,30.3,1,1,309,181,3
267192,326016,opens the face on a short and wide delivery and secures a single to third man,2,30.4,30.04,30.4,1,1,97,64,8
5334,326016,back of a length and Finch does better against this one as he softens his grip and rides the bounce to point,2,30.5,30.05,30.5,0,0,230,229,4
5334,326016,takes a length ball on off stump and dabs it to deep third man,2,30.6,30.06,30.6,1,1,115,32,8
5334,33335,"surprise, surprise, a slider down leg. Finch can't connect with the sweep, but will take the wide",2,31.1,31.01,31.1,0,1,0,0,0
5334,33335,"fuller delivery on off stump brings Finch forward with a slap over the long-on boundary. Got it more near the bottom of the bat, but he's got enough power, does Finch",2,31.1,31.02,31.1,6,6,265,354,4
5334,33335,backs away and slaps a flatter delivery to cover,2,31.2,31.03,31.2,0,0,111,206,6
5334,33335,"good length ball on off stump, cramps Finch up even if he had tried to make his own room",2,31.3,31.04,31.3,0,0,173,207,5
5334,33335,turned away through midwicket for a couple. The huge MCG outfield is finding India's fielders out,2,31.4,31.05,31.4,2,2,342,216,3
5334,33335,nudged through square leg,2,31.5,31.06,31.5,1,1,298,126,2
267192,33335,"good length ball on off stump, drilled to short midwicket",2,31.6,31.07,31.6,0,0,244,223,3
5334,376116,starts well here as he bowls a good length outside off and keeps Finch to a defensive push,2,32.1,32.01,32.1,0,0,139,185,6
5334,376116,"shortish on middle, Finch tickles it behind square leg and races across for a couple of runs before Akshar at long leg can come up to the ball",2,32.2,32.02,32.2,2,2,273,85,2
5334,376116,"back of a length on off stump, Finch uses soft hands to tap the ball into the covers and grab a quick, well-judged single",2,32.3,32.03,32.3,1,1,138,203,6
267192,376116,"a touch slower and a shade outside off, defended",2,32.4,32.04,32.4,0,0,161,185,5
267192,376116,"full and sliding down, Smith gets inside the line and glances it to the long leg boundary. Effortless",2,32.5,32.05,32.5,4,4,286,42,1
267192,376116,gets back and across to a shortish delivery on off stump and blocks,2,32.6,32.06,32.6,0,0,123,199,6
5334,33335,"good length ball a bit outside off, Finch can only defend",2,33.1,33.01,33.1,0,0,130,187,6
5334,33335,down the leg side and it misses Finch's shovel sweep. Wide though,2,33.2,33.02,33.2,0,1,0,0,0
5334,33335,"slog swept to the straight boundary! Again, it's not off the middle but it carries well over the boundary. Well, if the front line spinners didn't trouble Australia on this flat deck, what hope does Raina have",2,33.2,33.03,33.2,6,6,0,0,0
5334,33335,goes back to a good length ball and clips it through the leg side,2,33.3,33.04,33.3,1,1,222,317,4
267192,33335,gets up tall and punches a good length ball to long-off,2,33.4,33.05,33.4,1,1,80,290,5
5334,33335,,2,33.5,33.06,33.5,1,1,89,315,5
267192,33335,"beautiful shot! Take a bow, Smith. But he won't he has a job to do. And only a little bit of it might involve manufacturing a boundary like that with the required rate only at 5. Makes room and slices a flat delivery from a shade outside off stump to the point boundary",2,33.6,33.07,33.6,4,4,0,0,0
5334,376116,opens the face to a good length ball and finds a single to deep third man,2,34.1,34.01,34.1,1,1,104,64,8
267192,376116,"back of a length outside off, defended",2,34.2,34.02,34.2,0,0,113,227,6
267192,376116,stays back against a fuller delivery outside off and lets it run off the open face to deep third man,2,34.3,34.03,34.3,2,2,123,21,8
267192,376116,invites third man into the game with a glide as this too is short and wide outside off,2,34.4,34.04,34.4,1,1,104,59,8
5334,376116,"back of a length on off stump, defended",2,34.5,34.05,34.5,0,0,181,197,4
5334,376116,"full and slanted down leg, Finch isn't able to cash in. Gets an inside edge to long leg",2,34.6,34.06,34.6,1,1,237,46,1
5334,481896,"a bit short and wide outside off, Finch is forward and lobs it over point",2,35.1,35.01,35.1,2,2,56,95,7
5334,481896,"fuller delivery on off stump, Finch is onto it a bit too quickly and gets an outside edge into the covers",2,35.2,35.02,35.2,0,0,176,198,5
5334,481896,"leaps off his feet to negotiate a short ball on off stump, keeps it down towards square leg for a single",2,35.3,35.03,35.3,1,1,237,117,2
267192,481896,pushes an open face in line with a wide yorker and gets a single to third man,2,35.4,35.04,35.4,1,1,92,62,8
5334,481896,"back of a length on off stump, slid to point",2,35.5,35.05,35.5,0,0,122,163,7
5334,481896,"lovely timing on his flick and he is disappointed at finding short midwicket. Loud call of ""Argh"" is heard on the stump mic. Drinks, it appears",2,35.6,35.06,35.6,0,0,254,200,3
267192,554691,"good length on off stump, punched to long-off",2,36.1,36.01,36.1,1,1,64,261,6
5334,554691,"slid into the pads and Finch wears it, having been too slow on the flick",2,36.2,36.02,36.2,0,0,238,195,3
5334,554691,tucked to the right of midwicket as Akshar darts in on middle and leg,2,36.3,36.03,36.3,1,1,283,201,3
267192,554691,"pushed to long-on as the flat, length ball reaches him on leg stump",2,36.4,36.04,36.4,1,1,244,332,4
5334,554691,"slips down leg, as he fears Finch running at him. Dhoni does well to take it",2,36.5,36.05,36.5,0,1,0,0,0
5334,554691,worked away to short fine leg for a single,2,36.5,36.06,36.5,1,1,0,0,0
267192,554691,"flighted on off stump, driven smartly to long-on",2,36.6,36.07,36.6,1,1,112,323,5
