batid,bowlid,comm,inns,oa,ou,ovr,r,rt,x,y,z
267192,481896,"wants the yorker, but gets the low full toss and has to prevent a Smith straight drive from getting past him",2,37.1,37.01,37.1,0,0,167,205,5
267192,481896,"a shade short and outside off, Smith rides it to point. The required rate is under five now...",2,37.2,37.02,37.2,0,0,120,136,7
267192,481896,opens the face to beat point comfortably this time as Shami bowls short and wide. That's his 1000th ODI run,2,37.3,37.03,37.3,1,1,81,62,8
5334,481896,"slower ball, picked up by Finch as he drives to mid-off and sets off for a quick single. Makes it despite the throw",2,37.4,37.04,37.4,1,1,148,262,5
267192,481896,"full and outside off, stroked to mid-off",2,37.5,37.05,37.5,0,0,164,260,5
267192,481896,"shortish on middle and off, nudged to short midwicket",2,37.6,37.06,37.6,0,0,262,228,3
5334,554691,"fired in on middle and leg, driven to long-on",2,38.1,38.01,38.1,1,1,240,345,4
267192,554691,"only the smallest bit of room, but Smith has planted his front leg down, opened the face and drills the ball through point",2,38.2,38.02,38.2,4,4,0,141,7
267192,554691,pushed past mid-off,2,38.3,38.03,38.3,1,1,150,319,5
5334,554691,"a touch slower on off stump, defended",2,38.4,38.04,38.4,0,0,169,195,5
5334,554691,"whipped past short midwicket and he takes on the mid-on, who is right on the edge of the circle. India are doing nothing to stop Australia here.",2,38.5,38.05,38.5,1,1,274,276,4
267192,554691,down the track and whipped to short midwicket,2,38.6,38.06,38.6,0,0,238,208,3
5334,481896,"banged in short and Finch goes for a pull after pushing his balance back, too high for him",2,39.1,39.01,39.1,0,0,0,0,0
5334,481896,"seeks the blockhole on and around off stump, jammed into the covers",2,39.2,39.02,39.2,1,1,122,196,6
267192,481896,"offcutter at the base of off stump, Smith nails a straight drive and the stumps and forces Finch to jump back into the crease",2,39.3,39.03,39.3,0,0,182,198,4
267192,481896,"oops, he's swatted a slower bouncer right at short midwicket! Played with total control for the length of his innings but Shami did well to get enough height behind that ball to foil Smith's timing",2,39.4,39.04,39.4,0,0,269,193,3
325026,481896,rides the short ball down to deep third man,2,39.5,39.05,39.5,1,1,104,46,8
5334,481896,gets back to a shortish delivery on off stump and tucks it through midwicket,2,39.6,39.06,39.6,1,1,271,187,3
5334,376116,jogs in and bowls the customary slip down the leg side,2,40.1,40.01,40.1,0,1,0,0,0
5334,376116,nicks to the keeper! Finch misses out on a hundred on his home ground. Looks to force a short ball that seems to gain a bit more bounce than he expected. Feather through the keeper gives India a bit of a boost,2,40.1,40.02,40.1,0,0,0,0,0
4451,376116,"139kph, back of a length on middle, sends Bailey back into his crease and keeps it to a single to long leg. Skidder from Umesh",2,40.2,40.03,40.2,1,1,221,135,2
325026,376116,"what happened there?! Maxi had pulled his eyes off the ball, plonked his bat up like a periscope and it leaps off the face, wide of slip and gives him a single",2,40.3,40.04,40.3,1,1,119,86,8
4451,376116,short ball again and Bailey pulls to long leg,2,40.4,40.05,40.4,1,1,309,111,2
325026,376116,"fullish delivery on off stump, defended off the back foot",2,40.5,40.06,40.5,0,0,139,167,6
325026,376116,"banged in short, but it wanders a bit too far down leg",2,40.6,40.07,40.6,0,1,0,0,0
325026,376116,"fuller delivery on off stump, defended",2,40.6,40.08,40.6,0,0,139,185,6
4451,26421,"flighted on middle, driven to long-on",2,41.1,41.01,41.1,1,1,214,324,4
325026,26421,"shortish on middle and leg, Maxwell clips to deep square leg",2,41.2,41.02,41.2,1,1,309,105,2
4451,26421,"flighted outside off, Bailey defends to mid-off",2,41.3,41.03,41.3,0,0,132,205,6
4451,26421,down the track to the pitch of the flighted delivery outside off and whips it to long-on. Almost close to Ashwin's outstretched right hand,2,41.4,41.04,41.4,1,1,234,325,4
325026,26421,"good length ball on middle, defended",2,41.5,41.05,41.5,0,0,242,206,3
325026,26421,"dusts out the reverse sweep, but finds point",2,41.6,41.06,41.6,0,0,120,158,7
4451,376116,back of a good length outside off keeps Bailey honest,2,42.1,42.01,42.1,0,0,155,188,6
4451,376116,defends a shortish delivery on off stump,2,42.2,42.02,42.2,0,0,164,217,5
4451,376116,that's the 10th wide of the innings. Slipping down leg as Bailey fails to connect with the leg glance,2,42.3,42.03,42.3,0,1,0,0,0
4451,376116,"back of a length on middle, defended",2,42.3,42.04,42.3,0,0,183,200,4
4451,376116,"fuller delivery outside off, Bailey was into the drive too early and forgot to move his feet too. Inside edge wide of mid-on",2,42.4,42.05,42.4,1,1,254,211,3
325026,376116,"banged in outside off, Maxi ramps it up over the slip. Third man is fine enough to cut it short of the boundary",2,42.5,42.06,42.5,1,1,139,17,8
4451,376116,"back of a length on off stump, defended. Only three runs off that over then",2,42.6,42.07,42.6,0,0,162,197,5
325026,26421,"flighted on leg stump, Maxi attempts to make room but has to stay content with a push to long-on",2,43.1,43.01,43.1,1,1,250,295,4
4451,26421,"has he done it? Yes! Beautiful stumping! Good length ball sliding down leg, Bailey attempts a flick and overbalances and that fraction of a second is enough for Dhoni to jump across and flick the bails. Oh, and HotSpot says there was a nick in there too so it is actually a catch",2,43.2,43.02,43.2,0,0,0,0,0
5560,26421,"flighted on leg stump, pushed to long-on",2,43.3,43.03,43.3,1,1,243,316,4
325026,26421,goes back to a good length ball on leg stump and strikes Maxi on the pads as he plays a flick,2,43.4,43.04,43.4,0,0,203,188,3
325026,26421,down the track and pummels a length ball over the straight boundary. Clean ball-striking,2,43.5,43.05,43.5,6,6,236,362,4
325026,26421,"goes for the encore, but he has to settle for a four this time. Jumps down the track and clatters another good length ball into the sightscreen and away goes the advantage India whisked out of nothing",2,43.6,43.06,43.6,4,4,198,357,4
5560,376116,"back of a length and outside off, gets a bottom edge behind the wicket",2,44.1,44.01,44.1,0,0,131,166,6
5560,376116,"fuller delivery on middle and leg, pushed to long-on",2,44.2,44.02,44.2,1,1,206,251,4
325026,376116,"fuller delivery outside off, pushed into the covers",2,44.3,44.03,44.3,0,0,150,209,5
325026,376116,top-class yorker from Umesh as this one reverses back in at Maxi! Only barely managed to protect middle stump and nearly topples off his feet,2,44.4,44.04,44.4,0,0,165,181,5
325026,376116,"back of a length and zips in at Maxi off the deck, forces him to pull his bottom hand off as he nudges it into the leg side",2,44.5,44.05,44.5,0,0,198,190,4
325026,376116,"full and spearing in on leg stump, clipped to short midwicket",2,44.6,44.06,44.6,0,0,231,212,3
5560,554691,"pitched up on off stump, driven back at the bowler",2,45.1,45.01,45.1,0,0,179,198,5
5560,554691,chopped through the covers as he drags his length short and gives some room,2,45.2,45.02,45.2,1,1,32,261,6
325026,554691,"fuller delivery on middle, eased into the covers and the Indian contingent at MCG roars",2,45.3,45.03,45.3,0,0,146,203,5
325026,554691,"spears in on leg stump and it's a full toss, Maxi works it to deep midwicket",2,45.4,45.04,45.4,2,2,318,195,3
325026,554691,"lifts him over extra cover, and it just about lobs Rohit who was chasing after it. Maxi moved leg side to make more of a good length ball than it merited",2,45.5,45.05,45.5,2,2,71,255,6
325026,554691,"uses his wrists to try and flick a flatter delivery to long-on, Akshar throws himself to his right and parries it to midwicket",2,45.6,45.06,45.6,1,1,177,204,5
325026,481896,preempted that! Lovely change up from Shami as he slides a slower ball wide outside off to beat Maxi's desire to run down the track while making room for himself,2,46.1,46.01,46.1,0,0,0,0,0
325026,326016,"back of a length and outside off, not enough room for Maxi to exploit with the punch through point",2,46.2,46.02,46.2,0,0,0,0,0
325026,326016,"slower ball! Taken! Maxi has been sent back by a legcutter. He had been rushing down the track, has to adjust. Attempts a flick and gets it quite high on the bat to lob a simple catch back at the bowler.",2,46.3,46.03,46.3,0,0,179,193,5
270484,326016,"back of a length and outside off, tapped to point",2,46.4,46.04,46.4,0,0,127,147,7
270484,326016,"good length ball on off stump, defended and India's fans are buzzing at the ground. Chanting, roaring, clapping",2,46.5,46.05,46.5,0,0,129,211,6
270484,326016,"good length ball on off stump, eased to point and that's a wicket maiden! Phew, can I borrow someone's nails? Mine are done",2,46.6,46.06,46.6,0,0,127,139,7
5560,554691,"back of a length on off stump, Haddin pushes it back to the right of the bowler and Akshar darts across",2,47.1,47.01,47.1,0,0,183,198,4
5560,554691,"dired in on middle, Haddin moves outside off and drills it through the covers. That region doesn't have the best cover and Rohit pulls in a big dive to flick the ball back. Very well done",2,47.2,47.02,47.2,3,3,31,242,6
270484,554691,"full and fired in on leg stump, Faulkner is struck on the pads and weathers a huge lbw appeal. Would be sliding down leg",2,47.3,47.03,47.3,0,1,145,145,7
5560,554691,"good length ball on middle and leg, pushed to extra cover",2,47.4,47.04,47.4,1,1,143,269,5
270484,554691,"shake of the head as Dhoni and Akshar and a few thousand India fans appeal in unison. Good length ball meets the sweep, beats it and struck under the knee roll. But perhaps it did not straighten from the angle enough. Umpire's call on clipping leg stump",2,47.5,47.05,47.5,0,0,0,0,0
270484,554691,"stays back and chops a flat, length ball into the covers",2,47.6,47.06,47.6,0,0,113,206,6
5560,326016,"terrific bowling, but they nab a single into the leg side. Cramps Haddin up with a fuller ball on middle, which was blocked",2,48.1,48.01,48.1,1,1,194,197,4
270484,326016,"clattered to the long leg boundary. That's a sweep to a length ball from a medium pacer, and he took the ball right on top of the bounce too. Didn't hurt his timing one bit",2,48.2,48.02,48.2,4,4,310,65,2
270484,326016,"down the track and slices a full toss into the covers, Faulkner runs with the shot and leaves Haddin in the lurch. Dhawan takes aim and misses the stumps, with Haddin nowhere in the frame",2,48.3,48.03,48.3,1,1,92,205,6
5560,326016,"slower, short and slid down the leg side, Haddin misses with the pull and gets a wide",2,48.4,48.04,48.4,0,1,0,0,0
5560,326016,"almost a yorker on middle, yet Haddin clears that front leg and creams it through extra cover. One of the shots of the day, especially in such tense circumstances!",2,48.4,48.05,48.4,4,4,34,294,6
5560,326016,gets a hand to the front-foot belt against a length ball and long-on tidies up,2,48.5,48.06,48.5,1,1,245,327,4
270484,326016,"full toss down leg, the Faulkner sweep dusts the game off! He does it time and time again, walks in with a few balls left and a tight game in the balance and swerves it Australia's way",2,48.6,48.07,48.6,4,4,247,22,1
