batid,bowlid,comm,inns,oa,ou,ovr,r,rt,x,y,z
33335,499660,banged in short and Raina was swift to get outside the line and pull to the fine leg boundary,1,27.6,27.06,27.6,4,4,75,53,8
34102,325026,"flighted on off stump, Rohit lunges forward to block",1,28.1,28.01,28.1,0,0,119,194,6
34102,325026,"gets back to a flatter delivery and threads it through the covers. Can't take on a fast bowler's arm, It was Cummins",1,28.2,28.02,28.2,3,3,9,196,6
33335,325026,"lurches down the track, but can't quite reach the pitch. Slugs it away wide of mid-on for a single",1,28.3,28.03,28.3,2,2,57,258,6
33335,325026,"another attempt at reaching the pitch, but Maxwell's controlled his flight quite well again. Made Raina reach outside off and secures an outside edge. But it travels to the third man boundary",1,28.4,28.04,28.4,4,4,326,62,2
33335,325026,shimmies down and pushes at a length ball to mid-off,1,28.5,28.05,28.5,0,0,227,215,4
33335,325026,goes back to a flatter delivery and turns it to midwicket,1,28.6,28.06,28.6,0,0,134,196,6
34102,499660,"back of a length on off stump, Rohit looks for a flick and inside edges onto pad",1,29.1,29.01,29.1,0,0,154,176,6
34102,499660,pushed down the ground to long-on,1,29.2,29.02,29.2,1,1,251,337,4
33335,499660,gets across on off stump to defend a back of a length delivery,1,29.3,29.03,29.3,0,0,251,201,3
33335,499660,good shot from Raina again as he picks the gap at fine leg. Strays in line does Sandhu with his shortish delivery and it's been pulled with lovely control,1,29.4,29.04,29.4,4,4,116,17,8
33335,499660,runs down the track while trying to make room for himself. Sandhu cramps him for room with an offcutter. Pushed towards the covers. No single there and Raina has to employ a full-length dive to save himself from Maxi's direct hit,1,29.5,29.05,29.5,0,0,247,198,3
33335,499660,"another slower ball on middle and off, defended",1,29.6,29.06,29.6,0,0,214,202,4
34102,270484,slid off the open face as Faulkner bowls short and works the angle across the right-hander,1,30.1,30.01,30.1,1,1,88,62,8
33335,270484,"good length ball on middle and off, Raina taps it towards mid-on and sets off. Maxwell does not allow the single and sends Raina scampering back again",1,30.2,30.02,30.2,0,0,221,195,3
33335,270484,turned into the leg side as he gets back and across to a good length ball outside off,1,30.3,30.03,30.3,0,0,214,200,4
33335,270484,"lands a leg-stump slower ball to which Raina attempts a sweep. But since the ball slides down, the umpire has called wide",1,30.4,30.04,30.4,0,1,0,0,0
33335,270484,back of the hand slower ball goes awry as it ends up a beamer outside off and Raina leaps up off his feet to lash it to deep third man,1,30.4,30.05,30.4,1,2,266,72,1
34102,270484,"back of a length on off stump, defended",1,30.4,30.06,30.4,0,0,127,191,6
34102,270484,"fullish on middle and leg, kept out",1,30.5,30.07,30.5,0,0,187,191,4
34102,270484,gets inside the line and pulls a shortish delivery to deep square leg. Rohit wants two and gets it off a weakish throw from Sandhu. Looks like it's drinks,1,30.6,30.08,30.6,2,2,283,93,2
33335,499660,"back of a length on off stump, Raina decides to stay inside the line this time and blocks",1,31.1,31.01,31.1,0,0,163,194,5
33335,499660,strays on the pads and it's been clipped to long leg quite easily,1,31.2,31.02,31.2,1,1,92,59,8
34102,499660,"full on off stump, Rohit pushes past the bowler before he could get down to it",1,31.3,31.03,31.3,1,1,148,263,5
33335,499660,"slower ball, but its on leg stump. Clipped through midwicket",1,31.4,31.04,31.4,1,1,84,61,8
34102,499660,"offcutter a bit outside off, defended with an open face",1,31.5,31.05,31.5,0,0,145,163,7
34102,499660,"banged in and Rohit's been very good on the pull today. Besides, Sandhu forgot to wave his magic wand and get this ball to bounce high enough.",1,31.6,31.06,31.6,4,4,325,86,2
33335,270484,goes back to block a shortish delivery and picks a single into the covers,1,32.1,32.01,32.1,1,1,235,189,3
34102,270484,"shortish on leg stump, tucked away off the hips to long leg",1,32.2,32.02,32.2,1,1,238,125,2
33335,270484,nails the back of the hand slower ball as he beats the flashing Raina blade outside off,1,32.3,32.03,32.3,0,0,0,0,0
33335,270484,"this time the batsman spots the variation, waits for it and runs the shortish delivery down to deep third man",1,32.4,32.04,32.4,1,1,269,51,1
34102,270484,a bit of bounce on the back-of-the-hand slower ball. Rohit attempts a flick and ends up with an inside edge that floats over the leg stump. Into the nineties,1,32.5,32.05,32.5,4,4,284,29,1
34102,270484,boundary to third man this time and Rohit controls it far better. Sees the room attached to the slower ball and dabs an open face on it,1,32.6,32.06,32.6,4,4,123,7,8
33335,8180,"good length ball on off stump, defended stoutly",1,33.1,33.01,33.1,0,0,174,195,5
33335,8180,change of pace slides down leg with Raina moving across to off stump. Wide called,1,33.2,33.02,33.2,0,1,0,0,0
33335,8180,opens the face and runs the ball to point,1,33.2,33.03,33.2,0,0,236,158,2
33335,8180,gets across and clips to deep square leg,1,33.3,33.04,33.3,1,1,90,215,6
34102,8180,waits on a shortish delivery on the fourth stump and runs it towards short third man. No single there,1,33.4,33.05,33.4,0,0,136,136,7
34102,8180,"flicks a good length ball on middle, no single there either with short midwicket racing in. Throw comes in at the non-strikers' and it was wide enough that Raina doesn't even bother grounding his bat",1,33.5,33.06,33.5,0,0,219,194,3
34102,8180,,1,33.6,33.07,33.6,1,1,114,174,6
34102,311592,"shortish on leg stump, nudged towards fine leg",1,34.1,34.01,34.1,1,1,229,107,1
33335,311592,"full and outside off, Raina clips it through midwicket to secure a fifty. A much-needed one in terms of where India were when he came in",1,34.2,34.02,34.2,1,1,47,186,6
34102,311592,"fuller delivery outside off, slid off the front foot to deep third man",1,34.3,34.03,34.3,1,1,65,100,7
33335,311592,"full and outside off, Raina plants the open face down on it to get a single behind point",1,34.4,34.04,34.4,1,1,279,50,1
34102,311592,rides the bounce on this short delivery outside off to beat a diving point,1,34.5,34.05,34.5,1,1,97,61,8
33335,311592,he's thrown it away! It was a fuller delivery outside off and Raina got on the front foot and hacked it straight at mid-on. And you know what happens when Australia get an opening...,1,34.6,34.06,34.6,0,0,156,259,5
34102,489889,"shortish on off stump, Rohit dabs towards point",1,35.1,35.01,35.1,0,0,0,0,0
34102,489889,"angled into the pads off a fuller length and Rohit clips to long leg. Moves to 99, one more run to become the second Indian to make a century at the MCG",1,35.2,35.02,35.2,1,1,310,140,2
28081,489889,"attempts a yorker first up, but can't quite land it. Dhoni protects his off stump",1,35.3,35.03,35.3,0,0,177,192,5
28081,489889,"good length ball, with a hint of shape back in at Dhoni. Defended",1,35.4,35.04,35.4,0,0,185,197,4
28081,489889,that's a missile! Target set on the point boundary the minute Cummins bowled short and wide. India's commander yells fire one!,1,35.5,35.05,35.5,4,4,13,137,7
28081,489889,"fuller delivery on off stump, defended towards the covers",1,35.6,35.06,35.6,0,0,149,186,6
34102,311592,"fuller delivery, angled across him. Outside edge to secure the run he wants to cross over to a hundred! The first by an Indian at the MCG since Jan 2000, and only the second in history. Raises his bat to the crowd and gets a pat on the back from his captain. He's weathered the new ball, got over his strike rate issues and has controlled the innings quite well",1,36.1,36.01,36.1,1,1,145,34,8
28081,311592,"back of a length and outside off, not bothered with",1,36.2,36.02,36.2,0,0,0,0,0
28081,311592,"a bit fuller as Starc tests Dhoni outside off, happy to leave this alone as well",1,36.3,36.03,36.3,0,0,0,0,0
28081,311592,"good length ball outside off, Dhoni gets across and lifts his bat over his head",1,36.4,36.04,36.4,0,0,0,0,0
28081,311592,"good length ball outside off, Dhoni lets Haddin worry about it",1,36.5,36.05,36.5,0,0,0,0,0
28081,311592,"full and wide, Dhoni slashes to deep third man with an open face",1,36.6,36.06,36.6,1,1,98,44,8
28081,489889,"good pace and better direction on this good length ball on middle, tucked to mid-on",1,37.1,37.01,37.1,0,0,221,199,3
28081,489889,rises up with a shortish ball outside off and slaps it to point,1,37.2,37.02,37.2,0,0,131,144,7
28081,489889,"offcutter on off stump, Dhoni is back with a punch to mid-off",1,37.3,37.03,37.3,0,0,134,214,5
28081,489889,"shortish on off stump, Dhoni jumps back and across and flicks through to midwicket",1,37.4,37.04,37.4,1,1,300,112,2
34102,489889,gets up on his toes to turn a shortish delivery on off stump towards square leg,1,37.5,37.05,37.5,1,1,227,176,3
28081,489889,punches a shortish delivery into the covers and races across to the other end,1,37.6,37.06,37.6,1,1,110,194,6
28081,270484,"punishes Faulkner for straying in line with the slower ball. Clipped off the thigh pad to the fine leg boundary, off the gloves though",1,38.1,38.01,38.1,4,4,245,20,1
28081,270484,"back to normal pace with the fuller ball on off stump, defended",1,38.2,38.02,38.2,0,0,131,210,6
28081,270484,"full on off stump, drilled to mid-off",1,38.3,38.03,38.3,0,0,168,260,5
28081,270484,"fuller delivery on off stump, Dhoni gets behind it",1,38.4,38.04,38.4,0,0,108,226,6
28081,270484,"good length ball on off stump, defended",1,38.5,38.05,38.5,0,0,119,215,6
28081,270484,"fuller delivery on off stump, pushed to mid-off",1,38.6,38.06,38.6,0,0,116,200,6
34102,489889,goes back in his crease to turn the shortish delivery at 140 kph to deep backward square leg,1,39.1,39.01,39.1,1,1,284,82,2
28081,489889,"goes for a clip off a good length ball on off stump, says wait as midwicket attempts to stop it, then jogs away after it passes him",1,39.2,39.02,39.2,1,1,244,200,3
34102,489889,"142kph, gets up on his toes against a short delivery on off stump, run down to point",1,39.3,39.03,39.3,0,0,119,149,7
34102,489889,"picks up the short ball and hammers it away! This was miles in front of midwicket! What a lusty blow, and he took it off the front foot as well.",1,39.4,39.04,39.4,4,4,352,237,3
34102,489889,"shortish and outside off, steered to deep third man. He's becoming too predictable with the length",1,39.5,39.05,39.5,1,1,103,49,8
28081,489889,"139kph, seems to stick in the pitch a bit more and gain some extra bounce. Dhoni softens his grip and clips into the leg side",1,39.6,39.06,39.6,0,0,223,203,3
34102,270484,"back-of-the-hand slower ball pitched full on off stump, defended off the inside edge",1,40.1,40.01,40.1,0,0,200,193,4
34102,270484,leans into a square drive against a fuller delivery outside off for a couple of runs,1,40.2,40.02,40.2,2,2,48,238,6
34102,270484,"wafts at a good length ball outside off and is beaten, hundred or not that little loose shot ends up surfacing for Rohit",1,40.3,40.03,40.3,0,0,0,0,0
34102,270484,"good length ball on middle and off, picked away to deep midwicket",1,40.4,40.04,40.4,1,1,292,215,3
28081,270484,"slower ball on the legs, Dhoni nudges it to fine leg",1,40.5,40.05,40.5,1,1,275,129,2
34102,270484,"fuller delivery on off stump, eased through the covers",1,40.6,40.06,40.6,1,1,52,226,6
34102,499660,gets off his feet to negotiate the bounce of this shortish offcutter on off stump,1,41.1,41.01,41.1,1,1,276,147,2
28081,499660,slower ball goes short and Dhoni has cracked a pull to long leg,1,41.2,41.02,41.2,1,1,308,109,2
34102,499660,"slants a good length ball a long way down leg, far enough that Haddin can't reach it with a dive to his left",1,41.3,41.03,41.3,0,3,0,0,0
34102,499660,gets across on off stump and works a good length ball to short fine leg. Good thing he got bat to that,1,41.3,41.04,41.3,0,0,220,123,1
34102,499660,"backs away, but he is fooled by Sandhu's offcutter. Tries to hack it through midwicket and gets an inside edge",1,41.4,41.05,41.4,0,0,235,135,2
34102,499660,"stays a bit low does this short, slower ball and Rohit pulls to long leg",1,41.5,41.06,41.5,1,1,292,96,2
28081,499660,"yawning open spaces on the on side and Dhoni exploits them with a deft flick. Deep midwicket has lots of ground to cover, before which the Indians have taken a couple",1,41.6,41.07,41.6,2,2,268,229,3
34102,311592,"full and wide, called as much by the umpire",1,42.1,42.01,42.1,0,1,0,0,0
34102,311592,"full and slid across the right-hander, but an open face from Rohit has the ball scurrying to the third man boundary. Nicely placed",1,42.1,42.02,42.1,4,4,121,14,8
34102,311592,settles on off stump and drives a fuller delivery into the covers,1,42.2,42.03,42.2,0,0,125,197,6
34102,311592,"lands a yorker on off stump, which Rohit jabs into the covers for a single",1,42.3,42.04,42.3,1,1,124,173,6
28081,311592,"142kph, spears in a fuller delivery on middle and leg. A bit of curl away from the batsman, to take the leading edge while he was attempting a flick",1,42.4,42.05,42.4,0,0,153,195,5
28081,311592,"sliced into the covers as he camps back, knowing it will be quite full and moving across him",1,42.5,42.06,42.5,1,1,123,190,6
34102,311592,finds deep third man this time as Starc searches for the wide yorker,1,42.6,42.07,42.6,1,1,116,37,8
34102,499660,"cramps him for room with a slower length ball, but there is no one inside the circle to prevent the mis-hit flick from amounting to a couple of runs",1,43.1,43.01,43.1,2,2,272,222,3
34102,499660,"shortish and on off stump, so Rohit makes his own room and belts it to point. Good work there as he gets a hand on it and keeps it to a single",1,43.2,43.02,43.2,1,1,73,167,6
28081,499660,"shortish on leg stump, goes for a pull but doesn't quite connect well. Hit high on the bat for a single to long leg",1,43.3,43.03,43.3,1,1,246,147,2
34102,499660,"slower ball, picked and clattered to the wide long-on boundary! Good, long stride and a clean swing of the arms against the fuller ball. Poor from Sandhu for affording the room to swing the arms",1,43.4,43.04,43.4,4,4,330,280,3
34102,499660,"shortish on off stump, pulled off the front foot to long leg",1,43.5,43.05,43.5,1,1,328,151,2
28081,499660,"lots of slower balls being employed of varying lengths, this one is shorter and Dhoni pulls to long leg as well",1,43.6,43.06,43.6,1,1,299,107,2
28081,311592,flashing blade of Dhoni doesn't succeed when Starc cramps him up. Shortish delivery on fourth-fifth stump. Finds point,1,44.1,44.01,44.1,0,0,121,172,6
28081,311592,his penultimate over of the match and he secures a huge strike for Australia. The offcutter has very little room but Dhoni wants to slice it. Gets a thick inside edge and it crashes into the stumps,1,44.2,44.02,44.2,0,0,0,0,0
554691,311592,"cuts him in half with a full, fast inswinger. Akshar wants the booming cover drive, has to settle for his off stump being intact",1,44.3,44.03,44.3,0,0,0,0,0
554691,311592,"there goes another domino! Spearing yorker strikes the back leg with Akshar playing all around it. Would that have missed leg? Beaten for pace, beaten for movement and India are slipping",1,44.4,44.04,44.4,0,0,0,0,0
26421,311592,"lovely length from Starc, keeps it right up there on off stump and Ashwin is capably behind it",1,44.5,44.05,44.5,0,0,146,182,6
26421,311592,"<s>ends his spell with a double-wicket maiden</s>! Oops, he still has an over left. Brilliant yorker on off stump and Ashwin does well to get his bat down",1,44.6,44.06,44.6,0,0,185,193,4
34102,499660,"shortish on middle and off, turned through midwicket",1,45.1,45.01,45.1,1,1,235,191,3
26421,499660,"short delivery, pulled to long leg",1,45.2,45.02,45.2,2,2,345,99,2
26421,499660,"shortish on middle and off, picked away to deep square leg",1,45.3,45.03,45.3,1,1,329,157,2
34102,499660,sliced through to the sweeper,1,45.4,45.04,45.4,1,1,120,118,7
26421,499660,"lands it full on off stump, Ashwin digs it out",1,45.5,45.05,45.5,0,0,113,156,7
26421,499660,curls in late for Sandhu and Ashwin manages an inside edge to long leg. Ends a good first showing in ODIs,1,45.6,45.06,45.6,1,1,276,43,1
26421,270484,"starts off with the slower ball on off stump, Ashwin tries to exploit the huge gap in front of square on the leg side but fails. Sends the flick back at the bowler",1,46.1,46.01,46.1,0,0,183,193,4
26421,270484,waits on the shortish ball and slides it down to third man,1,46.2,46.02,46.2,1,1,123,151,7
34102,270484,"107kph, runs at Faulkner and slogs wildly, but the change of pace fools him. Off side is where the fielders are up and he goes cow corner. Misses",1,46.3,46.03,46.3,0,0,0,0,0
34102,270484,"shortish and cramping him on middle and leg, Rohit dabs it through point",1,46.4,46.04,46.4,1,1,135,130,7
26421,270484,goes for the paddle-pull and finds short fine leg,1,46.5,46.05,46.5,1,1,294,188,3
34102,270484,"length, that's what Rohit wants in this stage and he stays still, gets his balance right as he clears the front leg and lashes it over the long-on boundary",1,46.6,46.06,46.6,6,6,333,282,3
26421,489889,slower short ball slips beneath Ashwin's pull,1,47.1,47.01,47.1,0,0,0,0,0
26421,489889,"139kph, lovely stroke from Ashwin as he lines up a shortish ball angled in on off stump and cuts it quite late to third man",1,47.2,47.02,47.2,1,1,130,38,8
34102,489889,steps forward to a Cummins short ball and flat batted to long-on,1,47.3,47.03,47.3,1,1,293,246,3
26421,489889,gets across on off stump to try and pick the length ball off his toes. Appeal from Cummins for leg before but that would have gone down leg,1,47.4,47.04,47.4,0,1,238,161,2
34102,489889,"slower short ball, Rohit spotted it and belts it to midwicket for a single",1,47.5,47.05,47.5,1,1,248,200,3
26421,489889,lashed over the covers as he makes room against the back of a length delivery on off stump. But there is a sweeper in place,1,47.6,47.06,47.6,1,1,68,225,6
26421,311592,"is that his fifth? No, his new-ball partner Cummins drops it! Full and a shade wide, Ashwin did his bit by clearing the front leg and swinging for the cover fend. But gets a leading edge and the sweeper running in can't grab hold",1,48.1,48.01,48.1,2,2,44,172,6
26421,311592,"full delivery angled across Rohit, but he goes for a flick and gets a leading edge to deep third man",1,48.2,48.02,48.2,2,2,103,50,8
26421,311592,"wanders away outside off to try a scoop, but Starc bowls it too full for Ashwin to get under. Has to settle for a leg bye",1,48.3,48.03,48.3,0,1,121,142,7
34102,311592,"caught on the edge of the circle, that is Starc's fifth and it comes off his worst ball of the day - a full toss. Rohit was looking for quick runs, but his cow-corner club comes low off the inside half of the bat and picks out midwicket",1,48.4,48.04,48.4,0,0,244,220,3
326016,311592,"cleaned him up! that's six! Changed the angle of delivery and came around the wicket to Bhuvi, the new batsman. It was full, it was speared in on middle. The batsman stayed beside the ball to open up the off side, but fails to connect with his shovel drive. Starc smile might as well translate as 'you miss, I hit'",1,48.5,48.05,48.5,0,0,0,0,0
481896,311592,good yorker on off stump and Shami does well to prevent three in three,1,48.6,48.06,48.6,0,0,151,189,6
26421,270484,starts off with the slower ball outside off. dabbed to short third man. Not quite enough pace for Ashwin to exploit,1,49.1,49.01,49.1,1,1,125,48,8
481896,270484,"tucked through midwicket to return strike to the better batsman. Well done, Shami. Bat on ball.",1,49.2,49.02,49.2,1,1,212,183,3
26421,270484,"the back of the hand slower ball is short on middle, Ashwin pulls off the front foot and misses. Gripped in the pitch and bounced a bit more",1,49.3,49.03,49.3,0,0,0,0,0
26421,270484,"moves leg side, Faulkner follows him with a back of a length delivery which has been slogged to deep square leg",1,49.4,49.04,49.4,1,1,313,186,3
481896,270484,"length on off stump, Shami looks for the stands beyond long-on but mistimes it. Single to deep midwicket",1,49.5,49.05,49.5,1,1,274,215,3
26421,270484,"and they secure a bye off the last ball. Only five runs off it, as Ashwin ran away outside off to scoop the fuller ball and misses",1,49.6,49.06,49.6,0,1,184,107,1
5334,326016,"swings it in a little bit on length outside off, left alone",2,0.1,0.01,0.1,0,0,0,0,0
5334,326016,"wider outside off and coming in again, Finch chops it to point",2,0.2,0.02,0.2,0,0,124,172,6
5334,326016,"shorter and wider outside off now, cut straight to point again",2,0.3,0.03,0.3,0,0,120,171,6
5334,326016,"mixes it up with an outswinger this time, but it's well outside off for a wide",2,0.4,0.04,0.4,0,1,0,0,0
5334,326016,"length delivery swinging away a bit, pushed with a thickish edge down to third man for one",2,0.4,0.05,0.4,1,1,96,64,8
219889,326016,"back of length from leg towards middle, good bounce makes Warner go back and hop to defend it to leg",2,0.5,0.06,0.5,0,0,148,188,6
219889,326016,"fullish outside off now, pushed through the covers off the front foot in the gap, Kohli chases and slides to pull it in",2,0.6,0.07,0.6,3,3,291,276,3
219889,376116,"back of length on the legs, clipped off the pads after a hop on the back foot to deep square leg for two",2,1.1,1.01,1.1,2,2,39,165,6
219889,376116,"back of length towards middle this time, tucked to midwicket and the fielder gets a direct hit at non-striker's. No overthrows",2,1.2,1.02,1.2,0,0,139,183,6
219889,376116,"144kph, induces the outside edge but it flies well past second slip to third man for one. Was slightly back of length outside off and it moved away as Warner defended off the back foot",2,1.3,1.03,1.3,1,1,249,67,1
5334,376116,"flashes at it and gets four over the slips! It was pretty wide and short, Finch didn't time it very well but got enough to send it over slip",2,1.4,1.04,1.4,4,4,124,15,8
5334,376116,this one's pretty wide too and swings away further outside off for a wide,2,1.5,1.05,1.5,0,1,0,0,0
5334,376116,"crunching drive, that looked glorious! Full outside off with the away movement and Finch got on top of it with an authoritative cover drive for four",2,1.5,1.06,1.5,4,4,20,251,6
5334,376116,"drifts towards the pads now from back of of length, deflects it down behind square for a leg bye",2,1.6,1.07,1.6,0,1,268,89,2
5334,326016,"gets back and across against a shortish delivery, contact was a bit high on the bat as he cuts",2,2.1,2.01,2.1,0,0,110,181,6
5334,326016,mild appeal from Bhuvi as he corrects his length and line on middle. Might have been sliding down,2,2.2,2.02,2.2,0,0,0,0,0
5334,326016,picked away through to long leg,2,2.3,2.03,2.3,2,2,320,146,2
5334,326016,leaps to his left at cover and lifts himself onto his knees soon after to prevent Finch from going for a single. Deserved some runs considering the timing on that back-foot cover drive,2,2.4,2.04,2.4,0,0,109,182,6
5334,326016,clipped through midwicket as he gets in line with a length ball on middle,2,2.5,2.05,2.5,0,0,241,196,3
5334,326016,"good length ball a shade outside off, gets some seam away as well, gets Finch's respect as well as he leaves",2,2.6,2.06,2.6,0,0,0,0,0
219889,481896,"oh dear, that's a terrible delivery to start off with. And Warner gleefully sends it away to the fine leg boundary. Short, way down leg and all the batsman had to do was help it away",2,3.1,3.01,3.1,4,4,130,10,8
219889,481896,"143 kph, short and sliding down leg again. This time Warner is happy to collect the wide",2,3.2,3.02,3.2,0,1,0,0,0
219889,481896,"much better, he needs to stick in that off-stump region. Back of a length delivery also keeps Warner honest",2,3.2,3.03,3.2,0,0,224,191,3
219889,481896,"one-legged pull to the square leg boundary, but this was the bowler's mistake again. Bowling short with the new ball, bowling on leg stump with the new ball. No pressure on Australia now",2,3.3,3.04,3.3,4,4,9,187,6
219889,481896,pendulums back to off stump and Warner pushes to mid-off,2,3.4,3.05,3.4,0,0,232,192,3
219889,481896,"145kph, shortish on and around off stump, defended",2,3.5,3.06,3.5,0,0,212,196,3
219889,481896,keeps to the crease and hits through the line of a back of a length delivery and finds mid-off,2,3.6,3.07,3.6,0,0,243,215,3
5334,326016,"back of a length, yet Finch is confidently forward and taps to mid-off, who is under pressure as Finch sets off. Direct hit would have caught him short at the non-strikers', with Finch not diving. Ends up with an overthrow",2,4.1,4.01,4.1,2,2,153,260,5
5334,326016,"tight line on off stump, Finch can only block down the pitch",2,4.2,4.02,4.2,0,0,176,205,5
5334,326016,"back of a length on off stump, defended carefully",2,4.3,4.03,4.3,0,0,242,215,3
5334,326016,"shortish and outside off, Finch goes for the cut but seems to check it at the last minute",2,4.4,4.04,4.4,0,0,119,158,7
5334,326016,"back of a length on off stump, Finch gets behind it",2,4.5,4.05,4.5,0,0,163,205,5
5334,326016,"down the track to try and mess up Bhuvi's lovely lengths, ends up with an inside edge for his trouble and he retains strike as it goes towards square leg",2,4.6,4.06,4.6,1,1,243,165,2
5334,481896,brings Finch forward to protect his off stump. He should bowl better at the right-hander,2,5.1,5.01,5.1,0,0,177,193,5
5334,481896,"attempts a forcing drive off a good length ball on off stump, gets it off the inside of the bat and Shami gets a hand on it while following through",2,5.2,5.02,5.2,0,0,177,195,5
5334,481896,seems to get a bit of a bottom edge to a good length ball only a shade outside off. Single to deep third man,2,5.3,5.03,5.3,1,1,88,57,8
219889,481896,"takes on the short ball, with the field set for it! Nearly carries all the way to Akshar at deep square leg.",2,5.4,5.04,5.4,1,1,34,201,6
