batid,bowlid,comm,inns,oa,ou,ovr,r,rt,x,y,z
536936,554691,this is innovative. He has manufactured his own line here by moving across the stumps and has swept this from in front of off and middle. No power required. Patel's pace does the trick as this goes past square leg for four more,2,15.6,15.06,15.6,4,4,267,24,1
436677,26421,"flat length ball, defended off the front foot",2,16.1,16.01,16.1,0,0,205,181,3
436677,26421,defended with an open face,2,16.2,16.02,16.2,0,0,241,165,2
436677,26421,"sharp turn and bounce, angling in, on off, and spits away to beat the edge",2,16.3,16.03,16.3,0,0,0,0,0
436677,26421,"this is a shooter to get Sarkar out. Flatter, quicker delivery, pitches on a length, Sarkar is justified in staying back, but the ball doesn't come up. It squeezes under the toe of the bat to hit him in the shin. No chance for Sarkar really",2,16.4,16.04,16.4,0,0,0,0,0
56029,26421,steps half-forward to defend an offbreak,2,16.5,16.05,16.5,0,0,0,0,0
56029,26421,a sharp offbreak that hits him in the ribs ends a wicket-maiden. Can India make something out of this?,2,16.6,16.06,16.6,0,0,174,205,5
536936,554691,"flat ball, Das looks to pull, is hurried into it by a quick delivery",2,17.1,17.01,17.1,0,0,206,186,3
536936,554691,"tossed up this time, defended to cover",2,17.2,17.02,17.2,0,0,156,197,5
536936,554691,"really quick delivery, 95ks, hits him in the rib cage as he looks to pull",2,17.3,17.03,17.3,0,0,0,0,0
536936,554691,pushes this flighted delivery to deep cover for one,2,17.4,17.04,17.4,1,1,62,196,6
56029,554691,"leading edge as he looks to work this to leg, but it is a soft edge and doesn't carry back to Patel",2,17.5,17.05,17.5,0,0,194,185,4
56029,554691,"flat, short and wide, and Rahim loves it there. He back-cuts it past the diving man at point. That should get him going",2,17.6,17.06,17.6,4,4,34,88,7
536936,26421,"down the wicket, beaten in the flight, is hit on the pad",2,18.1,18.01,18.1,0,0,0,0,0
536936,26421,"overpitched this offbreak, clipped to wide long-on for one",2,18.2,18.02,18.2,1,1,282,282,4
56029,26421,"and there is the odd bad ball that Ashwin tends to bowl once in a while. This is short, with an attacking field in place, and Rahim has enough time to go back to punch this through vast open spaces in the covers",2,18.3,18.03,18.3,4,4,2,201,6
56029,26421,slog-swept along the ground for one,2,18.4,18.04,18.4,1,1,292,260,3
536936,26421,"tossed up, middle and leg, easily worked away for one",2,18.5,18.05,18.5,1,1,284,109,2
56029,26421,"flighted offbreak, but into the pads, clipped to short midwicket",2,18.6,18.06,18.6,0,0,227,190,3
536936,554691,"short of a length, on off stump, punched to point",2,19.1,19.01,19.1,0,0,112,160,7
536936,554691,"Dhoni takes the catch on the rebound, India are still in. A loose shot. Bangladesh getting complacent here. This is a flat length ball outside off, Das pushes at it, away from his body, and edges it through. Dhoni's gloves close early but the rebound doesn't go too far away. India very much in this contest",2,19.2,19.02,19.2,0,0,176,154,8
56143,554691,"flat ball, stays back, turns this around the corner for one",2,19.3,19.03,19.3,1,1,74,227,6
56029,554691,"slower through the air, defended back to him",2,19.4,19.04,19.4,0,0,187,194,4
56029,554691,"pushed through, stays back to defend",2,19.5,19.05,19.5,0,0,199,177,3
56029,554691,"flighted, middle and leg, defended to leg",2,19.6,19.06,19.6,0,0,194,176,3
56143,26421,"lovely offbreak. It drifts in, dips on him, lands on a length in front of off, and then breaks away to beat the edge",2,20.1,20.01,20.1,0,0,0,0,0
56143,26421,"looks to sweep, is beaten in the flight, but goes ahead with it, and it lands safe. Rayudu from long leg has to run to his right and put a dive in to save two runs. Target under 100 now",2,20.2,20.02,20.2,2,2,28,121,7
56143,26421,this time a proper old-fashioned slog sweep despite not being to the pitch of it. Risky batting but he gets four for it,2,20.3,20.03,20.3,4,4,17,270,6
56143,26421,defended off the front foot this time,2,20.4,20.04,20.4,0,0,225,181,3
56143,26421,"slows this down, hands it in the air, middle and leg. Defended off the front foot",2,20.5,20.05,20.5,0,0,180,200,4
56143,26421,"fired in, Shakib rocks back to help this around the corner for a single",2,20.6,20.06,20.6,1,1,101,124,7
56143,554691,"full and flat, clipped away off the toes",2,21.1,21.01,21.1,1,1,70,199,6
56029,554691,"<b>dropped</b>. Some turn for Patel as Rahim defends. He gets a sharp edge that goes to the right of Dhoni's glove and to the left of Raina at slip. Raina gets a hand to it, but this is going too fast for him to catch",2,21.2,21.02,21.2,2,2,164,21,8
56029,554691,solid front-foot defensive,2,21.3,21.03,21.3,0,0,159,188,5
56029,554691,"another defensive shot, this time with an open face",2,21.4,21.04,21.4,0,0,161,174,6
56029,554691,"flatter delivery, stays back to defend",2,21.5,21.05,21.5,0,0,150,126,8
56029,554691,looks to late-cut this but can't beat short fine leg,2,21.6,21.06,21.6,0,0,149,194,6
56143,26421,"plays the delicate lap sweep, from in front of the stumps, gets a couple",2,22.1,22.01,22.1,2,2,109,32,8
56143,26421,"quicker, flatter, he picks the trajectory early, and defends off the back foot",2,22.2,22.02,22.2,0,0,144,182,6
56143,26421,"a nothing shot. Quite an ordinary shot. No shape, just throws his arms at one tossed up outside off. Gets a thick outside edge but it somehow clears cover",2,22.3,22.03,22.3,1,1,257,225,3
56029,26421,"looks for the late cut, is beaten by the extra bounce",2,22.4,22.04,22.4,0,0,0,0,0
56029,26421,"flighted outside off, dips on him, turns back in, hits the pad, but is turning too much",2,22.5,22.05,22.5,0,0,186,183,4
56029,26421,solid front-foot defensive to end the over,2,22.6,22.06,22.6,0,0,198,200,4
56143,554691,"fired into the pads, helped around the corner for a single",2,23.1,23.01,23.1,0,1,140,181,6
56029,554691,"Patel slows it down, and draws some turn to beat the outside edge",2,23.2,23.02,23.2,0,0,0,0,0
56029,554691,pushes this flighted ball into the covers for one,2,23.3,23.03,23.3,1,1,112,189,6
56143,554691,down the wicket to drive this to long-on for one,2,23.4,23.04,23.4,1,1,132,302,5
56029,554691,"flatter, on off, defended off the back foot",2,23.5,23.05,23.5,0,0,144,180,6
56029,554691,"tossed up on off, turns away, takes a soft thick outside edge",2,23.6,23.06,23.6,0,0,144,154,7
56143,26421,"flighted on middle and leg, defended off the front foot",2,24.1,24.01,24.1,0,0,156,185,6
56143,26421,"slower still, dipping on him, Shakib presses forward to defend",2,24.2,24.02,24.2,0,0,201,171,3
56143,26421,tries to force an offbreak outside off and is beaten. He needs to realise this is Ashwin's last over. Just play him out,2,24.3,24.03,24.3,0,0,0,0,0
56143,26421,"flatter and straighter, he stays back to defend",2,24.4,24.04,24.4,0,0,215,180,3
56143,26421,"tosses this up, but overpitches, and is picked away off the toes for one",2,24.5,24.05,24.5,1,1,133,200,6
56029,26421,"sharp turn down the leg side to be called a wide. Dhoni, while making the collection, shouts, ""Catch it.""",2,24.6,24.06,24.6,0,1,0,0,0
56029,26421,"flatter, defended to leg. That does it for Ashwin. Bangladesh can breathe half a sigh of relief now",2,24.6,24.07,24.6,0,0,196,176,3
56143,554691,"down the wicket, drives a full ball to long-on for one",2,25.1,25.01,25.1,1,1,114,288,5
56029,554691,"beautiful shot. That might be the shot of the match. He is down the wicket, deliberately not right to the pitch of it. He has left himself some room to swing his arms through it, and chips it over extra cover",2,25.2,25.02,25.2,4,4,20,247,6
56029,554691,"after that touch shot Rahim brings out the brute force, slog-sweeping this for six into the cow corner. With Ashwin out of the attack, Bangladesh are now looking to finish this off in a hurry",2,25.3,25.03,25.3,6,6,358,295,3
56029,554691,drives this along the ground to long-off,2,25.4,25.04,25.4,1,1,131,296,5
56143,554691,"full and flat, pushed to cover",2,25.5,25.05,25.5,0,0,221,184,3
56143,554691,"this is a Shakib special. This is only slightly short of a length, but he has rocked back to use all of Patel's pace to send this between point and short third man. Target under 70 now",2,25.6,25.06,25.6,4,4,315,57,2
56029,33335,"flighted outside off, takes a thick inside edge as he looks to work this to leg",2,26.1,26.01,26.1,1,1,244,43,1
56143,33335,"down the wicket to drills this past the diving Raina. It's not too far to his right, but he has smashed this hard. Even long-off can't keep it in",2,26.2,26.02,26.2,4,4,247,350,4
56143,33335,down the wicket to chip this to long-on for one,2,26.3,26.03,26.3,1,1,124,284,5
56029,33335,"short of a length, on the stumps, but he moves back to open the face on it",2,26.4,26.04,26.4,1,1,108,87,8
56143,33335,"short of a length, on off, punched to cover",2,26.5,26.05,26.5,0,0,225,183,3
56143,33335,pushed to long-off for another single. Target under 60 now,2,26.6,26.06,26.6,1,1,302,205,3
56143,234675,"gets this to dip a little and beat him in the flight, but the ball is headed down leg",2,27.1,27.01,27.1,0,0,184,193,4
56143,234675,"short of a length, turning in, he looks to force it behind square, but finds cover-point",2,27.2,27.02,27.2,0,0,236,147,2
56143,234675,"sharp turn from middle and off, and is called a wide",2,27.3,27.03,27.3,0,1,0,0,0
56143,234675,"looks to sweep, early into the shot, gets a bottom shot towards short fine",2,27.3,27.04,27.3,0,0,155,151,7
56143,234675,"short of a length, flick-pulled into the gap on the on side for a couple",2,27.4,27.05,27.4,2,2,24,173,6
56143,234675,stays back to drop this length ball into the leg side for one,2,27.5,27.06,27.5,1,1,115,156,7
56029,234675,"flat ball, on a length, defended off the back foot",2,27.6,27.07,27.6,0,0,174,200,5
56143,33335,stays leg-side of a flat delivery. Defends with an open face,2,28.1,28.01,28.1,0,0,225,174,3
56143,33335,"shapes up to slog-sweep, but the ball doesn't arrive, and his check shot falls safe to Raina's left",2,28.2,28.02,28.2,1,1,157,308,5
56029,33335,"fired in, Rahim sees it early, and ramps this fine of fine leg for a couple",2,28.3,28.03,28.3,2,2,227,21,1
56029,33335,stays back to defend an offbreak to leg,2,28.4,28.04,28.4,0,0,240,180,3
56029,33335,"goes leg side of an offbreak, Raina fires it in, and he defends",2,28.5,28.05,28.5,0,0,164,184,5
56029,33335,"flighted outside off, driven with an open face, between cover and extra cover for three runs. Target under 50 now",2,28.6,28.06,28.6,3,3,25,231,6
56029,234675,"short and wide, cut away square of deep cover. He comes back for a second run, but Rahim's strides and Dhoni's fox-like work runs him out. The throw is not exceptionally fast so he leaves his station at the stumps, moves towards the stumps, and then deflects it between his legs with his back to the stumps. Guess what, he has hit the stumps. That is some work by MS Dhoni",2,29.1,29.01,29.1,1,1,55,96,7
373538,234675,"flighted outside off, driven to long-off for one",2,29.2,29.02,29.2,1,1,103,304,5
56143,234675,"flighted into the pads, worked to leg for one",2,29.3,29.03,29.3,1,1,61,136,7
373538,234675,"tossed up on off, defended with an open face",2,29.4,29.04,29.4,0,0,134,178,6
373538,234675,"flighted, middle and off, defended back to him",2,29.5,29.05,29.5,0,0,158,193,5
373538,234675,"fired in, pretty straight, defended to leg",2,29.6,29.06,29.6,0,0,217,197,3
56143,277955,"short of a length, not enough room to play the cut, but he gets a single off the dab",2,30.1,30.01,30.1,1,1,285,73,2
373538,277955,"misses out. This is a shortish ball down the pads, all it needs is a tickle to send it for four, but Sabbir misses, and gets just the leg-bye",2,30.2,30.02,30.2,0,1,265,111,2
56143,277955,"bouncer, good sharp bounce. Not quite. It is called a wide for height. Slightly harsh on Kularni",2,30.3,30.03,30.3,0,1,0,0,0
56143,277955,"slower ball, just outside off, Shakib stays back to open the face, but can't guide it past slip",2,30.3,30.04,30.3,0,0,236,126,2
56143,277955,"another slower ball, and Shakib shows a lovely touch. He waits and waits for it, and then open the face at the last moment to guide this between the keeper and the wide slip. Target under 40 now",2,30.4,30.05,30.4,4,4,224,4,1
56143,277955,"short of a length, wide, punched to deep point",2,30.5,30.06,30.5,1,1,343,182,3
373538,277955,"short of a length, getting high, tucked away off the armpit",2,30.6,30.07,30.6,1,1,270,122,2
373538,234675,"angling in, no turn, helped into the leg side for one",2,31.1,31.01,31.1,1,1,235,197,3
56143,234675,"flatter, into the pads, defended to leg",2,31.2,31.02,31.2,0,0,133,169,6
56143,234675,"slower in the air, driven to long-on for another single",2,31.3,31.03,31.3,1,1,145,329,5
373538,234675,"short of a length, gets good bounce, but is punched to deep cover",2,31.4,31.04,31.4,1,1,34,139,7
56143,234675,pushed to long-on for one,2,31.5,31.05,31.5,1,1,149,329,5
373538,234675,"shorter, flatter, cut away for one",2,31.6,31.06,31.6,1,1,45,178,6
373538,277955,"short of a length, on off, punched to cover",2,32.1,32.01,32.1,0,0,131,198,6
373538,277955,"into the pads, gets lucky that he has clipped it straight to fine leg for one",2,32.2,32.02,32.2,1,1,249,41,1
56143,277955,"short of a length, just outside off, punched to point",2,32.3,32.03,32.3,0,0,247,155,2
56143,277955,"short and wide, cut away for a single",2,32.4,32.04,32.4,1,1,332,180,3
373538,277955,"slower short ball, pulled away, can't beat square leg",2,32.5,32.05,32.5,0,0,255,146,2
373538,277955,"bouncer, quick one, but it is a wide down the leg side. Target is under 30 now",2,32.6,32.06,32.6,0,1,0,0,0
373538,277955,"short of a length, beats his flick-pull, flies off the thigh pad to square leg. India make half an appeal for a catch but this is heights of optimism",2,32.6,32.07,32.6,0,0,0,0,0
56143,234675,"flighted outside off, defended towards the bowler",2,33.1,33.01,33.1,0,0,160,186,5
56143,234675,"flighted again, meets a dead bat",2,33.2,33.02,33.2,0,0,153,181,6
56143,234675,"flatter, stays back to defend",2,33.3,33.03,33.3,0,0,206,187,3
56143,234675,"pushed into the pads, easily worked away for a single",2,33.4,33.04,33.4,1,1,94,125,7
373538,234675,"short of a length, on off, turning away, punched to deep cover",2,33.5,33.05,33.5,1,1,29,181,6
56143,234675,"shortish, into the pads, worked past the backward short leg",2,33.6,33.06,33.6,1,1,88,73,7
56143,277955,"short and wide, cut away for a single. Asking rate under two an over now",2,34.1,34.01,34.1,1,1,325,208,3
373538,277955,"that's dismissive. That's disdainful. That is showing Bangladesh belong. This is a full ball, he clears the front leg and sends it crashing between mid-ff and the bowler. Doesn't even look where the ball has gone. Stylish",2,34.2,34.02,34.2,4,4,146,355,5
373538,277955,"short ball, pulled to short midwicket. Words exchanged between the bowler and the batsman. Mortaza is applauding from the balcony",2,34.3,34.03,34.3,0,0,245,209,3
373538,277955,"bouncer, Sabbir thinks of ramping him, but withdraws from the shot as it is too high",2,34.4,34.04,34.4,0,0,0,0,0
373538,277955,"slower bouncer, he has to check the pull, but gets a single to long leg",2,34.5,34.05,34.5,1,1,298,75,2
56143,277955,"slower short ball, punched to third man. Target under 20 now",2,34.6,34.06,34.6,1,1,300,105,2
56143,234675,"short of a length, turning in, defended to leg",2,35.1,35.01,35.1,0,0,156,136,8
56143,234675,"gets this to jump at him, but Shakib does well to keep the defensive shot down",2,35.2,35.02,35.2,0,0,195,185,4
56143,234675,"fired in, Shakib is caught in a shimmy down the wicket, but defends it well",2,35.3,35.03,35.3,0,0,138,198,6
56143,234675,"turning into the pads, defended to short leg",2,35.4,35.04,35.4,0,0,157,145,7
56143,234675,stays back to defend a flat delivery,2,35.5,35.05,35.5,0,0,133,174,6
56143,234675,breaks the maiden by working this to long leg for one,2,35.6,35.06,35.6,1,1,128,76,8
56143,277955,"short of a length, outside leg, easy single for Shakib",2,36.1,36.01,36.1,1,1,143,116,8
373538,277955,"short, wide, backs away to cut it in front of square, past the diving Dhawan at cover. Even closer. The party is about to begin",2,36.2,36.02,36.2,4,4,12,229,6
373538,277955,"<b>nearly hit wicket</b>. This is into the ribs, he looks to tuck it away, but it has pushed him way back in the crease. In fact he has landed behind the stumps but just outside off. He somehow manages to acrobatically avoid the stumps as he falls down the leg side",2,36.3,36.03,36.3,0,0,226,144,2
373538,277955,"dismissed out of his sight. He is waiting for another short ball with the front leg out of the way, and he pulls it between mid-on and midwicket for four",2,36.4,36.04,36.4,4,4,301,307,4
373538,277955,"short again, this time pulled to fine leg for one",2,36.5,36.05,36.5,1,1,281,60,1
56143,277955,wide down the leg side. The bouncer but inaccurate,2,36.6,36.06,36.6,0,1,0,0,0
56143,277955,"short again, pulled away for a single to deep midwicket. One shot to go now",2,36.6,36.07,36.6,1,1,42,136,7
56143,554691,"Jadeja drops short, and he pulls it through midwicket for four to bring up a fifty. Another reason to celebrate in Dhaka",2,37.1,37.01,37.1,4,4,40,278,6
56143,554691,"fired into the pads, defended to leg",2,37.2,37.02,37.2,0,0,141,196,6
56143,554691,pushed to mid-on,2,37.3,37.03,37.3,0,0,157,210,5
56143,554691,defended solidly,2,37.4,37.04,37.4,0,0,174,191,5
56143,554691,"down the wicket, the crowd roars, but he gets just the single to long-on",2,37.5,37.05,37.5,1,1,149,334,5
373538,554691,"gets extra bounce, runs it down to third man to win the series. That's 10 home matches in a ow. That's Champions Trophy spot sealed. No crazy celebration. Just a matter-of-fact look. These are no crazy upsets. This is a better team in the conditions and on the days dominating the other",2,37.6,37.06,37.6,1,1,145,22,8
