batid,bowlid,comm,inns,oa,ou,ovr,r,rt,x,y,z
28081,300618,"soft hands, works this into the leg side, between the two men deep on the leg side. He rushes back for the second",1,29.6,29.06,29.6,2,2,279,92,2
33335,538506,"on a length, middle and off, defended off the front foot",1,30.1,30.01,30.1,0,0,149,198,5
33335,538506,tucked away off the hip for one,1,30.2,30.02,30.2,1,1,51,180,6
28081,538506,"leg-stump half-volley, clipped away wide of deep midwicket for two",1,30.3,30.03,30.3,2,2,336,220,3
28081,538506,"short of a length, outside off, pushed to deep cover for one",1,30.4,30.04,30.4,1,1,25,204,6
33335,538506,"bouncer, over the top of leg stums. Raina ducks it. Called one for the over",1,30.5,30.05,30.5,0,0,0,0,0
33335,538506,"short of a length, just outside off, punched wide of point. They take a single even though Nasir gets a hand on to the ball",1,30.6,30.06,30.6,1,1,258,151,2
33335,300618,"tossed up outside off, defended off the front foot",1,31.1,31.01,31.1,0,0,242,193,3
33335,300618,<b>appeal for lbw</b> as the ball doesn't turn and beats his inside edge. Headed down leg? Really close. A strangely aborted shout from Bangladesh,1,31.2,31.02,31.2,0,0,0,0,0
33335,300618,defended off the front foot,1,31.3,31.03,31.3,0,0,229,190,3
33335,300618,"short of a length, quick, hits the bottom edge on the dab",1,31.4,31.04,31.4,0,0,253,173,3
33335,300618,punched down to long-on for one,1,31.5,31.05,31.5,1,1,108,312,5
28081,300618,"flighted on middle and leg, defended to leg as there is no pace to work with",1,31.6,31.06,31.6,0,0,223,181,3
33335,56143,"short of a length, into the pads, helped away for one",1,32.1,32.01,32.1,1,1,143,114,8
28081,56143,"tossed up on middle and leg, pushed down to long-on for one n",1,32.2,32.02,32.2,1,1,215,319,4
33335,56143,"slow through the air, full, around off, defended to leg",1,32.3,32.03,32.3,0,0,156,190,5
33335,56143,"draws Raina forward with a flighted delivery, which goes on straight to beat the outside edge",1,32.4,32.04,32.4,0,0,0,0,0
33335,56143,comes down the track to drive this to long-off,1,32.5,32.05,32.5,1,1,225,328,4
28081,56143,"really slow through the air, Dhoni goes back to drop this to leg for a single",1,32.6,32.06,32.6,1,1,253,153,2
28081,300618,"short of a length, quick, punched down to long-on",1,33.1,33.01,33.1,1,1,230,323,4
33335,300618,"down the wicket, beaten in the flight, goes inside-out, gets it past cover, though",1,33.2,33.02,33.2,1,1,320,242,3
28081,300618,"full and quick, pushed to the bowler's right, but Nasir is quick to field it",1,33.3,33.03,33.3,0,0,206,211,4
28081,300618,diving save by Sabbir at short midwicket saves a single,1,33.4,33.04,33.4,0,0,236,204,3
28081,300618,"short of a length, faster, worked to square leg",1,33.5,33.05,33.5,0,0,250,171,3
28081,300618,"flighted on leg, pushed to long-on",1,33.6,33.06,33.6,1,1,230,323,4
28081,56143,"slow through the air, some turn away, Dhoni lunges forward in defence",1,34.1,34.01,34.1,0,0,109,182,6
28081,56143,"even slower, even higher, wide outside off, teasing him. Dhoni refuses to be teased, plays just a push-drive to deep cover",1,34.2,34.02,34.2,1,1,35,206,6
33335,56143,"arm ball, cut away, and misfielded by Nasir at cover-point to allow the first boundary since the 27th over. Brings up fifty for the partnership",1,34.3,34.03,34.3,4,4,352,191,3
33335,56143,"flat delivery, pushed back to him",1,34.4,34.04,34.4,0,0,161,194,5
33335,56143,down the wicket to drive this to long-on for one,1,34.5,34.05,34.5,1,1,216,330,4
28081,56143,punched down to long-off for another single,1,34.6,34.06,34.6,1,1,114,318,5
28081,330902,"on a length, on off, pushed to point",1,35.1,35.01,35.1,0,0,123,144,7
28081,330902,"and there is a quick single to cover, and seems Mustafizur has learnt his lesson and has gone straight in his follow-through as opposed to cutting across",1,35.2,35.02,35.2,1,1,35,206,6
33335,330902,"and Mustafixzur has struck immediately. The cutter again. Raina hasn't picked it. This is a short ball, which usually means Raina's mind half-stops working immediately. On top of that it is a cutter that has stuck into the surface and bounced like a tennis ball to take the top edge as Raina looks to run this down to third man. The edge is taken through to the keeper",1,35.3,35.03,35.3,0,0,189,106,1
234675,330902,"<b>huge lbw shout</b>. This is full, regulation pace, beats his inside edge as Jadeja plays across the line. Looks good live time, but Tucker seems to have made a good decision: going down the line perhaps",1,35.4,35.04,35.4,0,0,0,0,0
234675,330902,"yorker gone wrong, the low full toss that is pushed wide of mid-on for one",1,35.5,35.05,35.5,1,1,124,244,5
28081,330902,"short of a length, on off, Dhoni can't do much other than defend to point",1,35.6,35.06,35.6,0,0,106,160,7
234675,56007,"slower ball, on off, defended off the front foot by Jadeja",1,36.1,36.01,36.1,0,0,230,195,3
234675,56007,"on a length, slower offcutter again, Jadeja dabs on it, but can't send it anywhere",1,36.2,36.02,36.2,0,0,212,139,2
234675,56007,"whipped away off the pads, between fine leg and deep square leg. Comes back for two",1,36.3,36.03,36.3,2,2,66,93,7
234675,56007,"short of a length, no room, Jadeja dabs it towards point",1,36.4,36.04,36.4,0,0,243,142,2
234675,56007,"short of a length, punched into the pitch, and it bounces over Mortaza's head for a single",1,36.5,36.05,36.5,1,1,141,326,5
28081,56007,"slower ball, offcutter, defended to leg",1,36.6,36.06,36.6,0,0,211,203,4
234675,330902,"length ball, angling in, beats the inside edge, but going down",1,37.1,37.01,37.1,0,0,0,0,0
234675,330902,whipped away but straight to short midwicket. These fielders are all cutting singles,1,37.2,37.02,37.2,0,0,132,190,6
234675,330902,"yorker, just outside off, hits the toe of the bat",1,37.3,37.03,37.3,0,0,193,140,1
234675,330902,"full, into the pads, worked to deep midwicket for one",1,37.4,37.04,37.4,1,1,45,131,7
28081,330902,"offcutter, on a length, middle and leg, defended to cover. Takes the single",1,37.5,37.05,37.5,1,1,49,197,6
234675,330902,"full toss, a low one, beats his inside edge as Jadeja plays across its line again",1,37.6,37.06,37.6,0,0,0,0,0
28081,56007,"short of a length, middle and off, punched down to long-on for one",1,38.1,38.01,38.1,1,1,233,316,4
234675,56007,"slower ball, cut away to third man for one",1,38.2,38.02,38.2,1,1,312,84,2
28081,56007,"on a length, holds its line a touch, pushed down to long-on for one",1,38.3,38.03,38.3,1,1,224,325,4
234675,56007,"slower ball, full, pushed towards long-off for one",1,38.4,38.04,38.4,1,1,207,260,4
28081,56007,"slower ball, offcutter, pushed to short midwicket",1,38.5,38.05,38.5,0,0,222,211,4
28081,56007,"slower ball again, on off, on a length, another defensive",1,38.6,38.06,38.6,0,0,131,204,6
234675,330902,"on a length, angling in, not getting any timing. Pushed to short midwicket",1,39.1,39.01,39.1,0,0,131,189,6
234675,330902,"tries a yorker, Jadeja walks down to take it on the full, drives it to long-on for one",1,39.2,39.02,39.2,1,1,101,310,5
28081,330902,"huge wicket. Dhoni has been delaying that final push because wickets have been falling, and now he himself falls. The lethal cutter of Mustafizur again. Dhoni hasn't picked it, and he is early into the shot. Ends up jabbing at a length ball, and the ball lobs to short cover",1,39.3,39.03,39.3,0,0,138,202,6
554691,330902,"he is on a hat-trick. Axar has a golden duck. Bangladesh on fire. 25000 people on their feet. Smart bowling. First ball to a new batsman in pressure situation? Straight. On middle stump. And this is a seam-up delivery. Pitches just outside off, angling in towards middle, Axar plays across the line for his third duck in his last four innings",1,39.4,39.04,39.4,0,0,0,0,0
26421,330902,"full and on off, Ashwin keeps it out. Takes a single to cover",1,39.5,39.05,39.5,1,1,100,197,6
234675,330902,"full and straight. A yorker. Just too straight, and goes for four leg-byes to fine leg",1,39.6,39.06,39.6,0,4,109,18,8
26421,56143,"slow through the air, on off, defended to short cover",1,40.1,40.01,40.1,0,0,144,181,6
26421,56143,"short of a length, into the pads, punched away to leg for one",1,40.2,40.02,40.2,1,1,251,112,2
234675,56143,"slow through the air, short of a length, dropped to leg for one",1,40.3,40.03,40.3,1,1,136,146,7
26421,56143,"flighted just outside off, defended off the front foot",1,40.4,40.04,40.4,0,0,146,173,6
26421,56143,"flighted outside off again, pushed for a single to long-off",1,40.5,40.05,40.5,1,1,141,298,5
234675,56143,"arm ball, pitches outside leg, slides to hit his pad",1,40.6,40.06,40.6,0,0,0,0,0
26421,330902,"on a length, regulation pace, pushes this down at his feet and rushes through for one",1,41.1,41.01,41.1,1,1,144,174,6
234675,330902,"full, on off, pushed to long-on for one",1,41.2,41.02,41.2,1,1,174,251,5
26421,330902,"slower ball, pitches leg, cuts away, defended off the back foot",1,41.3,41.03,41.3,0,0,153,176,6
26421,330902,"nearly the five-for. Seam-up, angling across him, beats the outside edge. Ashwin is off balance as he looks to push at this",1,41.4,41.04,41.4,0,0,0,0,0
26421,330902,"the cutter this time, short of a length, pitched outside leg, cuts away, defended off the back foot",1,41.5,41.05,41.5,0,0,135,185,6
26421,330902,"Ashwin is walking. There is a five-for for Mustafizur. They have all surrounded him in jubilation. Only the second bowler after Brian Vittori to take five-fors in his first two ODIs. Another offcutter. It is a length ball, dips a little, and Ashwin is pushing at it in front of his body. The beauty of this cutter is that it is only slightly off pace, which means the edge carries to the keeper. What joy on the young man's face. Lovely to watch",1,41.6,41.06,41.6,0,0,178,134,8
234675,56143,"flighted on the pads, worked to leg",1,42.1,42.01,42.1,2,2,139,195,6
234675,56143,"short ball, and Jadeja rocks back to cut that for four. A rare loose ball, and he cashes in",1,42.2,42.02,42.2,4,4,354,207,3
234675,56143,"flighted outside off, driven to long-on for one",1,42.3,42.03,42.3,1,1,175,254,5
326016,56143,"tossed up, really full, dug out for a single to long-off",1,42.4,42.04,42.4,1,1,130,282,5
234675,56143,"slightly short of a length, punched to short midwicket",1,42.5,42.05,42.5,1,1,86,206,6
326016,56143,"flighted high, really slow in the air, defended back to him",1,42.6,42.06,42.6,0,0,193,189,4
234675,330902,"short of a length, sharp delivery, but is a wide down the leg side",1,43.1,43.01,43.1,0,1,0,0,0
234675,330902,"short of a length, Jadeja walks down to run this down to third man for one",1,43.1,43.02,43.1,1,1,238,59,1
326016,330902,"short of a length, seam-up, defended off the back foot",1,43.2,43.03,43.2,0,0,133,198,6
326016,330902,"what a mean little offcutter. What sting in it. Short of a length, pitched outside leg, cuts away, bounces extra, beats the outside edge",1,43.3,43.04,43.3,0,0,0,0,0
326016,330902,"another lovely cutter. They have no clue. That wrist does it again. Short of a length, just at the leg stump, he plays at it, and is beaten as the ball spits away",1,43.4,43.05,43.4,0,0,0,0,0
326016,330902,"another lovely cutter, this time finds the edge, and it goes down for a single",1,43.5,43.06,43.5,1,1,118,150,7
234675,330902,"and he has a six-for. Mustafizur has sent the crowd into a frenzy. He has 11 wickets in two matches. Full and straight to end the spell, Jadeja plays across its line, hits it into his pad, and the ricochets rattles the stumps. What a spell from Mustafizur",1,43.6,43.07,43.6,0,0,183,162,1
326016,300619,"on a length, fast, beats the inside edge, hits the pad, concedes a leg-bye",1,44.1,44.01,44.1,0,1,237,180,3
277955,300619,"full, just outside off, dug out for another single",1,44.2,44.02,44.2,1,1,140,234,5
326016,300619,"full, on off, pushed to mid-off for one",1,44.3,44.03,44.3,1,1,149,241,5
277955,300619,"yorker, nearly squeezes it under the at, but Kulkarni gets the bat down in time. Only a single",1,44.4,44.04,44.4,1,1,281,287,4
326016,300619,"on a length, driven on the up, but straight to short cover",1,44.5,44.05,44.5,0,0,137,190,6
326016,300619,"bouncer, and India are bowled out in 45 overs. What joy in the stands. Hossain bowls this at his head, Kumar looks to get his head out of the way and then pull it. Manages only to glove it through",1,44.6,44.06,44.6,0,0,196,119,1
56194,326016,"short of a length, middle and off, angling away, left alone",2,0.1,0.01,0.1,0,0,0,0,0
56194,326016,"shimmies down a little, mis-hits this shortish ball to cover",2,0.2,0.02,0.2,0,0,251,210,3
56194,326016,and the wrost ball to bowl with the keeper standing up. A big leg-side wide. Dhoni does well to get hids gloves around and concede only one wide,2,0.3,0.03,0.3,0,2,0,0,0
436677,326016,"some swing for Kumar, but he is headed down leg when he hits Sarka's pad",2,0.3,0.04,0.3,0,0,0,0,0
436677,326016,"on a length, on off, pushed back to Kumar",2,0.4,0.05,0.4,0,0,177,194,5
436677,326016,"drives. A bit loose. Away from the body. His feet don't take him towards the ball, but he gets a thick inside edge that goes wide of mid-on",2,0.5,0.06,0.5,2,2,111,280,5
436677,326016,"short ball, and he pulls it over square leg. Not in control of it at all, but manages to clear the man inside the circle",2,0.6,0.07,0.6,2,2,56,191,6
56194,277955,"a bit of shape around off, coming back in, defended to mid-off",2,1.1,1.01,1.1,0,0,207,201,4
56194,277955,"<strong>is this a clean catch or not?</strong> Soft signal is not out. Tamim dances down the track, drives this towards mid-off where Kohli claims a catch. The angles so far are not great, the soft signal is not out, and this is looking good for Tamim right now. It is impossible to tell from the angles we have. Kohli claims it immediately, but you can't say either way with such shoddy pictures. Tamim bats on. A cheer goes around. Kohli has a word with the umpire, which draws a round of boos. He is still shaking his head",2,1.2,1.02,1.2,0,0,223,245,4
56194,277955,slower ball outside off as he sees Tamim advance. Wided outside off,2,1.3,1.03,1.3,0,1,0,0,0
56194,277955,"that will rub a block of crystallised salt into the wound. Half-volley outside off, and he has dismissed it through extra cover for four. Past, well, Kohli",2,1.3,1.04,1.3,4,4,315,299,3
56194,277955,"slight shape back in, respectfully played down to mid-off",2,1.4,1.05,1.4,0,0,200,242,4
56194,277955,"swinging in, beats the inside edge, concedes a leg-bye",2,1.5,1.06,1.5,0,1,157,113,8
436677,277955,"this will annoy India further. Sarkar is looking midwicket, hitting third man. The head falls away as he slogs, but the outside edge flies over the slips' heads",2,1.6,1.07,1.6,4,4,232,11,1
56194,326016,"short and wide, gets away with it. Tamim's cut finds point",2,2.1,2.01,2.1,0,0,237,145,2
56194,326016,"length ball, middle and off, defended off the front foot",2,2.2,2.02,2.2,0,0,157,189,5
56194,326016,"one-bounce four. Tamim is ripping into this target. Audacious shot. This is just short of a length, but he plays a pick-up over midwicket for four",2,2.3,2.03,2.3,4,4,17,247,6
56194,326016,"on a length, on off, defended off the front foot",2,2.4,2.04,2.4,0,0,227,172,3
56194,326016,"short of a length, pitched outside leg, with fine leg up. He has flicked it past that man for four more",2,2.5,2.05,2.5,4,4,119,22,8
56194,326016,"bouncer, that looked over head to me, but it hasn't been called a wide",2,2.6,2.06,2.6,0,0,0,0,0
436677,26421,"tossed up on off, no turn, gets an inside edge onto the pad",2,3.1,3.01,3.1,0,0,217,178,3
436677,26421,"down the wicket, beaten in the flight by a wide offbreak, but does enough to get his toe end on to the ball",2,3.2,3.02,3.2,0,0,154,250,5
436677,26421,"flatter delivery, defended off the back foot",2,3.3,3.03,3.3,0,0,260,186,3
436677,26421,"slower through the air, offbreak, lovely offbreak, beats the outside edge",2,3.4,3.04,3.4,0,0,0,0,0
436677,26421,"arm ball, fired in, takes the inside edge, goes for two runs fine of short fine leg",2,3.5,3.05,3.5,2,2,140,25,8
436677,26421,"tossed up outside off, a calm push to long-off for one",2,3.6,3.06,3.6,1,1,238,319,4
436677,326016,"short of a length, middle and leg, pushed to mid-off",2,4.1,4.01,4.1,0,0,213,199,4
436677,326016,"short of a length, on off, punched to short cover",2,4.2,4.02,4.2,0,0,237,183,3
436677,326016,"short of a length, outside off, a lovely square-drive. There is a short cover in place, and the usual cover ring, but he has pierced it",2,4.3,4.03,4.3,4,4,349,196,3
436677,326016,"slightly fuller, just outside off, pushed to cover",2,4.4,4.04,4.4,0,0,223,201,3
436677,326016,"down the wicket, not in control of this pull at all, but he has managed to clear midwicket",2,4.5,4.05,4.5,2,2,79,286,5
436677,326016,"looks to pull, but the ball is not short enough, and it squeezes between the stumps and his bat",2,4.6,4.06,4.6,0,0,0,0,0
56194,26421,"spinning away from a length, pushed towards point",2,5.1,5.01,5.1,0,0,253,177,3
56194,26421,"good amount of turn once more for Ashwin, left alone by Tamim",2,5.2,5.02,5.2,0,0,0,0,0
56194,26421,"length ball on middle and off, plenty of flight, watchful forward defensive from Tamim",2,5.3,5.03,5.3,0,0,141,201,6
56194,26421,"dropped it a touch short, Tamim gets on the back foot and guides that towards cover",2,5.4,5.04,5.4,0,0,249,200,3
56194,26421,more careful forward defence from Tamim,2,5.5,5.05,5.5,0,0,230,192,3
56194,26421,"fuller and on the pads, a loose delivery to end the over, guided behind square leg",2,5.6,5.06,5.6,1,1,123,46,8
56194,277955,guided off the front foot in front of point,2,6.1,6.01,6.1,0,0,265,172,3
56194,277955,"slower full ball outside off, Kulkarni rolls his fingers across it, Tamim looked to carve that through cover, top edges it for a loopy catch to slip, India get their first",2,6.2,6.02,6.2,0,0,207,113,1
536936,277955,"short ball from Kulkarni, was that too high? no says the umpire as the ball goes through to the keeper",2,6.3,6.03,6.3,0,0,0,0,0
536936,277955,"back of a length and sliding down the leg side, helped behind square leg",2,6.4,6.04,6.4,1,1,291,69,2
436677,277955,"length ball on off stump, driven crisply off the front foot but towards the man at cover-point",2,6.5,6.05,6.5,0,0,246,196,3
436677,277955,"anopther firm hit from Sarkar, again can't get it past the fielder, cover point stops it",2,6.6,6.06,6.6,0,0,254,153,2
536936,326016,"length ball outside off, carefully defended to the off side",2,7.1,7.01,7.1,0,0,116,174,6
536936,326016,"length ball heading for middle stump, stylishly picked up and dispatched over midwicket for four",2,7.2,7.02,7.2,4,4,353,177,3
536936,326016,"trying to be cute, and super early in his innings as well, this was a shortish ball well outside off, Litton tries to twirl that towards fine leg, no contact",2,7.3,7.03,7.3,0,0,0,0,0
536936,326016,"a touch fuller, again well outside off, Litton isn't tempted into some innovative stroke this time, happoy to let it through to the keeper",2,7.4,7.04,7.4,0,0,0,0,0
536936,326016,"fuller than the previous one, driven off the front foot towards cover point",2,7.5,7.05,7.5,0,0,108,151,7
536936,326016,"again way outside off stump, tapped towards cover to end the over",2,7.6,7.06,7.6,0,0,117,196,6
436677,277955,"length ball from round the wicket, heading for middle stump, patted back towards the bowler, again this was a slower one from Kulkarni",2,8.1,8.01,8.1,0,0,194,193,4
436677,277955,"short of length, on middle and off, more defence towards the bowler",2,8.2,8.02,8.2,0,0,152,189,6
436677,277955,"shorter and into the body, Sarkar goes for the pull, can't connect properly and the ball rolls behind square leg, some dot balls being bowled here, the asking rate remains low",2,8.3,8.03,8.3,0,0,121,154,7
436677,277955,"again the slower one, again Sarkar can't time it as he looks to loft over mid-on, just clears the man in the ring",2,8.4,8.04,8.4,2,2,89,293,5
436677,277955,"a bit shorter, goes back in the crease and defends down the pitch",2,8.5,8.05,8.5,0,0,175,197,5
436677,277955,"bouncer from over the wicket to end the over, Sarkar wants to pull that but he misses",2,8.6,8.06,8.6,0,0,0,0,0
536936,326016,"lovely shot. Shortish ball angling in from wide on the crease, punched away past mid-on for three. All along the ground",2,9.1,9.01,9.1,3,3,297,288,4
436677,326016,"<b>India think they have got him but this has come off the helmet</b>. It is a good bouncer, which beats the top edge and hits the badge on the helmet and lobs up to Dhoni. India look disbelievingly, but the correct decision has been made. Called one for the over with a raised index finger to tease India more",2,9.2,9.02,9.2,0,0,0,0,0
436677,326016,"another bouncer, and called a wide this time",2,9.3,9.03,9.3,0,1,0,0,0
436677,326016,"this short ball doesn't rise, and is pulled off the toe end to mid-on",2,9.3,9.04,9.3,0,0,147,226,5
436677,326016,"this has to be frustrating. Sarkar is going a shot a minute and getting away with some loose ones, and in between he plays some excellent ones like this. Short of a length, outside off, stands tall and punches this to the right of backward point",2,9.4,9.05,9.4,2,2,333,132,2
436677,326016,"slower ball, short of a length, opens the face, gets a single to third man",2,9.5,9.06,9.5,1,1,307,87,2
536936,326016,"short of a length, angling in, worked into the leg side for one",2,9.6,9.07,9.6,1,1,305,202,3
536936,26421,"Das down the wicket, beaten in flight, plays a defensive to midwicket",2,10.1,10.01,10.1,0,0,224,213,4
536936,26421,"flighted middle and leg, defended to leg",2,10.2,10.02,10.2,0,0,201,194,4
536936,26421,defended to cover,2,10.3,10.03,10.3,0,0,130,203,6
536936,26421,"sharp turn, flies off the thigh pad, goes for a leg-bye",2,10.4,10.04,10.4,0,1,200,114,1
436677,26421,"flatter delivery, defended to cover",2,10.5,10.05,10.5,0,0,232,191,3
436677,26421,"another risky shot from Sarkar. An almighty slog-sweep, which he misses by a day. yet he gets away with it. The off stump watches it go six inches wide",2,10.6,10.06,10.6,0,0,0,0,0
536936,234675,"and they are not letting the new bowler settle. Slog-sweep first ball, and he clears midwicket. It is a difficult shot to play, given the trajectory and pace of Jadeja, but he has dragged this from outside off, which is the right line to attempt such a shot",2,11.1,11.01,11.1,4,4,353,213,3
536936,234675,pushed down to long-on for one,2,11.2,11.02,11.2,1,1,227,255,4
436677,234675,"half an appeal from Jadeja and Dhoni as he beats him with the turn, but it is turning too far",2,11.3,11.03,11.3,0,0,202,189,4
436677,234675,stays back to defend this length ball to leg,2,11.4,11.04,11.4,0,0,142,202,6
436677,234675,"slightly short of a length, on the pads, worked away for an easy single",2,11.5,11.05,11.5,1,1,84,88,7
536936,234675,"short of a length, outside off, punched to deep cover for one",2,11.6,11.06,11.6,1,1,34,199,6
536936,26421,"flat offbreak, stays back to work this to deep square leg for one",2,12.1,12.01,12.1,1,1,307,133,2
436677,26421,"on a length, middle and off, defended back to him",2,12.2,12.02,12.2,0,0,221,185,3
436677,26421,punched down to long-off for another single,2,12.3,12.03,12.3,1,1,233,326,4
536936,26421,"sharp offbreak, dipping on him, beats the inside edge, but is headed down leg",2,12.4,12.04,12.4,0,0,217,153,2
536936,26421,"down the wicket, not to the pitch of the ball. Defends",2,12.5,12.05,12.5,0,0,194,211,4
536936,26421,"clips this off the pads for a single. Too full, too straight",2,12.6,12.06,12.6,1,1,328,136,2
536936,234675,"slightly short, wide, cut away to deep cover",2,13.1,13.01,13.1,1,1,38,126,7
436677,234675,"overpitched, clipped away off the toes for a single",2,13.2,13.02,13.2,1,1,36,190,6
536936,234675,"short and wide, cut away for another single despite the extra bounce",2,13.3,13.03,13.3,1,1,66,101,7
436677,234675,"on a length, turning in, pushed to midwicket",2,13.4,13.04,13.4,0,0,125,178,6
436677,234675,"short of a length, gets inside the line, works this to leg",2,13.5,13.05,13.5,1,1,47,194,6
536936,234675,"Raina at slip is running here and there anticipating a paddle sweep, but he has played the orthodox sweep for one to deep square leg",2,13.6,13.06,13.6,1,1,336,209,3
536936,26421,"last ball he was moving here and there, this time Raina has had no time to move. Ashwin tosses one offbreak up on the pad, Das turns it around the corner, and it has gone between leg slip and the keeper",2,14.1,14.01,14.1,4,4,205,8,1
536936,26421,"short of a length, defended to leg",2,14.2,14.02,14.2,0,0,203,203,4
536936,26421,"shortish offbreak again, another defensive to leg",2,14.3,14.03,14.3,0,0,229,187,3
536936,26421,down the wicket to push this flighted delivery to long-on,2,14.4,14.04,14.4,1,1,221,337,4
436677,26421,"on a length, no turn, hits the inside edge for a single",2,14.5,14.05,14.5,1,1,101,140,7
536936,26421,"sharp offbreak, Das wants to cut, is cramped for room, but manages to dab this down into the ground",2,14.6,14.06,14.6,0,0,142,159,7
436677,554691,"Sarkar dances down first ball, is beaten in the flight and is hit on the pad",2,15.1,15.01,15.1,0,0,164,165,6
436677,554691,"they are not letting these spinners settle. The right line to play slog-sweep. From outside off, and he has made a lovely connection to send this deep into the celebrating stands",2,15.2,15.02,15.2,6,6,13,259,6
436677,554691,"pushed through, worked into the on side for one",2,15.3,15.03,15.3,1,1,118,186,6
536936,554691,"long hop from the under-pressure Patel, and Das has pulled this through midwicket for four more. The asking rate is under four",2,15.4,15.04,15.4,4,4,343,282,3
536936,554691,"slightly fuller and slower, draws a defensive from Das",2,15.5,15.05,15.5,0,0,181,199,4
