batid,bowlid,comm,inns,oa,ou,ovr,r,rt,x,y,z
537119,56007,"and Bangladesh are a step closer. Mushfiqur has turned his own night around after dropping Dhawan twice. This is a slower ball from Mortaza, Sharma makes a bit of room to try to run this down to third man. The ball is slow, takes the edge, and Rahim dives to his right to take it one-handed. That's a fifth catch for Rahim",2,42.4,42.04,42.4,0,0,157,131,8
376116,56007,"on a length, on off, defended off the back foot",2,42.5,42.05,42.5,0,0,135,168,6
376116,56007,"short of a length, outside off, pushed to cover",2,42.6,42.06,42.6,0,0,126,198,6
326016,56143,slow teasing delivery. He waits and waits and then defends,2,43.1,43.01,43.1,0,0,167,187,5
326016,56143,mis-hit towards long-on but it falls short,2,43.2,43.02,43.2,1,1,235,298,4
376116,56143,"short of a length, outside off, defended to cover",2,43.3,43.03,43.3,1,1,45,194,6
326016,56143,stays back to keep out a flat delivery,2,43.4,43.04,43.4,0,0,154,192,5
326016,56143,"looks to sweep, finds square leg with it",2,43.5,43.05,43.5,0,0,254,179,3
326016,56143,"tossed up outside off, left alone",2,43.6,43.06,43.6,0,0,0,0,0
376116,56007,"bouncer, just outside off, he stays away from it",2,44.1,44.01,44.1,0,0,0,0,0
376116,56007,"short of a length, outside off, runs to third man for one",2,44.2,44.02,44.2,1,1,84,102,7
326016,56007,"bouncer, wide. Too high",2,44.3,44.03,44.3,0,0,0,0,0
326016,56007,"slower ball, a nothing ball as it is easy to pick and Kumar makes room to sends it crashing over mid-off for four",2,44.4,44.04,44.4,4,4,122,346,5
326016,56007,"full, angling in, he moves across to work this to leg",2,44.5,44.05,44.5,1,1,279,235,3
376116,56007,"full, into the pads, defended to mid-on",2,44.6,44.06,44.6,0,0,204,229,4
326016,56143,"short of a length, outside off, cut in front of square for one",2,45.1,45.01,45.1,1,1,49,201,6
376116,56143,"on a length, on off, punched back to him",2,45.2,45.02,45.2,0,0,128,188,6
376116,56143,"tossed up outside off, slow through the air, turns past the edge",2,45.3,45.03,45.3,0,0,0,0,0
376116,56143,stays back to punch this back to Shakib,2,45.4,45.04,45.4,0,0,148,199,5
376116,56143,"flighted outside off, teasingly slow, left alone outside off",2,45.5,45.05,45.5,0,0,0,0,0
376116,56143,"that's it. Shakib has provided the finishing touch with an lbw with an arm ball. Trapped in front. Cue big celebration. They have earned it, and deserved it. Mortaza calls Taskin for a chest bump to reprise the World Cup celebrations. And Mortaza performs a mock fall to reprise World Cup again",2,45.6,45.06,45.6,0,0,0,0,0
